1999-01-21,"[""['Yesterday the Shiv Sena yielded , hours before the Pakistan side landed at New Delhi airport and was bundled into a motorcade and taken to a heavily fortified hotel .'"", ""He told them to go out and promote good neighbourliness between India and Pakistan .']""]"
1999-02-21,"['[\'Nine months after entering the nuclear age , India and Pakistan promised yesterday to share information that could prevent a holocaust .\', ""Yesterday \'s belated recognition of the dangers of the nuclear age - the first since India and Pakistan carried out rival nuclear tests last May - is a small and tentative step towards a peace that has eluded the neighbours for more than 50 years . \'""', 'Yesterday , police fired tear gas into the headquarters of the Jamiat Islami party in central Lahore as police flushed out , beat and arrested Islamic activists .\', ""The prime minister of India , Atal Bihari Vajpayee , and his Pakistani counterpart , Nawaz Sharif , declared : \' The two sides undertake to notify each other immediately in the event of any accidental , unauthorised , or unexplained incident that could create the risk of a fallout ... or an outbreak of nuclear war . \'""', ""The Lahore Declaration was made at the end of an epic journey to Pakistan by Mr Vajpayee .']""]"
1999-05-14,"[""['The editor of the respected Friday Times news magazine , Najam Sethi , was arrested in a midnight raid and badly beaten .'"", 'Pakistani intelligence services distributed millions of pounds to ensure the electoral success of parties opposing the former Prime Minister , Benazir Bhutto , according to court documents obtained by The Observer .\', ""The money - totalling 140 million rupees ( pounds 3 million ) - was allegedly distributed among Bhutto \'s opponents in 1990 .""', ""The election was won by a coalition of parties led by Nawaz Sharif , the current Prime Minister , which received the bulk of the funds .']""]"
1999-05-26,"[""['India launched an air and ground offensive on May 26 to dislodge what it says are Pakistan army regulars fighting alongside mercenaries who crossed the line of control .'"", ""Although the generals continued their regular weekly telephone calls during the fighting , this was the first face - to - face meeting since May 26 , when New Delhi unleashed its air force against some 800 intruders .']""]"
1999-05-28,"[""['Earlier yesterday , a foreign ministry official in New Delhi appeared to rule out the prospects of a speedy resumption of the peace mission Mr Vajpayee launched last February , by riding a golden love bus across the border to Pakistan .'"", ""The telephone conversation between Nawaz Sharif , and his Indian counterpart , Atal Bihari Vajpayee , conducted over a hotline intended to avoid such high - stakes episodes , marks the first diplomatic attempt to cool temperatures along the disputed Himalayan border .']""]"
1999-07-04,"[""['President Bill Clinton and the Pakistani prime minister , Nawaz Sharif , have reached an agreement under which guerrillas who cross into the Indian - held sections of Kashmir will withdraw , US officials said yesterday .'"", ""The White House said Mr Clinton had spoken to the Indian prime minister Atal Bihari Vajpayee for about 10 minutes yesterday to brief him on the talks .'"", ""India takes key Kashmir hill Indian soldiers captured the strategic Himalayan peak of Tiger Hill yesterday after a 10-hour battle , military and political officials said , declaring it a major turning point in their battle in Kashmir against fighters loyal to Pakistan .'"", ""The campaign to persuade Warsaw city council to rename Constitution Square after the former US president Ronald Reagan gained momentum yesterday when a committee of 100 prominent Poles was inaugurated , led by the deputy foreign minister .'"", ""After the three - hour meeting between the two leaders on Sunday , US officials said they expected forces from Pakistan to leave their positions .'"", 'So far little has been revealed about the Washington meeting beyond the joint statement issued on Sunday , in which the two leaders announced that they had agreed that "" concrete steps would be taken for the restoration of the line of control "" - the divide between the Pakistani and Indian parts of the disputed region .\'', ""It came as Indian soldiers captured the strategic Himalayan peak of Tiger Hill after a 10-hour battle against fighters loyal to Pakistan , according to Indian officials .'"", ""The agreement at the White House , if carried out , may defuse the worst conflict between India and Pakistan in almost 30 years .'"", 'The Indian prime minister , Atal Bihari Vajpayee , was said to have declined an invitation to the US .\', ""He was told Pakistan \'s president , Nawaz Sharif , was heading to Washington .""]']"
1999-07-05,"['[\'Withdrawing fighters from the Kashmir frontline with India is "" out of the question "" , several militant Pakistani groups said yesterday , despite the weekend agreement in Washington between the prime minister of Pakistan , Nawaz Sharif , and President Clinton aimed at defusing the Kashmir conflict .\'', ""As news of the deal reached Pakistan yesterday opposition parties condemned it and several of the militant groups which claim to have fighters around Kargil rejected the notion of withdrawal .'"", 'The agreement at the White House , if carried out , may defuse the worst conflict between India and Pakistan in almost 30 years .\', ""He was told Pakistan \'s president , Nawaz Sharif , was heading to Washington ."", ""There is concern in Pakistan about the impact on morale in the country \'s regular armed forces if a withdrawal takes place , particularly as there has been heavy loss of life in the recent fighting with India in Kashmir .""', ""But the army and the militant Islamic groups seem to be heading for a falling out .']""]"
1999-07-06,"[""['One of the main Islamic political parties , Jamaat - e - Islami , said it would hold demonstrations today , and accused the prime minister of making a total surrender .'"", ""But the army and the militant Islamic groups seem to be heading for a falling out .']""]"
1999-07-07,"[""['An alliance of the main Muslim militant groups fighting Indian forces in Jammu and Kashmir yesterday rejected appeals by the United States to withdraw from positions inside Indian territory .'"", ""The appeals were made after an agreement in Washington last weekend between President Bill Clinton and the Pakistani prime minister , Nawaz Sharif .']""]"
1999-07-11,"['[""Faced with mounting international isolation and military reverses on the ground , Pakistan announced yesterday that forces which had captured ice - capped ridges in India \'s portion of the disputed territory of Kashmir had begun to withdraw ."", ""Last night \'s announcements followed a meeting between Pakistani and Indian generals at Attari , on the Indian side of the Punjab border .""', ""The announcement should bring to an end one of the most dangerous confrontations between the two nuclear powers in nearly 30 years , and followed a crucial meeting of top military officials from both countries earlier in the day .'"", 'It comes a week after Pakistan \\\'s prime minister , Nawaz Sharif , agreed with President Clinton in Washington to take "" concrete steps "" to defuse the tension , which had taken India and Pakistan to the brink of all - out war and which raised international concern about a nuclear confrontation .\']']"
1999-07-12,"['[\'On July 12 , he appeared on national television to declare he was not willing to play "" this game of blood and fire "" that had consumed both India and Pakistan since independence in 1947 .\'', 'It comes a week after Pakistan \\\'s prime minister , Nawaz Sharif , agreed with President Clinton in Washington to take "" concrete steps "" to defuse the tension , which had taken India and Pakistan to the brink of all - out war and which raised international concern about a nuclear confrontation .\']']"
1999-08-03,"[""['Saudi Arabia appears to be seeking nuclear weapons in a devastating blow for non - proliferation efforts in one of the most heavily - armed regions in the world , it emerged last night .'"", 'Concern was underlined yesterday when a senior British official spoke of of "" concern "" that Saudi Arabia , the most powerful state in the Gulf , may be seeking to acquire a nuclear weapons capability .\', ""Suspicions that the Saudis were planning to buy nuclear weapons technology were raised privately in diplomatic circles after the kingdom \'s defence minister , Prince Sultan bin Abdul Aziz , toured Pakistan \'s secret nuclear facilities in May ."", ""The prince toured the Kahuta uranium enrichment plant and missile factory with Pakistani prime minister Nawaz Sharif and was briefed by A.Q. Khan , the father of Pakistan \'s atom bomb .""]']"
1999-08-12,"[""['A funeral ceremony was held in Karachi yesterday for the 16 Pakistani servicemen killed when their navy patrol plane was shot down by Indian fighter aircraft close to the border between the two countries on Tuesday .'"", 'After the coffins , draped in the Pakistani flag , had been loaded onto planes to be flown for burial in their home districts , Mr Sharif told reporters that the shooting down of the plane was "" a very serious violation of all principles , international laws and agreements "" . ""\']']"
1999-10-08,"['[\'"" There is no easy solution , \\\' said Najam Sethi , editor of the Friday Times .\'', ""Road to conviction October 8 1999']""]"
1999-10-12,"['[""Pakistan \'s government has been ousted in a coup , army - controlled television said today ."", ""After today \'s events India \'s army went on a state of high alert along the border , a senior officer in India \'s northern command in Kashmir said ."", ""As last night \'s events show , Mr Sharif miscalculated ."", ""As the armed forces tightened their control over Pakistan \'s cities last night , Mr Sharif appeared to be under house arrest ."", ""Pakistan , the world \'s newest nuclear power , last night appeared to be in the hands of a hawkish army general , whom the prime minister had attempted to dismiss just hours before .""', ""After a day of high drama , hundreds of soldiers surrounded the homes of the Pakistani prime minister Nawaz Sharif and his cabinet last night , before a message on national television screens announced that the government had been dismissed in what appeared to have been a clinically executed military coup .'"", ""However , minutes before the prime minister was due to make an address from the PTV state television station in Islamabad at around 7 pm , a squad of soldiers arrived at the gates .'"", ""Sharif was due to make the announcement on national TV yesterday evening , which is why the army took over the television station and closed it down .'"", 'Asked if the IMF should give money to the military rulers who seized power from prime minister Nawaz Sharif in a coup yesterday , managing director Michel Camdessus said , "" I hope that developments in Pakistan will lead to a democratic normalisation of the situation . ""\'', 'In a television address last night , Gen Musharraf said he had acted as a last resort after Mr Sharif had "" systematically destroyed "" the nation \\\'s institutions .\'', 'Former prime minister Benazir Bhutto , who was twice thrown out of power with the connivance of the army , welcomed Mr Sharif \\\'s dismissal , saying that yesterday "" will be remembered not as the day democracy died , but rather the day that it began to be reborn "" .\', ""For many Pakistanis , last night \'s events were inescapable and preordained : the coup was the revenge of generals who had been forced to make a humiliating retreat from the border war with India last July ."", ""But yesterday \'s events make it clear that the military was not prepared to countenance the sacrifice of another of their generals so soon , nor was Gen Pervez Musharraf , the present army chief , the type to walk away from a showdown ."", ""Even before last night \'s events , Gen Ziauddin had been touted as Mr Sharif \'s choice to head the armed forces- largely for his pliability - but it was also foreseen that any attempt to remove Gen Musharraf would rebound on the prime minister ."", ""General Pervez Musharraf , the army commander in charge of Tuesday \'s coup in Pakistan , was desperately searching yesterday for a way out of imposing martial law on the country ."", ""Tuesday \'s coup has forced the IMF \'s biggest shareholder , the US , to rethink its relations with Pakistan .""', 'Of the army chief now in charge after Tuesday \\\'s anti - Sharif coup he added : "" General Musharraf will work for us . ""\', ""Minutes after Mr Sharif was placed under house arrest on Tuesday night , the prime minister was summoned to a meeting with the commander of Rawalpindi \'s 10th corps , Mahmood Ahmed , who spent 12 hours pleading with him to resign .""', 'Twenty miles south of the eastern Pakistani city of Lahore lies the sprawling estate of Raiwind - the newly built home of Nawaz Sharif , the prime minister ousted in an army coup 17 days ago .\', ""The allegations - which are probably meant to justify the continuing detention of the prime minister until the regime \'s investigations can come up with corruption charges against the Sharif family and its supporters - stem from an episode on October 12 .""', ""Police in Karachi said a formal complaint was filed by a senior military officer against Mr Sharif in connection with the attempted diversion on October 12 of a plane carrying General Pervez Musharraf , who hours later overthrew Mr Sharif in a bloodless coup .'"", ""He was just one of hundreds taken in during the crackdown ordered by General Pervez Musharraf , who promised to root out corruption after after seizing power in a bloodless coup on October 12 .'"", 'And it will be seen as the result of a personal vendetta by Gen Pervez Musharraf , the armed forces chief who launched the October 12 coup when Mr Sharif tied to sack him .\', ""Aminuddin Chaudhry , the former chairman of the civil aviation authority , is believed to have told police that Mr Sharif personally issued the orders to turn away the flight carrying Pakistan \'s military chief , General Pervez Musharraf , and 200 civilians to Karachi airport on October 12 , the night of the bloodless coup .""', 'During the hour - long hearing Mr Sharif , who was ousted on October 12 , attacked the conditions in which he is being held , and claimed that he had been denied access to a TV . ""\', ""Mr Sharif \'s co - defendants - his brother Shabhaz , a former senior minister and four senior officials - also pleaded not guilty to charges relating to events on October 12 , the day of the military coup .""', ""Although Mr Sharif , 51 , has been incarcerated since October 12 , legal arguments have delayed the start of proceedings .'"", ""Mr Sharif , who was overthrown by a military coup on October 12 , is on trial along with his brother , Shahbaz , and five former senior government officials .'"", ""Mr Sharif was overthrown in a military coup on October 12 and is now on trial at the court in Karachi together with his brother Shahbaz and five former senior government officials .'"", 'He has been in detention since being overthrown by Pakistan \\\'s army chief , General Pervez Musharraf , in a bloodless coup on October 12 . ""\'', ""The charges arose after Mr Sharif refused to let a passenger plane carrying General Pervez Musharraf , the army chief , land in Pakistan on October 12 .'"", ""The general - whom Sharif had just sacked - only landed after the army took control of Karachi airport , staging a coup hours later on October 12 last year .'"", ""The plan was aborted on October 12 , 1999 , however , when Mr Sharif was overthrown in a military coup led by General Pervez Musharraf , who refused to continue the operation , despite substantial efforts by the Clinton administration to revive it .'"", ""The president has only to think back to October 12 1999 , when Mr Sharif , then prime minister , dismissed General Musharraf as head of the army while he was out of the country .'"", ""A message scrolled across the screen saying that prime minister Nawaz Sharif and his cabinet had been dismissed and that the chief of army staff , General Pervaiz Musharaf , would address the nation shortly .'"", ""Earlier , troops took control of airports and government buildings throughout the country and the state - run radio and television stations , hours after Mr Sharif had sacked Gen Musharraf .'"", ""General Musharraf General Musharraf is a former commando and is regarded by his fellow officers as an independent - minded general , and a straight talker .'"", ""That was not how Nawaz Sharif saw it .'"", ""The Pakistani prime minister promoted Gen Musharraf over two more senior generals to the post of army chief last October , thinking he would prove more pliant than his predecessor .'"", ""1947 Pakistan created by partition from India 1958 General Ayub Khan stages a military coup ; martial law until 1962 1969'"", ""General Yahya Khan reimposes martial law'"", 'The Pakistani army \\\'s "" dismissal "" of Nawaz Sharif , the country \\\'s prime minister who won office in a landslide election victory in February , 1997 , represents another dismaying milestone in the troubled history of Pakistan .\', ""It is a blow to democracy , a blow to Pakistan \'s image abroad , and a blow to those who hope for peace in the Subcontinent , most especially between Pakistan and India .""', 'The announcement said the sacked army chief , Gen. Pervez Musharraf , would address the nation in a broadcast speech .\', ""A coup d\'etat is by definition a sudden , startling event but this week \'s military take - over in Pakistan was utterly and drearily unsurprising to anyone who has been watching that country closely .""', 'The military in Pakistan is a bedrock state institution ; without at least its acquiescence little gets done or decided .\', ""Prime minister Nawaz Sharif \'s increasing reliance on the army to perform tasks from inspecting electric meters to administering justice in special courts has caused severe anxiety since at least the beginning of the year .""', 'There is a grisly inevitability about the latest military coup in Pakistan , and about the apathetic acceptance of it by the people .\', ""After all , the Pakistan army has been pulling the strings of power for so long that it does n\'t really matter whether the top general sits in the presidential palace or stays in barracks .""', 'The excuse this time is that Prime Minister Nawaz Sharif was egregiously corrupt and that he was driving the national economy to the brink of collapse .\', ""But Pakistan \'s generals have been nursing a grudge against their political masters for much longer - ever since the prime minister , Nawaz Sharif , took on one of their own .""', ""In October last year Mr Sharif forced the then army chief , General Jehangir Karamat , into early retirement .']""]"
1999-10-13,"['[""As the world waited anxiously for general Pervez Musharraf , Pakistan \'s new military strongman , to reveal his intentions , the International Monetary Fund today threatened to cut off vital funding to Pakistan unless Islamabad restored democracy .""', ""Yesterday , the US secretary of state Madeleine Albright condemned the actions of the Pakistani military .'"", ""Last night , the IMF made it clear that the talks it had been holding with Mr Sharif on future loans to the heavily - indebted country were now in abeyance and that discussions were effectively suspended until democracy was restored .'"", 'Facing international economic isolation , Pakistan was calm yesterday as the country woke up to life under a military regime .\', ""As Washington , the UN and the International Monetary Fund condemned the army \'s actions in ousting the prime minister Nawaz Sharif , Pakistan appeared to be in limbo ."", ""The International Monetary Fund ( IMF ) said it had suspended the loan discussions it had been holding before the coup with Pakistan \'s prime minister , Nawaz Sharif , and said talks would not resume until democracy was restored .""]']"
1999-10-14,"['[""In Islamabad \'s Melody Market bazaar , few people were sparing a thought yesterday for Pakistan \'s deposed leader , Nawaz Sharif .""', ""On Thursday , with no sign of surrender from a prime minister with a penchant for confrontation , Mr Sharif was flown to his home town Lahore .'"", 'General Pervez Musharraf , the self - appointed Chief Executive of Pakistan , has not revealed his plans for the man ousted in a coup 10 days ago .\', ""As Washington , the UN and the International Monetary Fund condemned the army \'s actions in ousting the prime minister Nawaz Sharif , Pakistan appeared to be in limbo .""', 'The elected prime minister , Nawaz Sharif , his brother , Shahbaz and General Ziaudin , the head of Inter Services Intelligence ( ISI ) are under house arrest .\', ""The International Monetary Fund ( IMF ) said it had suspended the loan discussions it had been holding before the coup with Pakistan \'s prime minister , Nawaz Sharif , and said talks would not resume until democracy was restored .""', 'Having decided to overthrow the elected government of Nawaz Sharif in "" spontaneous reaction "" to the prime minister \\\'s "" wrong actions "" , General Pervez Musharraf seems to have precious little idea what to do next .\']']"
1999-10-15,"['[""Pakistan \'s coup leader , General Pervez Musharraf , yesterday tried to appease international condemnation by announcing that he was close to the installation of a transitional government ."", ""In cities , people awoke to the army chief \'s imposition of a state of emergency early yesterday with the same calm with which they greeted Tuesday night \'s coup , and the sacking of the prime minister , Nawaz Sharif ."", ""But the international community was unprepared yesterday to entertain the contention of most Pakistanis that Gen Musharraf \'s intentions are honest , and that good governance is preferable to elected politicians who have repeatedly betrayed the people \'s trust with corruption and misrule .""', 'Yesterday , he summoned the army \\\'s nine corps commanders to military headquarters in Rawalpindi for talks on a transitional regime . ""\'', 'Having decided to overthrow the elected government of Nawaz Sharif in "" spontaneous reaction "" to the prime minister \\\'s "" wrong actions "" , General Pervez Musharraf seems to have precious little idea what to do next .\'', 'The most egregious ( for the army ) of Mr Sharif \\\'s "" wrong actions "" was his sacking of Gen Musharraf .\'', 'Most seemed satisfied that Gen Musharraf would soon begin to share power with civilians . ""\']']"
1999-10-16,"[""['A US diplomat in Islamabad said the general might name the members of the new administration today .'"", 'Most seemed satisfied that Gen Musharraf would soon begin to share power with civilians . ""\']']"
1999-10-28,"['[""Yesterday Pakistan \'s military government allowed reporters to tour the complex for the first time .""', ""Yesterday a delegation of foreign ministers from the Commonwealth arrived in Pakistan for talks with leading public figures including the president , the chief justice , politicians and human rights activists .'"", ""Around four palatial , marble - faced villas stretch vast lawns and hundreds of acres of golden wheatfields , where dozens of farmworkers were harvesting ripe corn .']""]"
1999-10-29,"['[\'Gen Musharraf , who is to meet the foreign ministers today , has left little doubt that his focus is elsewhere . ""\'', ""Around four palatial , marble - faced villas stretch vast lawns and hundreds of acres of golden wheatfields , where dozens of farmworkers were harvesting ripe corn .']""]"
1999-11-07,"[""['Jemima Khan faces music Jemima Khan , the wife of cricket player - turned - politician Imran Khan and daughter of the late Sir James Goldsmith , returned to Pakistan yesterday to face charges of smuggling antique tiles .'"", ""Banana boat hits lighthouse A salvage expert yesterday began an inspection of a 10,000-tonne cargo vessel which crashed into the historic Nab Tower lighthouse off Portsmouth harbour yesterday .'"", 'Imran Khan said the charges were laid before the military coup . ""\'', 'During Nawaz Sharif \\\'s government , my wife could n\\\'t take the risk of returning to Pakistan , "" he said at Lahore airport ""\']']"
1999-11-10,"[""['His Pakistan Muslim League had said yesterday that it would go to the supreme court to challenge the coup which dismissed the government and the suspended the constitution , parliament and provincial assemblies .'"", ""The accusations , which cover not only treason but kidnapping , were lodged in Karachi after midnight against Nawaz Sharif and seven others .'"", ""These offences can carry the death penalty .']""]"
1999-11-11,"['[""Britain warned Pakistan \'s military rulers yesterday not to stage a show trial of the ousted prime minister Nawaz Sharif and said it would oppose any use of the death penalty .""', ""The ousted prime minister was yesterday accused - along with four other people - of hijacking and kidnapping , which carry the death penalty .'"", ""These offences can carry the death penalty .']""]"
1999-11-12,"['[\'Osama bin Laden , the Islamic leader wanted for the bombing of the United States embassies in Kenya and Tanzania , yesterday came under immediate suspicion after an audacious series of rocket attacks on American and United Nations targets in Islamabad .\', ""Robin Cook , the foreign secretary , said in a statement that Pakistan must respect the rights of Mr Sharif and other ministers arrested in last month \'s military coup .""', ""There were no immediate claims of responsibility .']""]"
