2010-02-06,"['[""Assange \'s extradition hearing has been scheduled for 6 - 7 February .""', 'This outlines "" some important issues which will be gone into in detail on 6 and 7 February "" , he said .\'', ""His bail was modified , allowing him to stay at the Frontline Club for journalists in Paddington on 6 and 7 February , so he does not have so far to travel .'"", 'This outlines "" some important issues which will be gone into in detail on February 6 and 7 "" , he said .\'', ""His bail was modified , allowing him to stay at the Frontline Club , in Paddington , on February 6 and 7 so he does not have so far to travel .']""]"
2010-07-26,"['[\'The Wikileaks founder , Julian Assange , said today that the organisation is working through a "" backlog "" of further secret material and was expecting a "" substantial increase in submissions "" from whistleblowers after one of the biggest leaks in US military history .\'', ""The founder of the whistleblowing website Wikileaks today defended his decision to publish thousands of secret US military files about the war in Afghanistan , faced with criticism from the White House for placing troops in danger .'"", 'Julian Assange said his organisation was currently working through a backlog of further secret material and was expecting a "" substantial increase in submissions "" from whistleblowers after one of the biggest leaks in US military history .\'', 'He said the files showed that "" thousands "" of war crimes may have been committed in Afghanistan .\']']"
2010-07-27,"[""['( An aside for British readers not familiar with Colbert and thus puzzled at my quoting a comedian : it is a sad but undeniable reality that the two most incisive American media critics today may well be Colbert and his fellow fake anchorman Jon Stewart . )'"", ""why would an organisation as independent - minded and disdainful of the traditional media as WikiLeaks seek out those very media as partners rather than going it alone ?'"", ""Yet there was little in the WikiLeaks revelations that came as a surprise to Afghans and the local media mostly refrained from commenting , limiting their effort to reporting news of the publication of secret files .']""]"
2010-07-30,"[""['Assange said today that they had tried to comply with a private White House request to redact the names of informants before publication .'"", ""WikiLeaks and its editor - in - chief , Julian Assange , have come under attack from US officials and their allies for potentially endangering informants and troops in Afghanistan by posting the texts of thousands of leaked war logs .'"", ""Gates said sensitive intelligence which could endanger informants had been widely distributed down to junior level in the US army , in a loose policy which might now have to be reconsidered .'"", ""WikiLeaks founder Julian Assange has hit out at the US military , saying that it bears the ultimate responsibility for any deaths of Afghan informers in the wake of the publication by his organisation of 75,000 leaked files of American army secrets .']""]"
2010-08-12,"[""['WikiLeaks initially withheld around 15,000 of more than 92,000 reports to protect informants but Assange revealed yesterday it is preparing to publish them , once the organisation has finished checking them all .'"", ""Assange said yesterday WikiLeaks was about halfway through reviewing the remaining 15,000 documents but gave no timeframe for their publication .'"", ""A group that campaigns for press freedom has become the latest organisation to condemn WikiLeaks for publication of the leaked Afghanistan war logs .'"", 'In an open letter to WikiLeaks founder Julian Assange , Reporters Without Borders accused him of "" incredible irresponsibility "" for publishing the tens of thousands of documents "" indiscriminately "" .\']']"
2010-08-13,"[""['Moneybookers moved against WikiLeaks on 13 August , according to the correspondence , less than a week after the Pentagon made public threats of reprisals against the organisation .'"", ""He recounted evidence of the encounter on the night of 13 August 2010 between Assange and a woman known as AA , who was hosting Assange at her apartment , during which AA said Assange tried to have sex with her without a condom .'"", ""A group that campaigns for press freedom has become the latest organisation to condemn WikiLeaks for publication of the leaked Afghanistan war logs .'"", 'In an open letter to WikiLeaks founder Julian Assange , Reporters Without Borders accused him of "" incredible irresponsibility "" for publishing the tens of thousands of documents "" indiscriminately "" .\']']"
2010-08-14,"[""['Prosecutors have released no details about the allegations against Assange , but police reports leaked to the media showed that both women had met him in connection with a seminar he gave in Stockholm on 14 August .'"", ""Investigators have released few details about the allegations against Assange , though a police report showed that both women had met him in connection with a seminar he gave in Stockholm on 14 August .'"", 'She said the first complainant , Miss A , said she was victim of "" unlawful coercion "" on the night of 14 August in Stockholm .\'', 'She said the first complainant , Miss A , said she was victim of "" unlawful coercion "" on the night of 14 August in Stockholm .\'', 'Gemma Lindfield , for the Swedish prosecutors , said the first involved complainant A , who said she was the victim of "" unlawful coercion "" on the night of 14 August in Stockholm .\'', ""The claims related to two women who said they had met Assange in connection with a seminar he gave in the Swedish capital on 14 August .'"", 'The first complainant , a Miss A , said she was the victim of "" unlawful coercion "" on the night of 14 August in Stockholm .\'', 'The first complainant , known as Miss A , said she was the victim of "" unlawful coercion "" on the night of 14 August in 2009 in Stockholm .\']']"
2010-08-17,"[""['The alleged rape of Ms W was said to have occurred on the morning of Tuesday 17 August .'"", ""The fourth charge accused Assange of having sex with a second woman , Miss W , on 17 August without a condom while she was asleep at her Stockholm home .'"", ""The fourth charge accused Assange of having sex with a second woman , Miss W , on 17 August without a condom while she was asleep at her Stockholm home .'"", ""The fourth charge accused Assange of having sex with a second woman , Miss W , on 17 August without a condom while she was asleep at her Stockholm home .'"", 'A fourth charge , relating to a Miss W , alleged that on 17 August , he "" improperly exploited "" the fact she was asleep to have sex with her without a condom .\']']"
2010-08-18,"[""['On the following day , the charge of rape was dropped and the warrant was rescinded .'"", 'The third charge claimed Assange "" deliberately molested "" Miss A on 18 August "" in a way designed to violate her sexual integrity "" .\'', 'The third charge claimed Assange "" deliberately molested "" Miss A on 18 August "" in a way designed to violate her sexual integrity "" .\'', 'The third charge claimed Assange "" deliberately molested "" Miss A on 18 August "" in a way designed to violate her sexual integrity "" .\'', 'A third charge claimed Assange "" deliberately molested "" Miss A on 18 August .\'', 'A third charge claimed Assange "" deliberately molested "" Miss A on 18 August .\']']"
2010-08-20,"[""['â€ “ was the subject of a Swedish arrest warrant on Friday after separate complaints made by two women .'"", ""The preliminary allegation , made on Friday night , and not further investigated at that stage , was apparently leaked by police to a tabloid in Stockholm , which published dramatic claims on Saturday morning that Assange was to be arrested .'"", 'The Swedish Prosecution Authority todaysaid an "" on - call "" prosecutor issued an arrest warrant for Assange late on Friday , only to see it revoked the next day by a higher - ranked prosecutor who found no grounds to suspect him of rape . ""\'', ""On Friday last week , Ms A and Ms W together approached police in Stockholm and reported that they had been sexually assaulted by Assange .'"", ""The women filed their complaints together six days later .'"", ""The report shows the women filed their complaints together six days later .'"", ""The women filed their complaints together six days later , on Friday 20 August .'"", ""The charges have changed several times since they were first levelled by two women on 20 August in relation to events over the weekend of 13 August .'"", 'An arrest warrant , issued on 20 August , was withdrawn the following day , when one of Sweden \\\'s chief prosecutors , Eva FinnÃ © , said she did not think there was "" reason to suspect that he has committed rape "" .\', ""He told police that he had continued to sleep in Miss A \'s bed for the following week and she had never mentioned a torn condom .""', ""The paper says the officer had just started her shift at Klara police station in Stockholm on 20 August when Miss A and Miss B arrived to make a complaint against Assange .'"", ""The senior district judge threw out the appeal and ordered his extradition , and a week later Assange appealed to the high court .'"", ""He has to sign in at a local police station every day , he wears an electronic tag that monitors his movements and he has to be back inside the house by 10 pm each night .']""]"
2010-08-21,"['[""Before Stockholm \'s chief prosecutor made clear on Saturday afternoon that Assange was in fact neither charged with rape nor due to be arrested , the story had spread , generating more than 1,200 articles , available through internet news search , that received more than 1 m hits .""', '"" It was 7 am when a friend who is Swedish and has been out on the net told me about the allegations , "" Assange told Stockholm daily newspaper Aftonbladet , which has hired him as a columnist : "" It was shocking .\'', ""The founder of WikiLeaks , Julian Assange , was himself the subject of a rapidly spreading online story when news cascaded across the internet for several hours at the weekend mistakenly saying he was being sought in Sweden on rape charges .']""]"
2010-08-22,"[""['Julian Assange , the secretive founder of the whistle - blowing WikiLeaks website , has today denied allegations of rape and sexual molestation and insisted he has never had non - consensual sex .'"", ""The founder of WikiLeaks , Julian Assange , was himself the subject of a rapidly spreading online story when news cascaded across the internet for several hours at the weekend mistakenly saying he was being sought in Sweden on rape charges .'"", ""Prosecutors say they are considering a complaint of sexual molestation from one woman , Ms A , who has previously been an active supporter of Assange .']""]"
2010-08-30,"[""['Assange had been interviewed by Swedish police over the allegations on 30 August and vehemently denied any wrongdoing , Robertson said .'"", ""He must stay at a country mansion owned by a friend , Vaughan Smith , and observe curfews from 10 pm to 2 am , and then from 10 am to 2 pm .'"", ""Assange had been interviewed by Swedish police over the allegations on 30 August and vehemently denied any wrongdoing , Robertson said .'"", ""He must stay at a country mansion owned by a friend , Vaughan Smith , and observe curfews from 10 pm to 2 am , and then from 10 am to 2 pm .']""]"
2010-11-03,"[""['On 3 November , House , 23 , said he found customs agents waiting for him when he and his girlfriend returned to the US after a short holiday in Mexico .'"", 'The founder of whistleblowing website WikiLeaks has called on the US to investigate alleged abuses by its troops in Afghanistan and Iraq , saying it has a "" proud tradition "" of self - scrutiny .\'', ""Julian Assange says the US has not started any investigations into the alleged incidents detailed in thousands of documents published by WikiLeaks and has instead concentrated on tracking down those responsible for the leaks and on hounding his group .'"", ""Last month , WikiLeaks published 400,000 US field reports containing evidence that US soldiers handed over detainees to a notorious Iraqi torture squad .']""]"
2010-11-18,"[""['A Swedish court today approved a request by prosecutors to detain Assange for questioning on suspicion of rape , sexual molestation and unlawful coercion .'"", ""Swedish prosecutors are to issue an international arrest warrant for the WikiLeaks founder , Julian Assange , for questioning in a rape case .'"", '"" I request the court detain Assange in his absence on suspicion of rape , sexual assault and coercion , "" the director of public prosecution , Marianne Ny , said in a statement .\']']"
2010-11-27,"['[\'Julian Assange of WikiLeaks offered the White House and the Pentagon the opportunity to redact the material to protect innocent lives , yet was rebuffed at every stage – most recently by Harold Koh , who wrote on Saturday : "" Despite your stated desire to protect those lives , you have done the opposite and endangered the lives of countless individuals .\'', 'On November 27th , the state department , the US government basically , wrote a letter saying that the WikiLeaks \\\' activities were deemed illegal in the United States and as a result our policy group had to make the decision of suspending the account , "" Bedier said .\'', ""War had broken out on the internet , where the leaks began 13 days ago .']""]"
2010-11-28,"['[\'Anticipating Sunday \\\'s release of classified US embassy cables , Harold Koh , the top lawyer to the US state department , fired off a letter to Julian Assange , the editor - in - chief of WikiLeaks , on Saturday morning accusing him of having "" endangered the lives of countless individuals "" .\'', 'WikiLeaks chose to challenge this power on Sunday by releasing a historical record of what the Bush , Clinton and Obama administrations have done overseas – to allow the public to decide which , if any , of them has overstepped the boundaries of the law and , if so , how .\', ""Thus Koh pre - emptively made himself the figurehead for the US government \'s reaction to the WikiLeaks release ; the White House \'s subsequent statement has echoed his attack .""', 'Koh , a former dean of Yale law school , is also the man who authored a legal opinion for the Obama administration this past March stating that the president had the right to authorise "" lethal operations "" to target and kill alleged terrorists anywhere in the world without judicial review .\']']"
2010-11-30,"[""['The WikiLeaks founder , Julian Assange , is tonight facing growing legal problems around the world , with the US announcing that it was investigating whether he had violated its espionage laws .'"", 'While the Serious Organised Crime Agency , which is handling the case , said on Tuesday that it had flagged up an Interpol \\\' red notice \\\' to all UK police forces about the whereabouts of Assange and would arrest him if they discovered his precise location , other reports have suggested that police and security services know where Assange is based as he supplied contact details on arrival in Britain in October and have not arrested him or initiated extradition proceedings because Swedish authorities issued an incorrect European arrest warrant . ""\', ""Assange \'s details were also added to Interpol \'s worldwide wanted list .""', ""British police are continuing to look for the WikiLeaks founder , Julian Assange , over rape allegations made against him in Sweden .'"", ""Police sources said Assange would be arrested if they discovered his precise location .'"", 'His fellow potential Republican nominee Sarah Palin had already called for WikiLeaks founder Julian Assange to be "" hunted down "" , and an adviser to the Canadian prime minister has echoed her comments .\']']"
2010-12-01,"['[""Today , Assange \'s lawyer issued a vigorous condemnation of the Interpol move .""', ""There were unconfirmed reports yesterday that Assange had escaped arrest on Wednesday only because of the error and that British police are aware of his location .'"", ""There was confusion surrounding the legal status of Julian Assange last night after a dispute between his lawyer and Swedish authorities over the validity of an arrest warrant .'"", '[ Clinton ] should resign if it could be shown that she was responsible for ordering US diplomatic figures to engage in espionage of UN activities , in violation of the international covenants to which the US signed up , "" he said in an interview with Time magazine , published yesterday following the leak of secret US diplomatic cables that have caused huge embarrassment for the country .\'', ""British police are continuing to look for the WikiLeaks founder , Julian Assange , over rape allegations made against him in Sweden .'"", ""Police sources said Assange would be arrested if they discovered his precise location .'"", ""The Republican presidential hopeful Mike Huckabee has called for whoever leaked the 250,000 US diplomatic cables to be executed .'"", 'His fellow potential Republican nominee Sarah Palin had already called for WikiLeaks founder Julian Assange to be "" hunted down "" , and an adviser to the Canadian prime minister has echoed her comments .\'', 'Mark Stephens , his London - based lawyer , has called the allegations "" false and without basis "" , and has said they amounted to a smear campaign following recent high - profile political leaks by Assange \\\'s organisation .\'', 'WikiLeaks founder Julian Assange wanted to expose China \\\'s and Russia \\\'s secrets as much as those of the US , and believes Hillary Clinton should resign if she ordered diplomats to engage in espionage . ""\'', ""Assange gave the interview via Skype from an undisclosed location after a warrant was issued by Interpol following rape allegations in Sweden , which his lawyer said amounted to persecution and a smear campaign .'"", 'In a hard - hitting piece in defence of WikiLeaks founder Julian Assange - now officially named as a fugitive - Alexander Cockburn contends that American newspapers have colluded with the US government to conceal some of the leaked embassy cables .\', ""Top stories on MediaGuardian.co.uk Bennett quits job to switch to BBC Worldwide Corporation veteran Jana Bennett expected to leave role as director of BBC Vision this month , triggering search for replacement UK police seek Assange over rape claims Serious Organised Crime Agency flags up Interpol \' red notice \' over WikiLeaks founder Julian Assange \'s whereabouts Virgin Media to launch YouView rival \' Game changing \' mix of TV , VoD and internet services has a six - month headstart on BBC - backed YouView This week \'s featured media jobs Internet Advertising Bureau - Senior Marketing and PR Manager London / permanent / full time Sky - Creative Planner London / permanent / full time Citywire Financial Publishers - Supplements""]']"
2010-12-02,"['[""The Swedish authorities today issued a new arrest warrant for Julian Assange , the founder of WikiLeaks , following a request by the UK \'s Serious and Organised Crime Agency .""', 'Assange is due to give an online interview to Guardian readers today .\', ""Also on MediaGuardian.co.uk today BBC Films told to aim for bigger TV ratings BBC film - making department also ordered by trust to review the way it deals with independent producers Brunswick \'s Burt to launch new agency Philip Gawith and Julian Hanson - Smith to join Brunswick partner in new venture , to be called Stockwell Group Russian government to sell media outlets Russia \'s president says \' public figures \' should no longer own national and local newspapers Newspaper ad optimism in the States New study of north American publishers expects improvement in advertising revenues in 2011 Lester Middlehurst , a star interviewer Former Daily Mail and Daily Express showbusiness writer dies from overdose Britons well ahead of the pack in adopting new technology , says Ofcom Latest Ofcom survey finds UK at or near the front in take - up of broadband , smartphones , mobile internet and digital TV Labour MPs suspicious of Mervyn King \'s role in coalition talks Tristram Hunt wants the governor of the Bank of England to appear before a Commons committee to answer MPs \' questions WikiLeaks website pulled by Amazon after US political pressure Site hosting leaked US embassy cables is ousted from American servers as senator calls for boycott of WikiLeaks by companies WikiLeaks cables : \' Sri Lankan president responsible for massacre of Tamils \' Tamil activists in Britain - where Mahinda Rajapaksa is currently visiting - are seeking an arrest warrant for alleged war crimes Supreme court changes fair comment defence in libel cases Lord Phillips says that key test for defending libel cases should be changed to \' honest comment \' in light of new technology""', 'Assange gave the interview via Skype from an undisclosed location after a warrant was issued by Interpol following rape allegations in Sweden , which his lawyer said amounted to persecution and a smear campaign .\', ""Top stories on MediaGuardian.co.uk Bennett quits job to switch to BBC Worldwide Corporation veteran Jana Bennett expected to leave role as director of BBC Vision this month , triggering search for replacement UK police seek Assange over rape claims Serious Organised Crime Agency flags up Interpol \' red notice \' over WikiLeaks founder Julian Assange \'s whereabouts Virgin Media to launch YouView rival \' Game changing \' mix of TV , VoD and internet services has a six - month headstart on BBC - backed YouView This week \'s featured media jobs Internet Advertising Bureau - Senior Marketing and PR Manager London / permanent / full time Sky - Creative Planner London / permanent / full time Citywire Financial Publishers - Supplements""', ""Swedish authorities , who want to question Assange over sex offence allegations , issued a new warrant for his arrest .'"", 'Mistakes in the original European arrest warrant sent by Swedish prosecutors to the Serious Organised Crime Agency ( Soca ) last month had prevented any move to apprehend the Australian .\', ""As our Guardian colleagues are kept busy with revelations from the leaked US embassy cables , we \'ve turned our attention to the legal threats facing Julian Assange , as Sweden issues a fresh arrest warrant and the US investigates Wikileaks \' possible violation of its espionage laws .""]']"
2010-12-04,"['[\'The country \\\'s foreign minister , Kevin Rudd , said on Saturday : "" The federal police was asked by the Australian attorney general some days ago to investigate whether or not Assange has breached any element of the Australian criminal law . ""\'', 'PayPal \\\'s vice - president of platform , Osama Bedier , told an internet conference the site had decided to freeze WikiLeaks \\\' account on 4 December after government representatives said it was engaged in illegal activity . ""\'', 'Lawyers representing the WikiLeaks founder , Julian Assange , say that they have been surveilled by members of the security services and have accused the US state department of behaving "" inappropriately "" by failing to respect attorney - client protocol .\'', ""Jennifer Robinson and Mark Stephens of the law firm Finers Stephens Innocent told the Guardian they had been watched by people parked outside their houses for the past week .'"", '"" I \\\'ve noticed people consistently sitting outside my house in the same cars with newspapers , "" said Robinson .\']']"
2010-12-05,"['[\'Stephens today denounced the extradition warrant as a "" political stunt "" and said Assange would fight deportation to Sweden on the grounds that it could lead to him being handed over to the US , where senior politicians have called for him to be executed .\'', 'Mark Stephens , Assange \\\'s London - based lawyer , yesterday denounced the Swedish extradition warrant as a "" political stunt "" .\'', 'Another of Assange \\\'s lawyers , Mark Stephens , yesterday denounced the extradition warrant as a "" political stunt "" and said his client would fight deportation to Sweden on the grounds that it could lead to him being handed over to the US , where senior politicians have called for him to be executed .\'', ""The party referred 4,000 people a second to WikiLeaks through WikiLeaks.ch on Sunday , it has told the Guardian .'"", ""The list of mirror sites has risen from 74 on Sunday afternoon .'"", 'Lawyers representing the WikiLeaks founder , Julian Assange , say that they have been surveilled by members of the security services and have accused the US state department of behaving "" inappropriately "" by failing to respect attorney - client protocol .\'', ""Jennifer Robinson and Mark Stephens of the law firm Finers Stephens Innocent told the Guardian they had been watched by people parked outside their houses for the past week .'"", '"" I \\\'ve noticed people consistently sitting outside my house in the same cars with newspapers , "" said Robinson .\'', ""9.39pm :'"", ""Assange is seeking supporters to put up surety and bail for him .'"", ""Eric Holder , who did not specify what these actions might be , also said his justice department was examining ways to stem the flow of leaked cables .'"", 'His comments came as a Swiss bank announced it had closed Assange \\\'s account because he had given "" false information "" .\'', 'PostFinance has ended its business relationship with … Julian Paul Assange , "" the bank said in a statement . ""\'', ""The Australian citizen provided false information regarding his place of residence during the account opening process .'"", ""What do Julian Assange and some climate activists have in common ?'"", ""Answer :'"", ""Neither seem to understand that effective diplomacy requires some secrecy .']""]"
