2003-04-27,"['[\'Amanda Garrett garrett@dircon.co.uk Kevin Toolis oversteps the mark when , commenting on observing Iain Duncan Smith at the Imperial War Museum , he refers to the Battle of Britain veterans present as being "" like the rest of the museum \\\'s exhibits ... relics of another era "" ( Against All Odds , April 27 ) .\'', 'Amanda Garrett garrett@dircon.co.uk Kevin Toolis oversteps the mark when , commenting on observing Iain Duncan Smith at the Imperial War Museum , he refers to the Battle of Britain veterans present as being "" like the rest of the museum \\\'s exhibits ... relics of another era "" ( Against All Odds , April 27 ) .\', ""David Beckham may be on the bench again this afternoon - Sir Alex Ferguson refused to confirm that his disaffected star would be in the starting line - up against Tottenham Hotspur - and to the delight of news and fashion editors Manchester United \'s one - man publicity industry seems sure to be working overtime between now and the start of next season ."", ""His performance in yesterday \'s 2 - 0 victory was very different , however , from the frenetic half - hour cameo he delivered last Wednesday at Old Trafford against Real Madrid .""', ""The dropping of Juan Sebastian Veron and Nicky Butt yesterday allowed Beckham and Scholes to join Roy Keane in the three - man midfield , with Beckham playing in a narrower position on the right , generally holding station 15 yards in from the touchline .'"", 'Shed a tear for David Beckham .\', ""Alex Ferguson has deployed his most famous star as substitute for both Manchester United \'s most important games this season .""', ""Insurrection the air at Old Trafford , with that cheeky young varlet David Beckham likely to be banished to another kingdom .'"", 'Short of discovering he has already signed for Real Madrid , though , it is hard to see what he has done to upset Sir Alex Ferguson .\', ""He might wind up the gaffer by telling the tabloids \' never say never \' about a move when Ferguson and his fellow United knight , Sir Bobby Charlton , are telling everyone Beckham \'s not for sale ."", ""It is not Beckham \'s departure that will mark the end of an era at Old Trafford , but the seemingly irreversible decline of Roy Keane .""', ""Once again David Beckham reacted to the final whistle by raising his arms to each quarter of the ground , appearing to make no distinction between friend and foe in the grandstands .'"", 'This time he kept his shirt on - there was no Zinedine Zidane in the Tottenham side with whom to exchange souvenirs - but his body language appeared to convey the same message .\', ""Claudio Ranieri was laughing as heartily as ever but few Chelsea fans will have found much to smile about in their team \'s stuttering display and news of Liverpool \'s resurgence .""', 'A final - day meeting between those clubs here looks certain to decide the battle for a top - four spot and surely not even Ranieri will chuckle if his side miss out on a £ 10mChampions League pay - out .\', ""David Beckham may have spent a similar amount on clothes this season judging by last week \'s shopping , but Chelsea could do with the money for different reasons .""]']"
2003-04-28,"[""['Real Madrid last night issued the most emphatic of denials that they have any interest in signing David Beckham from Manchester United , in the process breaking their own taboo on commenting publicly on transfer speculation .'"", ""But last night Real issued a public statement that left little room for doubt .'"", ""Yesterday they barely exchanged words beyond the usual pleasantries at the meeting which took place at the Amigo Hotel in the Belgian capital .'"", ""Once again David Beckham reacted to the final whistle by raising his arms to each quarter of the ground , appearing to make no distinction between friend and foe in the grandstands .'"", 'A final - day meeting between those clubs here looks certain to decide the battle for a top - four spot and surely not even Ranieri will chuckle if his side miss out on a £ 10mChampions League pay - out .\', ""David Beckham may have spent a similar amount on clothes this season judging by last week \'s shopping , but Chelsea could do with the money for different reasons .""', ""But the Spanish club have taken the rare step of officially commenting on press reports in an attempt to quash the story .'"", 'The Spanish club last week knocked United out of the Champions League quarter- finals and Beckham \\\'s absence from Sir Alex Ferguson \\\'s starting line - up that night served to fuel stories of an imminent departure to Madrid , something that the England captain has done nothing to dispel with his "" never say never "" remark and his pointed applause to all four sides of grounds after his last two appearances for the club .\'', '"" Surrounding the speculation regarding the supposed interest from Real Madrid in signing David Beckham , the club wishes to communicate that :\'', 'No contact has existed between Real Madrid and Manchester United on this issue . ""\']']"
2003-04-29,"[""['Real Madrid tonight officially denied any interest in signing David Beckham from Manchester United .'"", 'Real Madrid president Florentino Perez yesterday took the unprecedented step of publicly stating that he will "" never , never , never "" be interested in buying the England captain .\'', 'Days of tense speculation seemed to come to an end on Tuesday night when the Spanish club issued a statement explaining , in stark terms , that "" Madrid has no intention of negotiating the transfer of Beckham "" .\'', ""But the Spanish club have taken the rare step of officially commenting on press reports in an attempt to quash the story .'"", 'The Spanish club last week knocked United out of the Champions League quarter- finals and Beckham \\\'s absence from Sir Alex Ferguson \\\'s starting line - up that night served to fuel stories of an imminent departure to Madrid , something that the England captain has done nothing to dispel with his "" never say never "" remark and his pointed applause to all four sides of grounds after his last two appearances for the club .\'', '"" Surrounding the speculation regarding the supposed interest from Real Madrid in signing David Beckham , the club wishes to communicate that :\'', 'No contact has existed between Real Madrid and Manchester United on this issue . ""\'', ""Despite speculation to the contrary , David Beckham and Roy Keane will both be Manchester United players next season .'"", ""Once again , Real Madrid are eyeing up a superstar .'"", ""The superstar is David Beckham and the story is becoming identical to when Madrid signed Zinedine Zidane two years ago and Ronaldo last summer .']""]"
2003-05-23,"['[\'Beckham had been given special dispensation to stay at home when the rest of Eriksson \\\'s players leave for a six - day training camp in La Manga today . ""\'', 'The picture of the Queen , page 5 , G2 , yesterday , used with comments about the quality of her verse , was flipped ( making her appear to be left - handed ) .\', ""Manchester United confirmed yesterday that Beckham will be in plaster for six to eight weeks but Beckham \'s commercial bandwagon is unlikely to have come off its tracks given that he will be fit for the club \'s pre - season tour of the United States which starts on July 22 .""', ""David Beckham returned to the Absa Stadium an hour after the final whistle with his right arm in a sling and a bandage over the hand where he has fractured the scaphoid bone between his thumb and forefinger .'"", '"" I feel very sorry for him , "" said Sven - Goran Eriksson .\'', ""The wrist had been injured in the opening half - hour of a surprisingly competitive match , when Beckham went down under a challenge for which Thabang Molefe , the South Africa left - back , was cautioned .'"", 'Like Mr Mandela , the Manchester Utd captain is a light unto the world . ""\'', ""The captain of Manchester United is Roy Keane .'"", 'Few footballers can claim to match David Beckham in the hairstyle stakes but Marc Bircham is one who tries .\', ""The Football Association could only be impressed , as they obligingly supplied David Beckham for a photo - opportunity with Nelson Mandela to kick it all off , at the slickness of South Africa \'s bid for the 2010 World Cup ."", ""Bring England to town , get two of the world \'s most famous faces to smile at each other for photographs that will be seen all over the globe , and have Sven - Göran Eriksson on stage at your official launch party ."", ""Danny Jordaan is making it all look easy and using England to give South Africa global exposure . \'"", ""Nothing David Beckham does nowadays is without broader consequences and Sven - Goran Eriksson will be hoping that his latest mishap , suffered in the 2 - 1 victory over South Africa , will not lead to a rash of copycat injuries , as so damagingly happened in the run - up to last year \'s World Cup ."", ""No doubt Beckham \'s favourite designers are already sketching a variety of decorative wrist protectors , to be exposed whenever the England captain is photographed on holiday with his family in Provence or fulfilling commitments to his sponsors in the Far East this summer ."", ""\' It has n\'t been the normal preparation for a Euro qualifier ', ' said Michael Owen outside Durban \'s Absa stadium , making a late bid for understatement of the season ."", ""A few steps away , Sven - Göran Eriksson was admitting he knew nothing of Southampton \'s plans to play a testimonial against Aberdeen a couple of days after the FA Cup final , but England will have a hard time admonishing James Beattie and Wayne Bridge for risking their fitness when David Beckham and his side have just flown to the southern hemisphere to take part in the biggest testimonial ever .""', 'And lost their captain into the bargain , although Beckham , lucky boy , always knew his season would end this week .\', ""It has been David Beckham \'s week .""]']"
2003-05-24,"['[\'"" We knew that after tonight we would have to plan without Beckham , "" Eriksson said before the squad left Durban late on Thursday night .\'', 'He is one of the best footballers in the world today , "" he said , "" but I hope England is not so poor that we stand or fall with David Beckham .\'', '"" I was very happy today because I know Lampard was disappointed with his performance against Australia , "" the manager said .\'', 'But he has had a very good season and today he showed what he can do . ""\'', 'Like Mr Mandela , the Manchester Utd captain is a light unto the world . ""\'', ""Few footballers can claim to match David Beckham in the hairstyle stakes but Marc Bircham is one who tries .'"", 'What started as a bet has now become a phenomenon at Loftus Road , much to the chagrin of the manager Ian Holloway .\', ""The Football Association could only be impressed , as they obligingly supplied David Beckham for a photo - opportunity with Nelson Mandela to kick it all off , at the slickness of South Africa \'s bid for the 2010 World Cup ."", ""Bring England to town , get two of the world \'s most famous faces to smile at each other for photographs that will be seen all over the globe , and have Sven - Göran Eriksson on stage at your official launch party ."", ""Danny Jordaan is making it all look easy and using England to give South Africa global exposure . \'"", ""Nothing David Beckham does nowadays is without broader consequences and Sven - Goran Eriksson will be hoping that his latest mishap , suffered in the 2 - 1 victory over South Africa , will not lead to a rash of copycat injuries , as so damagingly happened in the run - up to last year \'s World Cup ."", ""No doubt Beckham \'s favourite designers are already sketching a variety of decorative wrist protectors , to be exposed whenever the England captain is photographed on holiday with his family in Provence or fulfilling commitments to his sponsors in the Far East this summer ."", ""\' It has n\'t been the normal preparation for a Euro qualifier ', ' said Michael Owen outside Durban \'s Absa stadium , making a late bid for understatement of the season ."", ""A few steps away , Sven - Göran Eriksson was admitting he knew nothing of Southampton \'s plans to play a testimonial against Aberdeen a couple of days after the FA Cup final , but England will have a hard time admonishing James Beattie and Wayne Bridge for risking their fitness when David Beckham and his side have just flown to the southern hemisphere to take part in the biggest testimonial ever .""', 'And lost their captain into the bargain , although Beckham , lucky boy , always knew his season would end this week .\', ""It has been David Beckham \'s week .""]']"
2003-06-05,"['[\'Barcelona presidential candidate Joan Laporta today claimed he had "" presented a project "" to Manchester United to sign David Beckham .\'', 'Barcelona presidential candidate Joan Laporta today claimed he had "" presented a project "" to Manchester United to sign David Beckham .\', ""One report yesterday said that Real would offer Luis Figo plus an undisclosed sum to secure Beckham \'s services ."", ""Joan Laporta , the candidate to become the new president of Barcelona who has pledged to sign Beckham , added to the confusion surrounding the player \'s future yesterday when he claimed negotiations to buy him were going well . \'""', ""Joan Laporta , the Barcelona presidential candidate , said yesterday he was close to reaching an agreement with Manchester United to sell David Beckham .'"", 'United confirmed last night they have received enough private assurances to believe a deal is still imminent , with Ronaldinho provisionally accepting a £ 60,000-a - week offer . ""\'', 'David Beckham has probably played his last game for Manchester United , sources close to the player and inside the club have told Observer Sport .\', ""For several weeks , United have privately made clear that , while Beckham is not formally for sale , they would be prepared to sell him if \' a substantial offer \' came along .""', 'The 40-year - old Catalan lawyer held a press conference , 10 days before the club \\\'s 94,000 members vote to decide who will be their next president , and said : "" I can not go into specifics but I can not deny that we started negotiations [ over Beckham ] some time ago .\'', '"" We have shown our project to United and they think it is very solid .\'', ""Mr Forth is known for his loud ties .']""]"
2003-06-07,"['[""Manchester United last night paved the way for David Beckham \'s departure when they confirmed that Italian and Spanish clubs \' have expressed a firm interest \' in signing the midfielder .""', 'One report yesterday said Madrid would offer Figo plus an undisclosed sum to lure Beckham .\', ""Joan Laporta , who hopes to become president of Barcelona and who has pledged to sign Beckham if he does , yesterday claimed negotiations with United to buy him were \' well advanced and progressing very well .""', 'United broke their silence on the speculation surrounding Beckham \\\'s future on Saturday when they issued a statement in which they revealed that Italian and Spanish clubs had "" expressed a firm interest "" in signing Beckham .\'', ""All that was exploded last Saturday when United and Stephens admitted they were negotiating to transfer Beckham to Madrid .'"", ""Manchester United had made a previous announcement about Beckham via its website on Saturday June 7 , in which it first confirmed that Italian and Spanish soccer clubs were interested in signing him .'"", ""Barcelona may be prepared to spend £ 30 million on David Beckham , but the England captain does not seem to enjoy similar admiration all over the world .'"", 'He is planning a record £ 154,000-a - week four - year contract , plus £ 30 m transfer fee .\', ""A statement from United effectively hoisted a \' for sale \' sign over the world \'s richest , best - known and most marketable player and signalled the imminent end of his 12-year career with the Premiership champions .""', ""The England captain has almost certainly played his last game for United .']""]"
2003-06-09,"[""['Italian prime minister and AC Milan owner - president Silvio Berlusconi ruled out a move for David Beckham in emphatic terms today when questioned by reporters on his trip to the Middle East .'"", 'Asked directly about his future , he told the Los Angeles Times yesterday : "" There will always be changes at a club like Manchester United .\'', 'One option that would have appealed to Beckham seemed to close yesterday , however , when Milan \\\'s president Silvio Berlusconi ended their interest , saying : "" There are many better ways of spending money . ""\'', 'FSA rules state any price sensitive announcement made over a weekend should be formally reported when the market next opens , and Manchester United made a statement to the stock exchange about the interest in Beckham shortly after the start of trading on Monday June 9 .\', ""· A box accompanying a piece on David Beckham \'s problems with fame attempted to set out the probabilities of his transferring to one of three other clubs ( Roadshow makes Beckham too sexy for his team , Sport , page 2 , June 9 ) .""', ""Berlusconi , who still makes all the major decisions in the running of the club although he leaves his deputy Adriano Galliani in day - to - day control , could hardly have been more candid when asked about whether he would buy the Manchester United midfielder .'"", '"" There are many better ways of spending money , earned with such sacrifice , rather than signing Mr Beckham , "" said Berlusconi to Italian reporters in Jerusalem .\'', ""David Beckham has reluctantly accepted that his future lies away from Manchester United .'"", 'In his first interview since the club confirmed that Italian and Spanish clubs had "" expressed a firm interest "" , he made it clear he was prepared to move if United no longer wanted him .\'', '"" I \\\'ve never said that I would never move away from Manchester , "" he said , "" and I \\\'ve never said that I would end my career there .\', ""Manchester United may have announced an agreement to sell David Beckham to FC Barcelona but that does n\'t mean he \'ll be lining up at the Camp Nou next season .""', 'Indeed , much of the Spanish media continues to insist that Beckham will join Real Madrid this summer .\', ""However , Guardian Unlimited Football understands that Beckham is n\'t seriously contemplating a move to the Camp Nou - and has told his advisors he would prefer to join AC Milan or Real Madrid instead ."", ""No , it \'s David Beckham still .""]']"
2003-06-11,"['[""Sven - Goran Eriksson would not confirm who will replace David Beckham on England \'s right wing , let alone reveal his starting line up for the Euro 2004 qualifier against Slovakia , but the likelihood is that Wayne Rooney will get his second international start as striker in Middlesbrough on Wednesday ."", ""David Beckham will play for Real Madrid and not Barcelona next season , according to this morning \'s Spanish papers ."", ""The seriousness of the rift between David Beckham and Sir Alex Ferguson was revealed today when the player \'s father admitted the pair have not been on speaking terms for several months .""', 'David \\\'s definitely not going to Barcelona , "" he told today \\\'s Evening Standard .\'', '"" I recommend him to come to Barcelona because he will be one of the leaders of the team , "" said Laporta today .\'', 'Henry Winter Daily Telegraph , June 11 "" Old Trafford \\\'s decision - makers ... know that Beckham is unlikely to be seduced by the thought of Barcelona ... particularly as he seems to be a very high - profile pawn in the chess game raging between the Catalan club \\\'s presidential candidates .\'', 'Martin Samuel Times , June 11 "" If United are as low on Beckham \\\'s priorities as his club has wickedly suggested , then what is there to stop him flexing his muscles , too ?\'', 'Sod the football - politically David Beckham must sign for Barcelona , not Real Madrid ( Real to hijack Beckham deal , Sport , June 11 ) .\', ""Roberto Carlos last night broke ranks with an otherwise silent Real Madrid to confirm Barcelona \'s worst fears : Madrid are on the verge of countering the Catalans \' offer to sign David Beckham ."", ""Real \'s urgency is made greater by the fact that Beckham is due to leave for Tokyo on Wednesday for his promotional tour which will take him to Kuala Lumpur , Bangkok and Ho Chi Minh City over 10 days when both Real and Laporta would prefer to be negotiating with him .""', 'Laporta will suggest that a meeting is arranged in London on Wednesday and will also prepare to make Beckham the highest - paid player in the world in a bid to beat off interest from Real Madrid .\', ""Speculation about Beckham \'s move is flying faster than boots in the Old Trafford dressing room , and it seems opinion really is divided on what Golden Balls should do next .""', 'I may not pay to watch the team at Old Trafford week - in week - out , but I spend at least £ 300 a year on Man United merchandise .\', ""The mood in the two cities is contrasting with journalists in Catalonia appearing pessimistic following Beckham \'s agents \' refusal to meet presidential candidate Joan Laporta , who has agreed a conditional deal with Manchester United .""', 'Puyol was particularly blunt in his refusal to countenance the issue , but Salgado , who speaks English - "" My sister - in - law is from York , you know "" - was prepared to mouth a platitude about how every good footballer would want to play for Real Madrid .\'', 'The news that Barcelona have agreed terms with Manchester United for the purchase of David Beckham is really neither here nor there .\', ""It is , of course , subject not only to the result of the Catalan club \'s presidential election this weekend but to agreement over the player \'s personal terms ."", ""Real Madrid will open negotiations with Manchester United about the purchase of David Beckham early next week , after the results of Barcelona \'s presidential election are known ."", ""They have already held informal talks with United and the England captain \'s advisers and hope to conclude a deal swiftly .""', 'Ted Beckham also said that Victoria Beckham will have the final say on where her husband moves . ""\'', 'David has to talk to her about it and see what she says before he decides , "" said father Ted , 53 , from his home in Chingford , Essex .\', ""The image was a real - time projection of the Manchester United website ; almost at the same instant as David Beckham \'s club announced they were not only prepared to sell him , but that they had agreed a price with a man who is not even acting officially on behalf of the club yet , Laporta was able to read the statement out in Catalan to an awe - struck gathering of Spanish media ."", ""The David Beckham \' package \' is an advertiser \'s dream .""', ""How much is Beckham , as a footballing and marketing phenomenon , worth ?'"", ""David Beckham is not just another footballer ...'"", 'He has been an inspirational captain of England who is also a devoted father and family man .\', ""I see him at least as a social liberal , so how could he contemplate joining Real - Franco \'s team - when he could play in the cooperative - owned Barca club in front of sophisticated leftwingers ?""', 'As Barca \\\'s presidential candidate Joan Laporta continued his strident pleas for the England captain to consider them , Real \\\'s Brazilian international said : "" I \\\'m absolutely sure that Beckham prefers Madrid because our team is in much better shape than anyone else .\'', '"" We \\\'ll have to wait for the next few days to see what happens but what is absolutely sure is that our president Florentino Perez has worked really hard and well so that Beckham can come to Real Madrid . ""\'', 'The fate of David Beckham will only be decided after dozens of whoppers have been uttered by men who boast about their probity but wilfully indulge in skulduggery to earn their millions .\', ""Once the smoke clears and the last lies have been rumbled , Beckham will either be paraded as a new trophy in Madrid or Barcelona , or will remain a £ 30 m albatross in Manchester , sabotaging Sir Alex Ferguson \'s last bid to win the treble , including the almighty European Champions League .""', ""Until about a year or 18 months ago , whenever I looked at David Beckham'"", '"" Ooo , David Beckham !\']']"
