2007-01-14,"['[""The 60-year - old Hollywood star , who is promoting the sixth Rocky film which is released this week , was given a huge ovation at Everton \'s game with Reading yesterday ."", ""Beckham \'s representatives have been infuriated by Capello \'s public dismissal of the 31-year - old and want talks with Madrid officials but they recognise that the 2 - 0 defeat in La Coruña the previous Sunday will almost certainly prove the Englishman \'s last game in a white shirt and are keen to broker an early move to California .""', 'Instead , his ostracism in Madrid is set to accelerate the move , with the Galaxy coach Frank Yallop last night admitting that he would welcome Beckham arriving for the start of the American season in April , if a deal could be struck to release him from his contract at Madrid .\', ""You \'re all in love with David Beckham . \'"", ""In recent months , we have been witnessing David Beckham \'s career tailing off - or so we thought .""', 'Celebrity - sickened Brits may have been cheering last week when David Beckham signed to Major League Soccer ( MLS ) team LA Galaxy for $ 250 million over five years , but what do our American friends make of the news ?\', ""Here are a few online responses : That \'s $ 50 m a year .""', 'The total guaranteed salaries of all players in the MLS for the 2006 season was about $ 23 m .\', ""It is with sadness that we mark David Beckham \'s move away from European shores , although we wave his family off with hope .""', 'They join a very long line of dreamers heading to Hollywood .\', ""Of course , the Beckhams are not just another set of \' suckers with cute accents \' , as writer Richard Rayner was once described on arriving full of ambition in the City of Angels ."", ""A bristling Fabio Capello , the Real manager , made it clear that it was \' Adios Becks \' , immediately ."", ""Who said David Beckham \'s arrival in America would attract no attention ?"", ""Not only has the erstwhile galactico and England captain made it onto the US equivalent of GMTV and elicited praise from Sly Stallone , he \'s attracted the attention of Jayceon Taylor , aka gangster rapper The Game ."", ""Showing a not entirely cohesive understanding of the game Americans call soccer , the South Central - based rapper ( Beckham \'s new side , LA Galaxy , is his local club ! ) was not entirely effusive about the arrival of the face of Gillette razors in his hood ."", ""Sylvester Stallone believes David Beckham \'s arrival at LA Galaxy will prompt an explosion of interest in the game in the United States , helping Major League Soccer to emerge from the shadow of more established sports .""', '"" I am sure in America David Beckham will be received as a superstar , no question about that , "" said Stallone .\', ""Here \'s something that might surprise readers outside the US trying to make sense of what the owners of the Los Angeles Galaxy could possibly be thinking by agreeing to help David Beckham on his quest to gross a quarter of a billion dollars over the next five years : in 2006 , the final game of Major League Baseball \'s World Series , in St Louis , was watched by 16.3 million Americans .""', 'I thought of these numbers last week , when I heard the Guardian \\\'s sports correspondent Paul Kelso on the Newsdesk podcast assert that "" US indifference "" to football would mean that David Beckham would soon find himself "" playing in front of crowds of 20,000 , many of whom may not know quite what \\\'s going on . ""\'', 'Ever the opportunist , Sam Allardyce attempted to lure David Beckham to Bolton before the former England captain opted for a new life in Los Angeles . ""\'', 'Yes , I did inquire about Beckham , "" said Allardyce , whose team could have done with a few of his devastating right - foot deliveries here .\', ""Moreover , with Fabio Capello announcing that Real Madrid \'s Los Angeles - bound midfielder will not play for the Spanish club again before his summer departure , Bolton \'s manager has even briefly contemplated bringing one of Adidas \'s key marketing tools to the Reebok on a six - month deal ."", ""David Beckham is likely to be heading for the United States ahead of schedule after Real Madrid \'s coach Fabio Capello insisted that he would not play another game for the club .""', ""Beckham had expected to see out the remaining six months of his contract at the Santiago Bernabéu in one last attempt for an honour in Spain before joining Los Angeles Galaxy in August in the run - up to MLS play - offs .']""]"
2007-01-16,"[""['UPDATE ( January 16 ) :'"", '"" We look forward to welcoming him in the summer and we respect his chance to honour his contract with Madrid , "" yee - hawed Galaxy general manager Alexi Lalas today , neglecting to mention that his club ca n\\\'t actually afford to prise Becks away for the start of the new Major League Soccer season in less than four months time .\', ""England \'s biggest - selling litter today reveals that El Diego may have scored his country \'s first goal not , as is generally believed , with his head but with ..."", ""Today \'s winner of a""', ""Beckham , who met up with the rest of his team - mates to have lunch in a restaurant in the Spanish capital today , is now prepared to sit it out for as long as necessary - even it means spending the next six months watching Madrid from the sidelines .'"", ""Despite claims to the contrary from Major League Soccer commissioner Don Garber , LA Galaxy general manager Alexi Lalas today insisted his club will not try and negotiate an early departure from Real Madrid for David Beckham .'"", 'And funnily enough I did once have a bird called Gloria in a transit , though it was a Tuesday and there was nothing sick about it .\', ""IT \'S ALL ABOUT THE BENJAMINS"", ""The stars of many of David Beckham \'s former MU Rowdies team - mates may be on the wane , but you would n\'t know it to look at Messrs Scholes , Giggs , Solskjaer and Neville as they rage against the dying of the light .""', ""Meanwhile at West Ham , Teddy Sheringham is fighting a relegation battle worth winning ; while a division below , Roy Keane is quietly going about establishing himself as a managerial force .'"", 'Real Madrid president Ramon Calderon has launched another bitter attack on David Beckham , claiming the former England captain will be "" an average cinema actor living in Hollywood "" .\', ""Any hopes of an amicable agreement between Beckham and Real over the remaining six months of his contract look doomed following Calderon \'s astonishing outburst ."", ""The Real president also said coach Fabio Capello \'s decision not to pick Beckham again was justified because not a single club had been in contact to request the 31-year - old \'s services ."", ""Real manager Fabio Capello \'s decision to draw a public end to the midfielder \'s playing days at the Bernabéu prompted speculation that Beckham would leave before his contract expires this summer .""', 'Garber supported such talk by saying that he expected the Galaxy to do "" everything they can "" to bring Beckham in before the MLS season kicks off in April , but Lalas denied that any such talks had taken place .\'', ""Beckham would like to negotiate an early departure from Madrid but that may prove difficult after the MLS commissioner Don Garber admitted LA Galaxy will struggle to find the money necessary to buy him out of his current contract .'"", ""If he is forced to stay , he will have little choice but to sit and suffer as a Bernabéu outcast - and , even if he succeeds in joining the LA Galaxy in time for the start of the MLS season in April , his departure will be wrought with bitterness .'"", 'I read with interest this week that David Beckham was a 1500 m champion in his formative years .\', ""Of course in the world in which he and his family reside this probably equates to an outing in the Boy Scouts \' fancy dress sports day .""', ""But it may well be that he was indeed blessed with prodigious athletic talent and it was just the first in a long line of successful career moves that saw him opt for practising free - kicks and corners rather than pounding the roads and running through mud .'"", '"" Obviously , I asked him for his advice because he is a very wise man and a very good friend of mine .\'', 'It \\\'s going to be a big help for us to have friends when we arrive in LA . ""\'', '"" Obviously , I asked him for his advice because he is a very wise man and a very good friend of mine .\'', 'It \\\'s going to be a big help for us to have friends when we arrive in LA . ""\'', ""Much like David Beckham , Ronaldo has fallen out of favour at Real Madrid , and speculation emerged in the last week that coach Fabio Capello had instructed sporting director Predrag Mijatovic to sell him this January .'"", '"" There is this possibility and I can not deny it , "" admitted Milan vice - president Adriano Galliani when asked about the speculation .\']']"
2007-05-24,"['[\'Of more immediacy is the England B match against Albania at Burnley tonight , and McClaren confirmed Michael Owen would captain an experimental 4 - 4 - 2 line - up on his first international appearance since rupturing his knee ligaments in the World Cup .\', ""Two months have elapsed since that night of rancour in Barcelona \'s Olympic Stadium and McClaren will return to the dugout tonight for an England B match against Albania before the more serious business of a Wembley friendly against Brazil and the Euro 2008 qualifier in Estonia ."", ""That is difficult to say but this evening \'s crowd at Turf Moor will expect a polished display , particularly with Michael Owen in attack , and it is safe to assume that anything less will leave him vulnerable to another barrage of abuse ."", ""Real Madrid \'s coach , Fabio Capello , last night insisted Beckham is currently playing the best football of his career , and certainly he has become a key part of the club \'s push for a first title since he arrived at the Santiago Bernabéu in 2003 .""', '"" I ca n\\\'t understand why Beckham is not in the England squad at the moment , "" the Italian insisted yesterday .\', ""After a frenzied day of will - he - won\'t - he speculation , the indications last night were that the England coach had gradually convinced himself that Beckham \'s inclusion would be a valuable short - term fix for a team languishing in fourth position in their Euro 2008 qualifying group .""', 'Sources say it is an 80 % chance that Beckham will return , particularly as there are doubts about the fitness of Aaron Lennon , who lasted only 10 minutes of the 3 - 1 win for England B against Albania in Burnley last night .\', ""The squad will be announced in the morning and a campaign has been growing for Beckham \'s return after an impressive series of performances to help Real Madrid to the top of La Liga ."", ""There have been times in Steve McClaren \'s short but turbulent spell as England manager when he has walked into press conferences looking as though he needs a bloody mary even before taking his seat .""', 'His verdict , delivered in a series of interviews in Manchester , was that he can , and will , win over the England supporters who verbally abused him during the 3 - 0 victory over Andorra in March .\', ""If David Beckham is finally recalled to the England squad for the first time since last summer \'s World Cup it will be his umpteenth resurrection and just reward for his performances at the club whose shirt he was told he would never wear again ."", ""Nonetheless it will be hard to avoid the suspicion that it owes as much to Steve McClaren \'s brittle decision - making , and the deep insecurity into which the England coach has descended , as it does to the former captain \'s form .""', 'Beckham may make a case for inclusion right now , but then he always did .\', ""A call - up for Beckham is likely to divide opinion throughout the country and it has already created divisions within the Football Association , with McClaren \'s assistant , Terry Venables , among those thought to have reservations ."", ""More likely is that he will go with the flow and recognise that Beckham \'s return gives him a better chance of being England \'s head coach this time next year .""', ""Even in their present hapless condition , a Beckham - less England are capable of putting on a decent show in a friendly match against a depleted Brazil team .'"", ""Bill Nighy Photograph : Matt Sayles/ AP'"", ""In unrelated Beckham news , Bill Nighy reminds us why actors should always be encouraged to stray self - effacingly off - topic .'"", ""During promotional interviews this week , the Pirates of the Caribbean star revealed that he had written to David Beckham to express his outrage that Steve McClaren had dropped him from international duty .']""]"
2007-05-25,"[""['David Beckham will discover tomorrow whether his return to form with Real Madrid has persuaded Steve McClaren to resurrect his England career .'"", 'McClaren , desperate to boost his own popularity , has given serious consideration to recalling the former captain for the friendly against Brazil next Friday and the Euro 2008 qualifier in Estonia five days later .\', ""Steve McClaren will almost certainly announce an end to David Beckham \'s international exile today .""', 'However , desperate times call for desperate measures and McClaren is aware that Beckham would add to the sense of occasion when England play Brazil at Wembley on Friday and maybe provide a lift for the qualifier against Estonia five days later .\', ""If Steve McClaren \'s only concern is to preserve what remains of his personal reputation , the name of David Beckham will be conspicuous by its absence from his England squad for the inaugural international against Brazil at the new Wembley and the Euro 2008 qualifier against Estonia , due to be named today ."", ""David Beckham was yesterday recalled to the England football squad for the first time since his international career petered out at last year \'s World Cup ."", ""Beckham told the BBC last night that he has finally learned Spanish and \' can speak and understand about 80 per cent \' .""', 'Beckham is by far the most notable member of a 26-man squad , which includes Aaron Lennon , even though the Tottenham winger is almost certain to miss out after twisting a knee in last night \\\'s B international against Albania at Turf Moor . ""\', ""Beckham \'s recall - and the chance to add to his 94 caps - overshadowed Owen \'s return after a not wholly convincing run - out for England B in Burnley on Friday and completely obliterated what could be a significant call - up for Bentley , one player who certainly did impress against Albania .""', ""England squad to play Brazil ( Wembley , 8 pm Friday ) and Estonia ( Tallinn , 7.30pm BST 6 June )'"", ""10 Andorra 5 0 0 5 1 22 NEXT FOR ENGLAND Friday Brazil ( friendly ) ,'"", 'Ledley King could play a part against Brazil on Friday but , barring injuries , it appears McClaren will resort to Joe Cole , Frank Lampard , Steven Gerrard and Beckham in Tallinn .\', ""Guardian Unlimited piano - carriers Rob Smyth and Barry Glendenning join him in the pod , along with Fernando Duarte , who \'s very excited by the prospect of seeing his beloved Brazil give England a hiding at New Wembley on Friday ."", ""The England manager confirmed the magnitude of recalling David Beckham for Friday \'s friendly with Brazil and , more importantly , the Euro 2008 qualifier in Estonia next Wednesday ."", ""If David Beckham is finally recalled to the England squad for the first time since last summer \'s World Cup it will be his umpteenth resurrection and just reward for his performances at the club whose shirt he was told he would never wear again ."", ""Nonetheless it will be hard to avoid the suspicion that it owes as much to Steve McClaren \'s brittle decision - making , and the deep insecurity into which the England coach has descended , as it does to the former captain \'s form .""', 'Beckham may make a case for inclusion right now , but then he always did .\', ""A call - up for Beckham is likely to divide opinion throughout the country and it has already created divisions within the Football Association , with McClaren \'s assistant , Terry Venables , among those thought to have reservations ."", ""More likely is that he will go with the flow and recognise that Beckham \'s return gives him a better chance of being England \'s head coach this time next year .""', ""Even in their present hapless condition , a Beckham - less England are capable of putting on a decent show in a friendly match against a depleted Brazil team .'"", ""In unrelated Beckham news , Bill Nighy reminds us why actors should always be encouraged to stray self - effacingly off - topic .'"", 'During promotional interviews this week , the Pirates of the Caribbean star revealed that he had written to David Beckham to express his outrage that Steve McClaren had dropped him from international duty .\', ""It is great news for the 32-year - old \'s fans , including the actor Bill Nighy , who says the decision to drop Becks \' got on my wick \' ."", ""Beckham , who captained his country in 58 of his 94 appearances , was dismissed by new coach Steve McClaren following this summer \'s World Cup in what many believed was a attempt to distance himself from the ill - fated and lambasted Sven - Goran Eriksson tenure ."", ""After England \'s good start under McClaren - they thumped Greece 4 - 0 in a friendly , beat Andorra 5 - 0 at Old Trafford and Macedonia 1 - 0 away in the Euro 2008 qualifiers - McClaren \'s decision to drop Beckham looked vindicated .""]']"
2007-05-31,"[""['David Beckham could be in line to receive a knighthood , it emerged today .'"", ""The revelation emerged as the Cabinet Office today dismissed reports that Whitehall officials were seeking to block a knighthood for the football star .'"", ""Reports in the Evening Standard this morning suggested questions had been raised over a possible honour for Beckham because of his planned move to the USA .'"", 'England returned to Wembley last night , and so did David Beckham , thus confounding those who had consigned both events to the realms of the improbable .\', ""Beckham tends to write his own scripts , and no Hollywood screenwriter could have bettered the moment , just over an hour into last night \'s friendly match against Brazil , when his free kick was headed home by John Terry , his successor as captain , to give England a 1 - 0 lead ."", ""Wisely , Beckham had kept his own counsel during the six days between the announcement of McClaren \'s decision to recall him to the squad and last night \'s match ."", ""With Terry now wearing the captain \'s armband , last night Beckham was back in the team strictly on his footballing merits , only a few weeks before he and his family fly to California , where he will earn a projected £ 128 m from a four - year contract with Los Angeles Galaxy ."", ""As well as his record as England captain , Beckham \'s claim to a knighthood is said to be bolstered by his work for charity and his role in securing the 2012 Olympic Games for London .""', 'David Beckham \\\'s latest tattoo declares "" Hate me as you fear me "" .\'', ""Because these days Beckham is just about the most widely read man on the planet , the JK Rowling of body - art .'"", ""The past locked arms with the present as the previous captain David Beckham flighted the free - kick with which his successor John Terry headed his side in front , but all the bonds that England forged could not shut out Brazil .'"", ""Gloom did not consume England .'"", ""David Beckham at an England training session .'"", ""The Cabinet Office has dismissed reports that officials in Whitehall are seeking to block a knighthood for David Beckham .'"", ""There have been times over the past year when David Beckham felt forced to resign himself to the idea that he had played his last game for his country but , as England were welcomed back into the deafening din of Wembley here , so a national icon re - established his credentials on the biggest stage .'"", ""California judges , for instance , thanked Paris Hilton for adding beauty , glamour and low - grade bongo to our otherwise mundane lives by chucking her in the slammer ; while the Queen is planning to reward David Beckham for finally getting Posh over to America and mercifully out of our hair by not giving him a knighthood .'"", 'David Beckham drew heart from a rapturous reception at Wembley in his first match for England since those touchline tears in Gelsenkirchen last year seemed to signal his swansong .\', ""The former England captain \'s name was given the most rousing cheer of all when it was read out before this 1 - 1 draw against Brazil ."", ""The 32-year - old then repaid the committed public support with what was a man - of - the - match performance in the nation \'s first return to Wembley since 2000 .""]']"
2007-06-06,"[""['Cavilling is justified over the continuing lack of incisiveness in attack , where Michael Owen was rusty and Alan Smith subdued , but there were heartening aspects for Steve McClaren as the manager prepares to face Estonia in the Euro 2008 qualifier next Wednesday .'"", ""The Bank of England governor Mervyn King may have a taste of what it is like to be Steve McClaren if David Beckham slots home one of his trademark free kicks in Estonia tonight .'"", 'David Beckham predicted he would play for England for "" many , many years "" , after justifying Steve McClaren \\\'s decision to recall him with an excellent performance in the 3 - 0 defeat of Estonia here last night .\', ""On Wednesday Owen was at his most industrious , anxious to play a full part in an improvement in England \'s build - up play .""', '"" We can have a nice summer now , "" he concluded on Wednesday night , speaking on behalf of his England team - mates .\'', ""England play in Moscow four days later , by which time Beckham could be looking as weathered as his passport .'"", ""All sorts of bitter endings could have lain in wait , but England left Estonia with a quietly satisfying close to an overwrought season .'"", ""The axe will not fall on Steve McClaren and the manager , in turn , is going to have trouble chopping David Beckham from the squad for a second time now that the midfielder has confirmed his efficiency by contributing to a couple of the goals .'"", ""It was his delivery which led to what must have been an intensely personal celebration as Michael Owen pushed the lead to 3 - 0 with his first strike in over a year lost to a knee injury .'"", 'At a time when the public has been less than impressed by the governor \\\'s choice of Adam Smith to adorn the new £ 20 note , the "" Becks for banknotes "" campaign will get a boost should the recalled winger help his country to a victory .\', ""He set up two of England \'s goals and , speaking in a new position of strength , he made it clear that he wanted to continue his international career when he leaves Real Madrid for Los Angeles Galaxy at the end of the Spanish season .""]']"
