1999-11-17,"['[""Yesterday \'s arrests followed the enactment by the martial - rule regime of a law barring politicians from holding office for 21 years if they were found guilty of corruption or of defaulting on loans .""', ""The coordinated sweep was just hours after the expiry of a deadline for debtors to repay loans or face criminal charges .']""]"
1999-11-19,"[""['It is thought he will be brought to court tomorrow .'"", ""The deposed prime minister of Pakistan , Nawaz Sharif , appeared yesterday before a special anti - terrorist court in the southern city of Karachi .'"", 'As he left the court yesterday , he reportedly told one journalist that "" the only hijacking has been of the democratic process "" .\'', ""Mr Sharif , 51 , arrived at the court in a convoy of armoured personnel carriers and jeeps amid chaotic scenes .']""]"
1999-11-21,"['[""Sharif backers claim bomb Militant supporters of Pakistan \'s deposed prime minister , Nawaz Sharif , claimed responsibility yesterday for a bomb that killed six people in Lahore , Punjab province \'s capital .""', ""Reuters , Bogota Swiss border guard killed A Swiss customs guard was killed early yesterday by a truck which smashed through a border control and disappeared into France , police said .'"", ""Yesterday , militant supporters of the deposed prime minister claimed responsibility for an explosion that killed six people in a crowded market place in Lahore .'"", '103 killed in floods Floods in Senegal have killed at least 103 people and made 23,400 homeless .\', ""Ex - premier in court Pakistan \'s ousted premier Nawaz Sharif appeared in court in Karachi to record a statement .""', 'Two children were among the dead , and 18 people were injured , police said .\', ""Ignoring the advice of Robin Cook , among others , Pakistan \'s military rulers appear determined to stage a show trial of the country \'s deposed prime minister , Nawaz Sharif , on capital charges of treason and hijacking .""]']"
1999-11-22,"['[""Mr Sharif maintains he is innocent , telling reporters outside the court on Monday that the army had carried out the only hijacking - of Pakistan \'s constitution , and of democracy .""', '\\x95 Re your leader ( Show trial in Pakistan , November 22 )\', ""Ignoring the advice of Robin Cook , among others , Pakistan \'s military rulers appear determined to stage a show trial of the country \'s deposed prime minister , Nawaz Sharif , on capital charges of treason and hijacking .""', ""It prospectively turns Mr Sharif into a martyr .']""]"
1999-11-23,"[""['Other Sharif supporters said that Mr Chaudhry had been coerced into giving his testimony on Tuesday , and that the former civil aviation chief was in poor health after being held in a mosquito - infested cell .'"", ""They were taken into protective custody for 90 days on Tuesday pending corruption investigations .']""]"
1999-11-24,"['[""Pakistan \'s deposed prime minister , Nawaz Sharif , yesterday suffered a setback to his defence against accusations of hijacking and treason when one of his co - accused agreed to testify against him .""', ""He is believed to have asked for a full pardon in return for appearing as the star witness against Mr Sharif and the three remaining accused .']""]"
1999-11-26,"['[""Mr Chaudhry \'s statement is expected to be made public tomorrow , when Mr Sharif is to be formally charged in a Karachi anti - terrorism court with hijacking , treason , kidnap and conspiracy to murder .""', "": the trial is taking place in a civil court constituted by the former prime minister Nawaz Sharif and not a military court .'"", 'As for the "" unsanctioned ascendancy "" of General Musharraf , let us not forget that 90 % of the people of Pakistan ( polled by the international media ) are in favour of Gen Musharraf .\']']"
1999-12-08,"[""['Today he is to appear with his brother and five senior officials before a special anti - terrorist court to face the so - called plane case charges .'"", ""Mr Sharif , who also faces separate charges of attempted murder and hijacking , was taken to the court in Islamabad in a convoy of armoured personnel carriers .']""]"
2000-01-11,"['[""In this respect , the chancellor \'s announcement yesterday that Britain would no longer underwrite arms sales to highly - indebted countries was ethical as well as economical ."", ""When General Pervez Musharraf overthrew the country \'s elected prime minister , Nawaz Sharif , in a military coup last October , Britain \'s response was robust .""', ""Robin Cook , the foreign secretary , roundly condemned the takeover and led a successful effort to suspend Pakistan from the Commonwealth .']""]"
2000-01-12,"['[""Today \'s disclosure that the government is actively considering a resumption of arms sales to Pakistan is deeply disturbing .""', ""Robin Cook , the foreign secretary , roundly condemned the takeover and led a successful effort to suspend Pakistan from the Commonwealth .']""]"
2000-01-19,"[""['The former prime minister of Pakistan , Nawaz Sharif , was formally charged yesterday with a series of offences that carry the death sentence .'"", '\\x95Following a spate of bombings in Pakistan , police yesterday defused a bomb in the car park of a Karachi civil court building .\', ""Sharif \'s trial is due to start a week on Wednesday .""', ""During a brief appearance in a special anti - terrorism court in the southern port city of Karachi , Mr Sharif , who was ousted by the military in a coup just over three months ago , was indicted for terrorism , hijacking and conspiracy to murder .'"", ""Mr Sharif pleaded not guilty to all charges .']""]"
2000-01-26,"['[\'Mr Sharif \\\'s full trial will start next Wednesday and few believe the death sentence will be passed if he is found guilty . ""\'', 'Gen Musharraf ordered all 13 supreme court judges to swear allegiance to a "" provisional constitutional order "" which he had passed immediately after taking power last October .\']']"
2000-02-03,"[""['The ousted prime minister of Pakistan , Nawaz Sharif , sat stoney faced in court yesterday as a pilot described how he had pleaded with air traffic controllers in Karachi to allow his plane carrying 200 passengers to land before it ran out of fuel .'"", ""The pilot , Captain Syed Sarwat Hussein , said he was alarmed after being told by Karachi air traffic control that he could not land at the airport in the southern port city .']""]"
2000-02-24,"['[""Mr Sharif \'s lawyers were preparing to open their defence yesterday , but prosecutors intervened to argue that the former leader could undermine national security in Pakistan - currently ruled by a military - dominated administration - if his testimony was not kept private .""', ""They have pleaded not guilty to charges of hijacking , kidnapping , attempted murder and terrorism which could carry the death penalty .']""]"
2000-02-25,"['[""A judge is to rule today on whether Pakistan \'s deposed prime minister , Nawaz Sharif , should be allowed to testify in open court ."", ""Judge Rehmat Hussain Jafri ruled on Friday that he would decide which parts of Mr Sharif \'s testimony could be reported after the former prime minister had spoken in open court and handed in written statements .""', ""They have pleaded not guilty to charges of hijacking , kidnapping , attempted murder and terrorism which could carry the death penalty .']""]"
2000-03-06,"[""['Nawaz Sharif , the deposed Prime Minister of Pakistan , will appear before a Karachi court tomorrow on hijacking and terrorism charges without his top defence lawyer and is facing new accusations by the military regime of corruption .'"", ""The trial is drawing to a close and the prosecution had been due to start summing up on Monday .']""]"
2000-03-08,"['[""Pakistan \'s deposed prime minister , Nawaz Sharif , told a court yesterday that the military had plotted to overthrow his government and then trumped up hijacking charges against him .""', ""Mr Sharif , 52 , looked relaxed and confident as he gave evidence for the first time at his trial in an anti - terrorism court in the capital , Karachi .']""]"
2000-03-10,"['[""Three smartly dressed gunmen walked into an office in Karachi yesterday and shot dead one of the leading defence lawyers representing Pakistan \'s deposed prime minister Nawaz Sharif .""', ""Iqbal Raad was killed with two other men as he sat at his desk on Friday .'"", 'Iqbal Raad was hit several times in the chest and died in his chair at his second - floor office in the Paradise Chambers building in central Karachi .\', ""Two other men in the room , an office worker and a judge \'s son , were also killed in the attack .""]']"
2000-03-13,"[""['He said he would discuss the shooting with the judge at the next hearing on Monday .'"", 'The demand is likely to further delay the drawn - out case , which was due to resume tomorrow .\', ""Sharif \'s defence team said they would not attend tomorrow \'s hearing . \'""]']"
2000-03-31,"['[\'The wife of the deposed Pakistani prime minister , Nawaz Sharif , yesterday threatened to defy the military regime and bring protesters out on to the streets if her husband is convicted in his hijacking trial next week .\', ""Kulsoom Sharif already faces a charge of treason after making an angry speech to hundreds of workers from her husband \'s Pakistan Muslim League last month .""', '"" If the decision is not positive then we will go and demonstrate , "" Mrs Sharif , 45 , said from her family \\\'s sprawling Raiwind estate , on the outskirts of Lahore .\']']"
2000-04-06,"[""['Next Thursday an anti - terrorism court judge in Karachi will deliver his verdict on Mr Sharif and may sentence him to death .'"", 'The foreign secretary , Robin Cook , yesterday expressed his concern .\', ""The prosecution yesterday announced they would appeal against Sharif \'s sentence and demand the death penalty - an option which Pakistan \'s military rulers were well aware would have provoked international outrage ."", ""Three gunmen shoot dead Sharif \'s lawyer , Iqbal Raad , in his Karachi office April 6 Sharif sentenced to life after being found guilty of terrorism and hijacking .""', ""Robin Cook , the foreign secretary , has expressed misgivings at the trial of former Pakistani prime minister Nawaz Sharif , who was found guilty of terrorism and hijacking and sentenced to life in prison .'"", 'Although Mr Sharif was spared death by hanging , Mr Cook said he was disturbed by a number of aspects of the trial . ""\'', ""The anti - terrorism court found Sharif guilty of hijacking and terrorism , but cleared him of attempted murder and kidnapping .'"", ""He was spared the death penalty .']""]"
2000-07-07,"[""['Party workers say up to 1,000 people have been detained nationwide since Friday .'"", ""Police began their operation with dawn raids on Friday , arresting dozens of party workers across Lahore , the Sharif stronghold .']""]"
2000-07-08,"['[\'Kulsoom Nawaz , who only two days ago was flailing in a destructive intra - party storm , is wearing the badge of a lady - leader who can make iron men run for extra security measures , "" the newspaper the News said .\'', ""But on Saturday Mrs Sharif slipped through the cordon and led police on a 10-mile car chase across the city before the road was blocked .']""]"
2000-07-23,"['[""Kohl \'s missing papers turn up A cache of files whose disappearance from the German chancellery helped raise suspicion about Helmut Kohl \'s 16 years in power is in the hands of a foundation affiliated to his party , a newspaper said yesterday ."", ""An armed ex - convict wanted for allegedly killing a shop assistant and wounding a sheriff \'s deputy is holding five hostages , four of them children , in a house near Orlando , the police said yesterday .""', 'The Italian opposition leader Silvio Berlusconi said in a newspaper interview published yesterday that he had won a battle against prostate cancer .\', ""AP , Seoul Pumping begins on oil tanker Pumping out an estimated 6,000 tonnes of fuel from the stern of the Erika , the tanker which leaked oil on to France \'s Atlantic coast last winter after splitting in two , began yesterday , officials said .""', 'Sharif , who was overthrown in a coup in October , was also banned from holding public office for 21 years and fined 20 million rupees ( £ 250,000 ) .\', ""A report in the Bild am Sonntag newspaper quoted the head of archives at the Konrad Adenauer Foundation as saying that many of the files presumed missing were in the foundation \'s possession and it would allow the government to see them sometime next month .""', ""AP , Berlin Ban on Sharif holding office']""]"
2000-07-24,"[""['AP , Paris Surgery under the hammer A South African private hospital will open an internet auction today offering a range of plastic surgery operations with a starting price of one rand ( 10p ) .'"", ""AP , Berlin Ban on Sharif holding office']""]"
2000-10-12,"[""['Prosecutors say that on October 12 Mr Sharif sacked his army chief , General Pervez Musharraf , and then tried to stop a commercial aircraft carrying the general landing in Pakistan , risking the lives of the 198 people on board .'"", ""Three resign , criticising the government for the economic crisis and religious killings October 12']""]"
2000-11-20,"[""['The agreement caused a serious row yesterday in the ranks of the Pakistan Muslim League , the party of Nawaz Sharif , the ousted prime minister who is serving a life sentence for hijacking .'"", ""Senior members opposed to an alliance with their erstwhile opponents stormed into the party headquarters in the capital , Islamabad , ripped portraits of Mr Sharif from the wall , and burned them , cheered on by hundreds of supporters outside .']""]"
2000-12-10,"[""['The deposed Pakistani prime minister Nawaz Sharif began a new life in exile in Saudi Arabia last night after being released from prison by the military regime which toppled him from power .'"", ""He had been in jail since the military coup 14 months ago , convicted of kidnapping , hijacking and corruption .']""]"
2004-04-12,"[""['A Pakistani opposition leader was sentenced to 23 years in prison yesterday for trying to incite an army rebellion against President Pervez Musharraf .'"", ""Mr Hashmi , de facto leader of the Pakistan Muslim League of the exiled former prime minister , Nawaz Sharif , was tried in prison behind closed doors ostensibly for security reasons .']""]"
2004-05-11,"['[""Hundreds of pro - democracy protesters were under arrest in Lahore and security forces were on full alert around the country last night after one of President Pervez Musharraf \'s main political opponents was deported to Saudi Arabia , just hours after touching down in Pakistan .""', ""He kissed the ground , declared love for his country and was then led away by the security forces .']""]"
2005-02-11,"['[""But there was little sign that yesterday \'s meeting would increase the pressure on him in the short term , analysts said ."", ""Pakistan \'s exiled opposition leaders , Benazir Bhutto and Nawaz Sharif , have met for the first time to call for the restoration of democracy and the end of military - dominated rule .""', ""The former political rivals met in Saudi Arabia , where Mr Sharif fled after being ousted from power by General Pervez Musharraf in a bloodless military coup in 1999 .'"", ""Ms Bhutto , a former prime minister , fled Pakistan in 1998 to avoid corruption charges .']""]"
2006-08-26,"['[""The killing of a tribal chief by Pakistani troops sparked widespread violence and rioting yesterday and raised fears that a decades - old conflict in the country \'s volatile south - west could widen .""', ""Nawab Akbar Bugti , 79 , died when troops raided his mountain hideout on Saturday .'"", 'His killing was described as "" the darkest chapter in Pakistan \\\'s history "" by the former prime minister Nawaz Sharif yesterday .\']']"
2006-10-06,"[""['The supreme court is hearing petitions that General Musharraf should not be allowed to contest the presidential vote on October 6 by federal and provincial MPs unless he resigns as head of the armed forces .'"", ""But the crackdown had already served its purpose - hours earlier Musharraf supporters had lodged his nomination papers for re - election on October 6 at the national election commission .']""]"
2007-01-08,"[""['That gives him long enough to file his nomination papers for the planned 8 January elections .'"", ""Last week , Musharraf flew to Saudi Arabia in a failed attempt to persuade King Abdullah to keep Sharif in the country until after the Pakistani elections on January 8 .'"", ""But this time the Saudis wanted Sharif home in time to contest the January 8 elections .'"", ""But the concession was immediately rebuffed by an opposition alliance headed by the former prime minister Nawaz Sharif , which threatened to boycott elections scheduled for January 8 .'"", 'Come hell or high water , elections will be held on January 8 .\', ""Benazir Bhutto \'s Pakistan People \'s party and Nawaz Sharif \'s Muslim League - N have both threatened to boycott the parliamentary vote set for January 8 unless the president , Pervez Musharraf , meets their demands .""', ""President George Bush called for the election to go ahead , though he avoided mention of whether Pakistan should stick to the January 8 timetable .'"", ""But he made no mention of January 8 .'"", 'He did not specifically say elections should be held on January 8 . ""\', ""Sharif , a former prime minister , told a news conference he believed the election should go ahead on January 8 despite Bhutto \'s death on Thursday .""]']"
2007-05-14,"[""['On Monday , Hamad Raza , a supreme court official close to Mr Chaudhry , was shot dead in his Islamabad home .'"", ""On Monday , Hamad Raza , a senior supreme court official close to Mr Chaudhry , was shot dead in his Islamabad home by unknown assailants .']""]"
2007-05-17,"['[""Pakistan \'s political crisis deepened yesterday when President Pervez Musharraf and his main rival , Benazir Bhutto , dismissed the possibility of a power - sharing deal .""', 'General Musharraf said on television last night that he would not allow Ms Bhutto or his other rival , Nawaz Sharif , to return from exile before parliamentary polls later this year . ""\'', 'Yesterday Shakil Turabi , the editor of a local news agency , said he was dragged from his car in Islamabad and beaten by men who accused him of "" writing against the government "" .\'', 'No , they will not be returning before elections , "" he said .\'', 'In a television interview broadcast , General Musharraf said he would not allow Ms Bhutto or his other rival , Nawaz Sharif , to return from exile before parliamentary polls scheduled for the end of the year . ""\'', 'No , they will not be returning before elections , "" he said .\']']"
2007-08-08,"[""['He failed to attend a meeting in Kabul yesterday designed to investigate peace moves on the Pakistan / Afghanistan border and faces a challenge in the courts today over the possible return from exile of the former prime minister , Nawaz Sharif , whom he deposed in 1999 .'"", ""He faces two election battles early next year , one for the presidency -- and he is constitutionally ineligible for a further term of office -- and a parliamentary election .']""]"
2007-08-22,"['[""President Pervez Musharraf \'s political problems deepened yesterday when the Pakistan supreme court ruled that his arch - rival , the former prime minister Nawaz Sharif , is free to return home after seven years in exile ."", ""Pakistan \'s chief justice , who survived a botched attempt by President Pervez Musharraf to fire him , has ruled that one of the president \'s key political rivals can return from a seven - year exile .""', 'In an extraordinary twist that is likely to enrage the president , Iftikhar Muhammad Chaudhry declared that the former prime minister Nawaz Sharif had an "" inalienable "" right to enter his native country .\'', ""Mr Sharif , who was ousted from power in 1999 by Gen Musharraf in a bloodless coup , is now set to contest upcoming parliamentary elections .'"", 'Mr Sharif and his brother Shahbaz , currently living in London , have an inalienable right of return , said the chief justice , Iftikhar Muhammad Chaudhry , whom Mr Musharraf tried to fire earlier this year .\', ""The government should not try to impede Mr Sharif \'s return , the judge warned .""]']"
2007-08-23,"['[\'But that would trigger a fresh confrontation with the supreme court , which ruled on August 23 that Mr Sharif has an "" inalienable "" right of return .\'', ""Legal experts said the deportation appeared to contravene the August 23 supreme court ruling allowing Mr Sharif to return home .'"", 'Mr Sharif \\\'s supporters said they would immediately appeal against the deportation to Pakistan \\\'s supreme court , which ruled on August 23 that the exiled politician had an "" inalienable "" right of return .\'', 'In an extraordinary twist that is likely to enrage the president , Iftikhar Muhammad Chaudhry declared that the former prime minister Nawaz Sharif had an "" inalienable "" right to enter his native country .\'', 'Mr Sharif and his brother Shahbaz , currently living in London , have an inalienable right of return , said the chief justice , Iftikhar Muhammad Chaudhry , whom Mr Musharraf tried to fire earlier this year .\', ""The government should not try to impede Mr Sharif \'s return , the judge warned .""]']"
2007-08-26,"['[\'A spokesman said yesterday that Mr Sharif , who was ousted by Gen Musharraf in a bloodless coup in 1999 and currently lives in London , was "" expected to embark for Pakistan in a few days "" .\'', ""Speculation that the president , Pervez Musharraf , would resort to drastic measures resurfaced this weekend after a supreme court ruling allowing the former prime minister , Nawaz Sharif , to return home after seven years in exile .']""]"
2007-08-29,"[""['But after a series of negotiations with Gen Musharraf , Ms Bhutto yesterday declared she had largely agreed a deal which would see him drop corruption charges against her , while in return he would relinquish his role as head of the army .'"", 'Yesterday he was scathing about any agreement between Ms Bhutto and Gen Musharraf . ""\'', ""Ms Bhutto , another exiled former prime minister , is an old ally of Mr Sharif .']""]"
2007-08-30,"['[\'Yesterday several government officials denied claims by Ms Bhutto that the general had agreed to resign from the army before elections . ""\'', ""Mr Sharif is planning to fight upcoming parliamentary elections against President General Pervez Musharraf , who is said to be on the brink of a deal with Benazir Bhutto .'"", ""Ms Bhutto , another exiled former prime minister , is an old ally of Mr Sharif .'"", 'We will be launching a movement against Mr Musharraf and his government , "" Mr Sharif told reporters in London .\']']"
2007-08-31,"['[""Ms Bhutto \'s party leadership is due to meet this afternoon to decide whether to sign a deal with the military leader , or go it alone .""', ""This man Musharraf is on his way out ...'"", 'We will be launching a movement against Mr Musharraf and his government , "" Mr Sharif told reporters in London .\']']"
2007-09-06,"['[\'He \\\'ll definitely be there , "" he said yesterday .\'', 'Yesterday lawyers ratcheted up the pressure on Gen Musharraf by hoisting black flags over courthouses across the country and calling for his resignation .\', ""Pakistan \'s former prime minister Nawaz Sharif has booked himself on five different flights to the country next week to counter government efforts to thwart his return ."", ""The airliner intrigue is one of several ruses by Mr Sharif to keep Pakistan \'s intelligence agencies guessing .""]']"
2007-09-08,"['[""Pakistan \'s former prime minister Nawaz Sharif left London last night on course for a stormy showdown with President Pervez Musharraf in a defiant bid to end his seven - year exile .""', '"" I \\\'m feeling great , "" he said as uniformed British police escorted him through a crowd of supporters at Heathrow airport on his way to the flight last night .\'', 'Human rights groups protested against the role of Saudi Arabia , which on Saturday sent its intelligence chief , Prince Muqrin bin Abdul Aziz , to admonish Mr Sharif . ""\'', ""Mr Sharif , who was ousted in a 1999 military coup , faces the prospect of arrest or deportation when he arrives at Islamabad airport on a scheduled flight from London at 11.45am ( 7.45am BST ) today .'"", 'The government has banned political rallies , arrested hundreds of opposition officials and declared an airport "" terror alert "" in an effort to scotch plans by Sharif supporters for a rousing welcome .\']']"
