2012-01-19,"['[\'Today , they introduce a lot more reality into it like homosexuality , adultery , all that stuff .\', ""Wertham \'s most notorious – and much - mocked – assertion was that DC Comics \' Batman , today a multi - million dollar cross - media industry in his own right , was an emblem of the creeping homosexuality that comics targeted at young males just coming to terms with their budding sexuality ."", ""The most significant new element of Thursday \'s hacking settlement announcements is the accusation by the hacking victims \' lawyers that Murdoch company directors tried to destroy evidence .""', 'Thursday \\\'s announcement accused NGN of a "" conspiracy , a cover - up and the destruction of evidence / email archives "" .\'', ""Leveson is likely to want to be supplied with the confidential papers detailing the reasons behind any settlements announced this morning .'"", 'Thursday \\\'s statement from Bindmans , which represented a number of the claimants , credited "" the work of investigative journalists at the Guardian "" in helping the victims by revealing the cover - up at the News of the World .\', ""Rupert Murdoch was in London on Thursday in time to follow the coverage of the 37 News of the World phone - hacking settlements he had already agreed to , a morning - long parade of apologies and admissions to celebrities and politicians on behalf of what was once Britain \'s best selling â€ “ and most feared â€ “ newspaper .""', ""Those days of aggressive denial may have gone , but even on Thursday , the publisher was dragged into a court battle over whether it should conduct a search of six desktop computers and three laptops belonging to various employees .'"", 'Batman now has a bigger enemy , in the shape of Rupert Murdoch , whose Fox News – reviled by the left , but with a reach into more than 100 m US households – is taking on the superhero and his DC Comics cohorts , criticising the comics for scenes including "" Batman and Catwoman having sex on the rooftop , a drunken Bruce Wayne , and graphic images of blood - splattered battles with heads chopped off "" .\'', 'Although the lawyers \\\' statement does not name names , it specifically accuses directors of News Group Newspapers Ltd , the Murdoch subsidiary which controlled the News of the World , of seeking to conceal the wrongdoing by "" deliberately deceiving investigators and destroying evidence "" .\', ""The directors of NGN were headed , from April 2008 , by James Murdoch , Rupert Murdoch \'s son ."", ""Ostensibly the purpose for his visit was to introduce the company \'s new chief lawyer from Washington , Gerson Zweifach , who will undoubtedly have to understand better how the English courts work .""', 'Murdoch will have known before his arrival that his company was prepared to admit "" senior employees and directors "" of News Group Newspapers , which published the News of the World , "" knew about its wrongdoing "" .\', ""Loz Kaye : \' The industry is failing to deliver what customers want \'""', 'It seems everyone is a pirate these days .\', ""Loz Kaye : \' The industry is failing to deliver what customers want \'""', ""It seems everyone is a pirate these days .']""]"
2012-02-11,"['[\'The Sun \\\'s editor , Dominic Mohan , said : "" I \\\'m as shocked as anyone by today \\\'s arrests but am determined to lead the Sun through these difficult times .\'', 'In an email to News International staff , Mockridge said he "" had a personal assurance today from Rupert Murdoch about his total commitment to continue to own and publish The Sun newspaper . ""\'', ""A Surrey police officer , 39 , a Ministry of Defence employee , 39 , and a member of the armed forces , 36 , were also arrested at their homes on Saturday on suspicion of corruption , misconduct in a public office and conspiracy in relation to both .'"", 'News Corporation , the parent company of News International which owns the Sun and the Times , confirmed that five Sun staff were among those arrested today .\', ""Surrey police confirmed a serving officer was arrested at the officer \'s home address on Saturday as part of Operation Elveden .""', 'Officers from Operation Elveden made the arrests between 6 am and 8 am as part of the investigation into allegations of inappropriate payments to police and public officials .\', ""On Saturday afternoon , as all hell was once again breaking loose in the Murdoch empire with the arrests of five senior people at the Sun in the police bribery investigation , I passed under Rupert Murdoch \'s windows on Fifth Avenue in New York â€ “ and got his latest tweet .""', '"" Five senior Sun journalists were arrested on Saturday on suspicion of corruption under the Prevention of Corruption Act 1906 , aiding and abetting misconduct in a public office ( contrary to common law ) and conspiracy in relation to both these offences .\'', ""Those arrested on Saturday include Geoff Webster , the deputy editor ; John Kay , chief reporter ; Nick Parker , chief foreign correspondent ; Mike Sturgis , reporter ; and John Edwards , picture editor .'"", ""The Sun has been plunged into its worst ever crisis following the arrest of five of its most senior journalists over corruption allegations , moving Rupert Murdoch to pledge his support for the paper amid rumours that it faces closure .'"", 'Murdoch \\\'s "" total commitment "" to continue to own and publish the Sun was sent to News International staff by chief executive Tom Mockridge after the journalists , who include the deputy editor , were arrested in connection with an investigation into inappropriate payments to police and public officials .\'', ""Mockridge confirmed that the five Sun journalists involved are deputy editor Geoff Webster , picture editor John Edwards , chief reporter John Kay , chief foreign correspondent Nick Parker and deputy news editor John Sturgis .'"", ""The Sun is suffering its biggest crisis since Rupert Murdoch acquired it in 1969 .']""]"
2012-02-12,"['[""None of these come close to today \'s crisis , with 10 journalists having been arrested and the potential for more to have their collars felt .""', ""It was reported on Sunday night that the solicitor representing the family of Milly Dowler and other alleged victims of phone hacking is to take his battle against Murdoch to America .'"", ""Meanwhile , over at a battered Sun the editor , Dominic Mohan , addressed staff on Sunday in an effort to rally journalists .'"", ""â€ “ the Sun , Times and Sunday Times â€'"", ""News International has been preparing to launch a Sun on Sunday ever since the News of the World was abruptly closed last July .'"", '"" This would be vintage Murdoch if he did something like announce the Sun on Sunday , "" said one insider .\', ""Rupert Murdoch \'s beloved red - top is the latest part of the New Corporation empire to be plunged into crisis â€ “ after a number of senior Sun journalists were arrested over alleged payments to public officials , having been tipped off by none other than News Corp \'s management and standards committee That betrayal caused huge ruptures in Wapping â€ “ but Murdoch has responded in his typically bullish way , not only by back his staff but also announcing the imminent launch of the Sunday edition of the Sun .""', 'Andrew Neil , the former Sunday Times editor , described Murdoch \\\'s carefully worded statement as "" clever "" , saying it had achieved the short - term objective of "" holding off an incipient rebellion at the Sun "" .\'', 'In his lunchtime email to staff , Murdoch said the Sun "" is part of me "" and promised to "" build on the Sun \\\'s proud heritage by launching the Sun on Sunday very soon "" .\'', 'This led to industry speculation that Murdoch was taking personal control of the crisis , and overseeing the launch of the Sun on Sunday .\', ""However , after the initial excitement of Murdoch \'s Sun on Sunday announcement had dissipated , other Wapping insiders offered more sober analysis of the day \'s events .""', ""Supposedly he was packing to head to London to take command of the crisis , but instead he was making a reasonable effort at normalcy , offering his views on various policy issues facing the US .'"", ""The man is a genius at holding it together .'"", ""The Sun is suffering its biggest crisis since Rupert Murdoch acquired it in 1969 .'"", 'I can not believe that Murdoch will take the nuclear option by closing his beloved paper , nor do I imagine him offering it for sale .\', ""Trevor Kavanagh , the associate editor and former political editor , took to the airwaves to give voice to anger and frustration emanating from the Sun \'s newsroom â€ “ which in turn prompted the MSC to defend the anti - corruption investigation , and the Metropolitan police its tactics .""', 'The Sun veteran , for years a close confidant of Rupert Murdoch , told Radio 4 that "" there is unease about the way that some of the best journalists in Fleet Street have ended up being arrested on evidence that the MSC has handed to the police "" .\'', 'News Corp is headquartered in New York .\', ""Rupert Murdoch \'s News Corporation faces the increased prospect of a full - blown inquiry by US authorities as part of the continuing investigation into alleged bribery of public officials under America \'s foreign corrupt practices act , after the latest round of arrests of senior journalists at the Sun this weekend ."", ""Murdoch flies into London later this week on a scheduled visit at a time of turmoil for Britain \'s best - selling newspaper , with journalists on the title angry at News Corp \'s powerful management and standards committee ( MSC ) , whose reconstruction and trawl of the company \'s email archive produced the evidence that led to the arrests .""]']"
2012-02-13,"['[""Simmering tensions at Rupert Murdoch \'s News Corporation burst into the open on Monday when a senior Sun journalist voiced unease that the company \'s powerful management and standards committee had handed information to the police that has led to the arrests of nine journalists from the tabloid over the last three weeks .""', 'But on Monday the Met defended its handling of the investigation , saying that it was justified by "" the seriousness of the allegations and significant number of victims "" .\'', ""The figures released on Monday are the first insight into the website since the sale .'"", 'The Times reported that News Corp \\\'s management and standards committee â€ “ which was publicly criticised by the Sun \\\'s associate editor Trevor Kavanagh on Monday â€ “ had disclosed the identity of police officers , a civil servant and an army officer to Scotland Yard because it did not believe they were "" legitimate sources "" .\', ""Littlejohn takes a more visceral line than the paper \'s leader , which credits the Daily Mail \'s investigative work with securing the convictions of police chief Ali Dizaei â€ “ who was on Monday found guilty of perverting the course of justice and misconduct in public office â€ “ and Gary Dobson and David Norris , the killers of Stephen Lawrence .""', 'In a page 10 news story , headlined "" Police \\\' used Stasi tactics \\\' arresting Sun news chiefs "" , taking in all of Monday \\\'s developments next to a panel , the Mail details the police crackdown on payments from journalists .\', ""The Sun \'s associate editor , Trevor Kavanagh , fired the first major shot in a column on Monday that criticised the MSC \'s work as a witch - hunt ."", ""Robertson \'s intervention follows revelations in the Times newspapers two days ago that the MSC disclosed names of sources to police that has led to the arrest and bailing of nine current and former Sun journalists , two police officers , an MoD employee and a member of the armed forces in relation to alleged illegal payments to public officials in the past three weeks ."", ""Trevor Kavanagh , the associate editor and former political editor , took to the airwaves to give voice to anger and frustration emanating from the Sun \'s newsroom â€ “ which in turn prompted the MSC to defend the anti - corruption investigation , and the Metropolitan police its tactics .""', 'The Sun veteran , for years a close confidant of Rupert Murdoch , told Radio 4 that "" there is unease about the way that some of the best journalists in Fleet Street have ended up being arrested on evidence that the MSC has handed to the police "" .\'', 'News Corporation executives could be vulnerable to individual prosecution by US anti - bribery authorities under the so - called "" willful blindness "" clause that holds company chiefs culpable if they chose to be unaware of any specific wrongdoing by their employees .\'', 'News Corp is headquartered in New York .\', ""Rupert Murdoch \'s News Corporation faces the increased prospect of a full - blown inquiry by US authorities as part of the continuing investigation into alleged bribery of public officials under America \'s foreign corrupt practices act , after the latest round of arrests of senior journalists at the Sun this weekend ."", ""Murdoch flies into London later this week on a scheduled visit at a time of turmoil for Britain \'s best - selling newspaper , with journalists on the title angry at News Corp \'s powerful management and standards committee ( MSC ) , whose reconstruction and trawl of the company \'s email archive produced the evidence that led to the arrests ."", ""I do n\'t think it can be said often enough how much the News of the World \'s phone hacking has cost Rupert Murdoch \'s company , News Corporation .""', ""In addition , News Corp spent $ 108 m ( £ 68 m ) in the previous quarter .'"", ""Myspace has said it has added more than 1 million new users in the past 30 days , taking it to 25 million registered users and representing a dramatic turnaround for the social network that Rupert Murdoch abandoned almost eight months ago .'"", 'The website claimed that about 40,000 people a day had signed up to Myspace since it introduced new ties with rival social networks , Twitter and Facebook . ""\'', 'The MSC , the News Corp body conducting an internal investigation into allegations of illegal activity by News International journalists , has according to the Times "" sought to reassure staff that it is protecting confidential sources by redacting names from documents but it has emerged that this does not apply if there is evidence that the source was a public official who may have been paid "" .\']']"
2012-02-16,"[""['Murdoch , who arrived at his Mayfair home on Thursday night after flying into Luton airport in a private jet , will be seeking to calm the febrile atmosphere .'"", ""After flying into Luton from the US on his private jet late on Thursday , Murdoch spent more than seven hours at Wapping as he sought to steady the ship .'"", ""Murdoch flew into the UK on Thursday to take personal control over the latest scandal to hit one of his titles .'"", 'Murdoch flew into the UK on Thursday to take personal control over the latest scandal to hit one of his titles .\', ""Many journalists on Murdoch \'s three News International titles""', ""Rupert Murdoch looked as if he had no hand to play .'"", ""But the old gambler came up trumps by producing a couple of surprise cards from his sleeve .'"", ""By cancelling the suspensions of the arrested Sun journalists he will have quelled the rebellion in the ranks .'"", 'Hugh Muir presents a special edition of Media Talk as we explore the growing civil war at the Sun .\', ""Roy Greenslade , Dan Sabbagh and Lisa O\'Carroll give their reaction to an extraordinary week .""', 'P4\', ""Rebekah Brooks \'s former personal assistant has been forced to abandon plans to relocate to News Corp \'s Australian outfit .""', ""Cheryl Carter had been hoping to start work as an editorial assistant in Perth last month .'"", 'A spokesman for Rupert Murdoch \\\'s Australian - based company , News Limited , said she was interviewed for the post but "" before a formal job offer was made , Ms Carter was arrested and so the process went no further . ""\'', ""Almost exactly 26 years ago , Rupert Murdoch prompted one of the most protracted and bitterly fought industrial disputes in Britain after he moved his newspapers overnight from Fleet Street to Wapping in east London , jettisoning the print unions along the way .'"", 'He also lifted the suspension of the 10 arrested journalists , inviting them to return to work "" until or whether charged "" .\']']"
2012-02-19,"[""['And by pledging to launch the Sun on Sunday he will have given the staff a sense of a long - term commitment to the paper and his UK empire .'"", 'Illegal activities simply can not and will not be tolerated – at any of our publications , "" he said , which will do little to allay the fears of journalists on News International \\\'s Sun , Times and Sunday Times that there could be more arrests to come .\'', 'The Sun on Sunday will publish for the first time next weekend , News International has announced .\', ""An internal memo sent to all staff on Sunday at Rupert \'s Murdoch \'s company said the media mogul will be in London for the launch .""', ""Speculation about a Sunday edition of the biggest - selling UK daily newspaper has been mounting since the closure of the News of the World after the hacking scandal .'"", ""The new paper is expected to be a Sunday edition of the Sun , rather than a standalone newspaper .'"", 'The Sun on Sunday will publish for the first time next weekend , News International has announced .\', ""An internal memo sent to all staff on Sunday at Rupert \'s Murdoch \'s company said the media mogul will be in London for the launch .""', ""Speculation about a Sunday edition of the biggest - selling UK daily newspaper has been mounting since the closure of the News of the World after the hacking scandal .'"", ""The new paper is expected to be a Sunday edition of the Sun , rather than a standalone newspaper .'"", ""Nobody can tell if the putative editor of the Sun on Sunday , or any of its embryo staff , is covered in hacking or bribing mud .'"", 'â€ “ before the Sun on Sunday can be launched .\', ""But what is true is that for all the problems Murdoch and the Sun have faced in recent weeks , it is the rival Sunday tabloids that could be vulnerable to the newspaper \'s return .""', ""There is already an initial acceptance that the Sun on Sunday is not just a rebadged News of the World .'"", 'However , the arrival of the Sun on Sunday could peg rivals back to below their News of the World levels .\', ""Top stories on MediaGuardian.co.uk Rupert Murdoch to supervise next week \'s birth of Sun on Sunday Some senior News of the World staff set to take roles at successor to tabloid that closed amid phone - hacking scandal Rupert Murdoch letter to News International staff \' full of legal errors \' Human rights lawyer says media mogul is not legally obliged to hand over evidence to police , and that doing so is unethical BBC \'s Sunday night TV \' ignores younger viewers \' , says Peter Bazalgette""', ""P21 Murdoch to launch new Sunday edition of the Sun .'"", 'P9 The Sun Sun on Sunday to launch on 26 February .\', ""Watson \'s intervention comes as the Sun prepares to launch its first Sunday edition this weekend .""', ""Well , he has done it yet again - surprising everyone by deciding to launch the Sun on Sunday next week .'"", 'Equally significantly , the Sun on Sunday means that once again Murdoch is publishing four national newspapers â€ “ and surely aspires to regain his former dominance , which saw him owning nearly 40 % of the national newspaper market .\', ""Maurice Glasman , a Labour peer , has pulled back from plans to write a column for Rupert Murdoch \'s new Sunday Sun newspaper after talking to Ed Miliband .""', 'But the Labour party does not endorse any newspaper and we do n\\\'t endorse the Sunday Sun . ""\'', 'Shortly after the closing of the News of the World – a bitter pill that he swallowed at the urging of his children – he proposed this new Sunday edition of the Sun , only to be met by practical resistance from his New York executives .\', ""What \'s more , they see a new Sunday paper , especially one with the Sun moniker , as quixotic , if not self - defeating : the Sun will only cause greater vexation for News Corp."", ""Rupert Murdoch \'s News International will face fresh questions over allegations of bribes at the Sun and hacking at the now - closed News of the World just one day after the publisher launches the Sun on Sunday ."", ""The mounting pressure could not come at a worse time for Murdoch , who this weekend is gambling on the launch of the Sun \'s Sunday edition , seven months after the News of the World closed .""', 'Murdoch , meanwhile , took to Twitter , to say : "" The Sun : great speculation , sweeps , etc on Sunday \\\'s sale .\', ""Simply : who \'s in charge here ?""', ""It is tempting ( if a little unlikely ) to think that was the moment where the octogenarian media mogul decided it was time for the rebirth of a newspaper , seven months after he abruptly closed the News of the World .'"", ""Labour MP Tom Watson has written to the head of the Metropolitan police questioning whether Rupert Murdoch is legally entitled to lift the suspensions of Sun staff arrested in relation to alleged payments to public officials .'"", ""Three weeks short of his 81st birthday , Rupert Murdoch can still do it .'"", ""More than 40 years after he swooped to buy the ailing Sun newspaper â€ “ and six months after just as shockingly closing the News of the World for corporate reasons â€ “']""]"
