2002-08-28,"[""['During his first speech to delegates at the earth summit in Johannesburg yesterday , Nelson Mandela urged politicians to make access to clean water a basic human right .'"", ""Nelson Mandela took the earth summit by the scruff of its neck yesterday , urging politicians to make access to clean water a basic human right and to put water and sanitation much higher up the political , economic and social agendas .'"", 'Yesterday a stream of people attested to the problem . ""\'', ""Confidential papers seen by the Guardian confirm that Europe will next week announce a major deal with African countries which is expected to channel hundreds of millions of pounds into African water supplies over the next 10 years .'"", 'Action programmes in six river basins will bring water to some of the 300 million people on the continent who have unsafe or intermittent supplies .\', ""In With Great Pleasure ( 11.30am , Radio 4 ) , her literary choices include excerpts from Nelson Mandela \'s autobiography and Louis MacNeice \'s Prayer Before Birth .""', 'In his first speech to delegates he said it was "" the absence of access to clean water "" that was "" most stark in the widespread impoverishment of the natural environment "" . ""\'', ""Access to water is a common goal .']""]"
2002-09-16,"[""['He was an editorial member of Marxism Today , and a supporter of its Welsh versions , Cyffro and Moving Left'"", '"" What right has Bush to say that Iraq \\\'s offer is not genuine ? "" he asked on Monday .\'', ""In 1998 , when Nelson Mandela received the freedom of the city of Cardiff , he singled out for praise , in the anti - apartheid struggle , the south Wales miners and the secretary of the Communist party in Wales , Bert Pearce , who has died aged 83 .'"", ""In 1997 , Pearce was part of the celebrations of the Yes'"", ""For Wales devolution campaign .']""]"
2002-10-28,"['[""The allegations are made in A Biography of Courage , an authorised account of the winger \'s career by Mark Keohane , the Springboks \' communications manager , and published in South Africa today .""', 'In particular , Mr Macgregor was never the chairman of the Young Monday Club , or even a member of the Young Monday Club or Monday Club .\', ""South Africa \'s best black rugby player has prompted uproar by denouncing the national sport as a bastion of white supremacy which faked multiracial harmony to host the 1995 world cup with Nelson Mandela \'s blessing ."", ""On the eve of the Springboks \' European tour , Chester Williams , a pinup for post - apartheid reconciliation , said he was ostracised and called a kaffir by fellow players and that prejudice flourished behind the myth of a changed society .""', 'Williams said the unity lasted a week after South Africa won the cup and that he was racially abused while being marketed as the symbol of a new beginning : "" That popular image of me being a black rugby icon was a bad joke . ""\', ""Punch Ltd , owner of the satirical magazine that closed earlier this year , today withdrew the claims and agreed to pay Mr Macgregor \'s legal costs as well as substantial libel damages ."", ""Mr Macgregor \'s solicitor , Kate Macmillan , told Mr Justice Eady at the high court in London the politician was considerably distressed and concerned by the item in Punch magazine in January ."", ""Amartya Sen , one of Britain \'s best - known academics , has announced his intention to resign as master of Trinity College , Cambridge , to take up a position at Harvard .""', 'In what is perhaps the greatest loss to British academe , Professor Sen will be returning to his old job as Lamont University professor in January 2004 .\', ""The Nobel Prize winning economist - who rivals Nelson Mandela with his 53 honorary degrees - is best known for overhauling the thinking on the causes of famine , and helping to develop the United Nation \'s human development index , the first measure of standards of living that considered factors other than gross national product .""]']"
2002-12-12,"['[""Only one in 10 people believed their elected representatives were interested in their needs and fewer than one in three felt today \'s government was more trustworthy than the apartheid regime .""', 'A teenage golf caddie , who shot dead a British tourist and wounded her husband during a botched robbery , was jailed for life yesterday by a judge who said he would not tolerate criminals treating tourists as "" soft targets "" .\'', ""Yesterday , the killer , who pleaded guilty to all charges , blamed the robbery plan on two accomplices .'"", ""One in five black people interviewed gave the regime which jailed Nelson Mandela and denied them the vote , a positive rating - a result which analysts attributed to crime and unemployment .'"", ""Mogane was also sentenced to an additional 44 years for armed robbery , illegal possession of a firearm and ammunition , and the attempted murder of Mr Conway .']""]"
2003-01-18,"['[""Yesterday Mandela \'s spokesperson , Zelda La Grange , said : \' We could have gone ahead with the concert but the image of Nelson Mandela is at stake .""', ""La Grange said organisers would consider another attempt but South Africa yesterday lamented the lost chance to raise money and awareness for HIV / Aids .'"", ""Not since Live Aid would there have been a concert like it .'"", ""Dozens of rock stars performing on Robben Island before Nelson Mandela and a global television audience to raise funds to fight HIV / Aids .']""]"
2003-03-03,"['[""South Africa \'s self - styled mother of the nation , Winnie Madikizela - Mandela , was plunged into a fresh legal battle today , as her trial for fraud and theft resumed following months of delays .""', ""A witness today told the court that she had been made to sign a blank loan application that was later fraudulently completed .'"", ""The former wife of Nelson Mandela faces up to 15 years in jail if convicted by the Pretoria regional court on all 85 charges .'"", ""It is her most serious brush with the law since a 1991 conviction for being an accessory to kidnapping .']""]"
2003-04-25,"[""['Winnie Madikizela - Mandela , the former wife of Nelson Mandela , could be sentenced to 15 years in jail today after being convicted of fraud and theft in a bungled banking scam .'"", 'She was once feted as South Africa \\\'s "" mother of a nation "" but , as Winnie Madikizela - Mandela was sentenced to jail for theft and fraud today , she is now as much reviled as adored .\'', ""The downfall of Winnie Madikizela - Mandela , the former wife of Nelson Mandela , was completed yesterday when a South African court sentenced her to four years in prison for fraud and theft .'"", ""Madikizela - Mandela , 68 , was caught in a web of forged signatures , bogus employees and a non - existent funeral scheme .'"", ""Supporters chanted outside the Pretoria court and the anti - apartheid campaigner promised to appeal but there seemed little doubt that her extraordinary political career was over .']""]"
2003-05-05,"['[""Walter Sisulu , a veteran of South Africa \'s anti - apartheid movement , died last night .""', ""But , whatever the hardship his mixed parentage brought to the life of Walter Sisulu , who has died aged 90 , South Africa can give thanks to the white foreman of black road workers who came to the Encobo area of the Transkei early in the last century and fathered one of the undoubted heroes of the liberation struggle .'"", ""Sisulu was - with Nelson Mandela and Oliver Tambo -'"", 'Mr Sisulu , who like his long - time friend Nelson Mandela spent more than 25 years in jail , died after suffering from a long illness . ""\']']"
2003-05-06,"['[\'She said yesterday : "" I am disappointed , because it is my wish and it was always Donald \\\'s wish that Nelson Mandela be seen as a world figure and not just someone who was significant in South African terms . ""\'', 'It is impossible for anyone who has not shared the experience to fathom the psychological suffering of those born into the no - man \\\'s land of "" coloured "" status in apartheid South Africa .\'', ""But , whatever the hardship his mixed parentage brought to the life of Walter Sisulu , who has died aged 90 , South Africa can give thanks to the white foreman of black road workers who came to the Encobo area of the Transkei early in the last century and fathered one of the undoubted heroes of the liberation struggle .'"", ""Sisulu was - with Nelson Mandela and Oliver Tambo -'"", 'Mr Sisulu , who like his long - time friend Nelson Mandela spent more than 25 years in jail , died after suffering from a long illness . ""\'', 'It is impossible for anyone who has not shared the experience to fathom the psychological suffering of those born into the no - man\\\'s - land of "" coloured "" status in apartheid South Africa .\'', ""But , whatever the hardship his mixed parentage brought to the life of Walter Sisulu , who has died aged 90 , South Africa can give thanks to the white foreman of black road workers who went to the Encobo area of the Transkei early in the last century and fathered one of the undoubted heroes of the liberation struggle .'"", 'Though statesmen all over the world fete Nelson Mandela , his image has been judged aesthetically inappropriate for Trafalgar Square .\', ""The suggested location is close to South Africa House , the scene of 40 years of anti - apartheid demonstrations and 28 years of protests against Mr Mandela \'s imprisonment .""]']"
2003-05-07,"['[\'Last night Angela Hooper , the cabinet member for city development , said the council was prepared to consider allowing the statue to be erected on the north - east corner of the square or outside South Africa House , but the mayor is likely to reject that .\', ""I am disappointed to hear about Westminster council public arts advisory committee \'s decision not to endorse a statue of Nelson Mandela near the South African embassy ( Mandela statue judged wrong for square , May 7 ) .""', 'It is of considerable concern that the public arts committee of Westminster city council has stated its opposition to the application for the statue ( Mandela statue judged wrong for the square , May 7 ) .\', ""Her mother died when Evelyn was 12 , and she was sent to Soweto to join her brother , Sam , who was living with Mandela \'s great friend and mentor , Walter Sisulu ( obituary , May 7 2003 ) .""', ""But , whatever the hardship his mixed parentage brought to the life of Walter Sisulu , who has died aged 90 , South Africa can give thanks to the white foreman of black road workers who went to the Encobo area of the Transkei early in the last century and fathered one of the undoubted heroes of the liberation struggle .'"", 'Though statesmen all over the world fete Nelson Mandela , his image has been judged aesthetically inappropriate for Trafalgar Square .\', ""To howls of protest by the promoters of the statue and the mayor of London , Westminster council \'s artistic advisers have rejected the proposal that it should go on the north terrace of the square ."", ""The suggested location is close to South Africa House , the scene of 40 years of anti - apartheid demonstrations and 28 years of protests against Mr Mandela \'s imprisonment .""', ""The proposal to put a statue of Nelson Mandela in Trafalgar Square may still go ahead , even though the art experts advising Westminister planning authority reportedly find it aesthetically unpleasing .'"", ""The Guardian has learned that the advisory panel did not completely rule out the north terrace of the square as a suitable location .'"", ""Although some said the section of the terrace under discussion was not the right one , there was no vote or formal decision .'"", ""While Mandela sat in his cell , many spent night after night outside the embassy remembering him .']""]"
2003-05-25,"['[\'That is why the public relations aspect of England \\\'s friendly in South Africa was almost as important as the football , and its branding as "" a PR disaster "" by the journalist guests on Jimmy Hill \\\'s Sunday Supplement on Sky yesterday will bring no comfort to the sporting establishment .\'', ""It has been a week of international disappointments .'"", ""In South Africa , Nelson Mandela misses out on the chance to meet Gareth Southgate .'"", ""Back home , meanwhile , our entry in the Eurovision Song Contest fails to garner a single vote from the rest of Europe .']""]"
2003-07-02,"['[\'The former South African president , Nelson Mandela , will join a thousand former Oxford University Rhodes scholars tomorrow to celebrate the centenary of the scholarship trust Rhodes scholarships are among the most sought after in the world .\', ""The first part of tomorrow \'s event will take place in Westminster Hall in London and will be attended by prime minister Tony Blair , Mr Mandela , Mr Clinton , Nicky Oppenheimer , the chairman of De Beers , and Lord Waldegrave , the chairman of the Rhodes trustees ."", ""Shoulder to shoulder , Tony Blair , Nelson Mandela and Bill Clinton celebrated the centenary of the Rhodes Trust in parliament \'s Westminster Hall last night .""', ""Last Wednesday , Nelson Mandela once again showed his unique moral influence , two weeks before he celebrates his eighty - fifth birthday with a banquet in Johannesburg .'"", 'Before 1,000 former scholars and world figures , the former South African president dismissed claims that he and the prime minister had become "" common enemies "" over Iraq .\'', 'Mr Mandela said : "" I looked forward to coming here to meet Tony Blair because we differed on one point , but we have never forgotten that we are the best of friends . ""\']']"
2003-07-08,"['[\'George Bush began his African tour in Senegal yesterday with an impassioned denunciation of slavery and praise for the "" persistence and courage "" of African Americans who fought to recover the life and liberty stolen from them .\'', 'Yesterday he said : "" Human beings were delivered , sorted , weighed , branded with marks of commercial enterprises and loaded as cargo on a voyage without return .\'', ""Yesterday his forces prevented a US military survey team inspecting a refugee camp outside the capital Monrovia .'"", ""Mr Bush met the Senegalese president , Abdoulaye Wade , and six other heads of state yesterday :'"", 'After a few hours in Senegal he flew to South Africa last night for talks today in Pretoria with President Thabo Mbeki .\', ""He visited the dungeons of Goree Island , a trading post from where slaves were shipped to America , and said the trade was one of history \'s greatest crimes .""', ""Nelson Mandela , the Pope and Bill Clinton have also visited the island , but sceptics said Mr Bush was making a thinly veiled attempt to wean black voters away from his Democrat challenger next year .']""]"
2003-07-12,"['[\'A black man voting for the Republicans makes about as much sense as a chicken voting for Colonel Sanders , "" as the late father of JC Watts , the former Republican congressman who will meet Mr Bush in Nigeria today , once said .\'', 'Hundreds gathered outside 13 Lyme Street , Camden , north London , as the former South African president paid a tribute to "" great comrades "" who had helped to achieve a democratic society in South Africa .\'', 'He said : "" It is a great honour to appear on this occasion , because we are honouring two eminent South Africans who , as young people , decided to join forces against those who suppressed millions of people in our country . ""\'', ""Even before he had boarded Air Force One , Mr Bush had fallen out with the black American establishment .'"", 'He failed to consult the Congressional Black Caucus , the 38-strong body of black legislators , and then left Nelson Mandela off his itinerary . ""\'', 'The fact that he \\\'s going at all is welcomed , "" said Julian Bond , chairman of the National Association for the Advancement of Coloured People .\']']"
2003-07-18,"['[""Nelson Mandela turns 85 today and South Africa will party into the weekend in a blaze of banquets and celebrations attended by pop stars and Hollywood \'s finest ."", ""Family tragedy hits Mandela on eve of great birthday celebration Nelson Mandela \'s eighty - fifth birthday celebrations were interrupted yesterday as he attended the funeral of his daughter - in - law , Zondi Mandela .""', 'The former South African president celebrated his birthday last Friday along with the fifth anniversary of his marriage to third wife Graca Machel .\', ""Former US President Bill Clinton delivered the inaugural Nelson Mandela lecture yesterday in Johannesburg , in which he urged the world to \' follow the path of Mandela \' . \'"", ""Nelson Mandela turned 85 last Friday and South Africa partied all weekend long with banquets and celebrations attended by statesmen , pop stars and Hollywood \'s finest .""', 'The former president will wake up to the air force orchestra playing Happy Birthday outside his Johannesburg home and be serenaded again by the Springbok rugby team .\', ""Zondi was the wife of Mandela \'s only surviving son , Makgatho .""', ""Those who stand beneath the white cables for the opening will see a different Johannesburg from those who consider it a byword for decay and crime .']""]"
2003-10-05,"[""['Until yesterday it seemed inconceivable that South Africa could pose any kind of threat in this World Cup .'"", ""Months of bitter off - field rows over racism and thuggery have simply emphasised how much ground has been lost since the Springboks hoisted the William Webb Ellis trophy in 1995 but , eight years on , the Nelson Mandela effect appears as powerful as ever .'"", ""Before they flew out , the embattled squad enjoyed an audience with their former president and from the moment they stepped off the plane in Australia'"", 'After the 1976 Soweto uprising , in which the apartheid regime murdered about 200 people and left many more injured , Nelson Mandela smuggled a message out of Robben Island prison : "" At all levels of our struggle , within and outside the country , much has been achieved and much remains to be done , "" he wrote . ""\'', 'But victory is certain ! ""\'', ""Given the times , these were bold words indeed .']""]"
2003-11-04,"['[""They also know how to avoid the pitfalls of banality the likes of Dido are accused of , not for them the hyper slick delivery of much of today \'s pop that leaves real emotions at a far remove .""', ""Fame is a slippery phenomenon .'"", ""Madonna , Nelson Mandela and the Pope :'"", 'they \\\'re "" famous "" .\']']"
2004-04-13,"[""['Yesterday morning , on the eve of our third democratic election , I walked round my neighbourhood park with my three - week - old daughter , Ayanda .'"", ""He might not have grown a mental beard and gone out on long , long runs of self - discovery .'"", 'He may not have met Elvis or JFK ( but then who cares when he has met Nelson Mandela ? )\', ""And his mum probably never told him that life was like a box of chocolates - you never know what you \'re going to get - not least because down Leytonstone way boxes of chocolate have those ingenious little cards telling you exactly what you \'re going to get .""', 'My mother still lives there .\', ""New Eersterus is a barren piece of land 45 minutes \' drive north of the capital city , Pretoria .""]']"
2004-07-05,"['[""I played it on Monday ', ' he says ', ' and it looked like it was taking good shape .""', 'Rather than celebrate , the woman once dubbed the mother of the nation was defiant and promised to appeal against the ruling that upheld other convictions for fraud .\', ""Mrs Madikizela - Mandela , 67 , allegedly abused her position as head of the African National Congress Women \'s League to defraud a bank by obtaining loans worth $ 120,000 in the name of non - existent employees .""]']"
2004-08-06,"[""['The party that built apartheid and turned South Africa into a pariah state completed its march to oblivion yesterday by deciding to merge with its one - time nemesis , the African National Congress .'"", ""Just a decade ago such a marriage would have been dismissed as a surreal impossibility , but the NNP is so enfeebled from successive electoral batterings that the wonder yesterday was how it managed to last so long since dismantling apartheid .'"", 'Yesterday he said he would join the ANC within weeks .\', ""South African politician Mangosuthu Buthelezi said yesterday that Aids had killed his daughter , his second child to die from the disease this year , and slammed the government \'s handling of the pandemic .""', 'The New National Party , heir of a mighty movement that jailed Nelson Mandela and built nuclear bombs , said its shrunken membership would dissolve and fight future elections under the banner of the black ruling party .\', ""A meeting of the NNP \'s federal council proposed that members join the ANC , a bitterly ironic twist for a party founded almost a century ago to promote the interests of white Afrikaners and keep blacks from power .""]']"
2004-10-28,"['[""South Africa \'s most prolific mass murderer was released on parole yesterday after serving 12 years in jail for a shooting spree that made him an apartheid folk hero .""', ""Praised by warders as a model prisoner , Van Schoor walked free yesterday thanks to a sentence reduction for all convicts issued by Nelson Mandela when he was president .'"", ""Van Schoor said yesterday that he would miss his daughter now he was out , but promised to look after her own daughter , who is of mixed race .'"", ""Louis van Schoor is believed to have shot 101 black people , killing 39 of them , including children , while working as a security guard in the port city of East London .']""]"
2004-11-21,"[""['What man that you have heard or read about , living today in any part of the world , do you admire most ?'"", ""What woman that you have heard or read about , living today in any part of the world , do you admire most ?'"", ""Then 1 Winston Churchill 2 Duke of Edinburgh 3 Anthony Eden 4'"", ""Sir Edmund Hillary 5 Clement Attlee']""]"
2005-01-04,"[""['Yesterday England were thrown straight back in by a former prison warder , and the only saving grace was that his broken hand might have prevented him from locking the door and throwing away the key .'"", ""Before Charl Langeveldt ran through England yesterday morning to take five for 46 , the best first - innings figures by a South African debutant for 43 years , his claim to fame was that he had worked at the Victor Verster prison outside Paarl - the institution from which Nelson Mandela famously walked to freedom in 1990 .'"", ""Yesterday , in six overs , he took the last four wickets - including Geraint Jones and Graham Thorpe - at a cost of 15 runs .'"", ""The talk after the second Test at Durban was that both teams had got out of jail .']""]"
2005-01-06,"['[\'Nelson Mandela today revealed that his eldest son , Makgatho , has died of Aids .\', ""Makgatho , a 54-year - old attorney , died earlier today in Johannesburg \'s Linksfield Park Clinic , to which he was admitted last month .""', 'The former South African president Mr Mandela today told a hastily - arranged news conference : "" Let us give publicity to HIV / Aids and not hide it , because the only way of making it appear to be a normal illness just like TB , like cancer , is always to come out and say somebody has died of HIV . ""\'', 'While not criticising Mr Mbeki publicly , and fending off questions about the president today , Mr Mandela has been increasingly prominent in the campaign against HIV / Aids , and recently hosted a concert to raise money for his HIV / Aids awareness foundation .\', ""Nelson Mandela broke one of South Africa \'s great taboos yesterday by admitting his oldest and only surviving son had died of Aids .""', 'Makgatho Mandela , 54 , died in a Johannesburg clinic yesterday morning after lengthy treatment for what had been an undisclosed illness .\', ""Mr Mandela \'s announcement challenged the widespread prejudice against sufferers of the disease in South Africa , which has undermined efforts to tackle the pandemic .""', ""Lauren Phillips , 38 , left South Africa in 1989 , shortly before Nelson Mandela was released from prison , and returned last year with her British husband and their three children after 15 years in London .'"", 'We were so isolated [ in South Africa ] with the boycotts and I wanted to be part of the rest of the world , to see rock concerts and so on . ""\']']"
2005-01-07,"['[\'That \\\'s why we have called you today to announce that my son has died of Aids . ""\'', ""Hours later his father , looking frail but resolute , assembled journalists to the garden of his home to confirm what everyone had suspected .'"", ""Lauren Phillips , 38 , left South Africa in 1989 , shortly before Nelson Mandela was released from prison , and returned last year with her British husband and their three children after 15 years in London .'"", '"" I had finished university and wanted to live abroad .\'', 'We were so isolated [ in South Africa ] with the boycotts and I wanted to be part of the rest of the world , to see rock concerts and so on . ""\']']"
2005-02-03,"[""['( At the Make Poverty History rally , London , 3 February 2005 )'"", ""Nelson Mandela is about to address a debt relief rally in Trafalgar Square .'"", ""He looked old .'"", ""Perhaps he will not come to London again .']""]"
