2010-06-10,"['[\'"" On a day on which the Fifa president , Sepp Blatter , declared that the World Cup had brought in record revenues , Jordaan confirmed that Mandela was scheduled to appear at today \\\'s opening ceremony . ""\', ""Zenani Mandela , 13 , was killed on the way home from last night \'s pre - tournament concert in Soweto , where tens of thousands of people sang and danced with pop stars including Shakira and the Black Eyed Peas .""', ""The crash comes after three British students died in a road accident in South Africa yesterday .'"", 'At last night \\\'s pre - tournament concert , South African president Jacob Zuma also took to the stage and thanked South Africans for the welcome they have given World Cup fans , and called on them "" to show the warmness for the whole duration of the tournament "" .\'', ""Eleanor Payne and Samantha Lake , both 19 , were killed when their driver apparently lost control on a bend on Thursday morning .'"", ""The crash happened a few miles from Barberton , shortly after 11 am local time .'"", ""Six have been discharged from hospital and left their hotel yesterday to fly home .'"", 'The death of Zenani Mandela , who was on her way home from a pre - World Cup concert in Soweto yesterday , stunned South Africa .\', ""There was no hotel room full of macheted England fans to pick over , no blazing bus of robbed Americans : just the 13-year - old great - granddaughter of the man who made it possible , killed when the car she was travelling in left the road after Thursday \'s Kick - Off Celebration ."", ""Danny Jordaan , who has campaigned for the World Cup to come to South Africa for the last 16 years and worked to deliver it for the last six , said the event could be as significant in the country \'s history .""', ""Director : Richard Attenborough Entertainment grade : C+ History grade : C Along with Nelson Mandela and Robert Sobukwe , Steve Biko was one of the most important anti - apartheid leaders in mid- 20th century South Africa .'"", 'It meant that a day the frail Mandela had long anticipated â€ “ his "" rainbow nation "" performing a new miracle under the world \\\'s gaze â€ “ became instead one of private grief and mourning .\'', 'The death of Zenani Mandela , who was on her way home from a pre - World Cup concert in Soweto , stunned South Africa on the day it was celebrating hosting the tournament .\', ""The 2010 World Cup gets under way today - minus Nelson Mandela , who \'s mourning the death in a car accident of his great - granddaughter ."", ""South Africa \'s national celebrations were tragically interrupted on the eve of the World Cup tournament , when a suspected drunk driver caused a car crash that killed the 13-year - old great - granddaughter of Nelson Mandela .""]']"
2010-06-11,"['[\'Violent crime is another post - apartheid scourge that sceptics warn could threaten the safety of fans at the World Cup , which kicks off on 11 June . ""\', ""Mandela is expected to make a brief appearance at tomorrow \'s opening ceremony before South Africa play Mexico ."", ""A heartbroken Nelson Mandela has pulled out of today \'s football World Cup opening ceremony in South Africa after the death of his great - granddaughter in a car crash .""', 'A spokesman for the South African organising committee said : "" Mr Nelson Mandela this morning learned of the tragic death in an accident of his great - granddaughter , Zenani Mandela .\'', 'Mamonyane said the driver could also face culpable homicide charges and is due to appear in the Johannesburg jmagistrates court today .\', ""Before today \'s first match â€ “ between the host country and Mexico â€ “ 1,581 performers will take part in an opening ceremony broadcast around the world in more than 200 countries .""', ""A suspected drunk - driver caused a car crash today that killed the 13-year - old great - granddaughter of Nelson Mandela , according to police .'"", 'Today , survivors of a bus crash that killed three British students on a college field trip to South Africa were said to be extremely traumatised by the tragedy .\', ""The Observer \'s South Africa correspondent Alex Duval Smith joins us from Cape Town , where Uruguay play France this evening .""', ""Zenani Mandela , who had just turned 13 , was killed in a car crash on her way home from the World Cup opening concert in the early hours of Friday morning .'"", 'It meant that a day the frail Mandela had long anticipated â€ “ his "" rainbow nation "" performing a new miracle under the world \\\'s gaze â€ “ became instead one of private grief and mourning .\'', ""The man , who has not been named , also faces a culpable homicide charge but has been released to await a further hearing .'"", 'The death of Zenani Mandela , who was on her way home from a pre - World Cup concert in Soweto , stunned South Africa on the day it was celebrating hosting the tournament .\', ""The 2010 World Cup gets under way today - minus Nelson Mandela , who \'s mourning the death in a car accident of his great - granddaughter ."", ""Football fans in Johannesburg share their excitement with Owen Gibson , the Guardian \'s sports news correspondent ."", ""South Africa \'s national celebrations were tragically interrupted on the eve of the World Cup tournament , when a suspected drunk driver caused a car crash that killed the 13-year - old great - granddaughter of Nelson Mandela .""', 'The driver , who has not been named , also faces a culpable homicide charge but has been released to await a further hearing .\', ""The shaming paradox for all merchants of doom as Africa \'s first World Cup commenced was that the only tournament - related death had been a member of the Mandela family ."", ""Zenani Mandela \'s passing kept Nelson Mandela away from South Africa \'s 1 - 1 draw with Mexico , which , as Siphiwe Tshabalala found the sweet spot with a crashing left - foot shot , prompted the thought that the most important goal had already been scored at this World Cup , unless an African nation scores one to win the final .""', ""For this World Cup Holland are the new Germany .'"", ""But they have based themselves in a hotel right in the middle of Johannesburg , in Sandton , where most of the fans and tourists congregate and where the nights are noisy with vuvuzelas and chatter from the restaurants that line Nelson Mandela Square .'"", ""The last time the World Cup was successfully retained , President Kennedy predicted the US would put a man on the moon , the Beatles released their first single , 12 East Germans escaped via a tunnel under the Berlin Wall , and the South African government arrested Nelson Mandela and charged him with incitement to rebellion .'"", ""In 1962 Brazil became the second nation to defend the World Cup , following the 1958 triumph that forever evokes grainy images of a precocious 17-year - old Pelé .']""]"
2010-07-10,"['[""Nelson Mandela , who presided over the birth of a democratic South Africa , took centre stage again last night at the country \'s coming of age .""', 'There had been uncertainty about his appearance last night , with his grandson accusing Fifa of putting "" extreme pressure "" on the anti - apartheid hero .\'', ""A thunderous mix of vuvuzelas and roars from the crowd greeted the former South African president as he was driven across the pitch in a golf cart with his wife Graça Machel .'"", ""The anti - apartheid icon had kept a low profile during the tournament , having cancelled plans to attend the opening ceremony after his great - granddaughter died in a car crash the night before .'"", ""The 2010 World Cup has been like no other – a cathartic showcase for the new South Africa , not just totally transformed from its evil past , but a successful , modern country with a global reach standing tall on the shoulders of giants .'"", 'Late in 1969 Nelson Mandela had been over five years on Robben Island , shivering the winters away in his tiny , freezing prison cell , when suddenly a glimmer of hope pierced the news blackout imposed on political prisoners .\', ""His apartheid jailers were beside themselves with rage , bursting with furious indignation about demonstrators wrecking their beloved rugby team \'s tour to Britain .""', ""This World Cup ended the way the modern South Africa began 16 years ago : with Nelson Mandela its star .']""]"
2010-07-11,"[""['The date is 11 July 2010 and , irrespective of what happened on the pitch , the true winners of the World Cup are the hosts .'"", ""Nelson Mandela enjoyed a rapturous reception from fans at the World Cup final tonight as he attended the closing ceremony .'"", 'FNB said simply : "" Today this is the greatest country in the world . ""\', ""Thus spake Alan Hansen on Nelson Mandela before Sunday \'s World Cup final , as the first democratically elected president of South Africa made his brief appearance , and the BBC pundit graciously glossed it with the same sort of platitude one might bestow upon a manager who had just reached the League One play - offs .""', ""Wrapped against the winter cold , Mandela beamed and waved to nearly 85,000 spectators before they together witnessed Spain claim its first World Cup with victory over the Netherlands .'"", ""The 2010 World Cup has been like no other – a cathartic showcase for the new South Africa , not just totally transformed from its evil past , but a successful , modern country with a global reach standing tall on the shoulders of giants .'"", 'This World Cup ended the way the modern South Africa began 16 years ago : with Nelson Mandela its star .\', ""A tournament that was all about harmony produced an acrimonious finish as the Dutch attempted to stop , by brute force , Spain becoming the game \'s eighth world champions ."", ""This is a grim epilogue to Africa \'s joyful first World Cup .""]']"
2010-08-05,"['[""The Children \'s Fund today categorically denied ever having diamonds in its possession .""', ""In court today , Campbell stressed she did not know personally whether the stones in question came from Taylor , after a party hosted by Mandela in Cape Town in 1997 .'"", 'The supermodel Naomi Campbell appeared before a war crimes tribunal in the Hague today where she admitted receiving "" dirty - looking "" diamonds that she was later told came from the former Liberian ruler Charles Taylor .\'', ""Naomi Campbell arrived at The Hague today amid intense media scrutiny to appear as a witness for the prosecution in the war crimes trial of the former Liberian president Charles Taylor .'"", 'In 90 minutes of testimony given to the Special Court for Sierra Leone ( SCSL ) on Thursday , the Streatham - born supermodel said that while she had accepted the "" dirty looking stones "" when they were presented to her in the middle of the night in September 1997 , she had no idea who had sent them .\'', 'The British supermodel testified that she passed the "" dirty - looking pebbles "" on to Jeremy Ratcliffe , then chief executive of the Nelson Mandela Children \\\'s Fund , intending he use them for charity .\'', ""Campbell told the court that she talked to Taylor at a charity dinner hosted by Nelson Mandela in South Africa in September 1997 .'"", 'The Streatham - born supermodel , who appeared at the court surrounded by a police escort , is alleged to have received a "" blood diamond "" from the then recently elected leader while staying at Nelson Mandela \\\'s home in September 1997 .\'', ""Taylor , the first former African leader to be tried in an international war crimes court , is accused of arming rebels in neighbouring Sierra Leone in return for diamonds .']""]"
2010-08-27,"[""['For these reasons , he considers it correct and proper for him not to make himself available for re - election as a trustee at the forthcoming annual general meeting of NMCF on 27 August 2010 .'"", 'The board has accepted Mr Ractliffe \\\'s apology , his decision not to make himself available for re - election on 27 August 2010 and to resign as a board member of the USA affiliate of the NMCF . ""\'', 'Nelson Mandela \\\'s appearance at last month \\\'s World Cup final was the acme of a tournament hailed as an organisational triumph , a defining moment in national self - esteem and a repudiation of centuries - old "" Afro - pessimism "" .\'', ""Commentators said that the question was not whether South Africa deserved the World Cup , but whether the World Cup deserved South Africa .'"", ""Which makes it all the more dismaying , just seven weeks later , to see a country once more at unease with itself .']""]"
2011-04-30,"[""['This is not an idle or meaningless statgasm , because Spurs must win today if they are to maintain realistic hopes of qualifying for the Champions League next season .'"", ""John Terry is playing his 500th game for Chelsea today .'"", 'Any word on the crowd \\\'s response to David Baddiel \\\'s \\\' Y - Word \\\' anti - semitism video , which I gather was to be shown before the game today ? "" asks Ryan Dunne .\'', ""There is no way in the world Spurs will keep a clean sheet today .'"", ""52 min Modric , who has been great today , body swerves beautifully away from Lampard in midfield .'"", 'Preamble Hello .\', ""Buster Douglas beat Mike Tyson , a West Indian spin bowler Mervin Durand returned figures of 19.4 - 11 - 15 - 7 against England \'s tourists on his first - class debut , Nelson Mandela was released from prison , a real Rolex oyster watch from the 1950s ( with a rare dial ) was found to be worth £ 15,000 on Antiques Roadshow – and Spurs won 2 - 1 at Stamford Bridge .""]']"
2012-02-25,"[""['Nelson Mandela was back in hospital on Saturday , triggering a fresh wave of anxiety over the health of the 93-year - old former South African president .'"", ""Again , on Saturday , there was trouble when a photographer was forced into a military police van for taking a picture of a hospital building thought to contain Mandela .'"", 'The former South African president Nelson Mandela is comfortable in hospital after receving treatment for a "" long - standing abdominal complaint "" , the government has said .\'', 'Officials insisted that Mandela was "" fine and fully conscious "" in hospital after undergoing a diagnostic procedure for a long - standing abdominal complaint .\'', ""Nelson Mandela has returned home from hospital , easing fears over his health and demonstrating his resilience and will to live at 93 .'"", ""It is the day South Africans dread more than any other , and it is not a question of if but when .'"", 'The death of Nelson Mandela will shake the nation to its core ; the fact that death in old age does not fit the proper definition of "" tragedy "" will not console the millions who grew up with him as a constant , consoling presence .\'', '"" It \\\'s like watching one \\\'s grandfather fade away , "" was how Heidi Holland , the South African - based journalist , put it recently .\']']"
2012-02-26,"['[""South Africa \'s first black president was discharged from One Military hospital in the capital , Pretoria , on Sunday and travelled in a VIP police convoy to his house in the Johannesburg suburb of Houghton ."", ""In an interview on South Africa \'s eNews channel on Sunday , Maharaj , also a former Robben Island inmate , described Mandela as a strong character who liked to keep fit and remained positive even when facing the prospect of the death penalty in 1964 .""', 'On Sunday , South Africa \\\'s City Press newspaper ran a front - page headline : "" Newsflash : Madiba : Do n\\\'t panic ; World on tenterhooks as Mandela is admitted to hospital . ""\'', ""Nelson Mandela has returned home from hospital , easing fears over his health and demonstrating his resilience and will to live at 93 .'"", ""It is the day South Africans dread more than any other , and it is not a question of if but when .'"", 'The death of Nelson Mandela will shake the nation to its core ; the fact that death in old age does not fit the proper definition of "" tragedy "" will not console the millions who grew up with him as a constant , consoling presence .\'', '"" It \\\'s like watching one \\\'s grandfather fade away , "" was how Heidi Holland , the South African - based journalist , put it recently .\']']"
2012-03-27,"['[""The poignant missive is among more than 1,900 documents , photographs and films of South Africa \'s first black president that were published online on Tuesday by Google and the Nelson Mandela Centre of Memory .""', 'Kathrada , 82 , said on Tuesday : "" It \\\'s a fantastic project .\'', '"" My Darlings , "" begins the neat blue script . "" Once again our beloved Mummy has been arrested and now she and Daddy are away in jail .\'', ""My heart bleeds as I think of her sitting in some police cell far away from home , perhaps alone and without anybody to talk to , and with nothing to read .'"", ""Twenty four hours of the day longing for her little ones .']""]"
2012-06-21,"['[\'"" Is nobody doing anything in the office today ?\', ""If not , one or two could swiftly become yesterday \'s men .""', ""Danny Care , Thomas Waldrom , Tom Palmer , Alex Corbisiero and James Haskell have also been included in the starting XV to face South Africa at Nelson Mandela Bay Stadium .'"", ""With Chris Robshaw and Ben Youngs both out injured , the head coach Stuart Lancaster was always going to have to reshuffle his lineup .'"", 'In a historic speech within the 11th - century walls of Westminster Hall , Aung San Suu Kyi has implored Britain and "" the world beyond "" to reach out to help Burma at "" the moment of our greatest need "" .\'', 'The Burmese pro - democracy leader , the first woman apart from the Queen to address both houses of parliament , appealed for practical help to support reforms to bring "" better lives , greater opportunities , to the people of Burma who have been for so long deprived of their rights to their place in the world "" .\'', ""The Nobel laureate received a standing ovation for her 30-minute address , an honour previously accorded only to the French president Charles de Gaulle , the South African president Nelson Mandela , Barack Obama , Pope Benedict XVI and the Queen .'"", 'England are reluctant to make excuses but a marathon season continues to exact its toll .\', ""The knee problem that has forced Alex Corbisiero \'s withdrawal from the side to face South Africa in the third Test at Nelson Mandela Bay Stadium is the latest untimely setback and further reduces the odds on the touring team avoiding a sobering 3 - 0 series defeat .""', ""A growing number of players are buckling beneath a workload which , in some cases , has been ludicrously excessive .']""]"
2013-06-23,"[""['Nelson Mandela is in a critical condition in hospital , officials said on Sunday , leaving millions of South Africans fearing the worst .'"", ""President Jacob Zuma and African National Congress ( ANC ) deputy president Cyril Ramaphosa visited Mandela on Sunday evening , the statement continued .'"", 'On Sunday , the presidency addressed the issue , stating that Zuma and Ramaphosa were assured by doctors that "" all care was taken to ensure that his medical condition was not compromised "" when the engine trouble developed .\', ""It started on Sunday with news that our former president Nelson Mandela \'s health had gone from serious to critical .""', ""The 94-year - old former president has been hospitalised four times since December but this is by far the gravest report on his health .'"", 'Mandela was taken to a hospital in Pretoria just over two weeks ago with a recurring lung infection but was said to have rallied after a few days . ""\']']"
2013-06-26,"[""['Zuma visited Mandela at about 10 pm on Wednesday and found he remained in a critical condition .'"", ""Napilisi Mandela was quoted as saying in media reports after visiting the hospital on Wednesday .'"", 'Napilisi Mandela , a relative , was quoted as saying in media reports after visiting the hospital on Wednesday .\', ""On Wednesday morning , as I watched reports on the hundreds of people who gathered outside the hospital where Mandela was being treated , I glanced over at a picture on the White House Instagram feed of Marine One leaving Washington , DC â€ “ America \'s first family had left for Africa ."", ""The veteran Indian journalist M.S. Prabhakara disagrees with the BBC \'s description of Nelson Mandela .""', 'He was so upset he sent his former newspaper , The Hindu , this letter for publication : "" It is disgusting , but not surprising , that the BBC in its online world news bulletin should consistently describe Nelson Mandela , lying critically ill in a Pretoria hospital , as "" South Africa \\\'s first black president "" instead of more accurately , and more relevantly in political terms , as South Africa \\\'s first democratically elected president . ""\'', ""The Brent Labour group first recommended the freedom of Brent for Nelson Mandela in April 1990 , after he came to a concert at Wembley following his release from prison ( Diary , 26 June ) .'"", 'President Jacob Zuma visited Mandela in hospital in Pretoria after abandoning a planned trip to a summit in Mozambique .\', ""Mandela \'s medical team advised him of a slight improvement in the former president \'s health .""', 'As Nelson Mandela clung to life in hospital and hundreds of people gathered to pray for a miracle recovery , his family lashed out at the foreign media for "" a racist element "" and behaving like "" vultures "" .\']']"
2013-06-27,"['[\'Nelson Mandela \\\'s condition has improved and he "" remains critical but is now stable "" , South African officials said on Thursday .\'', '"" I cancelled my visit to Mozambique today so that I can see him and confer with the doctors , "" Zuma said .\', ""Mandela \'s grandchildren gathered up cards , flowers and stuffed animals outside the hospital on Thursday and took them inside ."", ""Meanwhile an Australian politician apologised on Thursday to South Africa \'s high commissioner for incorrectly announcing that Mandela had died .""', 'Nelson Mandela is "" a hero for the world "" , Barack Obama said on Thursday , adding that his thoughts are with the former South African president and his family as he remains in a critically ill condition . ""\', ""Thursday began with knife - edge anxiety over the 94-year - old \'s deteriorating health and concern about what news the day would bring .""', ""On Thursday the situation reached boiling point as his eldest daughter Makaziwe , who has emerged as the senior member of the Mandela family , launched an emotional attack .'"", '"" I cancelled my visit to Mozambique today so that I could see him and confer with the doctors , "" Zuma said .\', ""Mandela \'s grandchildren gathered up cards , flowers and toys outside the hospital on Thursday and took them inside .""', 'She says she understands the concern of the family â€ “ not least his daughter Makaziwe , who condemned the media gathered outside the hospital as "" vultures "" on Thursday â€\'', 'President Jacob Zuma visited Mandela in hospital in Pretoria after abandoning a planned trip to a summit in Mozambique .\', ""Mandela \'s medical team advised him of a slight improvement in the former president \'s health .""', 'He is a personal hero , but I \\\'m not unique in that regard , "" the US president said .\'', '"" I think he \\\'s a hero for the world and if / when he passes , we know his legacy will linger on throughout the ages . ""\'', ""It was the day the pressure became too much to bear .'"", 'As Nelson Mandela clung to life in hospital and hundreds of people gathered to pray for a miracle recovery , his family lashed out at the foreign media for "" a racist element "" and behaving like "" vultures "" .\', ""On the road through the little hamlet of Qunu in South Africa \'s Eastern Cape , a local television crew is filming a group of boys playing with a home - made go - kart on a hill .""', 'The journalists gather them together and ask them to raise their fists and shout for the camera "" Dalibhunga ! "" , the name given to Nelson Mandela on his circumcision .\', ""Behind them , hidden by a red brick wall and a screen of trees built on the N2 , which passes south from Durban to East London , is Mandela \'s compound .""', ""South Africans have had a rough week .']""]"
