2010-09-16,"['[\'In a magazine interview published yesterday , the Italian culture minister launched a stinging attack on American film director Quentin Tarantino , who led this year \\\'s jury , calling him "" the expression of an elitist , relativist and snobbish culture . ""\', ""Yesterday Corriere della Sera wondered if he was able to name any of the films selected for this year \'s Venice festival .""', 'Silvio Berlusconi \\\'s culture minister has launched a stinging attack on Quentin Tarantino , who headed the jury at this year \\\'s Venice film festival , calling the American director "" the expression of an elitist , relativist and snobbish culture "" .\'', 'Sandro Bondi also slammed the prize - giving at Venice – where no Italian films were rewarded – and pledged to take part in the selection of next year \\\'s jury , "" since it is financed by the state "" .\', ""Venice film festival , the oldest and one of the most glamorous cinema awards ceremonies in the world , has been overshadowed this year by allegations of nepotism and elitism among the jury , with Silvio Berlusconi \'s government threatening to intervene and hand pick next year \'s judges .""', 'Sandro Bondi also slammed the judges \\\' choice of winners , which did not include any Italian films , and said he would take part in the selection of next year \\\'s jury , "" since [ the festival ] is financed by the state "" .\'', ""Civil rights campaigners have accused governments across Europe – not just France – of adopting explicitly anti - immigrant and anti - Roma policies to win popular support and gain electoral success .'"", ""The criticisms follows the rift between Nicolas Sarzkozy and fellow EU leaders over his determination to demolish Roma camps and deport their residents .'"", ""At an EU summit in Brussels Sarkozy was isolated , except for the backing of the Italian prime minister , Silvio Berlusconi .']""]"
2010-11-24,"['[""Bongiorno will not attend the hearing on Wednesday , and the timing of the appeal \'s first arguments , on 11 December , could not be worse for her .""', ""It was supposed to have been a high - minded debate on the Irish collapse and the euro crisis but instead the talk in the European parliament today degenerated into a screaming match about goose - stepping Nazis , Spitfires and Adolf Hitler .'"", 'Farage admitted today that Bloom had been "" rash and inflammatory "" , but the MEP was supported by far - right members from France \\\'s National Front and the Freedom Party of the Dutch anti - Islam campaigner Geert Wilders .\'', ""As for Schulz , today was not the first time he had had to deal with Nazi - related slurs .'"", 'Martin Schulz , a German social democrat previously taunted by the Italian prime minister , Silvio Berlusconi , as being "" perfect "" for the role of Nazi concentration camp guard , was criticising the EU \\\'s attempts to bail out Ireland when a British MEP interrupted to call him a "" Euro nationalist "" . ""\'', 'Ein Volk , ein Reich , ein Führer , "" [ one people , one nation , one leader ] yelled Godfrey Bloom , the UK Independence party \\\'s MEP for Yorkshire and North Lincolnshire , using the Nazi slogan to insult the leader of the European socialists in the Strasbourg chamber .\']']"
2010-12-17,"[""['The survey was conducted last week , as controversy raged over the findings of an investigation by prosecutors in Milan , which had been delivered to parliament on 17 December .'"", 'An experimental "" tweet - wall "" on giant TVs in the main hall of the EU summit in Brussels was shut down to avoid causing embarrassment to Silvio Berlusconi after being hijacked by Italian Twitter users who bombarded it with messages calling their prime minister "" a mafioso "" and "" a paedophile "" .\'', 'Postings on the microblogging site tagged "" # EUCO "" were automatically fed to a pair of large plasma screens in the main hall of the Brussels building in which the 27 leaders of Europe were meeting to discuss a response to the eurozone debt crisis .\'', 'Silvio Berlusconi considered increasing Italy \\\'s foreign aid budget during the country \\\'s 2009 G8 presidency to avoid a "" tongue - lashing "" from Irish rock hero Bono , according to a confidential US diplomatic cable released by WikiLeaks .\'', 'In the leaked memo , William Meara , the economic adviser at the American embassy in Rome , reports that despite budget cuts and "" with its 2009 G8 presidency looming "" , the newly installed , centre - right government "" may decide to maintain funding levels [ to Africa ] simply to avoid an embarrassing tongue - lashing from Bono et al "" .\'', 'The relationship between the two men had been publicly strained since 2006 , when Bono accused Berlusconi of "" exploiting "" his image in the runup to the country \\\'s elections .\']']"
2010-12-20,"[""['Monday , 09 May 2005 , 15:53 S E C R E T ROME 001593'"", 'There is no reason today to say , "" everybody home . ""\'', ""SIPDIS BAGHDAD'"", ""PLEASE PASS TO BG VANGJEL ; JUSTICE FOR ASSISTANT ATTORNEY GENERAL , CRIMINAL DIVISION'"", ""Just as the most recent scandal over his alleged use of prostitutes was fading from view , Barbara Berlusconi told a magazine interviewer she was so upset by what had happened she found it difficult to talk about .'"", ""The 26-year - old philosophy graduate also used the interview , with the Italian edition of Vanity Fair , to launch a ferocious attack on the former topless model whom Silvio Berlusconi has brought into his cabinet .']""]"
2010-12-25,"['[\'"" It is perhaps an unfortunate turn of phrase , "" the mayor said , "" but the operation ends on Christmas Day and it is quite common for there to be snow at this time of year .\'', ""Italy has demanded that the European Commission recall millions of diaries that are being distributed to schoolchildren throughout the EU because they do not mention Christmas'"", 'A Commission spokeswoman said it had "" realised the absence of some important European religious holidays , in particular Christmas "" .\'', 'Christmas or no Christmas , it will be reluctant to recall and pulp the latest edition : the spokeswoman said it had cost € 5.5 m ( £ 4.6 m ) .\', ""Prosecutors lifted the lid on a harem of women who were handed flats , cars and envelopes of cash in return for showing up at Berlusconi \'s parties dressed as police officers , nurses , football players and Father Christmas .""', 'I should have done this at Christmas . ""\'', 'Mills \\\'s conviction at trial and on appeal for receiving the bribe was timed out by the statute of limitations before Italy \\\'s highest appeal court could rule on it and prosecutors have packed in five hearings before Christmas , starting on 28 November , before Berlusconi \\\'s case is timed out in the spring . ""\']']"
2011-02-13,"['[""On Sunday a large nationwide bipartisan women \'s protest will be held to demand a country which respects all women .""', ""Several hundred people arrived on the island after midnight on Sunday , bringing the total number of immigrants to about 2,500 .'"", 'Anyway , some splendid news : on Sunday , hundreds of thousands of Italian women assembled in protest against the general slimy toading of their prime minister , Silvio Berlusconi , and in the hope of becoming "" a country that respects women "" .\', ""We Italian women may have had our finest hour on Sunday 13 February , but on Monday we were already complaining about the absence of a pragmatic agenda for a potential women \'s movement and the unreliability of our political class .""', ""On Sunday , half a million women turned out to protest at Berlusconi and the entrenched sexism they accuse him of representing in one of the biggest demonstrations seen in Italy in recent years .'"", ""On Sunday , half a million women turned out to protest at the entrenched sexism they accuse it of representing , in one of the biggest demonstrations seen in Italy in recent years .'"", ""Behind her , the Piazza del Popolo in Rome was filling up with tens of thousands of women , and many men who had arrived with their wives or girlfriends .'"", ""I was proud to count myself among the women and men who demonstrated the understanding that fighting against the archetype of male omnipotence embodied by Berlusconi is a political act .'"", ""I was proud to count myself among the women and men who demonstrated the understanding that fighting against the archetype of male omnipotence embodied by Berlusconi is a political act .']""]"
2011-03-29,"[""['A local couple living next door to the € 2 m house said they had been woken on Tuesday night by noises from the house .'"", ""George Clooney and Cristiano Ronaldo may be called to testify in defence of Silvio Berlusconi when he stands trial on charges of underage prostitution .'"", ""They have also called Karima El Mahroug , known as Ruby , the Moroccan runaway who was 17 when she allegedly attended sex parties held by Berlusconi .'"", ""Facing fierce criticism over his handling of a wave of north Africans landing on the Italian island of Lampedusa , Silvio Berlusconi has put on a vintage display of showmanship , claiming he would empty the island of immigrants within 60 hours , nominate locals for a Nobel peace prize and buy a holiday home there .'"", ""So far this year 18,000 north African migrants have sailed to the island , which has only 5,000 native inhabitants .'"", ""During a lightning visit to Lampedusa , which is closer to Africa than the Italian mainland , Berlusconi told cheering locals that six chartered ferries were arriving to pick up the remaining 6,000 migrants , mainly young Tunisian men , who have made the sea crossing since the collapse of the Tunisian government in January and the suspension of coastal patrols .']""]"
2011-04-25,"['[\'"" Rarely have the two countries seemed so far apart , "" said Le Monde in an editorial on Monday .\', ""Italian economist Mario Draghi was the bookies \' favourite last night to take the position as Europe \'s top central banker after he was endorsed by French prime minister Nicolas Sarkozy .""', ""The Syrian human rights organisation Sawasiah said at least 400 civilians had been killed during a month of protests including at least 35 in Deraa since Monday .'"", ""Hague said he had been in contact with the Turkish government over Syria , most recently on Monday night with its foreign minister , Ahmet Davutoglu .'"", ""The French president and the Italian prime minister are meeting in Rome after weeks of tension between their two countries over how to cope with an influx of more than 25,000 immigrants fleeing revolutions in north Africa .'"", 'The migrants , mostly Tunisian , reached the EU by way of Italian islands such as Lampedusa , but many hoped to get work in France where they have relatives and friends .\', ""France and Italy have thrown down the gauntlet over Europe \'s system of passport - free travel , saying a crisis of immigration sparked by the Arab spring was calling into question the borderless regime enjoyed by more than 400 million people in 25 countries .""', ""Challenging one of the biggest achievements of European integration of recent decades , Nicolas Sarkozy and Silvio Berlusconi also launched a joint effort to stem immigration and demanded European deportation pacts with the countries of revolutionary north Africa to send new arrivals packing .'"", 'The French president and the Italian prime minister , at a summit in Rome , opted to pile the pressure on Brussels and the governments of the other 25 EU states , demanding an "" in - depth revision "" of European law regulating the passport - free travel that takes in almost all of the EU with the exception of Britain and Ireland .\', ""Draghi \'s odds of securing the role as president of the European Central Bank narrowed after Sarkozy told Silvio Berlusconi that an Italian appointment would make Rome feel more included in the European project ."", ""Draghi , Italy \'s central banker , and finance minister Giulio Tremonti are credited with steering the debt - ridden Italian economy through the financial crisis without provoking the kind of disaster that has forced Ireland , Greece and Portugal to accept loans from the EU and International Monetary Fund .""', ""EU countries are discussing imposing sanctions on Syria if the regime continues its violent suppression of pro - democracy protests .'"", 'The foreign secretary , William Hague , said Damascus faced "" a fork in the road "" as opposition activists reported continuing government attacks in the southern town of Deraa and mass arrests and tanks in areas including Douma near the capital and Baniyas on the coast .\'', ""In Rome , Nicolas Sarkozy and Silvio Berlusconi issued a joint call for an end to violence against the demonstrators .']""]"
2011-10-24,"['[""With uncertainty crippling economic activity and investment , it emerged on Monday in Berlin that the eurozone \'s main bailout fund , the € 440bn ( £ 383bn ) EFSF , is likely to have its firepower boosted to € 1tn-€1.5tn at Wednesday \'s second summit this week ."", ""Monday \'s figures from Markit prompted economists to say the destabilising effects on confidence of the debt crisis had reached danger point .""', ""With the EU wanting answers by midweek , Berlusconi was reportedly planning a rushed cabinet meeting on Monday to drum up stimulus measures including pension reform to complement the two austerity budgets Italy has passed this year to cut its deficit .'"", 'Cabinet members suggested on Monday that League leader Umberto Bossi had been coaxed into a compromised deal , but Bossi said the division between the League and Berlusconi had left him "" pessimistic "" about the government \\\'s chances of surviving .\'', 'The European Central Bank is almost certain to cut interest rates next week after startling evidence that the sovereign debt crisis may have pushed the eurozone into recession .\', ""As Italy emerged as the eurozone \'s latest core problem country , Silvio Berlusconi summoned an emergency cabinet meeting in Rome and sharply criticised Germany and France for belittling his country \'s economy .""', 'Leading daily Corriere della Sera , which has criticised Berlusconi for delaying the economic stimulus package demanded by Europe , called the behaviour of Merkel and Sarkozy "" excessive "" in a front page editorial , adding : "" For an Italian it was not great , and it matters little if you are pro- or anti - Berlusconi . ""\'', 'The French and German leaders – now dubbed \\\' Merkozy \\\' – exchanged glances and smiled when asked if they were confident Berlusconi would come up with reforms , prompting a gale of laughter from journalists . ""\']']"
2011-11-03,"[""['As formerly loyal supporters in Rome jumped ship on Thursday , the beleaguered prime minister flew to Cannes to convince EU leaders at the G20 conference that an economic stimulus package he hastily put together the night before was enough to relaunch the moribund Italian economy .'"", 'Two further MPs then switched sides to the centrist UDC party on Thursday , and a third , Pippo Gianni , said there was "" an 80 % chance I will vote against the anti - crisis measures in a confidence vote "" .\'', ""A French bond issue on Thursday was less popular than at any time since the Greek crisis blew up in the spring , though enough investors did step forward to make sure the French government got the money it was looking for .'"", 'Italian debt yields – the rate at which the bond market is willing to buy Italian debt – rose to alarmingly high levels on Thursday before falling back slightly on the news that Greece had withdrawn a planned referendum on its austerity package .\', ""Silvio Berlusconi \'s resignation became a question of when , not if , as his majority in parliament was thrown into doubt by deserting MPs .""', 'Silvio Berlusconi insisted Italy has no financial problems â€ “ even as its cost of borrowing rose to dangerously high levels and the president , Giorgio Napolitano , warned that the country is undergoing its worst crisis since the second world war .\', ""As fears rose that the euro crisis is spreading to Italy and the embattled prime minister \'s majority continued to crumble , Berlusconi put on a typically upbeat performance in Cannes , defying reports of his political demise and denying that a planned IMF check - up on his reform programme was a humiliating limitation on his sovereignty ."", ""Barack Obama is leading a group of world leaders who are effectively ordering Silvio Berlusconi to accept surveillance of Italy \'s austerity measures by the International Monetary Fund .""', ""The move comes as doubts grow that the Italian prime minister has the capacity to oversee a major debt reduction programme or even to stay in power next week .'"", 'The deadpan caption read : "" Italy \\\'s prime minister Silvio Berlusconi is fighting for his political life because of the eurozone crisis , but still managed to smile for the cameras behind Argentina \\\'s president Cristina Fernandez de Kirchner at the G20 summit in Cannes . ""\']']"
2011-11-07,"['[""Italy was dragged deeper into Europe \'s debt crisis on Monday as its borrowing costs soared to their highest level since the euro was created ."", ""The yield , or interest rate , on 10-year Italian bonds leapt to 6.66 % on Monday , as Silvio Berlusconi \'s government prepared for a key vote on the country \'s public finances on Tuesday .""', 'With a new government being formed in Greece , French austerity measures due later on Monday , and European finance ministers meeting to hammer out the technical aspects of the revamped European rescue fund agreed in recent weeks , eurozone politicians were in for a busy day .\', ""The negotiations between George Papandreou and Antonis Samaras over Greece \'s new unity government were set to resume on Monday morning , with the name of the next prime minister expected to be announced before the end of the day .""', ""Though the markets reacted with delight on Monday when it began to look like the government would fall , attention has since shifted to the prospect of a protracted election campaign , or lengthy negotiations to form a new coalition .'"", ""As recently as Monday , he had quashed reports of his imminent resignation , describing them on Facebook as without foundation .'"", ""But in the night between Monday and Tuesday , things changed significantly .'"", ""But yesterday when the vote on the public finances was held in mid - afternoon , as an apocalyptic downpour lashed the capital , he obtained only 308 .'"", 'On Monday , Berlusconi had said : "" I want to look those who want to betray me in the face . ""\'', 'But for me this is the last day I \\\'m interested in politics . ""\'', 'With TV cameras following , Melani bought € 20,000 ( £ 17,000 ) in bonds from his local bank on Monday , and as he went on a chat show on Tuesday , an assistant enrolled to read his emails revealed that 1,000 Italians had already contacted Melani to say they had bought up a total of € 2 m worth of bonds . ""\'', 'With TV cameras following , Melani bought â‚¬20,000 ( Â£17,000 ) worth of bonds from his local bank on Monday , and as he rushed to appear on a chat show on Tuesday , an assistant revealed that 1,000 Italians had already contacted Melani to say they had bought up a total of â‚¬2 m worth of bonds . ""\', ""Cameron \'s G20 report to MPs on Monday was not impressive , but he was tired and did manage a good joke about proposing a cheese tax to the French ."", ""Silvio Berlusconi \'s imperilled Italian government faces a fresh test of its strength after Rome \'s corridors of power were engulfed by speculation of the prime minister \'s impending resignation , sending financial markets on a rollercoaster ride ."", ""Berlusconi appeared determined to stake his government \'s future on yet another confidence vote .""', '"" I want to look into the faces of those who are trying to betray me , "" he told the Libero newspaper .\'', 'At the G20 summit in Cannes , Nicolas Sarkozy and Angela Merkel successfully bullied George Papandreou into backing down on a referendum after the Greek prime minister had promised to consult his people on a new bailout .\', ""The Franco - German pair ordered Silvio Berlusconi to accept surveillance of Italy \'s austerity package by the IMF .""', ""Talk that Silvio Berlusconi might be about to resign seems to have perked up the markets a little .'"", 'The FTSE 100 is now down just 23.93 points at 5503.23 , having earlier fallen to 5432 , while Germany and France are now little changed .\', ""The Italian market has jumped 2.4 % while the pressure on the country \'s bond yields has also eased ."", ""Silvio Berlusconi has pledged to resign as Italy \'s prime minister in a long - delayed move that doomed his third government and appeared to foreshadow the end of the media tycoon \'s eventful and frequently scandalous 17-year career in politics .""', 'But opposition leaders were swift to warn that Berlusconi could be plotting to re - emerge . ""\'', ""Just after the vote that sealed the fate of his government , a photographer from the Ansa news agency managed to get a shot of the sheet of paper on which Silvio Berlusconi was writing .'"", ""A broader majority Silvio Berlusconi goes , but the right stays in power .'"", ""The key to this would be a thumbs - up from the Union of the Centre ( UDC ) , a party of conservative Christian Democrats .'"", 'A veteran political correspondent stepped out of the chamber of deputies after Silvio Berlusconi \\\'s body blow on the budget vote and shook his head . ""\', ""Did you notice how the opposition did n\'t celebrate ?""', 'There \\\'s a real crisis going on here and they just do n\\\'t know what to do either . ""\', ""Giorgio Napolitano Italy \'s president , a former communist , has won plaudits , influence and huge support from Italians for his calm monitoring of , and frequent intervention in , Silvio Berlusconi \'s attempts to bend the rules and disentangle himself from his trials .""', ""Once accused by Berlusconi of being incurably leftwing , Napolitano has recently been praised by the prime minister for giving him time to put together a package of much - needed economic reforms .'"", ""Naples - born Napolitano , 86 , boasts the stamina of a much younger man , recently listening to a speech attentively as Berlusconi , 75 , slumbered beside him .']""]"
