2012-09-27,"[""['The meeting was hosted by the Ecuadorean foreign minister , Ricardo PatiÃ±o , who said he would once more demand the UK grant Assange safe passage to Ecuador when he meets his British counterpart , William Hague , later on Thursday .'"", 'The first possibility is the one suggested by today \\\'s Sydney Morning Herald article on these documents ( as well as by WikiLeaks itself ) : that the US military now formally characterizes WikiLeaks and Assange as an "" enemy "" , the same designation it gives to groups such as Al Qaeda and the Taliban .\'', ""Assange was speaking to a gathering of diplomats at the UN general assembly through a satellite videolink from the Ecuadorean embassy in London , where he sought refuge three months ago from extradition to Sweden , where he is wanted for questioning on allegations of sex offences .'"", ""A US air force systems analyst who expressed support for WikiLeaks and accused leaker Bradley Manning triggered a formal military investigation last year to determine whether she herself had leaked any documents to the group .'"", 'Air Force investigative documents , obtained through a Freedom of Information Act request , show that the analyst was repeatedly interviewed about her contacts with and support for WikiLeaks - what investigators repeatedly refer to as the "" anti - US or anti - military group "" - as well as her support for the group \\\'s founder , Julian Assange .\'', 'The investigation was ultimately closed when they could find no evidence of unauthorized leaking , but what makes these documents noteworthy is the possible crime cited by military officials as the one they were investigating : namely , "" Communicating With the Enemy "" , under Article 104 of the Uniform Code of Military Justice ( UCMJ ) .\'', 'Ecuador is prepared to set up an operating theatre in its London embassy if Julian Assange needs urgent medical attention and the UK is not prepared to guarantee his safe passage to a hospital and back , according to the Ecuadorean foreign minister .\', ""As the WikiLeaks founder spent his 100th day in the Ecuadorean embassy , where he has sought refuge from extradition to Sweden to face allegations of sexual crimes , the country \'s foreign minister met his British counterpart , William Hague , to ask about contingency plans should Assange fall ill .""', 'Hague told Ricardo Patino that he would consult officials and lawyers and respond within a few days , but a British official commented : "" Maybe the Ecuadoreans should have thought of that before they granted him asylum . ""\']']"
2012-09-28,"[""['â€¢ This article was amended on 28 September 2012 .'"", ""Oh dear , Slutwalk London .'"", 'Ecuador is prepared to set up an operating theatre in its London embassy if Julian Assange needs urgent medical attention and the UK is not prepared to guarantee his safe passage to a hospital and back , according to the Ecuadorean foreign minister .\', ""As the WikiLeaks founder spent his 100th day in the Ecuadorean embassy , where he has sought refuge from extradition to Sweden to face allegations of sexual crimes , the country \'s foreign minister met his British counterpart , William Hague , to ask about contingency plans should Assange fall ill .""', 'Hague told Ricardo Patino that he would consult officials and lawyers and respond within a few days , but a British official commented : "" Maybe the Ecuadoreans should have thought of that before they granted him asylum . ""\']']"
2012-10-01,"['[\'Smith told the court that a group of them visited Assange on Monday and concluded "" the sureties do not have the power to meaningfully intervene in this matter .\'', 'He also highlighted the efforts of Sarah Saunders , a WikiLeaks activist and surety , who hosted Assange at her Kent home from where he had to report each day to a police station and adhere to a 10pm - to- 8am curfew . ""\', ""Julian Assange \'s bedroom behaviour is still the subject of much debate , but at least we now know what his bedroom looks like .""', ""My very first week writing regularly at the Guardian generated intense conflict with numerous members of the British media because that happened to be the week when Ecuador granted asylum to Julian Assange ( a decision I defended ) , and - for reasons that warrant sustained study by several academic fields of discipline - very few people generate intense contempt among the British commentariat like Assange does .'"", ""That is what has always led Assange to fear going to Sweden : that those detention procedures could be used to transfer him to the US without any public scrutiny ( only the most willfully irrational , given evidence like this , would deny that this is a real threat ) .']""]"
2012-12-20,"[""['Julian Assange has said ( video ) that WikiLeaks is preparing to publish 1 m new secret government documents as he marked six months of refuge in the Ecuadorean embassy in London with a speech from its balcony on Thursday .'"", ""About 80 supporters gathered on Thursday night to hear Assange speak .'"", 'WikiLeaks founder Julian Assange said on Thursday night the "" door is open "" for talks to break the deadlock over his campaign to avoid extradition to Sweden .\'', 'While my freedom is limited , I am still able to work and communicate , unlike the 232 journalists who are in jail tonight . ""\'', 'He said on Thursday that the Pentagon claimed recently that the existence of WikiLeaks was an "" ongoing crime "" .\'', ""The WikiLeaks founder has remained in the embassy to avoid arrest and extradition to Sweden on suspicion of sexual offences .'"", 'He made a rare public appearance on a balcony at the Ecuadorean embassy in London to mark the six - month anniversary of his sudden arrival at the building .\', ""He has since been granted political asylum by Ecuador \'s government but has remained inside the embassy ."", ""Top eight stories on MediaGuardian Oliver Letwin outlines new thinking on Leveson reforms Statute might be introduced to ensure ministers can not meddle in a press regulatory watchdog BBC director of news returns with rallying memo to crisis - hit staff Helen Boaden tells journalists that after \' several bruising weeks \' , she will take Pollard review into Jimmy Savile affair seriously Patten criticises MPs \' report into BBC payouts BBC Trust chairman calls public accounts committee report \' shabby \' after it accuses corporation of \' rewarding failure \' Jimmy Savile producer denies sex offence allegations Former Radio 1 producer Ted Beston who was arrested and bailed by Operation Yewtree detectives protests innocence UK copyright and parody laws to be relaxed Downloading purchased CDs onto laptop to be legalised , but call for levy on copying devices is rejected Mail Online passes 7 million daily unique browsers ABCs : Website \'s traffic grows almost 7 % month on month , making it almost twice size of next biggest national newspaper site Julian Assange : expect more from WikiLeaks Founder of whistleblowing website marks six months \' confinement in Ecuadorean embassy with bullish speech Julian Assange \' open \' to talks to end extradition row WikiLeaks founder thanks supporters during appearance on balcony of Ecuadorean embassy in London Top comment on MediaGuardian Why the US media ignored Murdoch \'s brazen bid to hijack the presidency Carl Bernstein :""]']"
2012-12-25,"[""['Some sang Christmas carols as they waited for Assange to speak from the first floor balcony , a short distance from Harrods department store .'"", "", TV tastes may have changed , but it appears that the British public has always had an insatiable desire for a dose of Sir Bruce Forsyth at Christmas .'"", ""The Radio Times looked at TV listings on Christmas Day in 1952 , 1972 , 1992 and 2012 and discovered that Brucie has been appearing in a 25 December spot for 40 years â€ “ 1972 to present .'"", 'Top of the Pops can match that , but the only Christmas Day "" performer "" that can better it is the Queen , who has been delivering a Christmas speech since 1957 .\'', ""P23 Queen to record Christmas message in 3D. P26 Seven bidders line up for 4 G spectrum auction .'"", ""How Christmas Day TV has changed in 60 years .'"", ""P86 Daily Express Drama and repeats set for Christmas TV .'"", 'P13 Queen \\\'s Christmas message to be broadcast in 3D. P13 The Sun Vince Cable in battle on EU "" iTax "" .\']']"
2013-01-23,"[""['The union plans to include Assange in an event celebrating prominent whistleblowers on 23 January .'"", 'Addressing the Oxford Union from his refuge at the Ecuadorian embassy in London last night , the activist also described the film as an inflammatory attack on Iran .\', ""The first picture of Cumberbatch as Assange was released yesterday , featuring Cumberbatch standing alongside Goodbye , Lenin ! \'s"", ""Cumberbatch stars as Assange , and the first picture of the Sherlock star with dyed white - blond hair ( alongside Goodbye , Lenin ! \'s Daniel BrÃ¼hl as the activist \'s confidant Daniel Domscheit - Berg ) has been released to coincide ."", ""But who could resist a picture of old Sherlock himself , Benedict Cumberbatch , dolled up in greasy Andy Warhol wig as everyone \'s favourite sticker - to - the - man , Julian Assange ."", ""But who could resist a picture of old Sherlock himself , Benedict Cumberbatch , dolled up in greasy Andy Warhol wig as everyone \'s favourite sticker - to - the - man , Julian Assange .""', 'WikiLeaks founder Julian Assange has described a forthcoming Hollywood film about him as a "" massive propaganda attack "" during a video - linked talk to students at Oxford University .\', ""Assange said he had seen a copy of the script for The Fifth Estate , which stars Sherlock \'s Benedict Cumberbatch and is directed by Dreamgirls \' Bill Condon .""', ""Speaking by video link from his refuge at the Ecuadorean embassy to undergraduates at Oxford University as part of an awards ceremony celebrating whistleblowers , Assange gave an impassioned defence of WikiLeaks and against censorship of all kinds .'"", 'It is a lie upon lie , "" he told Oxford university students by videolink from the Ecuadorian embassy . ""\']']"
2013-05-30,"[""['May 30'"", ""Australians live in dread of the months ahead .'"", ""When the workplace relations minister recently responded to the Oppositionsâ€ ™ industrial relations policy , he within a few excruciating minutes repeated over and over again that Abbottâ€ ™ s plans â€œshould send a shiver down the spine of every workerâ€ � .'"", ""In the run up to the elections , we know weâ€']""]"
2013-06-03,"[""['The highest - profile trial of an official leaker in a generation got under way on Monday when the US government accused Bradley Manning of betraying his nation to satisfy a craving for notoriety , while the defence presented him as a young , naive humanist who just wanted to make the world a better place .'"", 'The US government used the first day of the Bradley Manning trial to allege that the soldier had a much closer relationship with Julian Assange , the founder of WikiLeaks , than has previously been claimed .\', ""Prosecution lawyers peppered the government \'s opening statement at the trial with references to Assange , suggesting that he built up close ties to the army private over a six - month period in 2009 and 2010 .""', ""The government alleged â€ “ sometimes directly , on others through insinuation â€ “ that Assange guided Manning as to which classified documents to leak , advised him on how to avoid detection and even involved the soldier in the WikiLeaks editing process .'"", ""The court was also told of new allegations about the links between Manning and Julian Assange , founder of WikiLeaks , the whistleblowing website to which Manning is accused of sending the information .']""]"
2013-06-17,"['[""The WikiLeaks founder , Julian Assange , says he is fit enough to spend another five years inside the tiny Ecuadorean embassy in London , Ecuador \'s foreign minister said on Monday , as it was announced that British and Ecuadorean legal experts would try to resolve the impasse .""', ""Despite the news of the legal talks â€ “ which followed a meeting on Monday morning between the British foreign secretary , William Hague , and his Ecuadorean counterpart , Ricardo PatiÃ±o â€ “ neither London nor Quito is showing any sign of backing down .'"", ""The foreign secretary , William Hague , and his Ecuadorean opposite number , Ricardo PatiÃ±o , met on Monday to discuss the ongoing diplomatic stalemate , but were unable to reach agreement .'"", ""After talking to Assange until four in the morning on 17 June , PatiÃ±o met Hague for fruitless negotiations on the affair .'"", ""Though PatiÃ±o gave few details , it would appear that the bug was discovered on June 17 â€ “ a week before Snowden left Hong Kong .'"", 'The Foreign Office said "" no substantive progress "" had been made during the discussions , while PatiÃ±o told a press conference that Assange \\\'s situation was "" totally unjust "" .\', ""Julian Assange will not leave Ecuador \'s embassy even if Sweden drops its extradition bid over accusations of sexual assault , because he fears moves are already underway by the US to prosecute him on espionage charges , he has said .""', ""On the eve of the anniversary of his seeking asylum in the embassy in Knightsbridge , Assange said he believed a sealed indictment had already been lodged by a grand jury in Virginia , which could see him being arrested and extradited by Britain to the US to face prosecution over the WikiLeaks cable releases .'"", '"" The strong view of my US lawyer is that there is already a sealed indictment , which means I would be arrested , unless the British government gave information or guarantees that would grant me safe passage , "" the WikiLeaks founder told a small group of news agencies .\']']"
2013-06-19,"[""['Assange has been inside the embassy since 19 June last year and has been granted political asylum by Ecudador .'"", ""On Wednesday it will be one year since the WikiLeaks founder walked into the embassy in Knightsbridge in an attempt to avoid extradition to Sweden to face sex assault and rape accusations , which he denies .'"", 'So if the Swedish government drops their request [ to go to Sweden ] tomorrow , I still can not leave the embassy .\', ""Outrage is a tactic â€ “ let \'s hope this one backfires Today \'s headlines""', ""Assange walked into the embassy on 19 June last year in an attempt to avoid extradition to Sweden to face sex assault and rape accusations , which he denies .'"", ""Julian Assange has delivered a scathing attack on the Australian government in an interview marking one year since he walked into the Ecuadorean embassy in London and sought asylum .'"", ""Assange told the press he hoped the predicted Coalition win in September would clean out the Labor party and prime minister'"", 'Julia Gillard \\\'s "" cronies "" , who he said had relied too heavily on the United States and abandoned himself and WikiLeaks . ""\'', ""By Mark Sweney'"", ""Angelina Jolie stunt']""]"
2013-06-22,"[""['Assange appears to have had a strong role in obtaining the travel document for Snowden , dated 22 June which bore the printed name , but not signature , of the London consul , Fidel Narvaez , a confidante .'"", 'The WikiLeaks founder , Julian Assange , has called on the world to "" step forward and stand with "" Edward Snowden , after the NSA whistleblower was charged with espionage by US federal prosecutors .\'', 'According to a statement on the WikiLeaks website , Assange said : "" A few weeks ago , Edward Snowden blew the whistle on an ongoing program â€ “ involving the Obama administration , the intelligence community and the internet services giants â€ “ to spy on everyone in the world .\'', ""As if by clockwork , he has been charged with espionage by the Obama administration .'"", 'When WikiLeaks claimed in a tweet that it was assisting NSA whistleblower Edward Snowden \\\'s "" political asylum in a democratic country "" there was one detail that apparently confirmed its involvement â€ “ that Snowden was travelling with a person whose surname was Harrison .\', ""“ has been a staff member for more than two years , and is one of Julian Assange \'s closest advisors .""', 'When WikiLeaks first claimed in a tweet that it was assisting NSA whistleblower Edward Snowden \\\'s "" political asylum in a democratic country "" there was one detail that apparently confirmed its involvement â€ “ that Snowden was travelling with a person whose surname was Harrison .\'', 'Sarah Harrison â€ “ a staff member for more than two years\', ""â€ “ has become one of Julian Assange \'s closest advisers since first working with the group as an intern on the publication of the Afghan war logs .""', ""Political cover'"", ""Although Ecuador is relatively small , it has strong regional allies and economic support from China , which strengthens its ability to resist extradition requests .'"", ""The president , Rafael Correa , has shown he is not afraid of standing up to the US and Europe by granting asylum to the WikiLeaks founder , Julian Assange .']""]"
2013-06-23,"[""['Sarah Harrison â€ “ who WikiLeaks on Sunday published an updated biography for â€'"", 'WikiLeaks claimed on Sunday that it was helping Snowden to secure asylum in "" a democratic nation via a safe route "" .\'', ""Snowden fled Hong Kong on Sunday after leaking secret documents revealing US surveillance programmes .'"", ""Russian officials have been lining up to throw their support behind Snowden since he first landed in Moscow on Sunday .'"", 'When WikiLeaks claimed in a tweet that it was assisting NSA whistleblower Edward Snowden \\\'s "" political asylum in a democratic country "" there was one detail that apparently confirmed its involvement â€ “ that Snowden was travelling with a person whose surname was Harrison .\'', 'When WikiLeaks first claimed in a tweet that it was assisting NSA whistleblower Edward Snowden \\\'s "" political asylum in a democratic country "" there was one detail that apparently confirmed its involvement â€ “ that Snowden was travelling with a person whose surname was Harrison .\'', ""Sarah Harrison â€ “ a staff member for more than two years'"", ""Although Ecuador is relatively small , it has strong regional allies and economic support from China , which strengthens its ability to resist extradition requests .'"", ""The president , Rafael Correa , has shown he is not afraid of standing up to the US and Europe by granting asylum to the WikiLeaks founder , Julian Assange .']""]"
2013-06-26,"['[\'Sander Levin , a US congressman , told The Hill newspaper on Wednesday that if Ecuador granted Snowden asylum there was no "" basis for even discussing "" extending a trade deal up for renewal in July .\'', ""Yet Snowden lost a supporter on Wednesday when the Spanish judge Baltasar GarzÃ³n said he would not represent him .'"", 'On Wednesday , Alexey Pushkov , head of the Duma \\\'s international affairs committee , said : "" Assange , [ Bradley ] Manning , and Snowden , were not spies and did n\\\'t give up secret information for money but out of conviction .\'', ""Putin presented Snowden as just another transiting passenger , and Russian news agencies on Wednesday continued their campaign of possible disinformation , citing an anonymous source who claimed that he had checked in to an airport hotel but checked out a few hours later .'"", 'Ecuador has said it could take months to decide whether to grant asylum to Edward Snowden , potentially confining the US whistleblower to the halls of a Russian airport for weeks to come .\', ""Ricardo Patino , Ecuador \'s foreign minister , said Snowden \'s case was similar to that of the WikiLeaks founder , Julian Assange , who has been granted asylum at the country \'s embassy in London .""', ""If Edward Snowden can make it to Ecuador , it will be a good choice for him and the world .']""]"
2013-07-02,"['[\'"" We regret to inform you that in our embassy in London we have found a hidden microphone , "" PatiÃ±o told a news conference in Quito on Tuesday .\'', ""Now interview a week earlier by referencing the bulk collection of telephone calls ( Assange was expressly talking about a widely reported Bush program from 8 years earlier , not the FISA court order under Obama I reported ) ; 3 ) Pincus strongly implied that Snowden had worked for the NSA for less than 3 months by the time he showed up in Hong Kong with thousands of documents when , in fact , he had worked at the NSA continuously for 4 years .'"", ""Covering the Edward Snowden story has not been straightforward for many in the mainstream media , which is reflected in the disjointed coverage it has received in the UK so far .'"", 'But then the brash young American "" stole "" the material , came to the Guardian with it , and has ended up stranded in Russia , where he may or may not receive asylum with the help of Julian Assange .\'', 'Despite the cheers and jeers at leakers such as Julian Assange , Bradley Manning and Edward Snowden over the last few years , it would seem access to such information is less protected than ever .\', ""A hidden microphone has been found inside the Ecuadorean embassy in London , where the WikiLeaks founder Julian Assange is holed up , according to the country \'s foreign minister ."", ""Ricardo PatiÃ±o said the device had been discovered a fortnight ago inside the office of the Ecuadorean ambassador , Ana Alban , while he was in the UK to meet Assange and discuss the whistleblower \'s plight with the British foreign secretary , William Hague .""', 'The international wrangle over the future of Edward Snowden took a further twist when Ecuador declared it had found a listening device in its London embassy and threatened to reveal who had planted it .\', ""In another day of drama and diplomatic indignation , Ricardo PatiÃ±o , Ecuador \'s foreign minister , said the device had been discovered a fortnight ago when he had been in the UK to discuss another fugitive , the WikiLeaks founder Julian Assange .""', 'PatiÃ±o said the hidden microphone had been found in the office of Ecuador \\\'s ambassador , Ana Alban , and he condemned the development as a "" loss of international ethics "" .\']']"
2013-09-02,"[""['This article was amended on 2 September 2013 .'"", 'We all remember President Obama \\\'s smiling face , full of hope and trust , in his first campaign : "" Yes , we can ! ""\'', ""â€ “ we can get rid of the cynicism of the Bush era and bring justice and welfare to the American people .'"", 'Now that the US continues its covert operations and expands its intelligence network , spying even on its allies , we can imagine protesters shouting at Obama : "" How can you use drones for killing ?\', ""WikiLeaks founder Julian Assange is to join the jury for this year \'s Raindance film festival .""', ""Raindance revealed the high - profile addition on Twitter .'"", ""Assange remains at the Ecuadorian embassy in London , where he has claimed political asylum since last summer in order to avoid extradition to Sweden , where he is wanted for questioning over rape and sexual assault allegations .']""]"
2013-09-03,"['[\'"" This , exactly , is our situation today : we are facing the shameless cynicism of the representatives of the existing global order , who only imagine that they believe in their ideas of democracy , human rights etc .\'', ""â€ “ we can get rid of the cynicism of the Bush era and bring justice and welfare to the American people .'"", 'Now that the US continues its covert operations and expands its intelligence network , spying even on its allies , we can imagine protesters shouting at Obama : "" How can you use drones for killing ?\'', ""Assange remains at the Ecuadorian embassy in London , where he has claimed political asylum since last summer in order to avoid extradition to Sweden , where he is wanted for questioning over rape and sexual assault allegations .']""]"
