1999-01-08,"[""['Mr Blair is to visit Nazareth House , an orphanage in which all but five of its 40 children are HIV positive or have Aids , tomorrow .'"", ""In a speech tonight in Cape Town , Mr Blair will return to domestic politics by trying to show his government has not lost its direction in spite of the loss of two ministers , including his close friend , Peter Mandelson , in the run - up to Christmas .'"", ""It will be the last time the two meet with Mr Mandela as president - he retires in the spring .'"", 'The development emerged after Tony Blair met Mr Mandela on the second day of his visit to South Africa .\', ""Tony Blair \'s trip to South Africa last week was seen an attempt to discover the truth about Nelson Mandela \'s political heir , whose true nature and ambitions remain elusive .""]']"
1999-01-09,"[""['The two men and a public works architect spent one Saturday winter morning going through the house , with the architect justifying a new fridge here or some redecoration there .'"", 'Who is Thabo Mbeki ?\', ""Tony Blair \'s trip to South Africa last week was seen an attempt to discover the truth about Nelson Mandela \'s political heir , whose true nature and ambitions remain elusive .""', 'Officially Deputy President , Mbeki , 56 , is believed to have been the day - to - day ruler of South Africa for much of the past year .\', ""Nelson Mandela \'s anointed successor , Thabo Mbeki , wants to be remembered for leading Africa \'s renaissance .""', 'But how can it take place amid war , bloodletting and instability ?\', ""Angola \'s shaky peace has disintegrated and it is one of half a dozen nations bound up in the war in neighbouring Congo .""]']"
1999-01-28,"['[""On Thursday , however , Mr Mbeki \'s legal adviser released the letters \' in the interests of transparency \' and because Mr Kriegler had \' blown the matter out of all proportion \' .""', ""1993 April 1993 Stephen Lawrence , aged 18 , is stabbed to death by a gang at a bus stop in Eltham , south - east London .'"", 'The murder is recorded as "" racially motivated "" but charges are dropped due to "" insufficient evidence "" .\'', ""May 1993']""]"
1999-03-17,"[""['Yesterday there were no prominent ANC leaders in court to hear the 54-year - old cleric convicted of theft and fraud .'"", ""When Allan Boesak was accused of stealing from foreign donors and flew back to South Africa to stand trial , thousands of supporters turned out to cheer him .'"", ""The minister of justice , Dullah Omar , raised eyebrows by greeting him with a hug .'"", ""President Nelson Mandela questioned whether the state should be prosecuting the case .']""]"
1999-03-18,"['[""A mock - up of the design was unveiled yesterday by Britain \'s Lennox Lewis in London , following his fight against Evander Holyfield in New York last Saturday , which ended controversially in a draw .""', ""When Allan Boesak was accused of stealing from foreign donors and flew back to South Africa to stand trial , thousands of supporters turned out to cheer him .'"", ""The minister of justice , Dullah Omar , raised eyebrows by greeting him with a hug .'"", ""President Nelson Mandela questioned whether the state should be prosecuting the case .'"", 'It will be cast from gold , is valued at £ 2 million and looks like a giant designer bracelet .\', ""But even by boxing \'s gaudy standards , this will be a belt with a difference .""', ""In fact , you could call it the peace belt because not only could it end a ferocious argument within the sport but at its heart will be a picture of a Nobel Prize winner , a noted amateur pugilist and one of the most symbolic peacemakers in the world Nelson Mandela .']""]"
1999-03-25,"['[\'It \\\'s very hard when your kids get up in the morning and ask , "" what name are we using today daddy ? "" , \\\' he said .\'', ""The birthday girl must have been disappointed .'"", ""Winnie Mandela had organised the party at her Soweto home for one of her young grandchildren .'"", ""But in the midst of the celebrations , Winnie whipped off the gold and diamond wedding ring Nelson Mandela had slipped on her finger 41 years ago and gave it to a shy teenage white girl in the corner .']""]"
1999-03-30,"[""['Arrangements for the surrender of two Libyans accused of the Lockerbie bombing are on track for next week , President Nelson Mandela of South Africa told the Libyan leader , Colonel Muammar Gadafy , yesterday .'"", ""Arrangements for the surrender of two Libyans accused of the Lockerbie bombing are on track for next week , President Nelson Mandela of South Africa told the Libyan leader , Colonel Muammar Gadafy , yesterday .'"", ""Nelson Mandela is being sued by his former wife , Winnie , over ownership of the small Soweto home they shared briefly until he was jailed in 1963 .'"", ""President Mandela gave the house to the Soweto Heritage Trust last year to administer as a public museum .'"", ""Nelson Mandela is being sued by his former wife , Winnie , over ownership of the small Soweto home they shared briefly until he was jailed in 1963 .'"", 'President Mandela gave the house to the Soweto Heritage Trust last year to administer as a public museum .\', ""The official Libyan news agency , Jana , said Mr Mandela , the key mediator in the eight - year quest to bring the perpetrators to justice , assured Col Gadafy that the deal was proceeding as planned . \'"", ""[ Mr Mandela ] confirmed to brother leader [ Col Gadafy ] that things were going as desired and in accordance with the agreement with the United Nations over the Lockerbie issue ', ' Jana said ."", ""The official Libyan news agency , Jana , said Mr Mandela , the key mediator in the eight - year quest to bring the perpetrators to justice , assured Col Gadafy that the deal was proceeding as planned . \'"", ""[ Mr Mandela ] confirmed to brother leader [ Col Gadafy ] that things were going as desired and in accordance with the agreement with the United Nations over the Lockerbie issue ', ' Jana said .""]']"
1999-05-10,"[""['Mr Mandela said that as early as 1992 he approached the then US president , George Bush , to propose trying the two Libyan suspects in a third country .'"", ""Mr Mandela said the American president was sympathetic , as was François Mitterrand of France and the Spanish king , Juan Carlos .'"", ""Mr Mandela said that as early as 1992 he approached the then US president , George Bush , to propose trying the two Libyan suspects in a third country .'"", ""Mr Mandela said the American president was sympathetic , as was François Mitterrand of France and the Spanish king , Juan Carlos .'"", ""Mr Mandela said that as early as 1992 he approached the then US president , George Bush , to propose trying the two Libyan suspects in a third country .'"", ""Mr Mandela said the American president was sympathetic , as was François Mitterrand of France and the Spanish king , Juan Carlos .']""]"
1999-06-01,"[""['South African financial markets were closed , but the rand traded firmer in London , edging two cents up from its Tuesday close as investors took heart from the fact that the poll was going peacefully .'"", ""In rural areas , people gathered from 1 am , waiting wrapped in blankets for the 7 am start of voting and sometimes lighting small fires to keep warm .'"", ""These are : \\x95 The African National Congress The African National Congress is expected to get more than 60 % of the vote , just shy of the two - thirds majority needed to rewrite the constitution .'"", ""Thabo Mbeki , the man who will be the next president of South Africa , does not evoke the warm and friendly image of Nelson Mandela .'"", ""Many white South Africans view the 56-year - old Mr Mbeki as Machiavellian , authoritarian and untrustworthy ; in short , another Robert Mugabe , the autocratic ruler of Zimbabwe next door .'"", ""Thabo Mbeki , the man who will be the next president of South Africa , does not evoke the warm and friendly image of Nelson Mandela .'"", ""Many white South Africans view the 56-year - old Mr Mbeki as Machiavellian , authoritarian and untrustworthy , in short , another Robert Mugabe , the autocratic rule of Zimbabwe next door .'"", ""Long queues moved steadily as South Africans lined up to consolidate their young democracy .']""]"
1999-06-02,"['[""The Cape Town parliament \'s farewell to Mandela marked the beginning of what is expected to be a protracted leave - taking as he prepares to hand over power to his deputy , Thabo Mbeki , after the general election on 2 June .""', ""South Africa turned the page on its violent political past today , voting peacefully in a watershed election expected to send Nelson Mandela into retirement with a landslide for his ruling party .'"", 'He said some polling stations were reporting very long queues in the early evening , but promised everyone who joined the queues by 9 pm would vote in safety before doors closed . ""\'', 'In places where there will be long queues tonight , we have asked the army to beef up security , "" he said .\', ""Mr Mbeki , who has been in day - to - day control of the country for the past two years , said today \'s election would help to entrench the democracy created in 1994 ."", ""Millions of South Africans endured long queues to elect a new president and parliament in the country \'s second all - race election yesterday .""', 'Although voting was extended into last night at thousands of polling stations which opened late or were slow in handling voters , the peacefulness of the ballot , compared to the bombs and violence which rocked the 1994 campaign , was a testament to how firmly the roots of democracy have taken hold .\', ""Millions of South Africans endured long queues to elect a new president and parliament in the country \'s second all - race election yesterday .""', ""Although voting was extended into last night at thousands of polling stations which opened late or were slow in handling voters , the peacefulness of the ballot , compared to the bombs and violence which rocked the 1994 campaign , was a testament to how firmly the roots of democracy have taken hold .'"", ""Thabo Mbeki , the man who will be the next president of South Africa , does not evoke the warm and friendly image of Nelson Mandela .'"", ""Many white South Africans view the 56-year - old Mr Mbeki as Machiavellian , authoritarian and untrustworthy ; in short , another Robert Mugabe , the autocratic ruler of Zimbabwe next door .'"", ""For the west , Mr Mbeki is an enigma , which is ironic .'"", ""Thabo Mbeki , the man who will be the next president of South Africa , does not evoke the warm and friendly image of Nelson Mandela .'"", ""Many white South Africans view the 56-year - old Mr Mbeki as Machiavellian , authoritarian and untrustworthy , in short , another Robert Mugabe , the autocratic rule of Zimbabwe next door .'"", ""For the west , Mr Mbeki is an enigma , which is ironic .'"", ""In contrast with the violent chaos of the 1994 election that ended white minority rule , polling went smoothly in most of the 14,650 polling stations .'"", 'Long queues moved steadily as South Africans lined up to consolidate their young democracy .\', ""With Thabo Mbeki \'s election as Nelson Mandela \'s successor virtually assured before the vote , the ballot was left to settle whether his African National Congress wins the two - thirds of the vote required to change the constitution at will , and which party will come a distant second to form the official opposition ."", ""With Thabo Mbeki \'s election as Nelson Mandela \'s successor virtually assured before the vote , the ballot was left to settle whether his African National Congress wins the two - thirds of the vote required to change the constitution at will , and which party will come a distant second to form the official opposition .""]']"
1999-06-16,"[""['Mr Mandela retires on June 16 .'"", ""Mr Mandela retires on June 16 .'"", ""Mr Mandela retires on June 16 .'"", ""For us , as South Africans , this day is as much a Day for the Inauguration of the new government as it is a Day of Salute for a generation that pulled our country out of the abyss and placed it on the pedestal of hope , on which it rests today .'"", 'The inauguration yesterday of Thabo Mbeki as the second president of a democratic South Africa has been characterised as the end of the Mandela era .\', ""Yesterday \'s ceremony in front of Pretoria \'s Union Buildings provided yet another testament to Mandela \'s grasp of such virtues , in his appreciation that his presidential term of office was of importance more because of the limits he imposed than his enjoyment of it ."", ""He turned his back on his fellow Nobel Peace Prize winner in Burma , Aung San Suu Kyi , while inviting the military regime \'s intelligence chief , General Khin Nyunt to Thabo Mbeki \'s inauguration yesterday ."", ""A simple swapping of seats marked the end of an era yesterday as Nelson Mandela gracefully surrendered his chair moments after Thabo Mbeki was sworn in as South Africa \'s new president .""', ""Your Majesties , Your Royal Highnesses , Your Excellencies , President of the Constitutional Court , Chief Justice , Isithwalandwe Nelson Mandela , Distinguished guests , Fellow South Africans , Iam honoured to welcome you all to our seat of government as we carry out the solemn act of the inauguration of the President of our Republic .'"", ""I feel greatly privileged that so many of you could travel from all corners of the globe , from everywhere in Africa and from all parts of our country to lend importance and dignity to this occasion .'"", ""But while it may be a convenient description of a historic period of time in South African politics , the phrase is inappropriate for a larger audience which , in an age not well populated with heroes , would also claim the great man as its own ; and for whom the saga , the romance and the tragedy that is the life of Nelson Mandela still has to run its course .'"", ""Part of the fascination of Nelson Mandela , which leads to worldwide identification with him , is his essential humanity .'"", 'Nelson Mandela welcomed Libya \\\'s Colonel Muammar Gadafy to South Africa this week after telling anyone who objected to the visit that they "" can go and jump in a pool "" .\'', ""For Mandela it is enough that the Libyan leader opposed apartheid .'"", ""The succession finally confirmed power in the hands of a new generation of South Africans , the sons and daughters of those who led the liberation struggle , as Mr Mandela joined his former comrades from Robben Island prison in retirement .'"", ""The occasion was made more poignant as inauguration day also marked the anniversary of the 1976 Soweto uprising , which Mr Mbeki acknowledged as a cornerstone of the struggle .']""]"
1999-06-17,"['[\'In his acceptance speech Mr Mbeki , 56 , saluted the generation of Mr Mandela , Walter Sisulu and his own father , Govan Mbeki , as "" titans "" who "" pulled our country out of the abyss and placed it on the pedestal of hope , on which it rests today . ""\'', 'He is expected to announce his cabinet today .\', ""South Africa \'s new president , Thabo Mbeki , unveiled his cabinet yesterday , doubling the number of women but otherwise largely reshuffling the ministers who served under Nelson Mandela ."", ""Imagine Vaclav Havel flying to South Africa to slap PW Botha on the back and announce that the hard man of apartheid was n\'t so bad because he was such a virulent opponent of communism .""', 'Nelson Mandela welcomed Libya \\\'s Colonel Muammar Gadafy to South Africa this week after telling anyone who objected to the visit that they "" can go and jump in a pool "" .\'', ""The succession finally confirmed power in the hands of a new generation of South Africans , the sons and daughters of those who led the liberation struggle , as Mr Mandela joined his former comrades from Robben Island prison in retirement .'"", ""The occasion was made more poignant as inauguration day also marked the anniversary of the 1976 Soweto uprising , which Mr Mbeki acknowledged as a cornerstone of the struggle .']""]"
1999-08-06,"['[""Today , Jim McVeigh , on leave from Her Majesty \'s H - blocks , will launch his book , Executed - Tom Williams and the IRA , which is where it all began , so to speak .""', ""Nelson Mandela is an honorary member ; so is former Beirut hostage Brian Keenan .'"", ""Pat Magee , sentenced to life imprisonment for the Brighton bombing , is also one .'"", ""The treasurer , Dickie Glenholmes , served 10 years for trying to spring a prisoner from Brixton jail using a hijacked helicopter .']""]"
1999-11-23,"[""['Luckily , yesterday provided just such a fix .'"", 'As more than one unionist whispered yesterday , "" This is Prods \\\' week "" - this is the time when unionists can demand all the tender loving care they want , including a prize for the police force they regard as their own .\', ""Yesterday \'s gesture had panache all right - but it may well have been just a bit too clever , a bit too flashy for the ultra - sensitive ecology of Northern Ireland .""', ""Are the politicians of Northern Ireland turning into drama queens ?'"", 'Are they becoming so hooked on the adrenaline rush of the major event that they can not get by without another fix ?\', ""If it \'s not Bill Clinton visiting Omagh , it \'s Bono at the Waterfront Hall ; if it \'s not an encounter with Nelson Mandela , it \'s a Nobel peace prize for David Trimble and John Hume .""]']"
1999-12-15,"['[\'As of yesterday it \\\'s no longer fanciful to imagine the Dalai Lama on Changing Rooms ( "" Go easy with the scumble , Your Holiness "" ) or Loyd Grossman taking a peek through General Pinochet \\\'s Wentworth keyhole ( "" And what have we here ?\', ""It \'s only a matter of time before Li Peng is co - hosting the National Lottery Wednesday draw with Maureen from Driving School .""', ""No one , not even a hero of the fight against racial oppression , is immune from the garden makeover .'"", ""They built pergolas , water - ways and flowerbeds around the house Mr Mandela has constructed in Qunu - the village in Eastern Cape province where he grew up .'"", ""Even as weird stories go , this one was difficult to get your head round .'"", ""Nelson Mandela arrives home from a diplomatic trip to America to find the Ground Force team standing in his newly transformed garden .'"", ""Come again ?']""]"
2000-04-04,"[""['Nelson Mandela seemed leaner and fitter at 81 than he was during his time as president of South Africa , as he talked to the Guardian yesterday in Kensington , where he is staying with a wealthy supporter .'"", '"" We need to be a little bit tough with them , "" he said yesterday .\'', 'Nelson Mandela , on his first visit to Britain since he retired as president of South Africa last year , yesterday accused the government of encouraging international chaos , together with America , by ignoring other nations and playing "" policeman of the world "" .\'', 'Tony Blair is a young man I like very much , "" Mr Mandela said .\']']"
2000-04-05,"[""['Former South African president Nelson Mandela last night pledged to help the family of two black men who died in suspicious circumstances in Telford in their fight for justice .'"", 'Last night Clifton McGowan said : "" I spoke to him [ Mandela ] just briefly and he has all the details of our case .\'', 'Nelson Mandela , on his first visit to Britain since he retired as president of South Africa last year , yesterday accused the government of encouraging international chaos , together with America , by ignoring other nations and playing "" policeman of the world "" .\'', 'In an interview with the Guardian , Mr Mandela said he resented the behaviour of both Britain and America in riding roughshod over the United Nations and launching military actions against Iraq and Kosovo . ""\'', 'Tony Blair is a young man I like very much , "" Mr Mandela said .\'', ""Mr Mandela met Clifton McGowan , whose brother Errol and nephew , Jason , were both found hanged in separate incidents .']""]"
2000-04-06,"[""['He will be speaking at the London School of Economics tomorrow .'"", ""Mr Mandela met Clifton McGowan , whose brother Errol and nephew , Jason , were both found hanged in separate incidents .'"", ""They are believed to be the victims of racist attacks .'"", ""That straight walk from the prison to the gate - that walk the world saw , and which changed the world - it led you through to life from life withheld , from broken stones with your unbroken heart .'"", ""To life which you imagined and then lived , which once we shared in your imagining but soon shared in the present that you shaped : the life which gave each human hope its chance of turning into truth and staying true ; the life which understood what changing takes ; the life which showed us we become ourselves in part by watching you becoming you .']""]"
2000-07-13,"[""['Nelson Mandela , the former South African president , yesterday used all his authority to end the destructive dispute in his country over the cause of Aids and urge scientists and politicians to work together in the battle against a disease that is devastating the continent .'"", ""In a powerful and dignified speech , Mr Mandela offered Africa the leadership it needs in the battle against Aids and a blueprint for the way forward .'"", ""To the delight of scientists and a rapturous reception from the 12,000 delegates at the closing ceremony of the international Aids conference in Durban , he said the rhetoric must end and action begin .'"", ""The Patriot | Oscar politics | His favourite films | Other roles within the film world | Comedy | On playing Nelson Mandela |']""]"
2000-09-27,"[""['Never forget cash for questions ; Black Wednesday ; the pit closures - the sheer injustice of those Tory years .'"", ""Nelson Mandela left the South African presidency in June 1999 after spending five years leading his country to democracy .'"", ""After 27 years in prison and a decade in frontline politics many thought the 81-year - old might look forward to a well - earned retirement with his new wife Graca Machel .'"", 'Mr Mandela , the first black president of South Africa , thanked the party for the support they gave to the anti - apartheid movement .\', ""Well , during 40 years in politics , I \'ve been the warm - up man for some really class acts : Jack Jones , Barbara Castle , Neil Kinnock , John Smith , Tony Blair - and even my old mate Dennis Skinner .""]']"
