2004-04-12,"[""['The Beckhams were due to return to their Madrid home together and he is expected to make a statement about alleged infidelities today , following discussions with advisers .'"", 'David and Victoria Beckham moved to stem speculation about their private life yesterday by instructing solicitors over "" absurd "" claims about the England football captain \\\'s alleged infidelities .\'', 'In a statement issued through Mr Brereton yesterday , Ms Marbeck said she had gone public with her story because "" for two years my life was on hold "" .\'', 'David and Victoria Beckham last night attempted to stem the tide of media allegations about their private life by issuing a statement saying they had instructed lawyers over the allegations .\', ""In yesterday \'s Sun , for example , there was what claimed to be a reproduction of a moving text sent by Beckham to a woman called Sarah ( the text was moving in the sense that the author claimed to be driving along in a Ferrari 550 when he sent it ) .""', ""At some point in the next 24 hours , David Beckham is expected to respond to the succession of lurid allegations about his private life .'"", 'After nine days of newspaper claims from women who say they have had affairs with David Beckham , the couple flew back to Britain from Spain to issue a statement which ridiculed the stories but did not specifically condemn them as untrue . ""\'', 'This weekend a series of even more absurd and unsubstantiated claims have been published about David and Victoria Beckham , "" the statement said .\'', ""Sarah Marbeck , the model whose claims of an affair with David Beckham have dominated the tabloids in recent days , turned to an Australian lawyer to broker the sale of her story to the News of the World .'"", ""This raises fresh questions about how the News of the World managed to get hold of the alleged text exchanges between David Beckham and his two alleged lovers .']""]"
2004-04-13,"['[\'Hayley Barlow , the paper \\\'s spokeswoman , said : "" We note a further dismissive statement issued today by the Beckham camp , this time on behalf of both Mr and Mrs Beckham . ""\', ""The News of the World today confirmed its sales were up substantially on Sunday , when it carried interviews with both Ms Marbeck and Rebecca Loos , Beckham \'s former personal assistant whose claims of an affair sparked a media furore last week .""', 'Sky One today denied it was paying up to £ 500,000 for an exclusive television interview with Rebecca Loos , the woman at the centre of the David Beckham allegations .\', ""But the statement failed to deter newspaper editors , with today \'s tabloids carrying a fresh round of allegations .""', 'Contrary to the impression given over the past week , it is virtually impossible to "" eavesdrop "" on another person \\\'s text messages , mobile telephone companies said today .\'', ""But Vodafone today said it would require a major technical operation to obtain the contents of text messages , even on the most sophisticated phone .'"", ""It was there that - last Tuesday night over a cup of Nescafé - I first learned about the David Beckham story .'"", ""But in a week of claim and counter claim , speculation emerged yesterday that News International was the only organisation outside the government and security forces to own a mobile base station .'"", 'After nine days of newspaper claims from women who say they have had affairs with David Beckham , the couple flew back to Britain from Spain to issue a statement which ridiculed the stories but did not specifically condemn them as untrue . ""\'', 'This weekend a series of even more absurd and unsubstantiated claims have been published about David and Victoria Beckham , "" the statement said .\'', ""Sarah Marbeck , the model whose claims of an affair with David Beckham have dominated the tabloids in recent days , turned to an Australian lawyer to broker the sale of her story to the News of the World .'"", ""Since the News of the World published its story , Mr Brereton has approached broadcasters in Britain to offer them an interview with his client , who has been staying in a hotel to escape the media scrum at her home .'"", 'Sky news presenter Kay Burley will conduct what the channel is billing as a "" warts - and - all "" grilling of Beckham \\\'s former personal assistant , who claims she conducted an affair with the England captain last year .\'', 'This raises fresh questions about how the News of the World managed to get hold of the alleged text exchanges between David Beckham and his two alleged lovers .\', ""A week after the News of the World published a stream of texts allegedly detailing an affair between the England captain and his former aide Rebecca Loos , the newspaper revealed yet more lurid messages , this time to barrister \'s daughter Sarah Marbeck .""', ""It dominated the headlines for eight consecutive days , and when the News of the World hit the streets with the sensational world scoop of another woman claiming to have intimate knowledge of David Beckham , sales should have rocketed .'"", 'When David Beckham began his endorsement for mobile phones by saying "" it \\\'s great to get my hands on this new Vodafone Live "" , little could he have known that tabloid tales about his alleged text messaging would cause him so much trouble .\'', 'Whether a "" CU in court "" text message is winging its way to Rebecca Loos or Sarah Marbeck is for Beckham \\\'s legal team to decide but , from what has been published in various papers , it would seem all parties concerned have used up their free text time .\'', ""The technology , which exposes a security loophole in the way some phones communicate , could provide new insights into how newspapers have been able to read texts sent by celebrities such as David Beckham .'"", ""Although it appears unlikely that the News of the World electronically eavesdropped on Beckham - one of the women at the centre of the affair took a written note of alleged text exchanges and the other is said to have had a reporter at her side during the text correspondence - technology is being developed that could open up texts to anyone and everyone .']""]"
2004-04-14,"['[""This morning \'s tabloid front pages are dominated by allegations about Ms Marbeck , while in today \'s Daily Mail columnist Lynda Lee - Potter offers generous support to the former Spice Girl .""', ""Last week , at the Edinburgh Science Festival , Prof Wiseman launched his Born Lucky experiment , and today confirms graphically that luck - in the northern hemisphere at least - might be just a matter of timing .'"", 'Fresh concerns over the security of mobile phones were sparked today by the news that technology which intercepts and records text messages could be available as early as next week .\', ""Rebecca Loos , David Beckham \'s former personal assistant , yesterday said she was willing to go to court to defend her claim to have had an affair with the England captain .""', ""Yesterday an escort agency in Australia confirmed that Ms Marbeck had begun working for it after her alleged affair with Beckham began .'"", ""It dominated the headlines for eight consecutive days , and when the News of the World hit the streets with the sensational world scoop of another woman claiming to have intimate knowledge of David Beckham , sales should have rocketed .'"", 'When David Beckham began his endorsement for mobile phones by saying "" it \\\'s great to get my hands on this new Vodafone Live "" , little could he have known that tabloid tales about his alleged text messaging would cause him so much trouble .\'', 'Whether a "" CU in court "" text message is winging its way to Rebecca Loos or Sarah Marbeck is for Beckham \\\'s legal team to decide but , from what has been published in various papers , it would seem all parties concerned have used up their free text time .\'', ""If David Beckham is playing a clean game and is innocent , then there is no reason not to get out the big guns and litigate .'"", 'As some of us already know , and soon nobody will be able to forget , there is another international tournament beginning in Portugal in June , but this time neither David Beckham \\\'s metatarsal nor his allegedly "" adventurous "" tongue is the problem . ""\'', ""Do you feel lucky , punk ?'"", 'Then you were probably born in May .\', ""You could be rugby hero Jonny Wilkinson , England \'s football captain David Beckham , or even glamour model Jordan .""', 'As some of us already know , and soon nobody will be able to forget , there is another international tournament beginning in Portugal in June , but this time neither David Beckham \\\'s metatarsal nor his allegedly "" adventurous "" tongue is the problem . ""\'', ""The technology , which exposes a security loophole in the way some phones communicate , could provide new insights into how newspapers have been able to read texts sent by celebrities such as David Beckham .'"", ""Although it appears unlikely that the News of the World electronically eavesdropped on Beckham - one of the women at the centre of the affair took a written note of alleged text exchanges and the other is said to have had a reporter at her side during the text correspondence - technology is being developed that could open up texts to anyone and everyone .'"", ""But in an interview with Sky Television , for which she is understood to have received £ 150,000 , Ms Loos said she had no reason to lie about the alleged affair .'"", 'If David Beckham played basketball , soccer and rugby , "" he says , "" and he was the world number one in each of them , he \\\'d be a little like me . ""\']']"
2004-04-15,"['[""Beckham is very much on Dash \'s mind today .""', ""He may be the CEO of a $ 500 m business , Roc - A - Fella , an outfit that today incorporates a record company , several ranges of clothes , a film production company , a hip - hop magazine , heck , even a bling - bling vodka , whatever that means .'"", 'Today , he says , he keeps working for his two children - "" every moment I \\\'m away from them is a great pain to me , "" he says .\', ""Over two million people tuned into Sky One \'s much hyped interview with Rebecca Loos last night giving the channel its fourth highest audience of all time .""', 'Sven - Goran Eriksson last night said he was certain that David Beckham would not let recent revelations about his private life affect his form in Euro 2004 .\', ""After Thursday night \'s infamous Sky broadcast , the damage may already have been done and the media involved should have the financial capacity to pay any damages awarded .""', ""But in an interview with Sky Television , for which she is understood to have received £ 150,000 , Ms Loos said she had no reason to lie about the alleged affair .'"", 'Damon Dash adjusts his gold chain , smooths his pristine sports apparel and reclines even more expansively in his chair . ""\'', 'If David Beckham played basketball , soccer and rugby , "" he says , "" and he was the world number one in each of them , he \\\'d be a little like me . ""\'', 'The 32-year - old head honcho of a company his PR people call "" a revered hip - hop kingdom "" has many appealing virtues , but modesty is not one of them .\', ""Despite the fact that large chunks of the interview had already been reported by the media , the public \'s appetite for intimate details of the alleged affair between Ms Loos and England football captain David Beckham showed no sign of fatigue .""', 'The interview , in which Ms Loos claimed she became "" besotted "" with Britain \\\'s most high profile footballer , had an average of 1.6 million viewers - a huge number for the channel , which usually struggles to get more than a handful of programmes past the 1 million mark .\'', ""Allegations that he has had affairs with two women have dogged Beckham for a fort night but the England coach , who has recent experience of tabloid attention himself , said he had no doubt that his captain would be focused and committed come the summer .'"", '"" I have spoken to him [ Beckham ] several times as I normally do and he is OK , "" Eriksson said .\']']"
2004-05-01,"['[""That view was backed up yesterday by Jimmy Greaves , one of England \'s best players of the 1960s , who left AC Milan after a short stay . \'"", ""Arsene Wenger took his unbeaten team home to celebrate their championship yesterday - but a lifeless draw was overshadowed by the manager \'s tantalising observations afterwards on the future of David Beckham . \'""', ""He suggested that his players were preoccupied with their unbeaten run and , especially in the last 20 minutes yesterday , were too concerned with not conceding a goal .'"", ""If they take the same attitude away to Portsmouth and Fulham , there could be a sense of anticlimax when they finally get their hands on the trophy here against Leicester on the last day of the season , 15 May .'"", ""Ferguson said last Saturday that he would be having a word with him about that .'"", '"" Real \\\'s coach Carlos Queiroz attributed his side \\\'s 2 - 0 defeat at Deportivo la Coruña on Saturday to having a player sent off for a third successive game .\'', ""Outside Stamford Bridge on Saturday , billboards assured Chelsea supporters of the imminent arrival of David Beckham much as sandwich boards used to advise football crowds of the Second Coming .'"", ""To have the best chance of turning around the semi - final , Chelsea have to score an early goal and , for that to happen , they need to attack with a greater degree of subtlety than was the case on Saturday , when they frequently ran into culs - de - sac against a retreating Southampton defence .'"", 'If David Beckham is to leave Real Madrid at the end of the season , as mounting speculation and strategic leaks from his camp strongly suggest , he will have to swallow hard on his pride .\', ""Spain has not been what Beckham expected and , in the wake of allegations from his former PA Rebecca Loos , with Madrid \'s season coming apart at the seams and with some harsh criticism being fired his way , a return to England looks increasingly likely .""', ""Professionally Beckham wants another year to prove himself , to silence the doubters , but now appears the time to get out .'"", ""Although men of different generations , the Duke of Edinburgh , Andrew Parker Bowles and David Beckham share the fact of being famous for different interpretations of the role of husband : respectively , consort , cuckold and , until some Loos talk , paragon of a two - career celebrity marriage .'"", 'Chelsea can have Ronaldo if the money is right , but David Beckham is not for sale and will play at least another season with Real Madrid .\', ""That was the message from Spain after Jorge Valdano , Real \'s director of football , spoke exclusively to The Observer about press speculation suggesting Beckham was on his way back to England ."", ""Valdano and Beckham met last week at the funeral of the mother of club president Florentino Pérez . \'"", ""David by Sam Taylor - Wood National Portrait Gallery , London WC2 Beck \'s Futures 2004 ICA , London SW1 David Beckham asleep ."", ""I rate the player ', ' he said ', ' but I am not interested because I know I ca n\'t afford him .""', 'The market in Europe is completely flat , unless Chelsea and United want to buy a player .\', ""Manchester United , as England \'s biggest club , will always be scrutinised in depth but this past week , igniting alongside all the tributes to Arsenal and speculation about David Beckham \'s next destination , a hearth full of slow - burning United stories have suggested that this time there might be fire behind all the smoke .""]']"
2004-05-25,"['[\'David Beckham today hit out at the media following a series of lurid claims about his private life , condemning coverage in the Daily Mail and the News of the World as an "" absolute disgrace "" and admitting he had considered boycotting certain media organisations .\'', 'But today he said he had decided against shunning the broadcaster which he had threatened to do following its decision to "" buy up "" Loos for more lurid revelations about his private life .\'', 'David Beckham yesterday turned on the media for its lurid coverage of his private life , condemning stories in the tabloid press as an "" absolute disgrace "" .\'', 'In an interview with BBC Radio 5 Live in Sardinia , where he was training yesterday , Beckham said he had complained to the newspapers concerned : "" I \\\'ve made it clear that , with two papers , the way I and my family have been treated is an absolute disgrace because at the end of the day I \\\'m a nice person and loving husband and father , and that \\\'s what I \\\'ve made clear to these people . ""\'', ""THE GUARDIAN David Beckham yesterday turned on the media for its lurid coverage of his private life .'"", ""31 Kevin McCarra on the press conference given by David Beckham yesterday .'"", ""P6 David Beckham launched an extraordinary attack on the media yesterday .'"", ""P37 David Beckham yesterday tried to exclude the Daily Mail from a press briefing .'"", ""P7 David Beckham yesterday spoke of his torment over newspaper allegations of infidelity .'"", ""P27 DAILY MIRROR David Beckham last night pleaded with the media to leave his family alone .'"", 'P15 THE SUN David Beckham yesterday flipped over stories about his two "" affairs "" .\'', ""P3 David Beckham last night broke his silence over newspaper allegations that he cheated on his wife .'"", ""THE GUARDIAN David Beckham yesterday turned on the media for its lurid coverage of his private life .'"", ""31 Kevin McCarra on the press conference given by David Beckham yesterday .'"", ""P6 David Beckham launched an extraordinary attack on the media yesterday .'"", ""P37 David Beckham yesterday tried to exclude the Daily Mail from a press briefing .'"", ""P7 David Beckham yesterday spoke of his torment over newspaper allegations of infidelity .'"", ""P27 DAILY MIRROR David Beckham last night pleaded with the media to leave his family alone .'"", 'P15 THE SUN David Beckham yesterday flipped over stories about his two "" affairs "" .\'', 'P3 David Beckham last night broke his silence over newspaper allegations that he cheated on his wife .\', ""Beckham \'s criticism of the press yesterday sparked damning headlines in much of today \'s tabloid press , including the Sun , which ran the banner headline \' Becks Loos - es It \' ."", ""The ethnic multicultural media awards ( Emma ) saw David Beckham win sporting personality of the year jointly with Arsenal \'s Thierry Henry .""', ""Speaking publicly for the first time since the storm over his alleged infidelities broke last month , the England captain revealed he had complained to the Daily Mail and the News of the World , which first reported the story , over their coverage .'"", '"" I \\\'ve made it clear that with two papers the way I and my family have been treated is an absolute disgrace because at the end of the day I \\\'m a nice person and loving husband and father and that \\\'s what I \\\'ve made clear to these people [ newspaper executives ] , "" he told BBC Radio 5 Live .\'', ""He had initially tried to ban representatives of certain television and radio stations , as well as newspapers whose coverage of his private life has angered him .'"", ""The England captain said he had considered boycotting some sections of the media , including the satellite broadcaster BSkyB , which paid his former personal assistant £ 150,000 for an interview in which she recounted details of their alleged affair .'"", ""Lawyers acting for David Beckham have warned newspapers against using paparazzi shots of the England captain and his son , Brooklyn , after a photographer snapped them on a private beach .'"", ""Beckham , who has steered clear of the media ever since the lurid claims about his private life appeared last month in the News of the World , was approached by a photographer on a hotel beach while on a training trip in Sardinia earlier this week .']""]"
2004-06-01,"[""['Eriksson plans to begin with his first - choice line - up against Japan and Iceland on , respectively June 1 and June 5 , but as a substitute the attacker might add to the powerful impression he made after coming on to make his England debut in Sweden in March .'"", ""The self - imposed ban will start on 1 June , 11 days before Euro 2004 begins , and last until after 4 July , the day of the final .'"", ""The forward will really have to convince the England coach in the friendly with Japan in Manchester next Tuesday because the deadline for changes to the squad falls the following day .'"", ""Heroics by the Iceland goalkeeper Arni Arason on his Manchester City home ground deprived Japan of a much more emphatic victory and , with Beckham and England due to face his team tomorrow night , Zico admits his men must up their game to avoid embarrassment .'"", 'Beckham went off during the game against Japan on Tuesday when his right ankle , which had been infected after a cut , began to feel "" sensitive "" again .\', ""He also moved to calm concern over England \'s lacklustre second - half display on Tuesday , and blamed tiredness for the disappointing 1 - 1 draw ."", ""So , David Beckham \'s Year turned into a disaster , with Madrid imploding so rapidly that you almost suspected a secret society had plotted their downfall .""', ""Eight points clear and cruising , in the Copa del Rey final and flying in Europe , they collapsed so spectacularly as to end the season trophy - less and down in fourth , having lost their last five matches - their worst run in history .'"", ""How strange it seemed , to be attending an England match along with a large number of Japanese spectators who were all supporting their own country .'"", ""Most of the fans wearing shirts expressing their allegiance to David Beckham and Michael Owen , their faces painted with the cross of St George , were English .'"", ""She may have enjoyed her 15 minutes of tabloid fame in the UK , but Rebecca Loos , the former personal assistant whose allegations of an affair with David Beckham hit the headlines earlier this year , lasted more like 15 seconds when she took up a career in TV presenting .']""]"
2004-06-03,"['[\'England captain David Beckham today moved to quell echoes of the last World Cup by insisting that his ankle injury "" is n\\\'t going to be a problem "" in the final countdown to Euro 2004 .\', ""With only 10 days until England \'s first game of the tournament against France in Lisbon , Beckham said he was confident about his fitness and had returned to training today with his team - mates ."", ""The row over David Beckham \'s controversial triumph at a multicultural awards ceremony took a new turn today after organisers branded criticism of his award racist .""', 'But the awards \\\' founder , Bobby Syed , today hit back at the criticism , saying : "" People have been very hostile to a white person winning an award , which is quite sad really .\'', ""The organisers of the highest profile multicultural media awards have complained that some press coverage of the prize - giving to stars including David Beckham and Tom Cruise showed racism towards white people .'"", 'The Commission for Racial Equality was asked to investigate after the appearance of articles which questioned the legitimacy of the winners for awards owing to their "" white "" skin , said the founder of the Ethnic Multicultural Media Awards , Bobby Syed .\'', ""David Beckham won sporting personality of the year , Tom Cruise was best actor , Vanessa Feltz won radio news journalist , and Greg Dyke was media personality of the year .'"", ""The England captain won sporting personality of the year at the Ethnic Multicultural Media Awards last week .'"", ""David Beckham may be feted in style mags and pursued by the tabloids .'"", ""ENGLAND :'"", ""Coach : Sven - Göran Eriksson Captain : David Beckham World ranking : 12 Tournament record ?']""]"
