2006-11-21,"['[""It might not have happened anyway ( ITV \'s board yesterday rejected the bid while implying it might look kindly on a higher price ) , but Murdoch \'s intervention makes it highly unlikely .""', 'The Times assured us yesterday that Labour was "" happy "" and the Conservatives "" content "" , and that only the dear old dotty Lib Dems were at all bothered .\', ""The ITV board crushed NTL \'s hopes of achieving a £ 4.7bn takeover yesterday as the cable group \'s largest shareholder , Sir Richard Branson , renewed his assault on Rupert Murdoch .""', '"" It appears that this share purchase has already had a material influence on the company and damaged the plurality of the British media , "" the Virgin tycoon said in a statement yesterday .\', ""Fidelity , the investment group that sold its 11.3 % stake in ITV to BSkyB last week , yesterday said it had bought back stock , paying between 110p and 114p for a 1.6 % stake . \'""', ""Then , on BBC2 on Tuesday , the great British documentary maker Paul Watson inserted into his latest film - an observational doc about alcoholics - anguished statements about what he sees as a crisis in factual programming .'"", 'How strange it is to find Rupert Murdoch standing as a protector of public sensibilities : saving viewers and readers from the book and film in which OJ Simpson apparently discusses how he might hypothetically have murdered Nicole Brown Simpson and Ron Goldman . ""\'', 'I and senior management agree with the American public that this was an ill - considered project , "" Murdoch said , announcing that the show will never be screened on Fox and that the book will be pulped .\'', 'In an apparent attempt to contain a public relations debacle for his media empire , News Corporation , Mr Murdoch apologised to the families of Nicole Simpson and Ron Goldman , and described the planned publication of a book by Mr Simpson entitled If I Did It , and an accompanying two - part television interview , as "" an ill - considered project "" .\'', 'The book and interviews , due to go out next week , were intended to describe the 1994 stabbings of the two victims in hypothetical terms , "" if he were the one responsible "" , heavily implying Mr Simpson \\\'s responsibility without formally admitting guilt .\', ""Fox News refused this week to publicise OJ Simpson \'s book"", ""If I Did It , despite the fact that the channel is owned by Rupert Murdoch \'s News Corporation , which also owns ReganBooks , the HarperCollins imprint under which the book was to appear .""', 'BSkyB \\\'s audacious move to grab a minority stake in ITV is an "" old - fashioned powerplay "" , according to media insiders , that owes more to the satellite company \\\'s desire to scupper a potential recovery in the fortunes of NTL than it does to any intention to help the UK \\\'s pre - eminent commercial broadcaster get back on its feet .\'', ""Rumours flew that BSkyB and NTL were looking to pick up shares as Sir Richard Branson , whose Virgin empire is central to a revamped NTL , and Rupert Murdoch squared up against each other .'"", 'OJ Simpson - who , while acquitted of actually murdering his ex - wife and her friend , was held responsible in a civil court for her death - was about to give the world , courtesy of Rupert Murdoch , a "" hypothetical "" account of how he could have committed the crime .\', ""Murdoch \'s News Corporation had a book lined up , a TV interview that would be syndicated across America and , no doubt , countless spin - offs in other countries and media ."", ""NTL and Sir Richard reacted angrily to the rejection from ITV , which came just four days after Mr Murdoch \'s BSkyB spent nearly £ 1bn buying an 18 % stake in ITV .""]']"
2007-05-01,"[""['About 50 executives from around the News Corporation empire - including delegations from Britain and Australia - will meet in the northern Californian town of Carmel , near to where Mr Murdoch has a ranch , over the first May bank holiday .'"", ""About 50 executives from around the News Corporation empire - including delegations from Britain and Australia - will meet in the northern Californian town of Carmel , near to where Mr Murdoch has a ranch , over the first May bank holiday .'"", 'In today \\\'s Daily Express , in a report headlined "" Murdoch gets Barclay brothers in a bear hug "" , Ashford \\\'s quote is extended still further : "" Just how naive can the Barclay brothers be to put their business in the hands of their greatest competitor ?\', ""An audacious $ 5bn ( £ 2.5bn ) attempt by Rupert Murdoch to gain control of the Wall Street Journal was in danger of failure last night as the family which controls the paper \'s publisher , Dow Jones , said it narrowly opposed the takeover ."", ""News Corp is already due to launch a 24-hour business television channel later in the year and some commentators suggested yesterday that Mr Murdoch \'s interest could be closely connected to the imminent launch of his Fox business channel .""', 'Mr Murdoch \\\'s News Corporation had its audacious "" friendly offer "" rejected last night by the Bancroft family , Dow Jones \\\'s controlling shareholders .\'', ""US newspapers reported that a huge volume of Dow Jones shares , some two - thirds of non - voting stock , changed hands in New York yesterday .'"", '"" About 50 executives - including delegations from Britain and Australia - will meet in the northern Californian town of Carmel , near to where Mr Murdoch has a ranch , over the first May bank holiday .\'', 'After news of the bid surfaced on May 1 , the board said it had "" determined to take no action "" , citing the fact that the Bancrofts held 64 % of the voting shares .\', ""As the exact date of Berkshire Hathaway \'s share purchase has not been disclosed , it is not clear whether Mr Buffett dipped into the market before or after the price of News Corporation \'s offer became public on May 1 ."", ""As the exact date of Berkshire Hathaway \'s share purchase has not been disclosed , it is not clear whether Mr Buffett dipped into the market before or after the price of News Corporation \'s offer became public on May 1 .""', 'THE GUARDIAN BBC receives the go - ahead from the BBC Trust to launch the iPlayer and on - demand services .\', ""P11 Telegraph signs new printing deal with Rupert Murdoch \'s News International ."", ""Rupert Murdoch \'s News Corporation has made a $ 5bn ( £ 2.5bn ) bid for Dow Jones , the publisher of the Wall Street Journal , according to US business channel CNBC ."", ""News Corp is said to have made a $ 60 a share , unsolicited bid for Dow Jones , sending the company \'s shares up more than 50 % at around 4.30pm .""', ""It is believed that Dow Jones has not immediately rejected the offer .'"", 'And he decided to target Rupert Murdoch , claiming that the deal represents Murdoch \\\'s "" creeping agenda "" to take over the British media .\'', 'That was also the theme advanced in public statements by the editorial director of his Express Newspapers group , Paul Ashford .\', ""Here \'s the good news about Rupert Murdoch buying the Wall Street Journal : at least he \'ll shift the paper \'s editorial line to the left .""', 'The Bancroft family said it intended to cast "" slightly more than 50 % "" of Dow Jones \\\' voting stock against a $ 60-a - share sale to Mr Murdoch \\\'s News Corporation .\', ""The Bancrofts \' negative reaction came at the end of a day of frantic activity ."", ""Rupert Murdoch \'s $ 5bn ( £ 2.5bn ) bid for Wall Street Journal publisher Dow Jones may have been rebuffed , but it is still possible that the veteran deal - maker - or perhaps someone else - will land his prey .""', 'But Mr Murdoch has reasons to be optimistic that things could yet swing his way .\', ""Mr Murdoch \'s $ 60-a - share bid for the Wall Street Journal \'s parent company is part of a strategy by the News Corporation chief to gain a franchise in financial news of the kind he previously built in covering sports ."", ""He faces an uphill struggle - Dow Jones \' controlling Bancroft family has rejected Mr Murdoch \'s approach and political analysts warned that Democrats in Congress were likely to make the chances of success as difficult as possible .""]']"
2007-05-03,"['[""However , the WSJ also reported that a group of the paper \'s reporters were yesterday urging fellow journalists to write individual letters opposing Mr Murdoch \'s offer to the three Bancroft family members on the Dow Jones board ."", ""However , boardroom opposition to Mr Murdoch \'s bid grew yesterday with the news that Dow Jones \' second family shareholder , the Ottaway clan , were throwing their 6 % shareholding against the bid ."", ""Reuters , the world \'s largest provider of news and financial information , admitted yesterday that 156 years of independence could come to an end after it received a bid approach from Canadian rival , Thomson Corp. News of the bid comes just a few days after Rupert Murdoch \'s News Corp empire made a $ 5bn ( £ 2.5bn ) offer for Dow Jones , owner of The Wall Street Journal .""', 'Reuters stressed yesterday that bid talks were at a very early stage and there was "" no certainty an offer will be made "" .\', ""Bankers were keen to stress yesterday that the deal is not a knee - jerk reaction to News Corp \'s swoop on Dow Jones .""', 'In a memo to staff yesterday Tom Glocer , Reuters chief executive , stressed : "" I want you to know that in considering this proposal I and my colleagues on the Reuters board will be guided by what is in the best interest of Reuters and its stakeholders , including employees . ""\', ""The Times editor , Robert Thomson , will discuss News Corporation \'s bid for Dow Jones when he flies to Calfornia for new media talks with Rupert Murdoch .""', 'It is understood Mr Thomson is one of several News International executives - including the executive chairman , Les Hinton - who are travelling to the US for talks with Mr Murdoch .\', ""Mr Murdoch , chairman and chief executive of News Corporation , News International \'s parent company , is hosting a gathering of senior management near his ranch in Carmel on the US west coast this weekend to discuss new media policy .""', ""Wily old Fox : Rupert Murdoch at a press conference in New York last year .'"", ""Photograph : Mark Lennihan / AP .'"", 'Rupert Murdoch has always coveted a financial title and if his bid for Dow Jones this week is eventually accepted , he will end up owning the biggest business paper in the world , the Wall Street Journal .\', ""Mr Murdoch \'s $ 60-a - share bid for the Wall Street Journal \'s parent company is part of a strategy by the News Corporation chief to gain a franchise in financial news of the kind he previously built in covering sports ."", ""He faces an uphill struggle : Dow Jones \'s controlling Bancroft family has rejected Mr Murdoch \'s approach and political analysts warned that Democrats in Congress were likely to make the chances of success as difficult as possible .""', 'The board of Wall Street Journal owner Dow Jones will "" take no action "" on Rupert Murdoch \\\'s $ 5bn ( £ 2.5bn ) takeover bid , but failed to reject the offer outright .\'', ""Dow Jones cited opposition to the News Corporation bid from the Bancroft family , which controls the company with 64 % of its voting stock .'"", 'Rupert Murdoch is hoping to win over staff at the Wall Street Journal with the promise of editorial investment as part of a charm offensive to thaw opposition against his $ 5bn ( £ 2.5bn ) bid for Dow Jones .\', ""Issues that would be covered include upping staff levels in international news bureaux and putting more investment behind the company \'s electronic properties .""', ""Rupert Murdoch would not install any of his current editors to run the Wall Street Journal and is calling on Times editor Robert Thomson for advice as he attempts to buy the business title .'"", '"" I think I \\\'d be around the place - not every day , "" Mr Murdoch added .\', ""Rupert Murdoch \'s digital media summit in the US this weekend will focus on issues including integration and adapting content for online , according to former BSkyB executive Richard Freudenstein ."", ""Mr Freudenstein , now the chief executive of News Corporation \'s Australian digital division News Digital Media , gave an interview in Australia about the digital pow - wow , where 50 senior editorial staff from around the company \'s global empire , including Robert Thomson , the Times editor , will discuss digital strategy .""', '"" It \\\'s a specific news online discussion , news as in news , information and sport online , "" Mr Freudenstein told the Murdoch - owned Australian .\'', ""It is also likely to flush out interest from financial buyers , with a number of private equity outfits expected to spend the bank holiday weekend working on potential counter offers for Reuters .'"", ""Reuters shares rose 25 % to 615.75p , valuing the company at £ 7.75bn .'"", ""It is also likely to flush out interest from financial buyers , with a number of private equity outfits expected to spend the bank holiday weekend working on potential counter offers for Reuters .'"", ""Shares in Reuters rose 25 % to 615.75p , valuing the company at £ 7.75bn .']""]"
2007-06-10,"['[\'However , despite his ownership of The Times and Sunday Times , "" he is a populist , a lover of tabloids "" such as "" beacons of excellence "" like the News of the World and the New York Post .\'', ""On the other hand , two editors - Robert Thomson at The Times and John Witherow at the Sunday Times - have been making it clear that Murdoch has never interfered with their decision - making .'"", 'Mr Murdoch has proposed a board replicating the one he established when he bought the Times and the Sunday Times in the early 80s .\', ""For his part , Mr Murdoch has repeatedly sought to reassure the Journal \'s owners that he is committed to maintaining the paper \'s editorial independence and has proposed an autonomous editorial board along the lines of the one he created at the Times and Sunday Times Bancroft family members , who control around two - thirds of the voting rights in Dow Jones , are keen to ensure that any solution is truly enforceable and reportedly want to ensure Journal editorial staff have a strong voice on the board .""', ""The media mogul is thought to have proposed an autonomous editorial board along the lines of the one he created at the Times and Sunday Times but Dow Jones union members say that structure has not worked .'"", ""The media mogul is thought to have proposed an autonomous editorial board along the lines of the one he created at the Times and Sunday Times , but Dow Jones union members say that structure has not worked .'"", ""Mr Murdoch has sought to reassure the owners that he is committed to its editorial independence and has proposed an autonomous editorial board along the lines of the one he created at the Times and Sunday Times .'"", 'The Financial Times columnist Martin Wolf opposes the idea of Rupert Murdoch acquiring the Wall Street Journal .\', ""· So exactly how much does Rupert Murdoch interfere in his newspapers \' editorial ?""', '"" I feel more restraint at the Times than I would at the [ New York ] Post .\'', ""I walk around the Sun office a lot more than I walk around the Times office .'"", 'A measure of the independence of a media organisation is how it covers itself .\', ""Rupert Murdoch must have pondered this issue as he read the Wall Street Journal \'s spread on how he handles editorial independence - a subject which has not bothered the WSJ before News Corp made a bid for their business and is a slightly curious subject for a purely business newspaper .""]']"
2007-06-13,"[""['The Wall Street Journal , the newspaper facing a $ 5bn ( £ 2.5bn ) takeover attempt from Rupert Murdoch , tonight announced a major newsroom reshuffle to integrate its print and online operations .'"", ""But they have since met with him to discuss a possible buyout and were expected to send off proposals by today on what editorial safeguards they want in place .'"", 'The union leader trying to fend off Mr Murdoch tonight admitted plans to find alternative buyers are a "" long - shot "" but rebuffed talk a sale is virtually a done deal .\'', ""The Bancroft family are expected today to send Rupert Murdoch their proposals for protecting the editorial independence of the Wall Street Journal should they agree to sell the paper to him .'"", ""The family had initially rejected the bid , but they have since met Mr Murdoch and were expected to send off proposals today on what editorial safeguards they want in place .'"", 'The IAPE president , Steven Yount , said yesterday that a sale to Mr Murdoch \\\'s News Corp was by no means "" inevitable "" even though any other buyer would have to raise huge sums of money .\'', 'Citing "" profound changes sweeping the news business "" but making no mention of News Corp \\\'s contentious bid for its owner Dow Jones , the Journal said the changes were designed to simplify its international news structure .\', ""The Bancrofts , who control 64 % of Dow Jones \'s voting power , have evidently taken a dim view of the editorial board at The Times , which Murdoch offered as a model for the Journal .""', 'Citing "" profound changes sweeping the news business "" but making no mention of News Corp \\\'s contentious bid for its owner Dow Jones , the Journal said the changes were designed to simplify its international news structure .\', ""The Wall Street Journal \'s controlling family is sending a fresh set of proposals to Rupert Murdoch \'s News Corporation on how they want editorial independence protected if Mr Murdoch buys the paper \'s parent company .""', ""No further talks are scheduled but it is thought Mr Murdoch will want to return to the negotiating table .'"", ""An editorial in the latest issue of the Columbia Journalism Review is a savage attack on Rupert Murdoch .'"", ""It casts the Bancroft family , controllers of the Dow Jones company that owns the Wall Street Journal , as a frog and Murdoch as a scorpion ( yes , that old fable ) .'"", 'The union leader trying to fend off Rupert Murdoch \\\'s $ 5bn ( £ 2.5bn ) takeover bid for Wall Street Journal owner Dow Jones has admitted plans to find alternative buyers are a "" long - shot "" but rebuffed talk that a sale to News Corporation is virtually a done deal .\'', 'So far , it has claimed the support of US billionaire Ron Burkle and said last week that an unspecified "" Wall Street group "" and an internet entrepreneur had expressed interest in bidding .\']']"
2007-07-09,"['[\'On the challenges facing media today , Hinton said : "" This is a tumultuous time and we have to refashion our business models , but the good news is that never has the media been able to reach more people more instantly with richer content . ""\', ""The Competition Commission today confirmed that its inquiry into BSkyB \'s swoop on a 17.9 % stake in ITV will include an investigation of the link between the satellite broadcaster and the rest of Rupert Murdoch \'s media empire , which includes The Times and The Sun ."", ""The Competition Commission yesterday confirmed that its inquiry into BSkyB \'s swoop on a 17.9 % stake in ITV will include an investigation of the link between the satellite broadcaster and the rest of Rupert Murdoch \'s media empire , which includes the Times and the Sun .""', 'In a statement yesterday the commission said it would look at the impact of the deal on the "" plurality "" of news and current affairs provision in the UK and might extend that probe to its impact on "" different aspects of culture more generally "" .\'', ""Job : chairman and chief executive , News Corporation Age : 76 Industry : broadcasting , publishing , new media Annual revenue : $ 25.33bn ( £ 12.65bn )'"", ""3 Rupert Murdoch is the old media baron who stole a march on his new media rivals .'"", 'Not quite certain about the provenance of this New York Times story , but here goes .\', ""Chief executive of the Barclay brothers \' Press Holdings Media , Neil \'s mini print empire includes the Spectator , the Business - relaunched more times than a human cannonball - and arts magazine Apollo ."", ""Rupert Murdoch \'s reputation as the media industry \'s master strategist remains as strong as ever .""', 'BSkyB chairman Rupert Murdoch has won back his crown as the most influential person in UK television after BBC director general Mark Thompson snatched it from him in 2005 and held on to the top spot last year .\', ""Murdoch \'s son James , the BSkyB chief executive , also rises to number four on this year \'s TV list and to number five overall on the MediaGuardian 100 , reflecting the satellite broadcaster \'s strength over the past 12 months .""', ""Job : editor , the Times Age : 46 Industry : publishing Circulation :'"", ""Staff : 430 2006 ranking : 41 Robert Thomson is editor of the Times and favourite to take charge of the Wall Street Journal now that Rupert Murdoch is thought to have been successful in his $ 5bn ( £ 2.5bn ) takeover bid for its parent company , Dow Jones .'"", 'In a statement the commission said it would look at the impact of the deal on the "" plurality "" of news and current affairs provision in the UK , and might extend that probe to its impact on "" different aspects of culture more generally "" .\', ""The last time the septuagenarian media mogul \'s expansive media interests faced such intensive scrutiny was during the passage of the Communications Act 2003 , when Lord Puttnam forced the government to insert a clause specifically to restrict his influence .""', ""Why is James Ottaway , whose family own 6.2 % of Dow Jones stock , opposed to a Rupert Murdoch takeover ?'"", 'In a lengthy Q&A , he says : "" The first biggest issue is more media concentration in the hands the people who use their media power for personal , political , and business interests . ""\']']"
