date,text
2011-06-07,"The UK firm that insured Michael Jackson 's comeback gigs at London 's O2 arena has asked a judge in Los Angeles to nullify the $ 17.5 m -LRB- # 10.7 m -RRB- policy . 
Insurer Lloyd 's of London is suing promoter AEG Live saying it failed to supply details including apparent `` prescription drug use and\/or addiction '' . 
AEG took out the cancellation and non-appearance policy - with cover of up to $ 17.5 m - two months before Jackson 's June 2009 death , court papers suggest . 
AEG Live was not available for comment . 
Lloyd 's said a lawyer for AEG Live submitted a claim , along with Jackson 's death certificate , within days of the singer 's death . 
It said that , when AEG Live took out the policy - in which the singer was given the alias Mark Jones - it should have given full information about his medical history . 
The insurer said a required medical examination was never carried out . 
It also claimed it had sought information from the promoter about Jackson 's personal doctor , Conrad Murray , since December 2009 . 
AEG had failed to provide that information , Lloyd 's said . 
For all these reasons , Lloyd 's said it was not obliged to pay for the cost of canceling the shows - one of the biggest debts faced by the singer 's estate following his death . 
Dr Murray , who had been treating Jackson for insomnia , has pleaded not guilty to a charge of involuntary manslaughter over the singer 's death . 
Prosecutors say he gave Jackson a lethal dose of a powerful anesthetic and then failed to provide proper care . 
Lawyers for Dr Murray , who will appear in court later this year , have suggested in recent months that the singer gave himself the dose of anesthetic . 
The pun - ancient artform , or the lowest form of wit ? 
"
2011-06-16,"Michael Jackson concert footage at center of legal row This Is It was made up of concert rehearsal footage filmed prior to Jackson 's sudden death in 2009 Sony Pictures is fighting lawyers for Michael Jackson 's doctor over access to raw footage from the singer 's posthumous concert film , This Is It . 
Prosecutors plan to use clips from the film to show Jackson was in good health before he died ; the defense believes rehearsal footage will show otherwise . 
Dr Conrad Murray has pleaded not guilty to involuntary manslaughter . 
He is accused of giving the singer a lethal dose of a powerful anesthetic and failing to provide proper care . 
Dr Murray is due to stand trial in September Lawyers from both sides are due in court on Thursday to argue whether more than 100 hours of footage shot at rehearsals for the star 's ill-fated comeback shows should be made available to the defense team . 
Sony has filed hundreds of pages of documents arguing against the release . 
Jackson , who died on 25 June 2009 aged 50 , had spent the previous four months rehearsing in LA for a run of 50 concerts which were to be held in London . 
Released in cinemas initially for a limited two-week run , This Is It earned $ 20.1 m -LRB- # 12.5 m -RRB- at global box offices in its first day . 
After two weeks , producer Sony Pictures said the film had taken more than $ 200m -LRB- # 124m -RRB- worldwide . 
The pun - ancient artform , or the lowest form of wit ? 
"
2011-07-26,"The announcement of a Michael Jackson tribute concert in Cardiff in October . 
Two of Michael Jackson 's brothers have criticised a planned tribute concert to the pop superstar in Cardiff as `` inappropriate '' and `` ill-timed '' . 
Jermaine and Randy Jackson are unhappy that it will clash with the trial of Conrad Murray , the doctor charged in relation to their brother 's death . 
The 8 October gig at the Millennium Stadium was announced by producers Global Live Events on Monday . 
But the event has won the backing of the late singer 's mother Katherine . 
Jackson died in June 2009 aged 50 while rehearsing for his This Is It tour . 
When plans for the concert were announced it was reported that Mrs Jackson , and the singer 's sister La Toya and brothers Tito , Marlon and Jackie , were in support of it . 
At a press conference Mrs Jackson said : `` Michael gave his entire life to the world through his love , his music and his devotion to healing the planet . '' 
She said she was positive that the event would `` form a worthy celebration of Michael 's life . '' 
Jermaine and Randy Jackson said there would come a time and place for such a tribute She revealed that `` as many members of my family that are available '' would attend the event . 
However following the press conference the two brothers released a statement saying that while they supported `` the spirit '' of a tribute concert , in choosing the timing of it the promoter had `` disrespected '' their opinions and wishes . 
`` In light of this , we feel it is inappropriate to be involved with such an ill-timed event and its promoter , Global Live , '' the statement said . 
No acts have been announced for the concert yet but a notice on the event 's website promises `` the world 's greatest performing artists '' will appear . 
STATEMENT BY JERMAINE AND RANDY JACKSON `` Today 's press conference in Los Angeles announced a tribute concert to Michael to be attended and supported by the Jackson family . 
`` However , we want to make clear that this does not reflect the position of the entire family . 
`` While we wholeheartedly support the spirit of a tribute that honors our brother , we find it impossible to support an event that is due to take place during the criminal trial surrounding Michael 's death . 
`` As everyone knows , those proceedings commence September 20th , and this Michael Forever concert takes place in Cardiff , Wales , on 8 October . 
`` In light of this , we feel it is inappropriate to be involved with such an ill-timed event and its promoter , Global Live . 
`` Furthermore , the decision to proceed with this concert disrespects opinions and wishes expressed in the strongest terms to Global Live during conversations in April when this event was presented to the majority of the family as an idea already in its advanced stages . 
`` There will come a time and place for an amazing and deserving tribute to Michael . 
But we feel that the most important tribute we can give to our brother at this time is to seek justice in his name . '' 
There are plans for the concert to be broadcast around the world to 30 countries in 2D and 3D . 
It will raise money for three charities including the Los Angeles-based Aids Project . 
Announcing the concert on Monday , Roger Lewis , group chief executive of the Welsh Rugby Union , which owns and operates the stadium , said the `` extra special '' concert would pay tribute to one of the world 's greatest pop icons of all time and benefit US and UK charities . 
He added it was `` fantastic news for music fans all over the world '' and that it would be `` a huge boost for Wales to host this spectacular one-off show . '' 
Global Live Events LLP has worked with a range of artists including Abba , The Beatles , Eric Clapton , Madonna , Placido Domingo , and Jackson himself . 
When the concert was revealed Chris Hunt , the firm 's president , said : `` We wanted to do something decent and worthy of Michael 's musical genius yet something fun and authentic that you would envision Michael attending with excitement and joy surrounded by talent that he respected and loved . '' 
Meanwhile , a Los Angeles judge has ruled that footage of Jackson rehearsing for a concert just days before his death will not be show in court . 
Prosecutors wanted to show several hours of unedited tapes filmed for the movie This Is It in an effort to prove Jackson was healthy before he died of a drug overdose in 2009 . 
The footage was not actually included in the movie , which was released four months after the singer 's death in 2009 . 
Sony Pictures , the studio behind the film , argued that showing the unseen footage in a public court may hurt its potential commercial value . 
Sony Pictures said it screened more than 100 hours of raw footage for the lawyers and the judge in the case . 
Judge Michael Pastor concluded on Monday that it would not help the defense and that `` it was a waste of my time . '' 
But the jury will be shown clips that were used in the film which show the star rehearsing for a series of comeback concerts in London . 
12th August 2011 - 23:07 This comment was removed because the moderators found it broke the house rules . 
The pun - ancient artform , or the lowest form of wit ? 
"
2011-07-26,"Page last updated at 08:03 GMT , Tuesday , 26 July 2011 09:03 UK -LRB- an error occurred while processing this directive -RRB- Katherine Jackson has announced a tribute concert for Cardiff on 8 October A judge in Los Angeles has ruled a film of Michael Jackson rehearsing before his death can not be used in the trial of the doctor accused of killing him . 
Lawyers for Conrad Murray say the footage is not a fair representation of the singer 's health in the days before he died . 
Prosecutors had wanted to show around 12 hours of recordings from This Is It . 
Conrad Murray has pleaded not guilty to the involuntary manslaughter of Jackson at his rented LA mansion in June 2009 . 
He faces up to four years prison if convicted at a trial that is scheduled to begin in September . 
Sony Pictures , the studio that released the documentary film , screened more than 100 hours of raw footage in private court sessions . 
But Judge Michael Pastor ruled on Monday that the film would not help the defense team and was a waste of his time . 
The jury will , however , be shown clips that were used in the movie showing 50-year-old Michael Jackson rehearsing for a series of comeback concerts in London . 
Meanwhile , divisions have emerged in Michael Jackson 's family after his mother announced a UK tribute concert for the star . 
Katherine Jackson says the show will take place at the Millennium Stadium in Cardiff on 8 October . 
She said : `` Michael gave his entire life to the world through his love , his music and his devotion to healing the planet . '' 
Statement from Jermaine and Randy Jackson But in a statement , Michael 's brothers Jermaine and Randy Jackson said the timing of the concert was `` inappropriate '' and `` ill-timed '' . 
It is two weeks after the start of Conrad Murray 's trial in Los Angeles . 
The brothers said : `` While we wholeheartedly support the spirit of a tribute that honors our brother , we find it impossible to support an event that is due to take place during the criminal trial surrounding Michael 's death . 
`` As everyone knows , those proceedings commence -LRB- on -RRB- 20 September and this Michael Forever concert takes place in Cardiff on 8 October . 
`` In light of this , we feel it is inappropriate to be involved with such an ill-timed event . '' 
If the concert goes ahead it will be shown in 30 countries around the world and will raise money for three charities including the Los Angeles-based Aids Project . 
"
2011-08-12,"Aguilera , Green and Robinson are expected in Cardiff for the benefit Christina Aguilera , Cee Lo Green and Motown veteran Smokey Robinson are set to perform at a tribute concert in honor of Michael Jackson . 
More acts will be added to the bill nearer the time , organisers of the Michael Forever concert said . 
Jackson 's brothers have protested to the timing of the event which coincides with the trial of the Dr Conrad Murray , charged over the singer 's death . 
The gig takes place at Cardiff 's Millennium Stadium on 8 October . 
While the concert has raised the doubts of Randy and Jermaine Jackson , it has the full support of the star 's mother and other siblings . 
British acts Leona Lewis , Craig David and JLS have also been lined up to perform at the gig . 
Several of Jackson 's brothers will also perform , along with 3T , which consists of Tito Jackson 's three sons . 
Rock band Alien Ant Farm , who had a hit with a cover version of Jackson 's Smooth Criminal , will also appear at the concert . 
`` We 're delighted that such exciting and globally recognized acts have joined the line-up to pay tribute to a music legend , '' said Chris Hunt , president of concert promoter Global Live Events . 
The concert will raise awareness and funds for Aids Project Los Angeles and two other charities , which have yet to be announced . 
Jackson died in June 2009 at the age of 50 while rehearsing for his This Is It tour . 
A Jackson tribute concert , expected to take place in Vienna in September 2009 , was canceled after organisers failed to attract major names to perform at the event . 
The pun - ancient artform , or the lowest form of wit ? 
"
2011-08-23,"Page last updated at 07:43 GMT , Tuesday , 23 August 2011 08:43 UK -LRB- an error occurred while processing this directive -RRB- Beyonce will perform at the UK Jackson tribute gig via satellite link-up Beyonce has been confirmed to take part in a Michael Jackson tribute concert in October . 
The singer will appear via satellite link-up to perform a Jackson 5 cover at the Michael Forever show at Cardiff 's Millennium Stadium . 
It is not known if the performance will be live or pre-recorded . 
Organisers said : `` Due to scheduling issues she ca n't be there in person , but this performance is not to be missed . '' 
Making the announcement on the event 's Facebook page they added that Beyonce was `` a lifelong Michael fan '' . 
She will join confirmed artists Leona Lewis , JLS , Christina Aguilera , Pixie Lott and Cee Lo Green at the event . 
The concert has been the subject of controversy since initial details were announced last month . 
Two of Michael Jackson 's brothers had criticised the planned tribute the pop superstar as `` inappropriate '' and `` ill-timed '' . 
Jermaine and Randy Jackson are unhappy that it will clash with the trial of Conrad Murray , the doctor charged in relation to their brother 's death . 
Rock band Kiss were then booked for the gig and removed once comments made by their bass player Gene Simmons about Michael Jackson were highlighted . 
He had described Jackson as a `` child molester '' during a magazine interview last year . 
Jackson was cleared of child molestation in 2005 . 
Organisers of the gig have reiterated that tickets for the concert , which takes place on 8 October , will go on sale to the general public on Wednesday at 9am . 
"
2011-08-24,"Page last updated at 13:13 GMT , Wednesday , 24 August 2011 14:13 UK Interview by Debbie Randle , words by Del Crookes The organiser of the Michael Jackson tribute concert is defending the event saying that they have the `` overwhelming majority '' of his family behind them . 
It 's after opposition from Jermaine and Randy Jackson , who say the concert should n't go ahead because it will clash with Conrad Murray 's trial . 
Michael Jackson 's former doctor is accused of involuntary manslaughter . 
`` There 's nothing in this . 
It 's not something to get excited about , '' said Chris Hunt from Global Live Events . 
`` The notion that an event which reminds people just how fantastic Michael Jackson was , what a loss he was to the world he is , what a great singer , a great performer he was , should be inappropriate - it does n't compute , it does n't make sense . '' 
Jermaine and Randy Jackson also say Global Live has `` mishandled '' the booking as well as `` misjudging '' the event 's timing . 
Rock band Kiss were dropped from the bill after over comments made by Gene Simmons . 
During a magazine interview last year the bassist said Michael Jackson was a child abuser . 
Chris Hunt 's response to fans The singer was cleared of child molestation in 2005 . 
Chris Hunt says all the criticism about the concert is understandable but wrong . 
`` They were saying that it was a pity that there had not been a big scale , proper tribute to Michael . 
`` We began to think , ` Why do n't we try and do one . ' 
LaToya was the lead one but there were other family members around as well . 
`` There are two that are n't so happy . 
I do n't wish to be ungenerous to anyone . 
I have the greatest respect for Jermaine , who I 've met a number of times . 
`` He did a couple of times announce that he was going to organise a concert like this and then was n't unable to do so . 
So I suppose it 's a little understandable . '' 
A coalition of 35 fan communities has since written an open letter to the concert organisers asking for the event to be canceled . 
But Chris Hunt says they have n't heard all the facts . 
Michael Jackson was preparing for a series of UK gigs when he died in 2009 `` We have the greatest respect for the fans , '' he said . 
`` We 've been listening to the fans . 
`` I think what 's happened is that there 's been a campaign , which some of them have listened to and have n't heard our responses to it yet . 
`` This concert will sell out either very quickly or quickly . 
We have no worries about it at all . '' 
The Michael Forever concert takes place at Cardiff 's Millennium Stadium on 8 October . 
Artists confirmed to be taking part include Christina Aguilera , Leona Lewis , Cee Lo Green , JLS , Alexandra Burke and Beyonce , who will perform via satellite . 
Speaking to Newsbeat about the controversy surrounding the concert , Alexandra Burke said : `` I definitely think it should go ahead , but it 's not up to me . 
I think the family should decide amongst themselves . '' 
She added : `` I 've got three weeks of rehearsals booked in -LRB- for the concert -RRB- because I 'm trying to make sure I do these songs justice . '' 
Michael Jackson died in June 2009 aged 50 while rehearsing for his This Is It UK tour . 
Conrad Murray has pleaded not guilty to the involuntary manslaughter charge , arguing he did not cause the singer 's death . 
"
2011-08-30,"Michael Jackson judge bars skin doctor from testifying Jackson died shortly before his 50-date run of comeback concerts in London The judge said it was `` not relevant '' . 
The defense plan to portray Jackson as an addict who may have given himself a lethal dose of the drug propofol . 
Dr Murray , who was hired by Jackson to help prepare for his planned July 2009 comeback concerts at London 's O2 arena , was in charge of administering the anesthetic to the star . 
He has pleaded not guilty to involuntary manslaughter . 
In court in Los Angeles on Monday , Dr Murray 's lawyer Edward Chernoff said the defense 's position was that Jackson was addicted to demerol and was withdrawing from it when he died in June 2009 . 
But Superior Court Judge Michael Pastor ruled that Arnold Klein would not be called to testify after prosecution lawyers said the defense wanted to transfer responsibility for Jackson 's death to the dermatologist . 
Prosecution lawyer David Walgren also said Jackson 's autopsy found no traces of demerol . 
Dr Conrad Murray faces up to four years in prison if convicted The judge also barred the defense from calling five of Jackson 's other former doctors to give evidence . 
But he allowed them to call Allen Metzger - who had treated Jackson for two decades - and anaesthetist David Adams . 
Jackson had asked Mr Metzger for intravenous medicines to help him sleep two months before his death but the doctor had refused his request , defense lawyers say . 
And Mr Adams had given propofol to the singer on a number of occasions after dental work . 
A nurse who treated Jackson in 2009 will also be allowed to testify . 
Meanwhile , Judge Pastor has also ruled the defense can not call any witnesses to testify about Jackson 's 2005 trial and acquittal over child abuse charges , saying it would distract the jury . 
And he also refused a request to bring up a 2003 raid of the singer 's Neverland Ranch in California in which defense lawyers say propofol was found . 
Jury selection for the trial is due to begin on 8 September with opening arguments due to begin on 27 September . 
The pun - ancient artform , or the lowest form of wit ? 
"
2011-08-30,"Michael Jackson tribute : Janet Jackson to miss concert Janet Jackson said she would find it `` difficult '' to attend the tribute concert in Cardiff Janet Jackson will not be attending her brother Michael Jackson 's tribute concert in Cardiff . 
The singer said she would find it `` difficult '' because it coincides with the trial of the singer 's doctor . 
Jackson 's mother Katherine and his sister LaToya have backed plans for the Michael Forever Tribute concert at the Millennium Stadium on 8 October . 
But the event is opposed by brothers Randy and Jermaine and some fans say the timing in inappropriate . 
`` Because of the trial , the timing of this tribute to our brother would be too difficult for me , '' Ms Jackson said in a statement . 
Christina Aguilera , Cee Lo Green and Smokey Robinson are due to headline the concert . 
Janet Jackson was not scheduled to perform and her representatives said she had issued the statement in response to media queries about her presence . 
The concert will take place in the middle of the high profile trial in Los Angeles of the Thriller singer 's doctor , Dr Conrad Murray . 
Dr Murray is accused of giving Jackson a lethal dose of the anesthetic propofol and failing to monitor him properly , leading to his death in June 2009 . 
Randy and Jermaine Jackson , along with several Michael Jackson fan clubs , have also said the timing of the tribute is inappropriate given the trial . 
Opening statements are expected to begin on September 27 and the trial is likely to last four to six weeks . 
Conrad Murray has pleaded not guilty to involuntary manslaughter and faces a four year prison term if convicted . 
Michael Jackson died in June 2009 aged 50 while rehearsing for his This Is It tour . 
The pun - ancient artform , or the lowest form of wit ? 
"
2011-09-09,"Trial of Michael Jackson 's doctor to begin in America The trial of Michael Jackson 's doctor is expected to start in America in the next few days . 
The singer died at his Los Angeles home on 25 June 2009 . 
His doctor , Conrad Murray , is accused of giving him a dose of strong medication which may have played a part in his death . 
Dr Murray says he did nothing wrong . 
The case was due to start on Thursday , but the men and women on the jury have taken longer than expected to choose . 
They have to answer lots of questions before lawyers decide if they can sit on the jury . 
Dr Murray has been charged with involuntary manslaughter , which is when a person did n't mean to kill someone but may be responsible for their death . 
"
2011-09-10,"Michael Jackson death : Court narrows down jury Jackson died shortly before his run of comeback concerts in London had been due to start A court in Los Angeles has completed the first phase of selecting a jury for the trial of Michael Jackson 's doctor Conrad Murray . 
A total of 145 people have been chosen to go forward to the next stage of the selection process . 
This involved completing a 30-page questionnaire about the pop star , his music and the media coverage of his death in June 2009 . 
Dr Murray has pleaded not guilty to charges of involuntary manslaughter . 
The potential jurors were also asked whether they knew anyone on a long list of people who may be called as witnesses during the trial , such as the singer 's three children , his parents and brothers and sisters . 
Superior Court Judge Michael Pastor decided there were sufficient prospective jury members available to go on to the next stage , in which they will be questioned in court on 23 September . 
The questionnaire asked potential jurors to give their thoughts about the singer and the fact his family members would be in court for the evidence . 
They were asked whether they had seen the posthumous Jackson concert movie This Is It , or had bought any of his CDs , DVDs or memorabilia . 
Dr Conrad Murray faces up to four years in prison if convicted Questions included : `` Have you ever considered yourself a fan of Michael Jackson or the Jackson family ? '' 
They were also required to say how much they knew about the case against Dr Murray . 
Dr Murray 's lawyer Edward Chernoff has already said in court that the defense 's position is that Jackson was addicted to the painkiller demerol and was withdrawing from it when he died . 
Dr Murray , who was hired by Jackson to help prepare for his planned July 2009 comeback concerts at London 's O2 Arena , was in charge of administering the anesthetic to the star . 
The pun - ancient artform , or the lowest form of wit ? 
"
