date,text
2010-03-23,"Tris Cotterill | 16:55 UK time , Tuesday , 23 March 2010 We are recording the first show of series two today which is very exciting but we managed to grab Russell a few seconds to ask him another of your questions , this time from @marysmith1992 . 
In order to see this content you need to have both Javascript enabled and Flash installed . 
Visit BBC Webwise for full instructions . 
If you 're reading via RSS , you 'll need to visit the blog to access this content . 
if you could live in any home on a television series , what would it be ? 
At 18:40 23rd Mar 2010 , jenny wrote : If you could go to Disney World with any celebrity alive today , who would it be and why ? 
and if you were to have anything in the world as ur birthday presant what would it be ? 
At 01:20 24th Mar 2010 , Tanya wrote : Happy Birthday Russell -LRB- for yesterday -RRB- . 
Hope you had a good day , and hope you had fun at the recording : -RRB- I no I did , was amazing ! 
So happy i 've finally got tickets ! 
Best birthday present ever ! 
That card you found on stage tonight was from me , so was the stig : -RRB- Hope you get to read this ! 
I 've got two questions , do you get the reason why I got you that stig thing and i 'm coming to the show for the next 3 weeks , so can I have my hug that you promised I could have at the end of tonights show ... but I did n't get one : -LRB- Someone let me know please , i 'm a hugeeeeeee fan !! Xxxxxxxxxx At 10:19 24th Mar 2010 , fizzylizzy21 wrote : This was front page news last week : direct quote `` we 're being invaded - they 're running everywhere its unbelievable '' Firstly , Thank you Russell for a brilliant recording last night , it was hilarious - 3 hours of non stop laughter - brilliant ! 
Oh and I hope you had a good birthday : -RRB- A question for Russell - Have you ever watched yourself on TV , and when you are 50 and look back\/watch yourself will you cringe or laugh ?! Couple of news stories - Not funny as much as completely ridiculous . 
Oh and thank you Russell - I can now never eat a poached egg ever again ! 
At 20:49 24th Mar 2010 , Gemma wrote : I know its a day late but HAPPY 30th BIRTHDAY : D Hope you had a great day . 
I send my love At 20:58 24th Mar 2010 , Gemma wrote : Here are some News stories I found for your show x There kinda weird They seem to point a very definate direction - towards the local lidl - and once you reach lidl they disappear ! 
Perhaps God 's trying to tell us something ... . 
\* Yeah , I know , how sad do you have to be to follow pliers ? 
\* Well , we did n't see this coming !?! : Check this out , it 's brilliant ! 
This teenager is awesome - the amount of things he keeps stealing - including planes that he learned to fly from a manuel - and they ca n't catch him , even though he gets pizza delivered to where he is , and has been hunted by the FBI ! 
he deserves a medal ! 
Man who drinks daughter 's breast milk to combat cancer Cancer sufferer Tim Browne pours a rather bizarre ingredient over his breakfast cornflakes his daughter s breast milk . 
Mum-of-one Georgia , 27 , expresses her milk after feeding baby son Monty , then delivers it to her ailing dad in the hope that it will boost his immune system as he battles colon and liver cancer . 
And one month after drinking her milk mixed with his daily pinta , scans showed that 67-year-old Tim s cancer had reduced . 
Tim , a retired teacher , of Calne , Wilts , said : It s not unpleasant just slightly pungent and oily . 
But once it is mixed with cow s milk , I can t taste it . 
I do feel like I have a special bond with Georgia and Monty . 
Daughter Georgia , of Bristol , said : I don t find it strange at all . 
I m just glad to help . 
My mum Carole and my siblings are right behind it . 
In fact , they all think it s quite funny and Dad s told his friends . 
Tim was diagnosed with cancer in July 2007 , a week before Georgia s wedding . 
He had an operation to remove a tumor and a year of chemotherapy put the disease in remission . 
But it returned when Georgia was pregnant . 
Baby Monty was just a month old when she saw a TV documentary on the benefits of breast milk . 
She said : This man with prostate cancer swore that drinking breast milk every day had reduced his tumors . 
Dad agreed it was a worth a go . 
Tim s doctors support the odd concoction . 
But although scans show that his condition has improved , it can not be proved if it is down to the milk or chemotherapy . 
World Cancer Research Fund UK said : We are not aware of any evidence that breast milk brings any benefits to cancer patients . 
Georgia said : I d do anything to give my dad more time . 
Prince Philip in strip club gaffe Prince Philip put his foot in it during a visit to a barracks when he asked a young Navy sea cadet instructor if she worked in a strip club . 
The Duke of Edinburgh 's question provoked howls of laughter from Elizabeth Rendle , 24 , and her friends , reports the Daily Mail . 
Miss Rendle , a barmaid , said Philip had asked her what she did for a living : `` I told him I worked in a club . 
He then asked if it was a strip club , '' she said . 
The 88-year-old royal then appeared to think better of the suggestion in the current weather and joked that such an occupation would be `` too cold '' . 
The Duke was with the Queen at Wyvern Barracks in Exeter during a tour of Devon . 
Miss Rendle later said that , far from being offended by the question , she felt Prince Philip had been `` putting people at their ease '' . 
She said : `` He was just going round chatting with people , asking them what they did for a living . 
`` It was a joke and we were all laughing which drew everyone else 's attention . 
I do n't think he put his foot in it . 
It was a joke and I did n't take any offence . '' 
Row over Tiger Woods blow-up doll Lawyers for Tiger Woods are reportedly trying to halt the sale of a series of sex toys which exploit the golfer 's personal problems . 
-LRB- Unsuitable\/Broken URL removed by Moderator -RRB- The toys include a ` Take Home , Blow-up Tiger Love Doll ' and are for sale on the website of Pipedream Products . 
Pipedream is advertising its Tiger products as being `` available for a very limited time only '' . 
The US gossip website TMZ.com has managed to obtain a copy of a lawyer 's letter to Pipedream . 
It is demanding that the company stops selling the products , recalls all items that have already been distributed and destroys all stock . 
This is n't the first time lawyers have been called to deal with offensive products in the wake of the Tiger Woods scandal . 
In February , Joslyn James , one of his extramarital girlfriends , called on her lawyers to stop the sale of sets of `` mistress '' golf balls in which each ball featured the face of one of his alleged lovers . 
Michael Jackson 's syringe ` up for sale ' The syringe that allegedly administered Michael Jackson 's fatal dose of drugs is reportedly set to go on sale for # 3.3 million . 
The needle is believed to have been obtained secretly and is apparently being offered around Las Vegas auction houses , reports the Daily Mirror . 
Michael Jackson 's family are said to have been informed by lawyers representing the unnamed seller and are said to be desperate to stop the sale . 
The artefact could go under the hammer on June 25 - the first anniversary of the singer 's death in Los Angeles . 
His personal doctor , Conrad Murray , 57 , has been charged with involuntary manslaughter after allegedly administering drugs such as Valium , lorazepam and propofol to the troubled star . 
An autopsy found that Jackson died from `` lethal levels '' of propofol , a powerful anesthetic . 
The syringe set to go on sale is said to be the one used to administer the fatal dose . 
The Mirror quoted a source as saying : `` This is one of the sickest lots ever put up . 
The syringe is no longer needed in the inquest or in Murray 's forthcoming trial but the moral implications do n't bear thinking about . 
`` The guy who has possession of the needle has been in meetings with his legal team , making sure it is legitimate and his to sell . 
`` The plan is to flog it for up to $ 5m in a big Vegas casino but he 's been told he may have to sell it somewhere that does n't have ` reciprocal legal agreements with the United States ' , such as Brazil or even Libya . 
`` Rumours are leaking thick and fast and the Jackson family are aware of the auction plan . 
They are furious and incensed that someone is yet again trying to profit from him . 
It 's an incredibly distressing time for them . '' 
Theme park takes the p \*\*\* A Surrey theme park is calling on members of the public to submit their urine samples in a bid to find the country 's most pungent smelling wee . 
Thorpe Park , near Chertsey , wants it to become the signature stench of its brand new attraction , SAW Alive - billed as the world 's most extreme live action horror maze . 
Bosses are offering a # 500 cash prize to the person who submits the winning sample and is asking entrants to attend the park on Friday , 26 , February between 11am and 2pm . 
The distinctive smell of the winning entry will be recreated and feature in the new attraction , which features six traps depicting the most grisly and iconic scenes from the six SAW films . 
It will be pumped into the iconic washroom scene , recreating a `` realistic and truly gut wrenching sensory experience '' designed to test the nerve of all who enter . 
Laura Sinclair , Thorpe Park 's entertainments manager , will be responsible for selecting the most stomach turning urine sample . 
She said : `` We want SAW Alive to be as authentic and terrifying as possible to make visitors feel as if they are living in a real life horror film . 
`` To do this we need to really push the boundaries of what our guests experience from a sensory point of view with the use of smells , special lighting and effects such as electrocution and vibrating floors that will create a full on attack of the senses . 
`` We 've begun creating some of the stenches of SAW Alive but need the help of the public to create the most realistic and unsavoury urine odour . 
We are looking for a sample that will really get the public gagging . '' 
At 15:45 25th Mar 2010 , frescoandfallow wrote : Its the look on the face of the man in the studio that made me laugh At 18:44 25th Mar 2010 , Liam wrote : I heard about a rollercoster that is supposed to so scary that people who go on it get offered free life cover . 
I know some rides are scary but come on it cant be that scary !! just something for the show LOL That sounds an amazing story ! 
If you can let us know where it 's from we 'll see if we can get it on the show Here are a few news stories I have found amusing At 23:29 28th Mar 2010 , jade wrote : heyyah russell i like this joke i heard when cherel coles song parachute came on -LRB- soz cant spell -RRB- and said she is screwed now because she doesnt have him any more i laughed just like how i laugh at all yur jokes because they are really cool just like yu xx love yu and how old were yu on yur birthday 19 ? 
please tell me xx love yu xx jade Welcome to Russell Howard s Good News blog where you can read about the big news , the little news and the random bits and pieces that have caught Russell s eye . 
And if you spot something that should be in the show this is the place to let us know or just keep up with the latest exclusive content . 
Follow the show on Twitter @bbcgoodnews Find out more about the program Subscribe to Russell Howard 's Good News You can stay up to date with Russell Howard 's Good News via these feeds . 
"
2010-06-09,"Jackson 's brothers were among the mourners at the public funeral service Michael Jackson fans will have limited access to the cemetery where the singer is interred on the first anniversary of his death , US authorities have said . 
Fans will be able to pay their respects in the grounds of California 's Forest Lawn cemetery , but not at the mausoleum where the pop star was laid to rest . 
`` They will be viewing it from a distance , '' police officer Tom Lorenz told the Los Angeles Times . 
Jackson died of a cardiac arrest at his home on 25 June last year . 
His death was ruled as homicide , largely as a result of the powerful anesthetic drug Propofol . 
Jackson 's doctor , Conrad Murray has denied a charge of involuntary manslaughter over the singer 's death . 
Sgt Lorenz said : `` We understand that Forest Lawn is working with the Jackson family for some kind of commemoration . 
`` We will be working closely with Forest Lawn to ensure the safety of those who want to pay their respects to Michael Jackson while ensuring the safety of others who are coming to the cemetery to pay respects to their loved ones , '' he added . 
Plans are expected to be finalized by the end of this week . 
The city of Los Angeles has no plans to issue special permits for access to the cemetery which would allow streets to be closed off and the sale of memorabilia . 
The singer was buried at a ceremony in September which was seen on television , while fans were largely kept away from the cemetery grounds . 
Jackson is due to be posthumously inducted into the Apollo Legends Hall of Fame at a ceremony in New York on 14 June . 
The singer , along with his brothers , won a talent show at the New York theater in 1967 , which led to the Jackson Five being signed to Motown Records . 
The pun - ancient artform , or the lowest form of wit ? 
"
2010-06-14,"Michael Jackson 's family were in court for the decision The doctor accused of giving Michael Jackson a lethal dose of anesthetic will be allowed to work in California as he awaits trial , a court has ruled . 
During a brief procedural hearing , a Los Angeles judge said he did not have the authority to ban Dr Conrad Murray . 
Members of the popstar 's family were inside court to hear the ruling . 
Dr Murray , 57 , denies involuntary manslaughter of Jackson , who died last June . 
A preliminary hearing has been scheduled for 23 August . 
California 's attorney general had asked the judge to suspend the cardiologist in the run-up to the trial . 
But Dr Murray 's lawyers argued that he needed to continue working to pay for his defense . 
Dr Conrad Murray faces up to four years in jail if convicted They said he had no intention of practising in California , but argued that a ban in that state would affect his working in Texas and Nevada . 
Judge Michael Pastor said the matter had already been ruled on by a previous judge , and he refused to allow the attorney general 's application . 
`` I do not have the ability to revisit a ruling by one of my colleagues , '' he said . 
The doctor is alleged to have administered a lethal dose of Propofol and other drugs , which resulted in the popstar 's death on 25 June . 
A condition of Dr Murray 's bail is that he does not administer Propofol . 
If convicted , he faces up to four years in jail . 
The pun - ancient artform , or the lowest form of wit ? 
"
2010-06-16,"Randy Jackson is the second youngest of the Jackson clan Randy Jackson , brother of the late pop star Michael Jackson , has been admitted to hospital with chest pains . 
Jackson , 48 , was taken to Huntington Memorial Hospital in Pasadena on Tuesday , according to the Associated Press news agency . 
He was in court on Monday with his family for a hearing in the case of Dr Conrad Murray . 
The doctor is accused of giving Michael Jackson a lethal dose of anesthetic but denies involuntary manslaughter . 
Last week , Randy Jackson appeared on CNN program Newsroom and said that Dr Murray should be charged with first-degree murder . 
Randy Jackson recently succeeded in stopping an unapproved tribute show to his brother Michael in Rome , which had been scheduled for 25 June , the anniversary of his death . 
He thanked fans on Twitter for their support in his effort to get it canceled . 
Another Twitter post stated : `` I know my brother is at peace although I miss him so much . 
Now that he is gone , my job is to uphold his wishes and make sure justice is served . '' 
The pun - ancient artform , or the lowest form of wit ? 
"
2010-06-24,"Michael Jackson was ` murdered for money ' , says sister Page last updated at 08:58 GMT , Thursday , 24 June 2010 09:58 UK Michael Jackson was murdered for money , according to his sister LaToya LaToya Jackson has claimed her brother Michael was murdered because he was `` worth so much more dead than alive '' . 
Speaking during a TV interview , the singer demanded what she called `` the truth '' surrounding the star 's death in June 2009 . 
She said : `` He was murdered for his catalogue and they knew that . '' 
Tomorrow -LRB- 25 June -RRB- marks the one year anniversary of the Thriller singer 's death with fans organising tributes around the globe . 
Earlier this week music trade magazine Billboard reported that the royalties accumulated since the star 's death had earned the Jackson estate $ 1 billion -LRB- # 677 million -RRB- . 
In an interview with GMTV she said : `` Personally I think it is a slap in the face , not just to Michael but to the entire family . 
It 's totally unfair , it 's wrong and it was not an accident . '' 
Asked whether she believed the star was murdered , she added : `` I never had a doubt . 
LaToya Jackson claims her brother 's death was `` not an accident '' `` You must remember from the day that I found out that Michael was no longer with us , when my mother screamed ` he 's dead ' on the phone , I just went into this , ` Who did it ? '' ' 
Michael Jackson 's personal physician Dr. Conrad Murray has pleaded not guilty to a charge of involuntary manslaughter and is currently awaiting trial . 
LaToya 's not the only member of the Jackson family talking ahead of the first anniversary of Michael 's death . 
His brother Jermaine 's claiming converting to Islam might have saved his life . 
`` I felt that if Michael would have embraced Islam he would still be here today , '' the former Jackson 5 member told the BBC World Service . 
Jermaine said life had been `` tough '' on his family since his brother 's passing . 
`` We 'll never get over it , '' he said . 
Jermaine Jackson says the past year 's been tough on the whole family `` There are n't no words to describe the feeling , we are just learning to live with it . '' 
Jermaine went on to question why Michael is getting so much positive attention now , when before his death many saw him as a bit of a joke . 
`` The love that they are giving my brother now he is dead is the love they should have shown him when he was alive . '' 
Meanwhile , the Los Angeles Forest Lawn cemetery have confirmed fans will be allowed to leave flowers on an outdoor terrace near the singer 's burial site to mark the anniversary but that balloons , candles and doves will not be permitted . 
Reverend Al Sharpton , who presided over Jackson 's memorial service last year said : `` I do n't think the world has been able to mourn him properly because there 's too many unanswered questions . 
Speaking in New York regarding the anniversary , he added : `` I do n't think we can heal until we look at the wounds . 
Who inflicted the wound and why . 
`` I think we can celebrate his life , but we ca n't be settled with his death until we know , who , what , when and why . 
And we still do n't know . '' 
"
2010-06-24,"24 June 2010 Last updated at 14:59 GMT Help A year on from the death of Michael Jackson , the singer 's fans are as passionate about their idol as ever . 
Many have traveled from around the world to be in Los Angeles , US , to mark the anniversary . 
These fans spoke to the BBC outside the LA courthouse where Dr Conrad Murray recently appeared on a charge of involuntary manslaughter . 
"
2010-06-25,"By Peter Bowes BBC News , Los Angeles Jackson was due to play 50 UK dates Michael Jackson died from an overdose of sedatives on 25 June , 2009 at the age of 50 . 
The death of the music superstar prompted an outpouring of grief from fans around the world and resulted in the singer 's doctor , Conrad Murray , being charged with involuntary manslaughter . 
We take a look at some of the unresolved issues surrounding the late King of Pop . 
In the months before his death , Michael Jackson employed Dr Conrad Murray , a cardiologist with practices in Las Vegas and Houston , as his personal physician . 
He was with the singer on the day he died but the doctor has always maintained that nothing he did should have killed Jackson . 
Dr Murray denies any wrongdoing On 8 February , 2010 , Dr Murray appeared in court in Los Angeles and pleaded not guilty to the charge of involuntary manslaughter . 
He has since made two further court appearances in the case and remains on $ 75,000 -LRB- # 50,000 -RRB- bail . 
He is free to practice medicine , providing he does not administer powerful sedatives , such as Propofol . 
Dr Murray is due to appear in court again on 23 August , when Judge Michael Pastor is expected to set a date for a preliminary hearing , which should start within 60 days of that date . 
A trial date can not be set until the process is completed and Judge Pastor has had an opportunity to consider the evidence . 
Dr Murray could be sent to jail for up to four years if found guilty . 
Like Elvis Presley , Michael Jackson remains a hugely powerful commodity from beyond the grave . 
Jackson is estimated to have made more than $ 1bn since his death According to estimates by music newspaper Billboard , the singer 's estate made more than $ 1bn -LRB- # 668m -RRB- since his death . 
The publication says album sales have generated about $ 383m -LRB- # 259m -RRB- and revenue from the film , This Is It , amounted to nearly $ 400m -LRB- # 267m -RRB- . 
Jackson 's This is It concerts , despite never taking place , also proved to be hugely profitable . 
Many fans held on to their tickets as souvenirs , instead of refunding them , which brought in about $ 6.5 m -LRB- # 4.3 m -RRB- , to be shared with the promoter AEG . 
The estate also made money from DVD sales , downloads , royalties and ringtones . 
It was revealed last week that the estate has agreed to foot the bill for Jackson 's memorial service in Los Angeles , with $ 1.3 m -LRB- # 868,169 -RRB- to be paid to the City of Los Angeles and the LA Police Foundation . 
In death , Jackson achieved the musical comeback that he had yearned for in the latter years of his life . 
He was the biggest selling album artist of 2009 , with 8.3 million sales , the vast majority of which were posthumous . 
In the past year , nearly 9 million of his albums have sold in the US alone , according to chart analyists Nielsen SoundScan . 
This is It , the film that documented the singer 's rehearsals for his London concerts , is the highest-grossing concert film and documentary in cinematic history . 
Sony Music Entertainment will release 10 albums of Jackson 's music over the next seven years , including one of previously unreleased material . 
Jackson 's children spoke at a Grammy awards tribute to the late singer Jackson 's children , Michael Joseph Jackson Jr. -LRB- 13 -RRB- , Paris Katherine Jackson -LRB- 12 -RRB- and Prince Michael Jackson II -LRB- 8 -RRB- , commonly known as Blanket , are being cared for by their grandmother , Katherine , who was awarded guardianship in accordance with Jackson 's wishes . 
The children have largely stayed out of the public eye , with the exception of Jackson 's memorial service and the Grammy Awards ceremony . 
The children have been schooled at home although it has been reported that Michael Joseph -LRB- Prince -RRB- will attend a private school from September . 
Jackson 's fans are an ever-present force at court hearings for Dr Conrad Murray . 
They claim the charge of involuntary manslaughter is too lenient and have criticised prosecutors on the case . 
Fans reflect on the Jackson annniversary Many fans have vowed to continue fighting for `` justice '' for their idol . 
`` I love him even more than I did already , '' said Natalia Franco , at a recent hearing . 
`` It 's just now that we 're really grasping his message of love and humanitarianism , '' added Amy Kimes . 
`` On the one-year anniversary I 'm very anxious ... I 'm asking lots of questions of why . '' 
The pun - ancient artform , or the lowest form of wit ? 
"
