date,text
2011-10-12,"Michael Jackson did not cause own death , says doctor Dr Christopher Rogers : `` It 's reasonable to believe that the doctor had an imperfect control over the dose '' Michael Jackson could not have given himself the powerful anesthetic that caused his death , the medic who carried out the singer 's autopsy has testified . 
Dr Christopher Rogers said it was more likely Jackson 's personal physician Conrad Murray mistakenly gave him too much of the drug propofol to try to help him sleep . 
He added Dr Murray had no precision dosing device in Jackson 's bedroom . 
Dr Murray has pleaded not guilty to involuntary manslaughter . 
His lawyers claim Jackson gave himself the fatal dose while Dr Murray was out of the room . 
The doctor told police , in an interview heard in court last week , that he was away from Jackson 's bed for only two minutes on 25 June 2009 to go to the bathroom , and returned to find the singer was not breathing . 
However Dr Rogers testified that Jackson - who was already heavily sedated - would not have been able to inject a lethal dose of propofol before Murray returned . 
`` The circumstances , from my point of view , do not support self-administration of propofol , '' the chief of forensic medicine at the Los Angeles County Coroner 's Office said . 
Dr Murray has admitted to giving Jackson 25ml of the drug to help him sleep , and would have had to give regular extra doses to keep the singer unconscious . 
Dr Murray has pleaded not guilty to involuntary manslaughter Dr Rogers said evidence found in Jackson 's bedroom included an empty 100ml bottle of propofol . 
But he noted that as Dr Murray had no accurate equipment to check the doses being administered , `` essentially , the doctor would be estimating how much propofol he was giving '' . 
`` I think it would be easy under those circumstances for the doctor to estimate wrong and give too much propofol , '' Dr Rogers said . 
He also noted the lack of sophisticated medical equipment in Jackson 's bedroom where the drugs were administered , such as resuscitation equipment . 
Dr Rogers said the cause of death was `` acute propofol intoxication '' , ruling the death a homicide . 
The trial in Los Angeles Superior Court is expected to last five weeks , until the end of October . 
If Dr Murray is convicted , he faces up to four years in jail . 
The pun - ancient artform , or the lowest form of wit ? 
"
2011-10-12,"Conrad Murray drops claim Jackson swallowed propofol Dr Murray say he was trying to wean Michael Jackson off using propofol for his insomnia Lawyers for Dr Conrad Murray have stepped back from claims that Michael Jackson swallowed a fatal dose of propofol when he was out of sight . 
The claim had been a key argument in Dr Murray 's defense at the trial over the superstar 's death . 
They may still argue he injected the dose himself . 
The change came a day after the doctor who performed Jackson 's autopsy said he could not have self-administered it . 
Dr Murray has pleaded not guilty to involuntary manslaughter . 
If convicted Dr Murray could face up to four years in prison and the loss of his medical licence . 
Both the prosecution and Superior Court Judge Michael Pastor appeared surprised by Wednesday 's disclosure , reports said . 
J Michael Flanagan , one of Dr Murray 's lawyers , said he had commissioned a study about the effects of swallowed propofol . 
Mr Flanagan said the effects from swallowing propofol , a powerful anesthetic that Dr Murray injected to relieve Jackson 's insomnia , would be `` trivial '' . 
`` We are not going to assert at any time during this trial that Michael Jackson orally administered propofol , '' Mr Flanagan said . 
Dr Christopher Rogers : `` It 's reasonable to believe that the doctor had an imperfect control over the dose '' The disclosure was made in court but not in front of jurors , the Associated Press reported . 
Lead defense lawyer Ed Chernoff said during opening statements on 27 September that his team would try to show that Jackson gave himself the fatal dose of propofol . 
On Tuesday , Dr Christopher Rogers said it was more likely Jackson 's Dr Murray mistakenly gave Jackson too much of the drug in an effort to help him sleep . 
`` The circumstances , from my point of view , do not support self-administration of propofol , '' the chief of forensic medicine at the Los Angeles County Coroner 's Office said . 
The pun - ancient artform , or the lowest form of wit ? 
"
2011-10-12,"12 October 2011 Last updated at 20:01 GMT Help The legal team representing Michael Jackson 's personal doctor has dropped its claim that the pop star swallowed a fatal dose of the anesthetic Propofol while the medic was not looking . 
Dr Conrad Murray is on trial charged with involuntary manslaughter following Jackson 's death in June 2009 . 
He has pleaded not guilty . 
The BBC 's Peter Bowes in Los Angeles said that the move was a huge about turn by Dr Murray 's defense . 
"
2011-10-13,"Every day is a lottery at the trial of Conrad Murray , Michael Jackson 's doctor , who stands accused of killing perhaps the world 's most famous singer . 
Jackson fans line up against the courtroom wall at 07:30 every morning in the hope of winning a draw for one of the few seats in the public gallery . 
Like millions of others across America and the world they could watch it on the internet or on TV , but there is obviously something more to be gained from being there in person , sitting just a few feet from the lawyers , the family and the accused . 
I joined the draw two days in a row - second-time lucky - to get a feel for the courtroom and to immerse myself in a trial that has been creating a buzz across America . 
It was an interesting day to sit in on the trial . 
It was a day which began with what the TV pundits called a `` cornerstone of the defense '' being pulled away , and went on to hear some damning accusations of `` gross negligence '' against the man whom Michael Jackson trusted as his doctor . 
Before proceedings even began , before the 16 men and women of the jury had been buzzed into their seats , the defense had conceded Michael Jackson could not have drunk the drug which killed him . 
Propofol is what it the trial all about . 
It is is an extremely strong sedative and Michael Jackson was having his doctor use it to help him get to sleep . 
It was a combination of that and a number of other sedatives which caused his death - and as the man prescribing the pills , injections and intravenous drugs , Conrad Murray stands accused of causing his death by involuntary manslaughter . 
One key line of defense is that Michael Jackson took the drugs himself , when his doctor was not looking . 
A presumption made by the countless commentators , TV experts , ex-prosecutors and journalists was that Michael Jackson drank the drug . 
But research by both the prosecution and the defense proved it was only effective if injected straight into the blood . 
And so a line of questioning defense lawyers may have used , and indeed hinted they would use , was dropped - but not the theory of self-medication altogether . 
Jackson could have injected himself , or taken other pills , but that is for another day of evidence or for when the defense case begins . 
But this day was all about independent medical experts and their professional opinion of Dr Murray . 
They were not impressed . 
For much of the day cardiologist Dr Alon Steinberg was in the stand , describing how he had reviewed Dr Murray 's own account of what happened the night Michael Jackson died , as told to a detective . 
He outlined six separate instances of what he called `` gross negligence . '' 
`` Propofol should never be given as a sleeping drug , '' was his premise , explaining it was a strong sedative used as an anesthetic in surgical operations and its use in this way was negligent and unethical . 
Once given the drug , Michael Jackson should have been monitored properly , all the time , with heart and blood pressure monitors , back-up drugs and equipment in case anything went wrong . 
And perhaps most damning of all , he said the way Conrad Murray reacted when Jackson stopped breathing was `` responsible for the singer 's death '' . 
By not immediately calling the emergency services , taking the wrong action in those vital few minutes and not having prepared for an emergency , he had made `` a direct contribution to Michael Jackson 's death '' , Dr Steinberg told the court . 
The second witness , Professor Nader Kamangar , was equally critical of the use of such a powerful sedative which he said required proper training and was usually given in a hospital or clinical environment , not in someone 's home . 
He also reviewed Conrad Murray 's account of what happened , and as a sleep medicine expert stressed propofol should not be used for insomnia . 
The two independent witnesses helped build up a strong picture of a poor doctor who did not follow basic procedure and was negligent . 
It is a picture the defense will be keen to undermine in the cross-examination of Prof Kamangar , with the prosecution continuing to build its case against Conrad Murray as the trial approaches its half-way mark . 
Meanwhile the Jackson fans will keep on arriving for the daily lottery , to secure one of those precious seats in the courtroom . 
The pun - ancient artform , or the lowest form of wit ? 
"
2011-10-19,"Conrad Murray ` responsible ' for Michael Jackson 's death Dr Steven Shafer : '' ` Yes ' is not what a doctor says to a patient request that is not in their best interest . '' 
Michael Jackson 's doctor made 17 flagrant violations when administering propofol to the star , an expert on the potent anesthetic has told the court . 
Dr Steven Shafer said the drug should never be used to treat insomnia and Dr Conrad Murray 's negligence was directly responsible for Jackson 's death . 
The expert called Dr Murray `` clueless '' about the drug that contributed to the 50-year-old singer 's June 2009 death . 
Dr Murray denies involuntary manslaughter of the star . 
Dr Shafer , who helped write the guidance on every bottle of propofol , told the Los Angeles court that Dr Murray did not know how to respond when the star stopped breathing . 
He said of Dr Murray 's delay in calling 911 : `` I almost do n't know what to say . 
That is so completely and utterly inexcusable . '' 
The Columbia University professor said propofol should never be taken as a sleeping aid . 
`` We are in pharmacological never-never land here , something that was done to Michael Jackson and no one else in history to my knowledge , '' he told the jury . 
The expert in anaesthesiology also said Dr Murray had acted like the pop star 's obedient `` employee '' and not his doctor , who should have refused the star 's requests for propofol . 
Dr Conrad Murray -LRB- right -RRB- denies involuntary manslaughter of the pop star `` Saying ` yes ' is not what doctors do , '' said Dr Shafer . 
`` A competent doctor would know you do not do this . '' 
Dr Shafer testified that Dr Murray should have taken minute-by-minute notes of Jackson 's condition while he was under the influence of propofol . 
He said Dr Murray 's lack of record keeping had been a denial of Jackson 's rights . 
Dr Shafer also criticised Dr Murray for talking on the phone in the hours before Jackson 's death . 
The anaesthesiology expert said doctors should never multi-task while monitoring a sedated patient . 
`` A patient who is about to die does not look all that different from a patient who is OK , '' he said . 
Dr Shafer is expected to be the prosecution 's final witness , and his testimony will continue on Thursday . 
The pun - ancient artform , or the lowest form of wit ? 
"
2011-10-24,"Detective Orlando Martinez was one of the first defense witnesses called Lawyers defending Conrad Murray , Michael Jackson 's doctor , have called their first witnesses . 
They will have to counter four weeks of testimony from prosecution witnesses , who alleged that Dr Murray acted unethically and with gross negligence Dr Murray is charged with involuntary manslaughter in a Los Angeles court . 
Among the first witnesses were a doctor and a nurse practitioner , who had both previously treated or counselled Jackson . 
Dr Allan Metzger , a friend of Jackson 's for over two decades , testified that Jackson had requested anaesthetics from him as a sleep aid . 
During their cross-examination , prosecutors used the same testimony to show that other medical professionals rejected using intravenous or oral anaesthetics to help Jackson sleep . 
Cherilyn Lee , a holistic nurse practitioner who treated Jackson with vitamin infusions , testified that she urged Jackson to undergo a sleep study for his insomnia , but he refused , saying he did n't have enough time . 
Ms Lee , who has spoken publicly about Jackson requesting propofol from her , is expected to tell jurors about further exchanges with the late singer when she continues testifying on Tuesday . 
The defense also questioned Detectives Dan Myers and Orlando Martinez about testimony from bodyguard Alberto Alvarez . 
Mr Alvarez said that after Jackson 's breathing stopped , Dr Murray told him to place equipment and vials into a bag before calling the 911 emergency service . 
The defense has contended that Mr Alvarez may have changed his story after a coroner 's official report was released . 
Dr Murray is not expected to testify , but the defense has said they will call their own propofol expert to counter testimony of anaesthesiologist Steven Shafer , the prosecution witness who testified for five days . 
Defense lawyers argued in opening statements that Jackson could have drunk an extra dose of propofol , but later told the court they would drop the argument based on their own studies . 
Prosecutors have portrayed Dr Murray as grossly negligent for administering the drug outside of a hospital setting . 
The defense has argued that he was trying to wean a troubled Jackson off the drug , and that the pop superstar , desperate for sleep during rehearsals for a planned comeback concert , administered the fatal dose himself . 
Correspondents say that with multiple witnesses already called on Monday , the case could go to the jury as early as the end of this week . 
The pun - ancient artform , or the lowest form of wit ? 
"
2011-10-26,"Michael Jackson ` warned about propofol use ' Cherilyn Lee fought back tears as she gave her testimony on Tuesday Singer Michael Jackson was warned by a nurse practitioner about using the sedative propofol to help him sleep , a Los Angeles court has heard . 
Cherilyn Lee said Jackson told her that Diprivan - a brand name for propofol - was the only thing that would knock him out and induce the sleep he needed . 
Ms Lee was testifying on Tuesday at the involuntary manslaughter trial of the singer 's physician , Dr Conrad Murray . 
His lawyers have told the judge they would not be calling him to the stand . 
Lee , a nutritionist and holistic nurse , was called to testify for the defense . 
She told jurors she had tried to give Jackson natural remedies to deal with his insomnia and had told him propofol was too dangerous to be used at his home . 
Under cross-examination by the prosecution , the tearful witness acknowledged a conversation with the singer in which she told him : `` No one who cared or had your best interest at heart would give you this . '' 
After refusing to supply him with the drug in April 2009 , she continued , she never saw Jackson again . 
Dr Conrad Murray is charged with involuntary manslaughter The superstar died on 25 June that year , a death the Los Angeles coroner subsequently attributed to `` acute propofol intoxication '' . 
Dr Murray has pleaded not guilty to involuntary manslaughter , arguing that Jackson self-administered the dose that killed him . 
If convicted he could face up to four years in prison and the loss of his medical licence . 
Dr Murray was hired in May 2009 by promoters AEG Live to be the star 's personal physician ahead of a 50-date concert comeback in London . 
His defense team had wanted to introduce Jackson 's contract to show he would have owed $ 40 million -LRB- # 25m -RRB- to the promoter if the concerts were canceled . 
The lawyers had wanted to argue that Jackson would have been desperate to make sure the shows continued and needed sleep to get through rehearsals . 
But Judge Pastor said there was no evidence Jackson was concerned about the money and allowing testimony about the contract might confuse jurors . 
`` This is not a contractual dispute , '' he said on Tuesday . 
`` This is a homicide case . '' 
It is believed the case , now in its fifth week , could go to the jury by the end of this week . 
The pun - ancient artform , or the lowest form of wit ? 
"
2011-10-27,"Conrad Murray trial : Jackson ` addicted to Demerol ' Dr Robert Waldman : `` I believe there is evidence that he was dependent upon Demerol . '' 
Dr Murray has pleaded not guilty to involuntary manslaughter . 
His lawyers claim Jackson gave himself the fatal dose while Dr Murray was out of the room . 
The defense also called their own propofol expert , Dr Paul White . 
Dr White told the court on Thursday he said he would not have expected the pop superstar to be killed from the drugs which Dr Murray said he had given to the singer . 
He is the last witness for the defense and is expected to continue testifying on Friday , including giving an alternate theory about how Jackson died . 
However , because of a late admission by the defense that Dr White would be using a new computer simulation to illustrate his theory , Judge Michael Pastor has given prosecutors the weekend to analyze the data before cross-examining the defense 's expert . 
Prosecutors told the judge they were surprised by the new development and needed time to study the software program . 
Lawyers for Dr Conrad Murray have moved quickly through witnesses since beginning their case earlier this week , including former patients of the doctor . 
Dr Waldman was testifying largely in the place of Dr Arnold Klein , Jackson 's dermatologist . 
Using Dr Klein as a witness was ruled out in the trial because his care of Jackson was not being investigated . 
Using the dermatologist 's records , he testified that over three days in April 2009 , Jackson received 775mg of Demerol , during the same period that Dr Murray was giving Jackson propofol . 
Dr Waldman told jurors that was a `` large dose '' for a dermatology procedure in an office . 
On cross-examination , however , prosecutor David Walgren asked Dr Waldman about legal obligations for doctors , including a requirement to keep accurate and detailed records . 
Dr Murray told police he had kept no records on his treatment of Jackson . 
Dr Paul White said after reading documents regarding the case he was `` perplexed '' . 
`` I would not have expected Michael Jackson to have died , '' if the dose Dr Murray said he had given Jackson was correct . 
But if Jackson 's doctor did in fact put him on an IV drip of propofol and leave him unattended , Dr White said he could not justify it , AP reports . 
The pun - ancient artform , or the lowest form of wit ? 
"
2011-11-01,"Conrad Murray decides not to give evidence Defense lawyers for Dr Conrad Murray say they will call no further witnesses Dr Conrad Murray has told a judge he will not testify in his own defense in the trial over Michael Jackson 's death . 
He denies involuntary manslaughter but could face a prison term and the loss of his medical licence if convicted . 
Dr Murray told trial Judge Michael Pastor he had made his decision `` freely and explicitly '' , reports said . 
The decision comes after the defense called its last witness , propofol expert Dr Paul White . 
Closing statements will begin on Thursday . 
`` My decision is I will not testify in this matter , '' Dr Murray said after being asked if he understood the choice to testify or not was his alone . 
Throughout the 22-day trial , both the prosecution and defense have called their own medical experts to take the stand . 
On Tuesday , the prosecution called their own propofol expert , Dr Steven Shafer , as a rebuttal witness to counter arguments put forth by Dr White . 
During earlier testimony , Dr Shafer said the suggestion that Jackson could have drugged himself was `` crazy '' . 
The defense called former patients of Dr Murray as character witnesses , and tried to introduce doubt into the testimony of the prosecution 's witnesses . 
Defense lawyers have argued that Jackson , dealing with insomnia , drugged himself with an additional dose of propofol after Dr Murray left his bedroom . 
They dropped their original contention that Jackson drank the propofol but maintained that he had intravenously administered the fatal dose himself . 
Paramedics were called to Jackson 's California home on 25 June 2009 after he stopped breathing . 
He was pronounced dead two hours later at the UCLA medical center . 
The prosecution alleges Jackson died from an overdose of the anesthetic drug propofol and that Dr Murray was negligent by giving him the drug outside of a hospital setting . 
The pun - ancient artform , or the lowest form of wit ? 
"
2011-11-04,"Dr Conrad Murray was hired by Jackson after becoming friends in 2006 When Michael Jackson died on 25 June 2009 , Dr Conrad Murray was at the hospital for the pop superstar , who had hired him as his personal physician and considered him a friend . 
Months later , the 58-year-old was charged with Jackson 's death and became a hate figure to the singer 's legions of fans around the world . 
Raised by his grandparents in Grenada in poverty , Dr Murray worked his way up to become a successful cardiologist in the US . 
A series of financial and personal problems seemed to be ending after a chance meeting in Las Vegas with Michael Jackson led to a once-in-a-lifetime opportunity . 
Dr Murray was hired at Jackson 's request to be the star 's personal physician ahead of his 50-date series of London concerts , This Is It . 
Raised by his maternal grandparents , Dr Murray proved a hard-working student , eventually following his absent father , also a doctor , to the US - where he enrolled at Texas Southern University . 
He graduated three years later with a degree in pre-medicine and biological sciences . 
He continued his medical studies in Nashville , Tennessee , before completing his training in California and the University of Arizona , where he studied cardiology . 
In 2000 , he opened his own practice in Las Vegas , expanding with a second clinic in Houston in 2006 . 
Like his father , he took pride serving both ends of the community , and provided medical care to deprived areas . 
However , Dr Murray 's apparent success was blighted by outstanding debts and tax demands . 
Reports suggest he filed for bankruptcy in 2002 while living in California . 
The doctor 's financial problems stemmed by providing medical care for the poor , his lawyers have said . 
He had not paid the mortgage on his home in months when Jackson offered him the job as his personal physician . 
Other unpaid bills and debts loomed . 
Dr Murray met Michael Jackson when the singer 's daughter , Paris , was sick during a family trip to Las Vegas in 2006 . 
According to Dr Murray 's spokeswoman , someone within Jackson 's group knew the doctor and called Dr Murray to treat her . 
They remained friendly and Jackson hired the physician in May 2009 . 
He was to be paid $ 150,000 -LRB- # 96,000 -RRB- a month . 
`` As a company , we would have preferred not having a physician on staff full-time because it would have been cheaper ... but Michael was insistent that he be hired , '' promoter AEG 's Randy Phillips told the Associated Press . 
`` Michael said he had a rapport with him . '' 
Dr Murray 's lawyer , Edward Chernoff , said the case had put his client in fear of his life and he had to be accompanied `` 24\/7 with a bodyguard '' . 
The prosecution called Dr Murray 's girlfriends to testify `` He ca n't operate his practice , '' said the attorney . 
`` He ca n't go to work because he is harassed no matter where he goes . '' 
According to public records cited by the LA Times , Dr Murray had two children with his wife , but also fathered several children with different women . 
Those children included the now young toddler of Nicole Alvarez , an actress who met Dr Murray in 2005 . 
Several of Dr Murray 's recent girlfriends have also testified at his trial , as well as former patients . 
According to court records , he has been sued more than 10 times , including for breach of contract and unpaid child support . 
He has never been sued for malpractice . 
The pun - ancient artform , or the lowest form of wit ? 
"
