time,timeline
"['2011-01-01T00:00:00', '2011-01-02T00:00:00', '2011-01-17T00:00:00', '2011-01-18T00:00:00', '2011-01-25T00:00:00', '2011-01-27T00:00:00', '2011-01-28T00:00:00', '2011-02-02T00:00:00', '2011-02-03T00:00:00', '2011-02-04T00:00:00', '2011-02-07T00:00:00', '2011-02-08T00:00:00', '2011-02-11T00:00:00', '2011-02-13T00:00:00', '2011-02-15T00:00:00', '2011-02-25T00:00:00', '2011-03-04T00:00:00', '2011-03-08T00:00:00', '2011-03-21T00:00:00', '2011-04-08T00:00:00', '2011-04-09T00:00:00', '2011-04-10T00:00:00', '2011-04-13T00:00:00', '2011-04-21T00:00:00', '2011-05-08T00:00:00', '2011-05-13T00:00:00', '2011-05-15T00:00:00', '2011-05-24T00:00:00', '2011-05-27T00:00:00', '2011-06-05T00:00:00', '2011-06-13T00:00:00', '2011-06-29T00:00:00', '2011-07-05T00:00:00', '2011-07-10T00:00:00', '2011-07-12T00:00:00', '2011-07-13T00:00:00', '2011-07-17T00:00:00', '2011-07-24T00:00:00', '2011-08-01T00:00:00', '2011-08-03T00:00:00', '2011-08-05T00:00:00', '2011-08-15T00:00:00', '2011-08-18T00:00:00', '2011-08-19T00:00:00', '2011-08-21T00:00:00', '2011-08-26T00:00:00', '2011-09-05T00:00:00', '2011-09-10T00:00:00', '2011-09-16T00:00:00', '2011-09-28T00:00:00', '2011-09-30T00:00:00', '2011-10-06T00:00:00', '2011-10-09T00:00:00', '2011-10-10T00:00:00', '2011-10-11T00:00:00', '2011-10-12T00:00:00', '2011-10-18T00:00:00']"," At least 21 dead and more than 70 injured after bomb explodes outside Coptic church in AlexandriaEgyptian President Hosni Mubarak 's announcement that he will serve out remaining term immediately rejected by angry crowdsMan sets himself on fire near Egyptian parliamentMohamed ElBaradei warns of ` Tunisia-style explosion ' in Egypt Mohamed ElBaradei says Egyptians ` yearning for change ' , but draws criticism for refusing to back street-level protestsThousands protest against President Hosni MubarakBloody and bruised : the journalist caught in Egypt unrestEgyptian government on last legs , says ElBaradei .Mubarak tries to head off protest .Mubarak supporters stage brutal bid to crush Cairo uprisingEgypt 's vice-president complains rioting is bad for business .Tourism loses at least $ 1bn as one million visitors flee anti-Mubarak protests .Cairo 's biggest protest yet demands Mubarak 's immediate departureEgypt 's new cabinet announces 15 % rise in salaries and pensionsWael Ghonim , the Google executive who helped organise the protests that started Egypt 's uprising , has been hailed as a hero and a symbol of hope amid calls for him to be appointed spokesman for the country 's democracy movement .Hosni Mubarak resigns   and Egypt celebrates a new dawnEgypt 's military rejects swift transfer of power and suspends constitutionEgyptian officials ' assets to be traced by Serious Organised Crime AgencyThousands join ` day of rage ' across the Middle EastEssam Sharaf , Egypt 's new prime minister , rouses Tahrir Square crowdsMillion-woman MarchEgyptians endorse reforms but Arab discontent simmersTahrir Square comes alive with protesters againEgyptian soldiers attack Tahrir Square protestersHosni Mubarak breaks silence to deny corruptionHosni Mubarak detained over corruption allegationsHosni Mubarak 's name to be removed from all public buildingsEgypt promises justice after Copts and Muslims clash in CairoTahrir Square fills again as Egypt holds Mubarak 's wife for crimes against stateEgypt 's Coptic church leader urges end to Christian sit-in protestHosni Mubarak charged with murderEgypt to open Gaza border crossingEgypt strikes $ 3bn IMF deal to ` relaunch ' economyFury over advert claiming Egypt revolution as Vodafone 'sCairo street clashes leave more than 1,000 injuredEgypt clashes after police released on bailProtests spread in Egypt as discontent with military rule growsEgyptian pipeline hit by fourth explosive attack since JanuaryEgypt hit by new wave of protests as military postpones electionEgypt 's prime minister reshuffles cabinet in response to protestsEgypt erupts into new violence as dozens injured during Cairo protestEgyptian army retakes Tahrir SquareMubarak in the dock : historic trial of former Egyptian president beginsHosni Mubarak 's puppet trade union federation dismantledMubarak on trialIsraelis killed in attacks near Egypt borderIsrael and Gaza trade missiles and rockets in wake of bloodshedCeasefire talks intensify as Israeli PM orders continuation of Gaza air strikesFighting stops in Gaza but fears of further violence remainHosni Mubarak denies police were ordered to fire on protestersIsrael evacuates ambassador to Egypt after embassy attackEgyptians rally in Tahrir Square against return of emergency lawsMilitary regime announces first elections since Hosni Mubarak was ousted , but opposition groups are unhappy with rulesEgyptians demand quicker move to democracy at protest ralliesEgypt 's ruling generals accused of buying time to stay in powerCairo clashes leave at least 24 deadEgypt 's Coptic Christians face an uncertain futureCairo witnesses blame security forces for bloodshed at Coptic marchIsrael apologises to Egypt over police officer deathsJailed Egyptian blogger on hunger strike says ` he is ready to die '"
"['2011-01-25T00:00:00', '2011-01-26T00:00:00', '2011-01-28T00:00:00', '2011-02-11T00:00:00', '2011-03-19T00:00:00', '2011-10-09T00:00:00', '2011-11-28T00:00:00', '2012-04-20T00:00:00', '2012-06-14T00:00:00', '2012-06-24T00:00:00', '2012-06-30T00:00:00', '2012-07-09T00:00:00', '2012-08-12T00:00:00', '2012-11-19T00:00:00', '2012-11-22T00:00:00', '2012-11-30T00:00:00', '2012-12-01T00:00:00', '2012-12-02T00:00:00', '2012-12-04T00:00:00', '2012-12-15T00:00:00', '2012-12-21T00:00:00', '2012-12-22T00:00:00', '2012-12-29T00:00:00', '2013-01-25T00:00:00', '2013-02-22T00:00:00', '2013-04-07T00:00:00', '2013-05-07T00:00:00', '2013-06-23T00:00:00', '2013-06-30T00:00:00', '2013-07-01T00:00:00', '2013-07-02T00:00:00', '2013-07-03T00:00:00', '2013-07-04T00:00:00', '2013-07-05T00:00:00', '2013-07-06T00:00:00', '2013-07-07T00:00:00']"," Egyptians hold nationwide demonstrations against the authoritarian rule of Hosni Mubarak , who has led the country for nearly three decades .A large security force moves into Cairo 's Tahrir Square , beating and arresting protesters and using rubber bullets and tear gas .Three protesters are killed in similar protests outside Cairo , among the first in an eventual death toll of about 900 during the uprising .Protesters burn down the ruling party 's headquarters , and the military is deployed .Protesters occupy Tahrir Square for a prolonged sit in .Mubarak steps down and turns power over to the military .Two days later , the body of top generals , the Supreme Council of the Armed Forces , dissolves parliament and suspends the constitution , meeting two key demands of protesters .In the first post Mubarak vote , Egyptians cast ballots on constitutional amendments sponsored by the military setting the framework for the transition to democracy , including scheduling the first parliamentary and presidential elections .Islamists back the amendments , eager to hold elections they are poised to dominate .Many revolutionaries push for a `` no '' vote , arguing a constitution should be written first .The measures are overwhelmingly approved .Troops crush a protest by Christians in Cairo over a church attack , killing more than 25 protesters .The rally is one of many during the military 's nearly 17 month rule , with protesters often calling for the removal of the generals and clashes frequently erupting that killed dozens .Voting begins in the first parliamentary elections since Mubarak 's ouster .The election concludes in January with nearly half the seats won by the previously banned Muslim Brotherhood .: The presidential campaign officially begins .A first round of voting on May 23 24 determines that Morsi and Ahmed Shafiq , the last prime minister under Mubarak , will face each other in a runoff .The Supreme Constitutional Court orders the dissolving of the Islamist dominated lower house of parliament on grounds that a third of its members were elected illegally .The military swiftly closes down parliament .Election officials declare Morsi the winner , with 51.7 % of the vote .Morsi takes his oath of office before the Supreme Constitutional Court , a day after reading a symbolic oath in Cairo 's Tahrir Square , birthplace of the revolution .July 8 : Morsi issues a surprise decree overruling the court 's dissolution of parliament and challenging the generals .Parliament convenes in defiance of the court ruling disbanding it .In a short session , it approves a new law that effectively places the panel tasked with writing the new constitution above judicial review .In a bold step , Morsi orders the retirement of the top Mubarak era leadership of the military and cancels the military 's last constitutional decree , taking back the powers that the generals gave themselves .The move was seen as way to curb the military 's role in political affairs , but it also gave Morsi the power to legislate in the absence of parliament .Members of liberal parties and representatives of Egypt 's churches withdraw from the 100 member assembly writing the constitution , created by parliament before it was dissolved .They say they are protesting attempts by Islamists who dominate the panel to impose their will on the draft .Morsi unilaterally decrees greater powers for himself , giving his decisions immunity from judicial review and barring the courts from dissolving the constituent assembly and the upper house of parliament .The move came just ahead of court decisions that could have dissolved the bodies .The move sparks days of protests , with clashes between Morsi 's supporters and opponents .At one point , some 200,000 people rally in Tahrir Square , with some of the first chants for Morsi to `` leave . ''In a marathon all night session , Islamists in the constituent assembly rush to complete the draft of the constitution , with almost all non Islamists boycotting the gathering .Morsi sets a Dec. 15 date for a referendum , fueling further protests .Morsi sets the referendum date for the disputed charter for Dec. 15 .A week later , he cancels the decrees that gave him immunity from judicial oversight .Islamists protest outside the Supreme Constitutional Court , blocking judges from entering to rule on the legality of the constituent assembly .More than 100,000 protesters march on the presidential palace , demanding the cancellation of the referendum and the writing of a new constitution .The next day , Islamists attack a peaceful anti Morsi sit in outside the palace , sparking street battles that leave at least 10 dead .Days later , Morsi rescinds his initial decrees , but maintains the date of the referendum .Unofficial results show that 56 % voted yes for the draft constitution .Islamists hold massive rally in the city of Alexandria to show solidarity with religious clerics .In the final vote on the constitution , it passes with a 64 % yes vote .The Egyptian Central Bank announces that foreign reserves drained to $ 15 billion from $ 36 billion in 2010 have fallen to a `` critical minimum '' and starts new measures to stop a sharp slide in the value of the Egyptian pound .The pound 's decline slows but does n't stop , and now stands at just over 7 to the dollar , compared to as strong as 5.5 to the dollar in 2010 .Hundreds of thousands hold protests in Tahrir Square and nationwide against Morsi on the 2 year anniversary of the start of the revolt against Mubarak , and clashes erupt in many places .The following day , residents of the city of Port Said stage protests , angered by a court ruling convicting and sentencing to death a group of local soccer fans for a 2012 stadium riot .Police crack down hard in Port Said , killing more than 40 protesters , and the city and others nearby go into near revolt .Much of the anger is focused at Morsi , who praised the police for their crackdown .Morsi schedules elections for a new lower house of parliament to begin in April .But the election is postponed after a court rules that the upper house which is carrying out legislative duties until a lower house is created improperly approved the law governing the election .It remains unknown when elections will be held .A Muslim mob attacks the main cathedral of the Coptic Orthodox Church when Christians hold a funeral and protest there over four Christians killed in sectarian violence outside of Cairo the day before .One person is killed in clashes at the cathedral , and Pope Tawadros II publicly blames Morsi for failing to protect the building , thought the president condemns the attack .Morsi reshuffles the Cabinet , bringing in more ministers from the Muslim Brotherhood to total 11 members of the 36 member government .Officials say the changes aim to finalize long stalled negotiations with the International Monetary Fund for crucial $ 4.8 billion loan , which requires sensitive reductions to fuel and food subsidies that take up a large chunk of the budget .A deal on the loan has still not been reached .A mob beats to death four Egyptian Shiites in their home in a village on the edge of Cairo .Morsi condemns the attack , but critics blame virulent anti Shiite rhetoric by his hard line Islamist allies , fueled by Syria 's civil war .A week earlier , Morsi shared a stage with hard line clerics at a rally , sitting silently as they denounced Shiites as `` filthy . ''Millions of Egyptians take to the streets in Cairo and other cities calling for Morsi to step down in a massive display of anger and frustration .The demonstrations are largely peaceful , although 16 people , half of them in clashes outside the Muslim Brotherhood 's Cairo headquarters , are killed in protest related violence nationwide .Organizers vow to keep up the protests until Morsi resigns .Large scale demonstrations continue , and Egypt 's powerful military gives the two sides 48 hours to resolve their disputes , or it will impose its own solution .The military 's statement appears to back the protesters , telling the government to respond to their demands .Military officials disclose main details of their plan if no agreement is reached : replacing Morsi with an interim administration , canceling the Islamist based constitution and calling elections in a year .Morsi delivers a late night speech in which he pledges to defend his legitimacy and vows not to step down .Deadline for Morsi and opponents to come to agreement passes , Morsi standing firm .The military chief met with opposition and religious leaders and sent soldiers to the state TV's newsroom in what were seen as first steps toward taking power .Egypt's military chief says Morsi has been replaced by Adly Mansour , the chief justice of constitutional court .Adly Mansour is sworn in as the nation's interim president , taking over hours after the military ousted the Islamist President Mohammed Morsi .Adly dissolves the Islamist dominated upper house of parliament as soldiers open fire on mostly Islamist protesters in Cairo demanding restoration of Morsi , killing at least one person .After an initial announcement that Mansour had named ElBaradei to the key post of prime minister , a spokesman for the interim president backs away , saying consultations are still underway .Secular and liberal factions wrangle with the sole Islamist group that backed Morsi's ouster over installing a new prime minister , reflecting the difficulties in building a broad coalition behind a new leadership .Morsi's opponents and supporters stage huge rallies to push their respective causes ."
"['2012-01-21T00:00:00', '2012-01-24T00:00:00', '2012-04-14T00:00:00', '2012-05-23T00:00:00', '2012-06-02T00:00:00', '2012-06-14T00:00:00', '2012-06-18T00:00:00', '2012-06-19T00:00:00', '2012-06-20T00:00:00', '2012-06-22T00:00:00', '2012-06-24T00:00:00', '2012-06-26T00:00:00', '2012-07-10T00:00:00', '2012-07-14T00:00:00', '2012-10-08T00:00:00', '2012-11-23T00:00:00', '2012-11-30T00:00:00', '2012-12-08T00:00:00', '2012-12-22T00:00:00', '2013-01-27T00:00:00', '2013-03-03T00:00:00', '2013-03-30T00:00:00', '2013-04-29T00:00:00', '2013-05-07T00:00:00', '2013-06-04T00:00:00', '2013-06-30T00:00:00', '2013-07-03T00:00:00']"," A new political era in Egypt begins as Islamist parties win nearly three-quarters of the seats in parliamentary elections to inherit a nation mired in economic crisis and desperate to move beyond military rule and the corrupt legacy of deposed President Hosni Mubarak .Egypt's new parliament holds its inaugural session , and a sense of wonder is mixed with the gravity of a country still under military rule and beset by economic turmoil .Egypt's volatile presidential race is jolted when the election commission disqualifies three controversial front-runners  the nation's former spy chief and two impassioned Islamists  just five weeks before voters go to the polls .Egyptians begin two days of voting in a landmark contest between a stirring political Islam and a secularist vision embodied by men connected to the old regime .The life sentence imposed on toppled President Hosni Mubarak for complicity in the deaths of hundreds of protesters marks an unprecedented milestone in Egypt's path toward democracy .The battle between Egypt's military leaders and the ascendant Muslim Brotherhood over the country's political fate dramatically sharpens when the nation's constitutional court dissolves the Islamist-dominated parliament while upholding the right of an ally of deposed leader Hosni Mubarak to remain on the presidential election ballot .The Muslim Brotherhood claims victory in Egypt's landmark presidential runoff election , but its historic rise to power is blunted by a decree from the ruling military council to greatly limit the authority of the nation's next leader .Egyptian officials deny reports that deposed President Hosni Mubarak was clinically dead after he suffered a stroke and slipped out of consciousness at a prison hospital in Cairo , according to state and independent news media .Conflicting reports about the former leader's health emerged after a report by the official state news agency MENA that Mubarak was declared clinically dead  after he was transferred from a prison hospital to a nearby military hospital. .The report could not be independently verified .Conflicting reports about Hosni Mubarak's health leave Egypt confused and suspicious .His near death  strikes many as just another political ploy .Protesters return en masse to Egypt's Tahrir Square as the Muslim Brotherhood and other groups stage a sit-in to protest actions by Egypt's military council ahead of presidential runoff results .Muslim Brotherhood candidate Mohamed Morsi is declared Egypt's first freely elected president , defeating Ahmed Shafik , the last prime minister to serve deposed leader Hosni Mubarak .A move by Egypt's ruling generals to revive martial law is blunted as a court strikes down a government decree that had allowed soldiers and military intelligence services to arrest civilians during the nation's political turmoilLawmakers defy a court order and reconvene the dissolved parliament , a symbolic victory for President Mohamed Morsi , who had ordered it to meet despite a recent court ruling that disbanded the chamber because of electoral violations .U.S. Secretary of State Hillary Rodham Clinton meets for the first time with new President Mohamed Morsi .Egyptian President Mohamed Morsi issues a blanket pardon for hundreds of activists arrested during the revolution and its turbulent aftermath , in what was widely viewed as a morally wise but politically timed move from a leader attempting to calm his critics amid social and economic turmoil .Clashes erupt across Egypt over President Mohamed Morsi's decree expanding his authority , a move that sharpens lines between Islamists and those who fear the president is stealing power in order to edge the country closer to Islamic law .Egypt's Islamist-dominated constitutional assembly passes a rushed draft of a constitution to ease public anger against President Mohamed Morsi's expanded powers and preempt an expected court decision to disband the chamber the following weekend .Morsi rescinds his 2-week-old decree seizing broad powers and putting his office beyond judicial oversight .But the move fails to calm unrest as the president refuses to cancel a referendum later in the month on a proposed constitution drafted by an Islamist-dominated assembly .Morsi scores a victory in his push for an Islamist state when a controversial new constitution is approved by 64 % of voters in a two-round referendum .But the secular opposition accuses the president's Islamist allies of fraud , portending more conflict between Muslim Brotherhood supporters and a newly collaborative opposition , the National Salvation Front , which includes Nobel laureate Mohamed ElBaradei and former Arab League Secretary-General Amr Moussa .Morsi invokes emergency powers in Ismailia , Port Said and Suez to quell riots that have killed nearly 50 and raised questions on whether his Islamist-backed government can secure order amid intensifying political turmoil .The U.S. government releases $ 250 million in aid to Morsi's government in exchange for pledges of political and economic reforms .Secretary of State John F. Kerry serves notice that the Obama administration will keep close watch on how Morsi honors his commitments and that future aid will be dependent on fulfilling promises of building democracy .Egypt is also struggling to meet conditions for a $ 4.8-billion loan package from the International Monetary Fund .Egyptian state prosecutors order the arrest of popular television satirist Bassem Youssef for allegedly insulting Islam and Morsi .The order reflects an accelerated campaign to stifle protest and opposition to the Islamist president as it follows the arrest a week earlier of five prominent pro-democracy activists .An alcohol-free hotel in the Red Sea resort of Hurghada opens , testament to the spreading influence of Islamic values in Egyptian commerce and society .The opening , marked by the ceremonial dumping of liquor bottle contents on the resort's sidewalks , is cheered by Islamists but denounced by secular political and business leaders as a threat to Egypt's tourism industry , already devastated by two years of political turmoil .Morsi reshuffles his Cabinet , strengthening the Muslim Brotherhood's hold on power and angering opposition leaders who had demanded more secular ministers to balance Islamist influence in the government's upper ranks .Nineteen Americans are convicted on charges of operating illegally funded organizations for their work helping Egyptians build civil society institutions .The U.S. defendants , all but one already out of the country , are sentenced to five-year prison terms .The move angers Washington and Egypt's secular opposition , as it is seen as an effort to repress rival political forces challenging Morsi's Muslim Brotherhood allies .Hundreds of thousands fill town and city centers across Egypt to denounce Morsi on the first anniversary of his inauguration .The protests against his Islamist agenda and heavy-handed moves to shackle political opposition are countered by the turnout of Morsi supporters , leading to deadly clashes and violence that escalates into a massive force demanding the president step down .Egypt's military , which two days earlier had issued an ultimatum that Morsi end the disruptive turmoil paralyzing the country within 48 hours , announces that it has removed him from office and suspended the constitution .Demonstrators celebrate in Cairo's Tahrir Square , restoring the scene of revolutionary chaos that ensued after Mubarak's February 2011 ouster ."
