2008-02-20,"Election results are in from Pakistan .
The late Benazir Bhutto 's Pakistani People 's Party ( PPP ) and former prime minister Nawaz Sharif 's Pakistan Muslim League Nawaz ( PML - N ) won roughly 40 % of the seats each .
President Musharraf 's Pakistan Muslim League Quaid ( PML - Q ) barely won 11 % .
US senators Joe Biden , Chuck Hagel and John Kerry all signed off on the authenticity of the elections , and a suddenly meek Musharraf conceded quickly .
A major story in the elections is the rise of the avowedly secular Awami National Party ( ANP ) in the heavily traditional and conservative North Western Frontier Province .
The NWFP , bordering Afghanistan , has long been a stronghold of the hard - line , pro - Taliban clerics , a sort of cudgel with which they beat the rest of the country .
In the 2002 elections , the Muttahida Majlis - e - Amal ( MMA ) - an umbrella of Islamist parties - essentially ran the table in NWFP .
The ANP did n't win even one seat .
The MMA then used that momentum to try and pass the Hisba Bill , a public morality law based on Saudi Arabia and Iran 's virtue police ( the supreme court struck it down on constitutional grounds ) .
This time , though , the MMA won only seven out of 96 seats .
The ANP won 31 , and the left - leaning PPP won 17 .
As a result of having the majority , the ANP is in a position to form the provincial government .
The story of the ANP 's resurgence , in the face of blatant intimidation by hard - line groups ( ANP leaders were bombed even on election day ) , is significant .
Tarek Fatah , formerly a left - activist in Pakistan , summarizes the ANP 's success succinctly : "" Leading up to the elections , the jihadi extremists targeted the ANP and assassinated a number of their candidates .
ANP activists - highly visible for wearing their red caps - became the Taliban 's primary targets .
There was a reason : The Islamists had managed to convince the Pashtun population that their historic national struggle was the same as the international jihad of Osama bin Laden .
The ANP , however , stood in opposition to this jihadi ideology .
Deeply religious and practising Muslims , ANP supporters have their roots in the kind of secularism where religion and state are kept apart and the use of Islam as a tool of politics is considered an insult to Islam itself .
"" A close look at the ANP 's platform confirms their political philosophy , which begins with a homage to the party 's founder , Bacha Khan , whom the British called Frontier Gandhi .
The manifesto highlights the ideas of separation of religion from state as well as the emancipation and empowerment of women .
The resurgence of the ANP is also a potent reminder to analysts who tend to characterise Pakistan as constantly on the brink of theocracy to not be so simple - minded .
In fact , to people ( including me ) who were paying attention , the ANP 's success is not altogether surprising .
The success of the ANP in the face of the Islamist programme is illustrative and instructive .
It shows that one way of defeating Islamism is to offer a potent and viable alternative narrative .
The ANP does that in the form of Pashtun nationalism .
The ANP represents the elevation of local ethnicity over pan - Islamic rhetoric .
Their local focus gives them a powerful appeal among people hankering for the essentials of life .
ANP 's electoral success also suggests an interesting trend within Pakistani politics .
It appears that regional parties based on ethnic or linguistic commonalities tend to adhere to secular principles .
For example , the MQM , which is essentially a party limited to the city of Karachi , has long been secular in its outlook .
( Last year the MQM held a rally of a few hundred thousand people opposing extremism - great pictures ) .
These regional secular parties - in alliance with the secular PPP , which has revealed itself to be Pakistan 's only truly national party ( it is the only party that won seats in all four provinces ) - seemingly creates a massive secular block in Pakistan .
These regional parties do have their downside .
Aside from the corruption that seems to be rampant no matter what party one belongs to , these parties can be seen as divisive .
The ANP , for example , has what is essentially a secessionist clause in its manifesto : "" Federating units which wish to reorganise on the basis of cultural , linguistic and geographic similarities shall be free to do so . ""
Many Pashtun people of Pakistan - who became geographically split between Pakistan and Afghanistan when the British left - not only consider the border to be artificial , but essentially meaningless .
The ANP has already said that one of the first things it will do upon coming to power is to change NWFP 's name to something like Afghania or Pakhtunkhwa .
Whether or not this gesture is a harbinger of explicit secession or is simply an exercise in pride remains to be seen .
This is why the discussion about Pakistan in western intelligentsia can not just limit itself to mosque and military .
Ethnic and linguistic groups are an immensely powerful force in the country .
If the ANP initiative to rebrand the NWFP is successful , it will mean that all four provinces will be named after the dominant ethnicity in the region .
The challenge for future Pakistani leaders is to find a way to negotiate these ethnic groups in a conciliatory and respectful way .
Historically , this has been nearly impossible for Pakistanis to pull off , and ultimately the problem is one of economic monopolisation by Punjabi interests in the military and industry ( as well as the feudal landlords in Sindh and Punjab ) .
Islamists tend to try to use the frustration these oligarchs cause as a way to provide their utopian solutions .
However , people are becoming wise to their tricks and trying out other , potentially more results - oriented alternatives .
In my opinion , the secular resurgence has far more to do with material concerns than ideological ones .
Ordinary Pakistanis did n't vote for the ANP because they suddenly became hip to Thomas Jefferson or because they became persuaded by some blogger in Birmingham .
They voted for the ANP because they want clean water .
If the ANP fails to deliver the essentials of life - and simply uses nationalism the way Islamists use Islam - then they will be replaced .
If western interests want to maintain the secular resurgence , they are going to have to make sure that these groups do not fail .
At the moment , though , I do n't see any discussion about this in our press ."
2008-02-21,"The battle for power in Pakistan took a fresh twist yesterday when the government reinvigorated a Swiss corruption case against the opposition leader Asif Zardari on the eve of post - election power sharing talks that threaten President Pervez Musharraf .
Government lawyers urged a court in Geneva to prosecute Zardari - whose Pakistan People 's party won the most seats in Monday 's election - on 10-year - old charges of stashing $ 55 m in kickbacks in a Swiss bank account .
The move was seen as a pressure tactic against Zardari , the husband of the assassinated Benazir Bhutto , as he prepared to start negotiations later today for a coalition government with the second - placed opposition leader , Nawaz Sharif , who has campaigned to oust Musharraf .
Despite a massive anti - Musharraf factor in Pakistan 's general election , the retired army chief rejected calls for his resignation from the presidency , indicating that he would serve out his five - year term of office .
His staunch ally , the US , urged the opposition to work with him .
The Swiss case against Zardari stalled last year after Musharraf struck a "" reconciliation "" deal with Bhutto under which all corruption charges would be dropped .
But since her assassination on December 27 , and this week 's election victory , all bets appear to be off . ""
There has been no ruling in 10 years .
Why ?
The answer is simple - because this is all political , "" Zardari 's lawyer , Saverio Lembo , said .
Musharraf 's political survival could depend on preventing a united opposition front that , with enough votes in the new parliament , could impeach him .
To do so he may try to exploit differences between Sharif and Zardari .
Sharif wants Musharraf to go and for senior judges who were sacked by the military leader last November to be reinstated .
But Zardari 's PPP has taken a softer line , keeping open the possibility of working with Musharraf and remaining ambiguous about the position of the former chief justice Iftikhar Muhammad Chaudhry , who is currently under house arrest .
Addressing the media outside his Islamabad home last night , Zardari said both issues would be solved by the next parliament .
"" Parliament will decide which president it can work with and which president it can not , "" he said .
The negotiations starting today will be complex and possibly slow .
Under the constitution there is no time limit for forming a government .
Yesterday the American ambassador , Anne Patterson , held a long meeting with Zardari .
Afterwards he denied that she had tried to pressure him to work with Musharraf . ""
I do n't think the diplomatic corps works on political lines .
They do not give political positions , "" he said .
President George Bush , on a trip to Ghana , deemed the elections "" fair "" and said he hoped the new government would work with the US .
"" We need Pakistan as an important ally , "" he said .
"" We 've got interests in helping make sure there 's no safe haven from which people can plot and plan attacks against the United States of America and Pakistan . ""
But EU observers said they found evidence of significant manipulation in favour of Musharraf 's party , particularly in the run - up to polling . ""
A level playing field was not provided for the campaign , with authorities primarily favouring the former ruling parties , "" Michael Gahler , head of the observer mission , told reporters .
The irregularities persisted last night , with the election commission failing to declare the results in a handful of constituencies - seats that could be vital in any future vote against Musharraf .
Samina Ahmed , south Asia director of the International Crisis Group , said there was evidence that pro - government rigging had deprived both opposition parties of an outright majority , but they should stick together if Pakistan were to achieve a transition from military rule .
"" Both parties have been deprived of a majority .
That makes them vulnerable to manipulation .
They need to realise that if they do not join hands , they can not stabilise the transition .
They have got to work together . """
2008-02-22,"Pakistan 's two largest opposition parties pledged to form a coalition government last night , stepping up pressure on President Pervez Musharraf to resign .
After meeting in Islamabad for the first time since Monday 's general election , Asif Zardari and Nawaz Sharif said they would come together in the national and provincial assemblies .
They did not say when the government would be formed or who would be prime minister , indicating further talks .
"" We intend to stay together , to be together in parliament , "" said Zardari , whose Pakistan People 's Party ( PPP ) won most seats in Monday 's election .
Sharif , whose party came second , again urged Musharraf to step down . ""
The nation has given its verdict ...
the sooner he accepts it , the better , "" he said .
In an apparent compromise , Sharif softened his position on the issue of the reinstatement of judges sacked by Musharraf : "" In principle there is no disagreement on the restoration of the judiciary .
We will work out the modalities in parliament . ""
Sharif avoided mentioning the former chief justice , Iftikhar Muhammad Chaudhry , who remains under house arrest and whose fate has become a sensitive point in negotiations .
The show of unity is part of a complicated power game to determine the shape of the next government .
Their main obstacle is Musharraf .
The US is striving to keep Musharraf in power .
The State Department has publicly urged the opposition to work with the retired general ."
2008-03-10,"Pakistan 's two largest parties agreed to form a coalition government yesterday and promised to reinstate judges fired last year by Pervez Musharraf , raising the prospect of fierce antagonism between president and cabinet .
Nawaz Sharif , the former prime minister once exiled by Musharraf , and Asif Ali Zardari , widow of Benazir Bhutto , announced a power - sharing deal at a resort town in the foothills of the Himalayas .
The deal dashes Musharraf 's hope that the party which backs him - a poor third in last month 's election - might get a role in the government .
Zardari 's Pakistan People 's party won 120 seats in the 342-seat National Assembly , followed by Sharif 's party with 90 .
The former ruling party aligned with Musharraf won 51 .
Zardari and Sharif agreed that the reappointment of the dismissed judges would occur through a parliamentary resolution within 30 days of the formation of the government .
The judges were seen as hostile to Musharraf 's October re - election by legislators for a new five - year term as president while he was still army chief .
The judges are likely to take up legal challenges to Musharraf if they are restored .
Lawyers launched a week of protests yesterday to press for the restoration of the judges .
Police fired teargas at protesters near the home of former chief justice Iftikhar Chaudhry where he has been detained since November .
It was a year ago yesterday that Musharraf first suspended Chaudhry , triggering protests by lawyers and the opposition .
Sharif , ousted by Musharraf in a 1999 coup , has been calling for the unpopular president to step down ; he said yesterday that Musharraf should accept the people 's verdict "" against dictatorship "" .
Zardari was more conciliatory , saying he did not believe in "" personal agendas "" ."
2008-03-10,"President Pervez Musharraf is facing a severe challenge to his fading authority with the formation of a hostile new government that has vowed to restore 60 sacked judges .
The announcement yesterday of a coalition government between Asif Zardari and Nawaz Sharif , whose parties swept last month 's general election , poses a potent threat to the retired general .
Zardari and Sharif control almost enough seats for the two - thirds parliamentary majority that would allow them to start impeachment proceedings against Musharraf , or at the very least strip him of his remaining powers .
But the alliance between the erstwhile political rivals is fraught with potential pitfalls , and for now at least , Musharraf shows few signs of resigning . ""
He 's a strong man , he 's a commando and he does n't give up easily , "" said Tariq Azim , a Musharraf loyalist and former information minister who recently met the president .
In reaching their agreement , Zardari and Sharif - whose parties were at daggers drawn during the last period of civilian rule in the 1990s - made crucial compromises , both with each other and Musharraf .
Sharif agreed to allow his party take oath under the president - his bitter enemy , who ousted him in a 1999 coup .
Sharif himself will not even be present because Musharraf officials prevented him from contesting a seat .
The most significant concession , however , was made by Zardari , the husband of the assassinated opposition leader Benazir Bhutto , who agreed that about 60 judges fired by Musharraf will be restored through a parliamentary resolution within the first 30 days of government .
The fate of the judges has become a burning issue in Pakistan .
They were removed on November 3 when Musharraf suspended the constitution and imposed emergency rule , days before the supreme court was due to rule on his controversial re - election .
Their restoration would be a victory for Sharif , whose supporters polled well thanks to promises of ousting Musharraf and reinstating the judiciary .
But the issue is a constitutional and political minefield .
Zardari 's Pakistan People 's party ( PPP ) has been more taciturn , advocating an "" independent "" judiciary but stopping short of calling for the reinstatement of the former chief justice Iftikhar Muhammad Chaudhry .
Chaudhry and Musharraf are bitter enemies and few analysts believe they can co - exist for long if Chaudhry is reinstated .
Musharraf 's ill - fated attempt to remove him a year ago last Sunday triggered a formidable protest movement that led to his present predicament .
In recent interviews Musharraf has denounced Chaudhry as a corrupt charlatan and "" the scum of the earth "" .
The PPP and many western diplomats are wary of Chaudhry for his fiery judgment and mercurial temperament .
They claim he has become politicised through his rivalry with Musharraf .
But Chaudhry is a hero to Pakistan 's lawyers and many ordinary citizens , and his fate has become a key factor in the complex political calculus .
On Sunday riot police fired tear gas on protesters outside Chaudhry 's Islamabad home , where the judge has been imprisoned with his family for the past four months .
Zardari has another problem .
Despite weeks of horse - trading and internal debate , his party has failed to choose a candidate for prime minister , underlining the difficulty of ensuring party unity in the wake of the assassination of his wife on December 27 .
A showdown between Musharraf and the new government is possible but unlikely as early as this week , when the national assembly may meet .
Even if the Sharif - Zardari government can muster the numbers needed to impeach Musharraf , the question is how the retired general and his military colleagues would react .
The army has held the balance of power in Pakistan for the past 50 years , ruling directly through military dictators or indirectly through intelligence agencies and clandestine machinations .
Musharraf 's stark unpopularity has caused the new army chief , General Ashfaq Kayani , to publicly distance the military from overt political interference .
Kayani recent withdrew serving officers from several public bodies .
But last week he sought to dispel speculation that the army was "" distancing "" itself from Musharraf .
In a statement viewed as a veiled threat , Kayani appealed to political parties to avoid "" any kind of schism which ... would not be in the larger interest of the nation "" .
Whether Kayani 's definition of a "" schism "" involves the political future of his former boss , Musharraf , will become clearer if the parliament moves against him ."
2008-03-17,"Political leaders in Pakistan who triumphed over Pervez Musharraf and his allies in last month 's elections today hailed the country 's transition to democracy today the new parliament was sworn in .
Former rivals Nawaz Sharif and Asif Zardari are now expected to form a coalition government after their parties ' victory , which observers believe will curtail Musharraf 's power .
Senator Tariq Azim , a Musharraf ally , hailed the inauguration of the lower house as a "" step toward political stability "" but Zardari - the widower of Benazir Bhutto , who was assassinated during election campaigning - said it marked the beginning of the end for "" dictatorship "" .
"" This is the first step for democracy , "" he said .
"" Democracy is the last step for dictatorship . ""
Zardari 's Pakistan People 's party won the most seats in the February elections .
It plans to form a coalition with Sharif and a smaller group from the unstable north - west area of Pakistan .
The party said its top priority will be to seek a UN investigation of the December 27 assassination of Bhutto and to amend the constitution to strip Musharraf of his power to dissolve the assemblies and dismiss the prime minister .
The new government is also expected to restore judges purged from the courts by Musharraf when he declared emergency rule last November .
Musharraf swept aside the supreme court as it prepared to rule on whether he was eligible for the five - year presidential term he won in an October vote in the outgoing parliament .
The ousted chief justice , Iftikhar Mohammed Chaudhry , has been under house arrest for more than four months .
Musharraf is likely to oppose his return , which could reopen the question of Musharraf 's eligibility to be president .
But Sharif said as he left parliament that the process of restoring the judges "" has started today and we will not let the nation down "" .
Pakistan is reeling from two deadly attacks in its tribal areas and the capital , Islamabad .
Pakistan 's western allies fear any confrontation between the president and a new government may encourage rebels to launch more bombing raids ."
2008-03-17,"A salvo of suspected American missiles killed at least 20 people , including several al - Qaida militants , in Pakistan 's tribal areas yesterday , a day after a restaurant bombing in the capital , Islamabad , that wounded US and British officials .
The bloody weekend underscored the extremist threat facing the new coalition government of erstwhile rivals Nawaz Sharif and Asif Zardari , which is due to be formed after parliament is sworn in today .
Tribesmen near Wana , the main town in South Waziristan , reported seeing up to seven missiles fired at two houses .
Earlier they heard a buzzing noise - the signature sound of US Predator drones , which have carried out at least two attacks on suspected al - Qaida hideouts in the tribal areas this year .
The Pakistan army confirmed five or six explosions , but could not identify the source .
The US and Pakistan have a policy of not officially recognising politically inflammatory Predator strikes .
Security officials said that al - Qaida fighters from Arab countries and Turkmenistan were hiding inside the house .
Angry tribesmen said the victims were innocent locals , said Sailab Masood , a veteran tribal journalist .
In an unusual admission of the presence of foreign militants , the Saudi interior ministry announced that three of its nationals had been extradited from Pakistan after being "" in troubled zones in an illegal capacity "" , an apparent reference to al - Qaida activity in the tribal areas .
Islamabad was tense yesterday after the bombing of Luna Caprese , an Italian restaurant popular with foreigners , the previous night .
A Turkish aid worker was killed and 13 others injured including five American diplomats , two Japanese journalists and a British police officer .
Local media showed photographs of Keith Pearce , a Scotland Yard counter - terrorism specialist who had contact with the Pakistani police , leaving the restaurant with eye injuries and a bloodied shirt .
He has returned to the UK for treatment .
Police yesterday stepped up security , mounting roadblocks and standing guard outside the restaurant , one of the few to serve alcohol in the capital .
The attack may mark a significant shift in militant tactics .
Until now most attacks have been suicide bombings targeting military and police installations .
Now foreigners have joined the target list .
The US embassy warned citizens to avoid congregating in public places and to "" act self defensively at all times "" .
The Foreign Office updated its travel advice for Pakistan , saying there was "" a heightened threat to westerners in major cities "" .
Today 's inaugural session of the new parliament is the latest challenge for the politically diminished President Pervez Musharraf .
It paves the way for a coalition government uniting Benazir Bhutto 's widower , Zardari , and Sharif , who has vowed to oust Musharraf at the earliest opportunity .
But the coalition 's unity is fragile and the president could still exploit differences over the status of the former chief justice Iftikhar Muhammad Chaudhry , who has been under house arrest since November .
Musharraf 's spokesman , Rashid Qureshi , said parliamentary procedures meant it could take up to a week for the new government to assume power ."
