1999-01-04,"Pakistan 's prime minister , Nawaz Sharif , escaped an assassination attempt yesterday when a bomb exploded on the road leading to his palatial weekend retreat outside the Punjab city of Lahore .
Four people died in the blast , including a policeman .
Three others were wounded .
The explosion , which was audible for several miles , destroyed a bridge about two miles from Mr Sharif 's sprawling estate at Raiwind , about 12 miles from Lahore .
The prime minister , his family and his political entourage had been due to travel to Raiwind just minutes before the blast , and security forces had been placed along the route .
But Mr Sharif had not set out when the bomb exploded .
The information minister , Mushahid Hussain , said the blast was an act of terror , clearly aimed at Mr Sharif .
The weekend retreat , built during the two years since Mr Sharif became prime minister , has been surrounded by controversy .
His political opponents say he has spent millions of rupees in state funds to build roads to the farm house , which he visits at least once a week .
They also claim that the estate was built on the proceeds of corruption - a charge Mr Sharif denies . '
This was the normal time and route on which he used to travel on a Sunday to visit his parents , ' Mr Hussain said . '
But the prime minister was delayed today because of meetings in Lahore . '
He said it was too early to assign blame for the explosion .
But earlier yesterday police in Lahore blamed Indian agents and the Muttahida Qaumi Movement , a political force in the southern province of Sindh which fell out with Mr Sharif late last year .
Police raided the party 's offices in Lahore yesterday , but made no arrests .
However , one official said three party workers had been arrested in Karachi .
The MQM has denied responsibility for the blast ."
1999-01-22,"When Pakistan 's cricketers assembled in Lahore yesterday morning for the 40-minute flight that would take their country 's first Test side to India in 12 years , there was one last formality to undergo .
The players were summoned to a meeting with the prime minister , Nawaz Sharif , who said he had taken the final decision to let the tour go ahead .
He told them to go out and promote good neighbourliness between India and Pakistan .
That Sharif 's intervention was necessary illustrates the explosive nature of any cricketing encounter between India and Pakistan , and why contests between the two have generally been restricted to far away - and neutral - grounds like Sharjah and Toronto .
But no tour has been undertaken amid such tension as this one after the Hindu extremists Shiv Sena threatened violence to sabotage the series .
Then they demonstrated their muscle power , digging up the pitch at the stadium here which was to host the first Test - while police stood by - and on Monday ransacking the headquarters of the Board of Control for Cricket in Bombay .
The Shiv Sena also issued threats against any India player who did not recognise his patriotic duty and boycott the series .
In 1991 such tactics prompted the Pakistan government to call off a planned tour .
Yesterday the Shiv Sena yielded , hours before the Pakistan side landed at New Delhi airport and was bundled into a motorcade and taken to a heavily fortified hotel .
Bal Thackeray , the Shiv Sena leader whose word is law in Bombay , was prevailed upon to call a temporary truce in his crusade to sabotage all Pakistani sporting visits on the pretext that Islamabad supports separatist militants in Kashmir . ""
In response to a request made by the prime minister , Atal Bihari Vajpayee , the Shiv Sena chief , Bal Thackeray , has decided to suspend the protest move against the series of matches against Pakistan - for this year only , "" said a statement issued after a meeting in Bombay between Thackeray and the Indian home minister LK Advani .
But the Indian government , which has had to reassure Pakistan on several occasions that it could protect the visitors , was taking no chances .
Hundreds of police manned barricades on roads leading to the New Delhi hotel and intelligence officers prowled the lobby muttering into radios as the Pakistan side , looking tired and slightly ill at ease in their green jackets , alighted from the bus .
Hotel guests were made to pass through metal detectors , and plain - clothed police sealed off the second floor to all but the Pakistani guests .
The players leave today for the central city of Gwalior for a match against India A , and six bulletproof cars will ferry them between hotel and stadium .
The first Test starts next Thursday in Madras , where 2,000 police have been deployed to protect the stadium and some 300 people were arrested on Wednesday for fear they will disrupt the match .
Amid much secrecy , the Indian side also arrived here yesterday from New Zealand , diverted from their original landing in Bombay because of the security threat .
"" This is in many ways a historic occasion , "" said Shahryar Khan , a former Pakistani diplomat who was made team manager for the tour .
""
Never before in the history of cricket has a team arrived in a country in such a daunting atmosphere .
"" Much of the tension was gone , Pakistan 's captain Wasim Akram conceded , and the fans can now concentrate on the series instead of the politics that have preceded it .
"" It 's been a completely different kind of pressure , "" Wasim said .
"" But after the assurances of the Indian government we are feeling much more relaxed . ""
However , it is not certain whether all of Thackeray 's followers , who have also dumped pigs ' heads outside the Chidambaram stadium in Madras and burnt effigies of Imran Khan in Bombay , will readily heed his truce after being worked into such a frenzy .
On several occasions before this tour , the Shiv Sena resorted to force to enforce its dictats .
Its thugs have smashed up galleries showing the paintings of India 's best - known artist , who is a Muslim , and cinemas showing the film Fire , which has lesbian love scenes .
Last year , they nearly sabotaged a visit by Pakistani squash players to Bombay .
But in taking on cricket they struck directly at India 's heart .
"" Cricket is above all religions , and the only thing that is binding this country together , "" says Bishan Bedi , who captained India to Pakistan in 1977 .
"" To fire communal guns on the shoulder of cricket is unpardonable .
Cricket has been my life ; it still is .
And anybody who hurts cricket is hurting me .
"" Not only Bedi , who was among the most outspoken critics of the Shiv Sena 's campaign to sabotage the tour .
The subcontinental passion for cricket is legendary , and on any Sunday in Bombay it is practically impossible to find a scrap of open ground without several groups of children playing games on it .
Commentators would be lost if they were forced to explain the machinations of Indian politics without cricketing metaphors .
And when all else goes wrong , there is always Sachin Tendulkar .
"" In a year of gloom one man brought us cheer - the last great hero , "" said the Indian weekly magazine , Outlook , devoting a double issue to the batsman .
Despite the terror tactics of the Shiv Sena , which included a particularly brazen order to Bombay cable television operators in its affiliated union to black out the series , some 74 per cent of Indians wanted the tour to go ahead , according to a poll published in Outlook .
Among them presumably were the 39 per cent who believed there could be riots . ""
There is something in the rhythm of cricket that moves in time with the subcontinental lifestyle , "" says Ashis Nandy , a sociologist and author of The Tao of Cricket :
On games of destiny and the destiny of games .
"" There is a bit of everything .
There is drama , there is a leisurely pace .
Even when you lose very badly cricket allows you to retrieve some amount of dignity and self - esteem , and that goes with the Indian sense of what is just and proper .
""
The contest is that much more exciting when it is India v Pakistan , ratcheted up because of the deadly , and now nuclear , sibling rivalry between the two countries that were born out of British India in 1947 , and which have gone to war three times since .
"" Defeating them is the greatest ambition we can ever have , "" says Nandy .
"" It 's like when a joint family splits .
Whatever you do for the rest of your life , somehow your point of reference is that other part of the family . ""
Despite the division of the sub - continent on religious lines , India is home to 120 million Muslims , and for the Hindu lunatic fringe , minority loyalties are always suspect when the neighbouring sides meet .
Most Indians , though , would find the idea of a cricketing loyalty test distasteful .
But in the disputed territory of Kashmir it is no longer required .
In the mid - Eighties a one - day international against West Indies in Srinagar , the summer capital , was disrupted by a pitch invasion and the raising of Pakistani flags , and for years Kashmiris made it a point of honour to support any side playing against India .
Yesterday 's climbdown by the Shiv Sena means that such political considerations will retreat into the background .
For the players , who share a language and often friendships made playing county cricket , hostilities eased years ago .
But for ordinary Indians it is too early to say if they will disappear entirely .
"" If we play each other at our own houses instead of far off Toronto , Bangladesh and Sharjah , things will gradually settle down , "" says Bedi .
"" But if this kind of vandalism is allowed to get away scot - free , then the subcontinent with all its prowess and cricket talent will make a laughing stock of itself . ""
Previous series in India
Overall record Matches : 24 India wins :
Four Pakistan wins :
Two Draws : 18 1952 - 53 :
India won 2 - 1 , two draws
In the second Test at Lucknow , Pakistan 's Nazar Mohammad became the first player to be on the field continuously throughout a Test .
His 124 not out helped Pakistan to victory by an innings .
In the decisive third Test , India 's Vinoo Mankad completed the Test double of 1,000 runs and 100 wickets in his 23rd match , a record which stood until 1979 when it was surpassed by Ian Botham .
1960 - 61 :
All five Tests drawn The second Test at Kanpur encapsulated the defensive play which saw 13 consecutive draws between the teams from 1952 - 1978 .
India 's Motganhalli Jaisimha batted five 1/2 hours for 99 runs and made only five scoring strokes before lunch on the third day .
The match featured a daily average of 175 runs , and India , batting second , did not complete their first innings until just before lunch on the fifth day .
1979 - 80
: India won 2 - 0 , four draws
An invasion of bees halted play at Bangalore , prompting the players and umpires to lie face down and cover their ears .
India 's Dilip Doshi was run out in the second Test at Delhi when he left his crease to complain about the shadow cast by a tree , but was allowed to resume on appeal .
1983 - 84 :
All three Tests drawn The first Test was the first in which no - balls and wides were debited to bowlers ' analyses .
India 's Sandeep Patil arrived by a chartered plane for the third Test after Mohinder Amarnath fell ill , but missed the first day .
It was the third rubber between the two countries in which every Test was drawn .
1986 - 87
: Pakistan won 1 - 0 , four draws Play was suspended for 50 minutes on the fourth day of the fourth Test after the crowd began to pelt Pakistan 's fielders with stones .
Six of the tourists returned wearing helmets .
Ruined the ' Cricket for Peace ' mission of Pakistan 's president , General Zia ul - Haq ."
1999-02-22,"Nine months after entering the nuclear age , India and Pakistan promised yesterday to share information that could prevent a holocaust .
The prime minister of India , Atal Bihari Vajpayee , and his Pakistani counterpart , Nawaz Sharif , declared : ' The two sides undertake to notify each other immediately in the event of any accidental , unauthorised , or unexplained incident that could create the risk of a fallout ... or an outbreak of nuclear war . '
The Lahore Declaration was made at the end of an epic journey to Pakistan by Mr Vajpayee .
Yesterday 's belated recognition of the dangers of the nuclear age - the first since India and Pakistan carried out rival nuclear tests last May - is a small and tentative step towards a peace that has eluded the neighbours for more than 50 years . '
There is no other way but peace .
We can no longer play with the embers because we can start a fire that will destroy everyone , ' Mr Vajpayee said .
His largely Pakistani audience on the lawn of the Punjab governor 's mansion was spellbound .
However , Mr Vajpayee and Mr Sharif skirted around the most contentious issue : their dispute over Kashmir .
But Mr Vajpayee 's trip to Lahore , where he inaugurated the first bus route between India and Pakistan , signalled that both countries are now committed to dialogue .
No other Indian prime minister has traversed the 40 miles from Amritsar , the closest Indian city to the border , to Lahore .
Mr Sharif made history too , venturing a few feet into Indian territory to shake hands with border guards .
The partition of India and Pakistan at independence was at its bloodiest in the two border cities and encounters between the two countries are traditionally tinged with suspicion . '
Whatever happens in India , they blame Pakistan .
Whatever happens in Pakistan , we blame India , ' Mr Sharif said .
' We have to live together .
History can change , but geography can not , ' Mr Vajpayee said .
For India , escaping the past means accepting that Pakistan exists .
But he admitted that the visit could antagonise the hardliners in his Hindu nationalist Bharatiya Janata Party .
He will also be returning home to a clamour about Pakistan support for the separatist uprising in Kashmir , where more than 20 Hindu villagers were killed at the weekend .
For Mr Sharif , rapprochement with India must be tempered by assurances that Pakistan will not lower its defences against its giant neighbour .
Yesterday , police fired tear gas into the headquarters of the Jamiat Islami party in central Lahore as police flushed out , beat and arrested Islamic activists .
On Saturday night ambassadors travelling to the state banquet at Lahore 's Shahi fort were ambushed by truckloads of protesters armed with bamboo sticks who slashed tyres and tore up national flags .
At their joint press conference yesterday , the prime ministers were guarded on the question of Kashmir , refusing to rise to provocative questions from journalists .
In both countries , opposition is confined to small but powerful fringe groups with a capacity to unleash unrest .
But among ordinary Indians and Pakistanis the longing for peace is tremendous . '
They should stay in the same room together until they have made peace , ' said a man selling lottery tickets . '
In the last 24 hours , the distance between Delhi and Lahore has grown a little bit smaller .
We have become a little closer , ' Mr Vajpayee promised ."
1999-05-10,"A Pakistani newspaper editor was handcuffed and marched from his home by armed police at the weekend , the fourth journalist in a week targeted by a government unwilling to tolerate dissent , writes Suzanne Goldenberg .
Several journalists have complained of harassment from intelligence agents and from officials seeking to block a BBC programme on corruption allegations against the prime minister , Nawaz Sharif , and his family 's financial empire .
Najam Sethi , editor of the Friday Times of Lahore , was arrested by uniformed Punjab police early on Sat urday .
He was filmed by the BBC earlier this month .
Last night his wife , Jugnu Mohsin , said he was believed to be held in Islamabad by the Inter - Services Intelligence , the military 's spy agency .
But the government has denied knowledge of his whereabouts , and Ms Mohsin fears for her husband 's safety .
The official news agency said Mr Sethi was being investigated for treason after a speech in New Delhi on April 30 about Pakistan 's decline .
But the arrest is seen as a warning to critics of Mr Sharif .
Mr Sethi delivered the same speech in Pakistan last November ."
1999-05-15,"Pakistani intelligence services distributed millions of pounds to ensure the electoral success of parties opposing the former Prime Minister , Benazir Bhutto , according to court documents obtained by The Observer .
The money - totalling 140 million rupees ( pounds 3 million ) - was allegedly distributed among Bhutto 's opponents in 1990 .
The election was won by a coalition of parties led by Nawaz Sharif , the current Prime Minister , which received the bulk of the funds .
Bhutto 's party was heavily defeated .
Statements by figures in the scandal have claimed Sharif personally received 3.5 m rupees ( £ 75,000 ) from the fund for his campaign .
He has denied receiving any money .
Hearings in the case will start this week in the Supreme Court in Islamabad .
Sharif could be disqualified from office if it is found that the receipt of money from Inter - Services Intelligence ( ISI ) constituted corruption .
Last month a special bench of judges sentenced Bhutto to five years in prison and fined her £ 5 m for accepting huge bribes while Prime Minister .
She is now at her home in Dubai and does not appear to have decided whether to return to Pakistan and risk almost certain imprisonment .
Last Thursday the Supreme Court decided her appeal against conviction could not be heard while she was out of the country .
Bhutto 's Pakistan People 's Party ( PPP ) - which had been elected in 1988 after the military dictator , General Zia ul - Haq , was killed in a plane crash - was dismissed by the President , Ghulam Ishaq Khan , after 22 months in power .
He then installed a caretaker government and called new elections .
The PPP claims its progressive agenda worried the conservative establishment , which sought to stop it returning to power .
Documents obtained by The Observer show that after Bhutto 's dismissal the ISI opened secret accounts into which about pounds 2 m in local currency was paid by a senior manager of the state - owned Habib Bank .
Highly placed sources say the money was from the public exchequer .
The operation appears to have been sanctioned by the President .
General Mirza Aslam Beg , then army chief of staff , has revealed in an affidavit that the ISI distributed just under half the money to ' various politicians and persons ' to pay for ' election purposes and the acquisition of election intelligence ' .
The rest was deposited in another secret account .
Aslam Beg describes how a ' cover account was opened by 202 Survey Section , [ which was ] a unit of the army for all political and technical purposes under the command of the ISI ' .
The head of the ISI at the time of the affair , Lt Gen Muhammad Asad Durrani , has said all the distributed funds went to the Islami Jamhoori Ittehad ( Islamic Democratic Alliance ) , the conservative coalition formed to contest the 1990 elections .
In an affidavit he alleges Sharif received 3.5 m rupees .
He says that ' in September 1990 I received instructions . . . to provide ' ' logistic support '' to the disbursement of donations to the election campaign of the IJI ' .
Professor Ghaffour Ahmed , Secretary - General of the IJI at the time of the alleged donations , said he knew nothing of any transactions . '
I would not have tolerated such a thing had I known , ' Ahmed said . '
The army chief of staff has said on the record that it happened , but I do not know anything about it . '
After winning the 1990 elections , Sharif remained in power until summer 1993 , when his government too was dismissed by the President .
However , allegations of corruption and mismanagement did not prevent him being re - elected two years ago with a huge parliamentary majority .
Sharif has now eradicated almost all serious threats to his power .
He is expected to win a majority in the upper house in the next round of Senate elections .
He has appointed a close aide as President , quelled dissent among the judiciary and manoeuvred a supporter into the post of army chief of staff .
Sharif has passed legislation to make the ISI more democratically accountable .
The service no longer answers to the President , but to the Prime Minister instead .
He has also removed the power of the President to dismiss elected governments .
Despite its strong position , the government has launched a crackdown on any dissent .
The editor of the respected Friday Times news magazine , Najam Sethi , was arrested in a midnight raid and badly beaten .
His only crime appears to have been to list in a recent speech the problems confronting Pakistan ."
1999-05-29,"Three days after Indian fighters jets first screamed over the mountains of Kashmir , driving tensions between the world 's newest nuclear powers to dangerous new levels , Pakistan 's prime minister last night said he had telephoned India 's leader to call for talks .
The telephone conversation between Nawaz Sharif , and his Indian counterpart , Atal Bihari Vajpayee , conducted over a hotline intended to avoid such high - stakes episodes , marks the first diplomatic attempt to cool temperatures along the disputed Himalayan border .
Earlier yesterday , officials in New Delhi were adamant there would be no let - up in the air raids , despite the loss of a third aircraft to a missile fired from within Indian - claimed territory .
They said diplomacy would have to wait until hundreds of Islamic militants , who had stolen across the frontier with Pakistani army support , were driven out of their high altitude dugouts near the Indian town of Kargil .
However , Mr Sharif told a public meeting in Karachi it was time for a pause .
He side both sides needed to review a confrontation which has prompted calls for restraint from the US , Russia , and China .
"" I talked to Vajpayee today and asked him where is this leading to , "" he said .
"" I told him and he agreed that there is no solution to Kashmir except to table talks .
"" There was no immediate reaction from the Indian prime minister .
Earlier yesterday , a foreign ministry official in New Delhi appeared to rule out the prospects of a speedy resumption of the peace mission Mr Vajpayee launched last February , by riding a golden love bus across the border to Pakistan .
"" The action taken to push out the armed intruders is the only action possible , "" the official said .
"" Our resolve is absolute and firm .
This armed intrusion will end .
We will not allow any armed intruders to remain in the Kashmir area .
This action will continue until it is completed and it will be completed successfully . ""
Meanwhile , defence officials claimed that 200 intruders had been killed since May 6 , and that they had driven the militants from several points , and cut off supply lines to other posts in the Drass area .
Last night , though , an adviser to Mr Vajpayee said privately that the prime minister would be more favourably inclined than his bureaucrats toward Mr Sharif 's gesture .
Throughout the rhetoric and blustering of Indian officials during the last three days , Mr Vajpayee has remained silent .
On Monday , he too resorted to the hotline , warning Mr Sharif that New Delhi was contemplating further action in the Kargil area to drive out the militants .
Such duality has been a feature of the last few days .
While officials in New Delhi have stepped up their accusations against Pakistan , accusing regular officers of guiding Islamic militants across mountain terrain , they have also claimed India has no intention of escalating the conflict .
The consequences of a further escalation in the most serious military confrontation in 28 years could not have been made more clear .
Mr Sharif announced his initiative at a rally to celebrate the first anniversary of its nuclear bomb explosion .
India tested its own nuclear device a few weeks earlier .
The Pakistani government has devoted 10 days to celebrating the bomb , which officials have described as the most important achievement in the country 's history after independence .
Mr Sharif 's government has sponsored song contests and science quizzes , and plastered city streets with images of the metallurgist credited with Pakistan 's entry to the nuclear age , set against a backdrop of a mushroom cloud .
Last night 's overture does not yet remove the prospects of worsening confrontation .
Mr Sharif also warned New Delhi that Pakistan would retaliate against any violations of its airspace .
The warning came hours after reporters were flown to view the wreckage of an Indian fighter strewn over several hundred yards , some 12 kms inside Pakistani territory .
The plane was shot down on Thursday .
Military analysts yesterday said they were not surprised by loss of a third aircraft , a helicopter gunship which was brought down by a Stinger missile some five miles south of the line of control at Tolcing .
A Pakistan - based militant group , the Mutahida Jihad Council , claimed credit for shooting down the helicopter , and claimed to have shot down another .
However , Indian defence officials said they had lost only one helicopter ."
