2010-12-01,"Pakistan 's president alleged that the brother of Pakistan 's opposition leader , Nawaz Sharif , "" tipped off "" the militant group Lashkar - e - Taiba ( LeT ) about impending UN sanctions following the 2008 Mumbai attacks , allowing the outfit to empty its bank accounts before they could be raided .
Six weeks after LeT gunmen killed more than 170 people in Mumbai , President Asif Ali Zardari told the US of his "" frustration "" that Sharif 's government in Punjab province helped the group evade new UN sanctions .
A month earlier , Shahbaz Sharif , who is chief minister of Punjab , "" tipped off "" the Jamaat - ud - Dawa ( JuD ) , LeT 's charity wing , "" resulting in almost empty bank accounts "" , Zardari claimed in a conversation with the US ambassador to Islamabad , Anne Patterson .
US diplomats were unable to confirm the allegation and noted that they came at a time of rising political tension between Zardari and Sharif .
But they conceded that JuD did appear to have received a warning from somewhere . ""
Information from the ministry of the interior does indicate that bank accounts contained surprisingly small amounts , "" said the cable in January 2009 .
A Punjab government spokesman vigorously denied the charge .
"" There 's nothing true in it , "" said senator Pervaiz Rashid , an adviser to Sharif .
"" Zardari is our political opponent and he wants to topple our government . ""
Sharif could n't have known about the UN sanctions , he said , because the UN co - ordinated its action with the federal government and not the provincial one .
The accusation , which has never been publicly aired , is one of several dramas that unfolded behind the scenes after the November 2008 attacks , now revealed by the embassy cables .
US diplomats and CIA spies found themselves playing the role of harried intermediaries to prevent Pakistan and India from going to war .
One week after the bloodbath an Indian official said his government was distinguishing between Pakistan 's civilian government , "" which India believed was not involved in the attacks "" , and the Inter - Services Intelligence agency ( ISI ) .
We are not yet ready to give ISI a clean chit , "" he said .
Four weeks later the US embassy grew alarmed by Indian plans to release a "" sanitised "" intelligence dossier that , they feared , could scupper intelligence sharing or thwart efforts to prevent a second attack .
"" There are still Lashkar - e - Taiba ( LeT ) sleeper and other cells in India , Nepal , Bangladesh and Pakistan , as well as many law enforcement leads which need to be pursued , "" the note said .
Pakistan 's generals , usually antagonistic towards India , appeared unusually conciliatory .
Six weeks after the attack Pakistan 's army chief , General Ashfaq Kayani , said he was "" determined to exercise restraint in his actions with India "" .
"" If there is any clue about another attack , "" he told General David Petraeus at his Rawalpindi headquarters , "" please share it with us . ""
His intelligence chief , General Shuja Pasha , went even further , acting as a regional fixer for some of his most bitter enemies .
In late 2009 Pasha travelled to Oman and Iran to "" follow up on reports he received in Washington about a terrorist attack on India "" .
He sent warnings to Israel – a country that Pakistan does not officially recognise – "" about information about attacks against Israeli targets in India "" .
Earlier in the year , he reminded Patterson , information about a second attack on India had "" come his way "" , which he conveyed to Delhi via the CIA .
The cables suggest Pakistan 's ardour for bringing the alleged Mumbai masterminds to justice appears to have wilted as time went on .
The secretive trial of Lashkar leader Zakhi ur Rehman Lakhvi and six other suspects "" is proceeding , though at a slow pace "" , US diplomats noted in February .
The secretive trial of Lashkar leader Zakhi ur Rehman Lakhvi , and six other suspects "" is proceeding , though at a slow pace "" last in February 2010 .
ThePakistan 's Inter - Service Intelligence agency ( ISI ) refused access to Abdur Rehman Syed , a retired army major and alleged LeT accomplice .
Instead the FBI was told it could "" submit questions for Syed through the ISI "" .
American officials say there is "" no smoking gun tying the Mumbai LeT operation to ISI "" but are less sure if the spy agency has , as promised , cut all its ties . ""
Despite arrests of key LeT / JuD leaders and closure of some of their camps , it is unclear if the ISI has finally abandoned its policy of using these proxy forces as a foreign policy tool , "" notes a briefing to the US special envoy Richard Holbrooke in February 2009 .
Dealing with LeT has long been a vexed issue for American diplomats in Pakistan .
In March 2006 the US ambassador Ryan Crocker requested the US government to delay by two weeks the designation of JuD. American helicopters were still delivering aid to earthquake victims in Kashmir , he explained , and they risked attack if still in the area when the designation was approved .
That same month , embassy officials met with Pakistan foreign office director Tasneem Aslam , who told her that Pakistan had "" no evidence "" linking JuD to terrorism – a conclusion US officials judged "" dubious "" .
Later , in November 2007 , the US ambassador presented the foreign secretary , Riaz Khan , with evidence that senior government ministers were publicly helping militant groups , including a declaration from the ministry of defence parliamentary secretary "" that he was proud to be a member of LeT and that he seeks to extend support to jihadi organisations when they seek his ' co - operation . '
"" "" Each of these reports is disturbing in itself , the ambassador said , as they seriously damage Pakistan 's image in the international community . ""
JuD denies that it is a front for LeT."
2013-03-19,"For some , the 17 miles of road and flyovers built for the exclusive use of a fleet of red buses that zoom above the gridlocked streets of Lahore is a shocking extravagance .
In a country where only 35 % of children are in secondary school and poverty is a reality for many , it is easy to think of other ways to spend
Â£220 m .
But for Nawaz Sharif , the frontrunner in the battle to become Pakistan 's next prime minister , the country 's first mass transit project is worth
every penny â€ “ if it staves off competition from the country 's wily president and a famous ex - cricket star .
Despite the chorus of doubters , the opening last month of the Metro Bus in the capital of Punjab , which is controlled by Sharif 's faction of the Pakistan Muslim League ( PML - N ) , was a massive hit .
Passengers damaged buses as they fought for the chance to fly across the congested city in air - conditioned comfort for a heavily subsidised 15p a ride .
"" People were just craving something like this , "" said Ahsan Iqbal , a senior PML - N leader working on a general election campaign that kicked off kick off with the dissolution of parliament on Saturday night .
"" It has become the symbol of a new Pakistan .
People are experiencing a new way of life that is much closer to developed countries , and that gives them a good feeling . ""
Enthusiasm for grand projects comes after a calamitous five years for the ruling Pakistan People 's Party ( PPP ) , led by Asif Ali Zardari â€ “ a surprise president who was swept to power on a tide of sympathy in 2008 after the assassination of his wife Benazir Bhutto .
Apart from being the first government in Pakistan 's history to fulfil a full term , the PPP has little to brag about .
Continuously buffeted by terrorist violence , corruption allegations and crippling energy shortages , the PPP has been unable to deliver real economic growth , let alone the motorways and infrastructure that Sharif touts .
But while the PPP 's vote is likely to be wiped out in much of urban Pakistan , Zardari still has some cards to play as his party 's prime minister Raja Pervez Ashraf goes to the polls .
Zardari â€ “ whose term as president expires in September â€
“ is a ruthlessly pragmatic politician with a track record of doing whatever is necessary to keep his party in power .
The PPP is thought to have deep reserves of electoral strength in parts of rural Punjab and Sindh where its "" feudal "" landlord allies maintain a tight control on votes .
Through the president 's political heir apparent , Oxford graduate Bilawal Bhutto Zardari , 24 , the PPP maintains a connection to the Bhutto name , harking back both to Benazir and Bilawal 's grandfather Zulfikar Ali Bhutto .
The party has also lavished more than $ 1bn in welfare handouts on 5.2 million people through its scheme branded the "" Benazir income support programme "" .
"" People at the grassroots know what we have done for them , they do n't believe what the media is saying , "" said Taj Haider , general secretary of the PPP in Sindh .
"" Living standards in the poorest areas have gone up and people are getting better prices for their crops . ""
Cynics say the Metro Bus is less about tackling urban congestion and more the dramatic political rise of Imran Khan , the country 's beloved former cricket captain , who emerged as a major threat to the PML - N in late 2011 by holding an enormous rally for his political party , the Pakistan Tehreek - e - Insaf ( PTI ) , on Sharif 's home turf .
About 100,000 people took part in the Lahore "" jalsa "" , creating speculation that what Khan calls a political tsunami would sweep Pakistani politics and break the corrupt , dynastic rule of the two established parties .
Perversely , Khan could actually be the best chance the deeply unpopular PPP has for clinging on to power , if his appeal to urban young people simply succeeds in cutting into the PML - N vote bank in the towns and cities of Punjab .
After the Khan rally , PML - N panicked .
It feared its cruise to power on the back of the PPP 's many failures was in jeopardy and so went into overdrive .
The party used its control of the government of Punjab , home to 60 % of Pakistanis , to push through as many eye - catching schemes as it could â€ “ nearly all of which have been criticised for wasting money .
Free laptops were given to students , a "" youth festival "" was held where thousands of young people set world records for the formation of giant flags and , most significant of all , the Metro Bus was built in 11 months .
At the party 's manifesto launch in Lahore last Friday , Sharif promised to turn Pakistan into an "" Asian tiger "" , with new infrastructure and a government with "" zero tolerance for corruption "" .
"" Our political philosophy revolves around economic progress , "" the two - time former prime minister said .
"" If a country is economically strong , it is able to solve all the problems , whether law and order or political extremism . ""
The period of hyperactivity appears to have paid off , with the PML - N now the favourite to win the largest number of seats after Pakistanis go to the polls in the first half of May , even if an outright majority is probably beyond it .
The party enjoys a substantial lead in the latest opinion polls .
Most analysts believe Khan will be lucky to get 20 of the 342 seats in parliament . ""
He peaked too early and gave the PML - N time to rejuvenate its base , "" said Cyril Almeida , a newspaper columnist .
"" People go to his rallies because he is a rock star in Pakistan .
He does n't have the party machine to actually turn out the voters and bring them to the polling booth on election day . ""
Sharif 's desire for improved diplomatic and trade relations with India and a reduced role of the army in national life has won over some liberal - minded Pakistanis who were once suspicious of the religious leanings of a man who tried to introduce Sharia law in the late 90s before a military coup sent him into exile in Saudi Arabia .
The PML - N is smarting from accusations that it has struck cynical electoral deals with sectarian terrorists based in the Punjab .
The bombing of apartment blocks in Karachi on 3 March that killed 48 has been widely linked to the Lashkar - e - Jhangvi ( LeJ ) , a Punjab based Sunni extremist group .
The LeJ 's leaders in Punjab have been left largely untouched by Sharif 's provincial government .
Even if a reported "" seat adjustment "" deal has not been struck , Sharif is "" supremely aware that he is fishing for votes in the same waters "" as the LeJ , said one diplomat .
The key parties â€¢ Pakistan People 's party ( PPP ) Traditionally leftwing party led by Asif Ali Zardari , the widow of Benazir Bhutto .
Despite five difficult years at the head of a governing coalition it is thought to have resilient support among the rural poor .
â€¢ Pakistan Muslim League Nawaz ( PML - N ) Centre right , pro - business party with stronghold in Punjab .
Leader Nawaz Sharif , who is committed to improve relations with India , was ousted as prime minister in a coup in 1999 .
â€¢ Pakistan Tehreek - e - Insaf ( PTI )
Founded by former national cricket captain Imran Khan .
Campaigned based on promise to abolish corruption "" in 90 days "" and stopping US drone strikes .
Has no seats in parliament but could upset final result .
â€¢ Regional , ethnic and religious parties They could well end up in government in the likely event of a coalition , even if they have no chance of winning the most seats .
Foremost is Muttahida Qaumi Movement ( MQM ) , a party with firm control over almost all seats in the mega - city of Karachi .
Secular , liberal and accused of controlling armed political gangs in Karachi , the party is run from London by its self - exiled leader Altaf Hussain ."
2013-04-07,"Take the long view , and there is progress to be found in the fact that elections are taking place in Pakistan on 11 May.
It will be the first transfer of power from one democratically elected civilian government to another in the 65-year history of the country .
Further , the frontrunner to become prime minister , Nawaz Sharif , is now committed to the idea of keeping the military out of politics .
In opposition , he allowed the deeply unpopular Pakistan People 's party ( PPP ) government to live out its full mandate .
The likely loser , Asif Ali Zardari , who as serving president can not campaign as leader of his party , has proved to be an adept transitional leader .
Under him , there has been no political victimisation , and parliamentary political culture is the stronger for it .
Alas , the good news peters out there .
Strong winds of religious conservatism are blowing among political stakeholders .
Pakistan 's self - propelled judiciary has taken upon itself the task of weeding out political candidates by applying two controversial provisions of the constitution , whereby candidates have to be righteous , truthful and good Muslims .
As there is no agreed way of verifying this , some candidates have been given the Orwellian task of reciting prayers as proof of religious belief .
Arbitrary hurdles are also erected by applying a Pervez Musharraf - era clause whereby holders of office must hold a degree .
Punjab 's provincial government , controlled by Mr Sharif 's Pakistan Muslim League ( Nawaz ) , has also had a less than glorious record with Islamist militant groups , on whom the PML - N depends for its seats .
A pogrom on a Christian neighbourhood in Lahore on 9 March was triggered by allegations of blasphemy against one man .
The PML - N has also been accused of making cynical electoral deals with a Sunni extremist group , Lashkar - e - Jhangvi , thought to be responsible for the bombing of apartment blocks in Karachi that killed 48 .
The PML - N 's counter argument is that only it can deal with the militants .
We will see .
Further still to the extremes , the Pakistani Taliban have overtly sought to influence the outcome of the election , by declaring that election rallies of the PPP , the Pashtun nationalist ANP , and the Karachi - based MQM are legitimate targets for attack .
The playing field is far from level .
Even so , the PPP deserves a period in opposition .
Despite his success at coalition building , Mr Zardari has lamentably failed to improve governance , with gas and electricity shortages , and inflation .
Paradoxically , his best hope lies in Imran Khan 's Pakistan Tehreek - e - Insaf , which is competing for votes on Sharif 's home turf .
But the fear is that an inconclusive result will leave a weak coalition – democratically elected but unable to take decisions needed to improve life for the majority of the people ."
2013-05-11,"Fourteen years after being overthrown by a military dictator and sent into exile , the former prime minister of Pakistan known to his supporters as the "" Lion "" has claimed victory in one of most dramatic general elections in the country 's history .
Nawaz Sharif was on course to become the next prime minister of the troubled country facing multiple crises after it became clear he had secured a commanding lead in votes despite the challenge from Imran Khan , the former cricketer who had waged a ground - breaking campaign credited with galvanising an army of young people .
Although the final result was still hours away , the country 's television networks projected Sharif heading for an ultimately tally of around 110 parliamentary seats , comfortably on course to secure the parliamentary majority he said he desperately needed to fix Pakistan 's ailing economy .
Khan 's Pakistan Tehreek - e - Insaf ( PTI ) appeared to be headed for a final tally of around 35 seats , in line with the expectations of many analysts , but far below the stratospheric expectations of his followers who had been repeatedly promised a "" tsunami "" that would sweep away the country 's established parties .
Meanwhile , the Pakistan Peoples party ( PPP ) , which is wildly unpopular after five years in government , was battered at the polls , and was set to secure around 35 seats , most of them in its traditional rural strongholds in Sindh province .
Sharif emerged on to the balcony of the Lahore headquarters of his Pakistan Muslim League - Nawaz party ( PML - N ) well before midnight to talk to his delirious supporters , who cheered and waved the green flags of the party .
He said he was prepared to work with all other parties to try to fix the country 's many problems .
"" We want to change the destiny of the country and fulfil the promises we made to the nation during the election campaign , "" he said .
While PML - N supporters erupted in noisy celebration across Lahore many PTI supporters reacted angrily to their disappointing result , with some beating cricket bats
â€ “ the symbol of the party
â€ “ on one of the city 's main boulevards .
One gain for Khan was the leading position the party gained in Khyber Pakhtunkhwa , the province close to the troubled frontier with Afghanistan , where the PTI could become a leading partner in a coalition government .
However , given the province 's acute problems and struggle with Taliban militancy , it might prove a mixed blessing for a party that has never come close to governing anything in its history .
Merely having an election is regarded as a major achievement for Pakistan and a huge milestone in its efforts to strengthen democracy .
It is the first time in its history that one elected government has handed power to another .
However , despite a strong turnout , which in the critical battleground of Punjab was described as "" huge "" by election officials , the day was also marred by violence that killed 22 people and vote - rigging in the country 's biggest city .
Politicians began crying foul even before counting began in the 70,000 polling stations throughout the huge country , particularly in the volatile port city of Karachi where a number of parties announced they would withdraw from the contest in protest .
The PTI in particular complained of blatant efforts to intimidate voters in Defence and Clifton , two affluent neighbourhoods where Khan has a devoted following .
There were reports of people being threatened as they attempted to go to vote and one case of gunmen opening fire at a polling station .
Sana Bilal , a 28-year - old PTI supporter , said her polling station located in a school in the Defence neighbourhood never even opened .
"" There were people who have been waiting outside since 8 am [ the official start of polling nationwide ] , "" she said .
"" It was a sea of PTI supporters .
Everyone is just really angry that we 've been deprived of our right to vote . ""
The Muttahida Quami Movement , the dominant political party in the city , was immediately blamed for attempting to suppress voting in an attempt to prevent the PTI eating into its territory .
Pakistan had been bracing for violence after the Taliban vowed to use suicide bombers to disrupt a democratic process the extremist movement regards as un - Islamic .
The government deployed 600,000 security personnel in an effort to protect the vote .
Many voters took the threat seriously , circulating election day tips on social media that included remaining watchful for any abandoned packages .
Some 22 people were killed nationwide in a series of attacks , some by bombs placed near polling stations in the restive north - west of the country ."
2013-05-12,"Fourteen years after he was overthrown and exiled by a military dictator , the former Pakistani prime minister known to his supporters as "" the Lion "" claimed victory on Saturday night in one of most dramatic general elections in the country 's history .
Nawaz Sharif , of the Pakistan Muslim League - Nawaz party ( PML - N ) , was set to become the next prime minister of the troubled country as it grapples with crises on multiple fronts after it became clear he had secured a commanding lead despite the challenge from Imran Khan , the former cricketer who waged a groundbreaking campaign credited with galvanising an army of youthful new voters .
Although final verified results were still hours away , the country 's television networks projected Sharif heading for an ultimate tally of around 110 seats that should give him the parliamentary majority he said was needed to fix Pakistan 's ailing economy .
Khan 's Pakistan Tehreek - e - Insaf ( PTI ) appeared to be headed for a final vote tally of around 35 seats , in line with the expectations of many analysts but far below the stratospheric expectations of his followers who had been repeatedly promised a "" tsunami "" that would sweep away the country 's established parties .
Compounding the PTI 's humiliation , Khan lost one of the seats he was personally contesting in Lahore .
Although Khan won other seats , victory in the capital of rich and populous Punjab province was seen as vital if the PTI was to sweep all before him .
It was clear throughout the day that Khan was struggling against his PML - N opponent , Sardar Ayaz Sadiq , an old friend from Khan 's schooldays at Lahore 's elite Aitchison College .
Sadiq enjoyed solid support from his personal biradari â€ “ the traditional clan networks that Khan has urged voters to ignore when they cast their votes .
"" I will vote for Sadiq because we have respect for our elders , "" said Usman Jamil , a 23-year - old office worker .
"" This system is very strong in Pakistan and we must respect it . ""
Meanwhile the Pakistan Peoples party ( PPP ) , which is wildly unpopular after five tumultuous years in government , was battered at the polls .
It was set to secure around 35 seats , most of them in its traditional rural strongholds in Sindh province .
Sharif emerged onto the balcony of the PML - N headquarters in Lahore well before midnight to address supporters who cheered and waved the green flags of the party .
He said he was prepared to work with all other parties to try to fix the country 's many problems .
"" We want to change the destiny of the country and fulfil the promises we made to the nation during the election campaign , "" he said .
While PML - N supporters erupted in noisy celebration across Lahore , PTI backers reacted sullenly to their disappointing result .
Some were seen beating cricket bats
â€ “ the symbol of the party
â€ “ on one of the city 's main boulevards .
One gain for Khan was in Khyber Pakhtunkhwa , where the PTI won enough seats to make it a leading partner in a coalition government .
However , given the province 's acute problems and struggle with Taliban militancy , it may prove a poisoned chalice for a party that has never come close to governing anything in its short history .
The election was the first time in the country 's history that one elected government has handed power to another .
The day was also marred by violence that killed 22 people and rampant vote rigging in the country 's biggest city .
Politicians began crying foul even before counting began in the 70,000 polling stations throughout the country .
The PTI in particular complained of blatant efforts to intimidate voters in Defence and Clifton , two affluent neighbourhoods in Karachi where Khan has a devoted following .
Sana Bilal , a 28-year - old PTI supporter , said her polling station located in a school in the upscale Defence neighbourhood never even opened .
"" There were people who have been waiting outside since 8 am [ the official start of polling nationwide ] , "" she said .
"" It was a sea of PTI supporters . ""
"" Everyone is just really angry that we 've been deprived of our right to vote . ""
The Muttahida Qaumi Movement ( MQM ) , the dominant political party in the city , was blamed for attempting to suppress voting in in a bid to prevent the PTI eating into their territory ."
2013-05-12,
